"paper_id","title","authors","year","venue","doi","url","dblp_id"
"doi:10.1109/DAC63849.2025.11133339","LearnGraph: A Learning-Based Architecture for Dynamic Graph Processing","Lingling Zhang","2025","DAC","10.1109/DAC63849.2025.11133339","https://doi.org/10.1109/DAC63849.2025.11133339","conf/dac/ZhangWJZL25"
"doi:10.1109/DAC63849.2025.11133204","Simulation-based Parallel Sweeping: A New Perspective on Combinational Equivalence Checking","Tianji Liu","2025","DAC","10.1109/DAC63849.2025.11133204","https://doi.org/10.1109/DAC63849.2025.11133204","conf/dac/LiuY25"
"doi:10.1109/DAC63849.2025.11132096","All-in-Memory Stochastic Computing using ReRAM","João Paulo C. de Lima","2025","DAC","10.1109/DAC63849.2025.11132096","https://doi.org/10.1109/DAC63849.2025.11132096","conf/dac/LimaMACNK25"
"doi:10.1109/DAC63849.2025.11133064","Unlocking a New Rust Programming Experience: Fast and Slow Thinking with LLMs to Conquer Undefined Behaviors","Renshuang Jiang","2025","DAC","10.1109/DAC63849.2025.11133064","https://doi.org/10.1109/DAC63849.2025.11133064","conf/dac/JiangDDSFDMZJ25"
"doi:10.1109/DAC63849.2025.11133263","Scalable Community Detection Using Quantum Hamiltonian Descent and QUBO Formulation","Jinglei Cheng","2025","DAC","10.1109/DAC63849.2025.11133263","https://doi.org/10.1109/DAC63849.2025.11133263","conf/dac/ChengZGQL25"
"doi:10.1109/DAC63849.2025.11132391","Adora Compiler: End-to-End Optimization for High-Efficiency Dataflow Acceleration and Task Pipelining on CGRAs","Jiahang Lou","2025","DAC","10.1109/DAC63849.2025.11132391","https://doi.org/10.1109/DAC63849.2025.11132391","conf/dac/LouZDZYW25"
"doi:10.1109/DAC63849.2025.11132533","From Flatland to Forest: Exploring Pareto-optimal Design through RTL Hierarchy Trees","Donger Luo","2025","DAC","10.1109/DAC63849.2025.11132533","https://doi.org/10.1109/DAC63849.2025.11132533","conf/dac/LuoSLZYG25"
"doi:10.1109/DAC63849.2025.11133309","Weighted Range-Constrained Ising-Model Decoder for Quantum Error Correction","Xinyi Guo","2025","DAC","10.1109/DAC63849.2025.11133309","https://doi.org/10.1109/DAC63849.2025.11133309","conf/dac/GuoAS25"
"doi:10.1109/DAC63849.2025.11133067","Can Short Hypervectors Drive Feature-Rich GNNs? Strengthening the Graph Representation of Hyperdimensional Computing for Memory-efficient GNNs","Jihe Wang","2025","DAC","10.1109/DAC63849.2025.11133067","https://doi.org/10.1109/DAC63849.2025.11133067","conf/dac/WangHW25"
"doi:10.1109/DAC63849.2025.11132989","Finding the Pareto Frontier of Low-Precision Data Formats and MAC Architecture for LLM Inference","Brian Crafton","2025","DAC","10.1109/DAC63849.2025.11132989","https://doi.org/10.1109/DAC63849.2025.11132989","conf/dac/CraftonPSLZKA25"
"doi:10.1109/DAC63849.2025.11132572","ESM: A Framework for Building Effective Surrogate Models for Hardware-Aware Neural Architecture Search","Azaz-Ur-Rehman Nasir","2025","DAC","10.1109/DAC63849.2025.11132572","https://doi.org/10.1109/DAC63849.2025.11132572","conf/dac/NasirSHS25"
"doi:10.1109/DAC63849.2025.11132674","RE3: Finding Refinement Relations with Relational Mapping Abstraction","You Li","2025","DAC","10.1109/DAC63849.2025.11132674","https://doi.org/10.1109/DAC63849.2025.11132674","conf/dac/LiZHZ25"
"doi:10.1109/DAC63849.2025.11132682","TetrisLock: Quantum Circuit Split Compilation with Interlocking Patterns","Qian Wang","2025","DAC","10.1109/DAC63849.2025.11132682","https://doi.org/10.1109/DAC63849.2025.11132682","conf/dac/WangJDL25"
"doi:10.1109/DAC63849.2025.11133278","Truly Pre-Routing Timing Prediction via Considering Power Delivery Network","Yuyang Ye","2025","DAC","10.1109/DAC63849.2025.11133278","https://doi.org/10.1109/DAC63849.2025.11133278","conf/dac/YeHRZCYS25"
"doi:10.1109/DAC63849.2025.11133396","Construction of DAG Models for Autonomous Systems","Jing Huang","2025","DAC","10.1109/DAC63849.2025.11133396","https://doi.org/10.1109/DAC63849.2025.11133396","conf/dac/HuangJWLC25"
"doi:10.1109/DAC63849.2025.11132949","A Scalable and Robust Compilation Framework for Emitter-Photonic Graph State","Xiangyu Ren","2025","DAC","10.1109/DAC63849.2025.11132949","https://doi.org/10.1109/DAC63849.2025.11132949","conf/dac/RenHLB25"
"doi:10.1109/DAC63849.2025.11132837","Parallel Dynamic Partitioning for Datapath Combinational Equivalence Checking","Shuai Zhou","2025","DAC","10.1109/DAC63849.2025.11132837","https://doi.org/10.1109/DAC63849.2025.11132837","conf/dac/ZhouZZJYC25"
"doi:10.1109/DAC63849.2025.11132864","Scaling Laws of Graph Neural Networks for Atomistic Materials Modeling","Chaojian Li","2025","DAC","10.1109/DAC63849.2025.11132864","https://doi.org/10.1109/DAC63849.2025.11132864","conf/dac/LiYPCWB25"
"doi:10.1109/DAC63849.2025.11133292","INSIGHT: A Universal Neural Simulator Framework for Analog Circuits with Autoregressive Transformers","Souradip Poddar","2025","DAC","10.1109/DAC63849.2025.11133292","https://doi.org/10.1109/DAC63849.2025.11133292","conf/dac/PoddarOLZHP25"
"doi:10.1109/DAC63849.2025.11133234","HiSpTRSV: Exploring Tile-Level Parallelism for SpTRSV Acceleration on FPGAs","Fan Sun","2025","DAC","10.1109/DAC63849.2025.11133234","https://doi.org/10.1109/DAC63849.2025.11133234","conf/dac/SunDS25"
"doi:10.1109/DAC63849.2025.11132887","IRGNN: A Graph-based Framework Integrating Numerical Solution and Point Cloud for Static IR Drop Prediction","Feng Guo","2025","DAC","10.1109/DAC63849.2025.11132887","https://doi.org/10.1109/DAC63849.2025.11132887","conf/dac/GuoXZJLZS25"
"doi:10.1109/DAC63849.2025.11132596","Graph-Guided Transfer Learning to Boost the Efficiency of System-Level Optimization of Analog/Mixed-Signal Circuits","Jiaqi Wang","2025","DAC","10.1109/DAC63849.2025.11132596","https://doi.org/10.1109/DAC63849.2025.11132596","conf/dac/WangG25"
"doi:10.1109/DAC63849.2025.11133310","Logic Optimization Meets SAT: A Novel Framework for Circuit-SAT Solving","Zhengyuan Shi","2025","DAC","10.1109/DAC63849.2025.11133310","https://doi.org/10.1109/DAC63849.2025.11133310","conf/dac/ShiTZKZYCX25"
"doi:10.1109/DAC63849.2025.11132604","X-SAT: An Efficient Circuit-Based SAT Solver","Yuhang Qian","2025","DAC","10.1109/DAC63849.2025.11132604","https://doi.org/10.1109/DAC63849.2025.11132604","conf/dac/QianCZC25"
"doi:10.1109/DAC63849.2025.11133063","Libra: A Hybrid-Sparse Attention Accelerator Featuring Multi-Level Workload Balance","Faxian Sun","2025","DAC","10.1109/DAC63849.2025.11133063","https://doi.org/10.1109/DAC63849.2025.11133063","conf/dac/SunZLLQCYW25"
"doi:10.1109/DAC63849.2025.11133311","Late Breaking Results: An Efficient and Scalable Track Assignment with GPU Parallelism","Genggeng Liu","2025","DAC","10.1109/DAC63849.2025.11133311","https://doi.org/10.1109/DAC63849.2025.11133311","conf/dac/LiuHLLHG25"
"doi:10.1109/DAC63849.2025.11133117","Differentiable Net-Moving and Local Congestion Mitigation for Routability-Driven Global Placement","Wenchao Li","2025","DAC","10.1109/DAC63849.2025.11133117","https://doi.org/10.1109/DAC63849.2025.11133117","conf/dac/LiWLLZ25"
"doi:10.1109/DAC63849.2025.11132687","FeKAN: Efficient Kolmogorov-Arnold Networks Accelerator Using FeFET-based CAM and LUT","Xuliang Yu","2025","DAC","10.1109/DAC63849.2025.11132687","https://doi.org/10.1109/DAC63849.2025.11132687","conf/dac/YuQYZZ25"
"doi:10.1109/DAC63849.2025.11132550","ACRS: Adjacent Computation Resource Sharing among Partitioned GPU Sub-Cores","Penghao Song","2025","DAC","10.1109/DAC63849.2025.11132550","https://doi.org/10.1109/DAC63849.2025.11132550","conf/dac/SongWHZZLW25"
"doi:10.1109/DAC63849.2025.11132948","The Unwritten Contract of Cloud-based Elastic Solid-State Drives","Yingjia Wang","2025","DAC","10.1109/DAC63849.2025.11132948","https://doi.org/10.1109/DAC63849.2025.11132948","conf/dac/WangY25"
"doi:10.1109/DAC63849.2025.11133191","MAGE: A Multi-Agent Engine for Automated RTL Code Generation","Yujie Zhao","2025","DAC","10.1109/DAC63849.2025.11133191","https://doi.org/10.1109/DAC63849.2025.11133191","conf/dac/ZhaoZHYZ25"
"doi:10.1109/DAC63849.2025.11132644","EdgeMM: Multi-Core CPU with Heterogeneous AI-Extension and Activation-aware Weight Pruning for Multimodal LLMs at Edge","Kangbo Bai","2025","DAC","10.1109/DAC63849.2025.11132644","https://doi.org/10.1109/DAC63849.2025.11132644","conf/dac/BaiYHJ25"
"doi:10.1109/DAC63849.2025.11133338","HIVE: A High-Priority Victim Cache for Accelerating GPU Memory Accesses","Yuhan Tang","2025","DAC","10.1109/DAC63849.2025.11133338","https://doi.org/10.1109/DAC63849.2025.11133338","conf/dac/TangZMLLLTW25"
"doi:10.1109/DAC63849.2025.11132798","AdreamDCO: AI-Driven Robust and Efficient Design Automation for Digitally Controlled Oscillators","Yaolong Hu","2025","DAC","10.1109/DAC63849.2025.11132798","https://doi.org/10.1109/DAC63849.2025.11132798","conf/dac/HuGWLCC25"
"doi:10.1109/DAC63849.2025.11133368","Mixed Structural Choice Operator: Enhancing Technology Mapping with Heterogeneous Representations","Zhang Hu","2025","DAC","10.1109/DAC63849.2025.11133368","https://doi.org/10.1109/DAC63849.2025.11133368","conf/dac/HuPXWC25"
"doi:10.1109/DAC63849.2025.11133404","Leopard: Hardware Pass-Through Remote Storage Access with Queue Concurrency for Edge Intelligent Workstations","Wenjie Wang","2025","DAC","10.1109/DAC63849.2025.11133404","https://doi.org/10.1109/DAC63849.2025.11133404","conf/dac/WangPYG25"
"doi:10.1109/DAC63849.2025.11133116","MMDFL: Multi-Model-based Decentralized Federated Learning for Resource-Constrained AIoT Systems","Dengke Yan","2025","DAC","10.1109/DAC63849.2025.11133116","https://doi.org/10.1109/DAC63849.2025.11133116","conf/dac/YanYHFC25"
"doi:10.1109/DAC63849.2025.11132637","CirSTAG: Circuit Stability Analysis on Graph-based Manifolds","Wuxinlin Cheng","2025","DAC","10.1109/DAC63849.2025.11132637","https://doi.org/10.1109/DAC63849.2025.11132637","conf/dac/ChengYDAZF25"
"doi:10.1109/DAC63849.2025.11132417","MemSeer: Leverage Memory Failure Distinctions and Multi-Grained Prediction in Ultra-Scale Heterogeneous X86/ARM Clusters","Yunfei Gu","2025","DAC","10.1109/DAC63849.2025.11132417","https://doi.org/10.1109/DAC63849.2025.11132417","conf/dac/GuLWSWLZLGYZL25"
"doi:10.1109/DAC63849.2025.11132424","CaMDN: Enhancing Cache Efficiency for Multi-tenant DNNs on Integrated NPUs","Tianhao Cai","2025","DAC","10.1109/DAC63849.2025.11132424","https://doi.org/10.1109/DAC63849.2025.11132424","conf/dac/CaiWXHWSL25"
"doi:10.1109/DAC63849.2025.11132777","Mixed-Precision Quantization for Deep Vision Models with Integer Quadratic Programming","Zihao Deng","2025","DAC","10.1109/DAC63849.2025.11132777","https://doi.org/10.1109/DAC63849.2025.11132777","conf/dac/DengSWO25"
"doi:10.1109/DAC63849.2025.11132094","RAP-Track: Efficient Control Flow Attestation via Parallel Tracking in Commodity MCUs","Antonio Joia Neto","2025","DAC","10.1109/DAC63849.2025.11132094","https://doi.org/10.1109/DAC63849.2025.11132094","conf/dac/NetoCN25"
"doi:10.1109/DAC63849.2025.11133088","NSFlow: An End-to-End FPGA Framework with Scalable Dataflow Architecture for Neuro-Symbolic AI","Hanchen Yang","2025","DAC","10.1109/DAC63849.2025.11133088","https://doi.org/10.1109/DAC63849.2025.11133088","conf/dac/YangWRPLSRK25"
"doi:10.1109/DAC63849.2025.11133082","Me-MPK: Accelerating Krylov Subspace Solvers via Memory-efficient Matrix-Power Kernel","Haozhong Qiu","2025","DAC","10.1109/DAC63849.2025.11133082","https://doi.org/10.1109/DAC63849.2025.11133082","conf/dac/QiuXFLDZDDWHCL25"
"doi:10.1109/DAC63849.2025.11133149","Data Oblivious CPU: Microarchitectural Side-channel Leakage-Resilient Processor","Behnam Omidi","2025","DAC","10.1109/DAC63849.2025.11133149","https://doi.org/10.1109/DAC63849.2025.11133149","conf/dac/OmidiAK25"
"doi:10.1109/DAC63849.2025.11133162","CMFuzz: Parallel Fuzzing of IoT Protocols by Configuration Model Identification and Scheduling","Qi Xu","2025","DAC","10.1109/DAC63849.2025.11133162","https://doi.org/10.1109/DAC63849.2025.11133162","conf/dac/XuMCCWZSJ25"
"doi:10.1109/DAC63849.2025.11132631","FLAG: An FPGA-Based System for Low-Latency GNN Inference Service Using Vector Quantization","Yunki Han","2025","DAC","10.1109/DAC63849.2025.11132631","https://doi.org/10.1109/DAC63849.2025.11132631","conf/dac/HanKKHK25"
"doi:10.1109/DAC63849.2025.11133056","Clearance-Constrained PCB Global Placement with Heterogeneous Components","Yan-Jen Chen","2025","DAC","10.1109/DAC63849.2025.11133056","https://doi.org/10.1109/DAC63849.2025.11133056","conf/dac/ChenHTOC25"
"doi:10.1109/DAC63849.2025.11133349","NetTAG: A Multimodal RTL-and-Layout-Aligned Netlist Foundation Model via Text-Attributed Graph","Wenji Fang","2025","DAC","10.1109/DAC63849.2025.11133349","https://doi.org/10.1109/DAC63849.2025.11133349","conf/dac/FangLLLZX25"
"doi:10.1109/DAC63849.2025.11133283","GS-TG: 3D Gaussian Splatting Accelerator with Tile Grouping for Reducing Redundant Sorting while Preserving Rasterization Efficiency","Joongho Jo","2025","DAC","10.1109/DAC63849.2025.11133283","https://doi.org/10.1109/DAC63849.2025.11133283","conf/dac/JoP25"
"doi:10.1109/DAC63849.2025.11132863","Fast End-to-End Simulation and Exploration of Many-RISCV-Core Baseband Transceivers for Software-Defined Radio-Access Networks","Marco Bertuletti","2025","DAC","10.1109/DAC63849.2025.11132863","https://doi.org/10.1109/DAC63849.2025.11132863","conf/dac/BertulettiZARVB25"
"doi:10.1109/DAC63849.2025.11133127","Ragnar: Exploring Volatile-Channel Vulnerabilities on RDMA NIC","Yunpeng Xu","2025","DAC","10.1109/DAC63849.2025.11133127","https://doi.org/10.1109/DAC63849.2025.11133127","conf/dac/XuFMD25"
"doi:10.1109/DAC63849.2025.11132093","Sphinx: A High-Performance Hybrid Index for Disaggregated Memory With Succinct Filter Cache","Jingxiang Li","2025","DAC","10.1109/DAC63849.2025.11132093","https://doi.org/10.1109/DAC63849.2025.11132093","conf/dac/LiZZDH25"
"doi:10.1109/DAC63849.2025.11133418","UniCoS: A Unified Neural and Accelerator Co-Search Framework for CNNs and ViTs","Wei Fu","2025","DAC","10.1109/DAC63849.2025.11133418","https://doi.org/10.1109/DAC63849.2025.11133418","conf/dac/FuLTWQGWZ25"
"doi:10.1109/DAC63849.2025.11132714","Cross-Attention for AES Mode Variation in Side-Channel Analysis","Fanliang Hu","2025","DAC","10.1109/DAC63849.2025.11132714","https://doi.org/10.1109/DAC63849.2025.11132714","conf/dac/HuSMW25"
"doi:10.1109/DAC63849.2025.11132847","Late Breaking Results: The Hidden Risks of Activation Duration in PLPUFs","Mohamed Alsharkawy","2025","DAC","10.1109/DAC63849.2025.11132847","https://doi.org/10.1109/DAC63849.2025.11132847","conf/dac/AlsharkawyZNGH25"
"doi:10.1109/DAC63849.2025.11132886","FactorHD: A Hyperdimensional Computing Model for Multi-Object Multi-Class Representation and Factorization","Yifei Zhou","2025","DAC","10.1109/DAC63849.2025.11132886","https://doi.org/10.1109/DAC63849.2025.11132886","conf/dac/ZhouHNZYYZ25"
"doi:10.1109/DAC63849.2025.11132448","DCO-3D: Differentiable Congestion Optimization in 3D ICs","Hao-Hsiang Hsiao","2025","DAC","10.1109/DAC63849.2025.11132448","https://doi.org/10.1109/DAC63849.2025.11132448","conf/dac/HsiaoLVALLRL25"
"doi:10.1109/DAC63849.2025.11133367","Curvilinear Optical Proximity Correction via Cardinal Spline","Su Zheng","2025","DAC","10.1109/DAC63849.2025.11133367","https://doi.org/10.1109/DAC63849.2025.11133367","conf/dac/ZhengLYMYW25"
"doi:10.1109/DAC63849.2025.11133307","Device-Algorithm Co-Design of Ferroelectric Compute-in-Memory In-Situ Annealer for Combinatorial Optimization Problems","Yu Qian","2025","DAC","10.1109/DAC63849.2025.11133307","https://doi.org/10.1109/DAC63849.2025.11133307","conf/dac/QianHWYZKZY25"
"doi:10.1109/DAC63849.2025.11133397","WISEDRAM: A Reliable Bitwise In-DRAM Accelerator","Mohammad Arman Soleimani","2025","DAC","10.1109/DAC63849.2025.11133397","https://doi.org/10.1109/DAC63849.2025.11133397","conf/dac/SoleimaniRKUS25"
"doi:10.1109/DAC63849.2025.11133288","CIM-BLAS: Computing-in-Memory Accelerator for BLAS","Rui Liu","2025","DAC","10.1109/DAC63849.2025.11133288","https://doi.org/10.1109/DAC63849.2025.11133288","conf/dac/LiuLZCHT25"
"doi:10.1109/DAC63849.2025.11132485","An Algorithm-Hardware Co-design Based on Revised Microscaling Format Quantization for Accelerating Large Language Models","Yingbo Hao","2025","DAC","10.1109/DAC63849.2025.11132485","https://doi.org/10.1109/DAC63849.2025.11132485","conf/dac/HaoCZY25"
"doi:10.1109/DAC63849.2025.11132839","Replay4NCL: An Efficient Memory Replay-based Methodology for Neuromorphic Continual Learning in Embedded AI Systems","Mishal Fatima Minhas","2025","DAC","10.1109/DAC63849.2025.11132839","https://doi.org/10.1109/DAC63849.2025.11132839","conf/dac/MinhasPAHS25"
"doi:10.1109/DAC63849.2025.11132944","ReMaP: Macro Placement by Recursively Prototyping and Periphery-Guided Relocating","Yunqi Shi","2025","DAC","10.1109/DAC63849.2025.11132944","https://doi.org/10.1109/DAC63849.2025.11132944","conf/dac/ShiLXKXYQZ25"
"doi:10.1109/DAC63849.2025.11133193","BlockPIM: Optimizing Memory Management for PIM-enabled Long-Context LLM Inference","Zhichun Li","2025","DAC","10.1109/DAC63849.2025.11133193","https://doi.org/10.1109/DAC63849.2025.11133193","conf/dac/LiZLS25"
"doi:10.1109/DAC63849.2025.11133011","PiSPICE: Accelerating Post-Layout SPICE Simulation via Essential Parasitic Identification","Zhou Jin","2025","DAC","10.1109/DAC63849.2025.11133011","https://doi.org/10.1109/DAC63849.2025.11133011","conf/dac/JinLXZWNY25"
"doi:10.1109/DAC63849.2025.11132587","3D-Flow: Flow-based Standard Cell Legalization for 3D ICs","Yuxuan Zhao","2025","DAC","10.1109/DAC63849.2025.11132587","https://doi.org/10.1109/DAC63849.2025.11132587","conf/dac/ZhaoLY25"
"doi:10.1109/DAC63849.2025.11133015","Optimizing Recovery Logic in Speculative High-Level Synthesis","Dylan Leothaud","2025","DAC","10.1109/DAC63849.2025.11133015","https://doi.org/10.1109/DAC63849.2025.11133015","conf/dac/LeothaudGRD25"
"doi:10.1109/DAC63849.2025.11132899","Grasp: Group-based Prediction of Activation Sparsity for Fast LLM Inference","Jiho Shin","2025","DAC","10.1109/DAC63849.2025.11132899","https://doi.org/10.1109/DAC63849.2025.11132899","conf/dac/ShinYY25"
"doi:10.1109/DAC63849.2025.11132475","Blaze: An Efficient Bit-Sparse Attention Architecture With Workload Orchestration Optimization","Runzhou Zhang","2025","DAC","10.1109/DAC63849.2025.11132475","https://doi.org/10.1109/DAC63849.2025.11132475","conf/dac/ZhangSWZQCYW25"
"doi:10.1109/DAC63849.2025.11132799","SynCircuit: Automated Generation of New Synthetic RTL Circuits Can Enable Big Data in Circuits","Shang Liu","2025","DAC","10.1109/DAC63849.2025.11132799","https://doi.org/10.1109/DAC63849.2025.11132799","conf/dac/LiuWFX25"
"doi:10.1109/DAC63849.2025.11133146","InsightAlign: A Transferable Physical Design Recipe Recommender Based on Design Insights","Hao-Hsiang Hsiao","2025","DAC","10.1109/DAC63849.2025.11133146","https://doi.org/10.1109/DAC63849.2025.11133146","conf/dac/HsiaoKZCGL25"
"doi:10.1109/DAC63849.2025.11133240","Rewire: Advancing CGRA Mapping Through a Consolidated Routing Paradigm","Zhaoying Li","2025","DAC","10.1109/DAC63849.2025.11133240","https://doi.org/10.1109/DAC63849.2025.11133240","conf/dac/LiWWCLTM25"
"doi:10.1109/DAC63849.2025.11133125","CVMAX: Accelerator Architecture with Polar Form Multiplication for Complex-Valued Neural Networks","Hyunwuk Lee","2025","DAC","10.1109/DAC63849.2025.11133125","https://doi.org/10.1109/DAC63849.2025.11133125","conf/dac/LeeKKR25"
"doi:10.1109/DAC63849.2025.11132509","GPS: GNN-Based Two-Stage Pre-Scheduling Loop Mapping Method on CGRAs","Mingyang Kou","2025","DAC","10.1109/DAC63849.2025.11132509","https://doi.org/10.1109/DAC63849.2025.11132509","conf/dac/KouJYY25"
"doi:10.1109/DAC63849.2025.11132578","OutlierCIM: Outlier-Aware Digital CIM-Based LLM Accelerator with Hybrid-Strategy Quantization and Unified FP-INT Computation","Zihan Zou","2025","DAC","10.1109/DAC63849.2025.11132578","https://doi.org/10.1109/DAC63849.2025.11132578","conf/dac/ZouCZWLDSCL25"
"doi:10.1109/DAC63849.2025.11133168","CHORD: Composable Hybrid Optical Reconfigurable Diffractive Framework For Optical Neural Network","Ziang Yin","2025","DAC","10.1109/DAC63849.2025.11133168","https://doi.org/10.1109/DAC63849.2025.11133168","conf/dac/YinYZG25"
"doi:10.1109/DAC63849.2025.11133100","Insights from Rights and Wrongs: A Large Language Model for Solving Assertion Failures in RTL Design","Jie Zhou","2025","DAC","10.1109/DAC63849.2025.11133100","https://doi.org/10.1109/DAC63849.2025.11133100","conf/dac/ZhouJWHJYFZGJ25"
"doi:10.1109/DAC63849.2025.11133290","Re4PUF: A Reliable, Reconfigurable ReRAM-based PUF Resilient to DNN and Side Channel Attacks","Ning Lin","2025","DAC","10.1109/DAC63849.2025.11133290","https://doi.org/10.1109/DAC63849.2025.11133290","conf/dac/LinLHWCWLYYXHCCXYSW25"
"doi:10.1109/DAC63849.2025.11133274","HybriMoE: Hybrid CPU-GPU Scheduling and Cache Management for Efficient MoE Inference","Shuzhang Zhong","2025","DAC","10.1109/DAC63849.2025.11133274","https://doi.org/10.1109/DAC63849.2025.11133274","conf/dac/ZhongSLWHL25"
"doi:10.1109/DAC63849.2025.11133270","CIMFlow: An Integrated Framework for Systematic Design and Evaluation of Digital CIM Architectures","Yingjie Qi","2025","DAC","10.1109/DAC63849.2025.11133270","https://doi.org/10.1109/DAC63849.2025.11133270","conf/dac/QiYWWWTDHZ25"
"doi:10.1109/DAC63849.2025.11133108","Invited: SambaNova SN40L: Unleashing Agentic AI with Dataflow","Raghu Prabhakar","2025","DAC","10.1109/DAC63849.2025.11133108","https://doi.org/10.1109/DAC63849.2025.11133108","conf/dac/PrabhakarNGFZ25"
"doi:10.1109/DAC63849.2025.11133371","An Input-Aware Sparse Tensor Compiler Empowered by Vectorized Acceleration","Xianhao He","2025","DAC","10.1109/DAC63849.2025.11133371","https://doi.org/10.1109/DAC63849.2025.11133371","conf/dac/HeWZYCL25"
"doi:10.1109/DAC63849.2025.11132792","Local-GS: An Order-Independent Gaussian Splatting Training Accelerator Exploiting Splat Locality","Yiyang Sun","2025","DAC","10.1109/DAC63849.2025.11132792","https://doi.org/10.1109/DAC63849.2025.11132792","conf/dac/SunZJYHJ25"
"doi:10.1109/DAC63849.2025.11132786","ArbiterQ: Improving QNN Convergency and Accuracy by Applying Personalized Model on Heterogeneous Quantum Devices","Tianyao Chu","2025","DAC","10.1109/DAC63849.2025.11132786","https://doi.org/10.1109/DAC63849.2025.11132786","conf/dac/ChuTLLLLGY25"
"doi:10.1109/DAC63849.2025.11133305","SAGA: A Memory-Efficient Accelerator for GANN Construction via Harnessing Vertex Similarity","Ruiyang Chen","2025","DAC","10.1109/DAC63849.2025.11133305","https://doi.org/10.1109/DAC63849.2025.11133305","conf/dac/ChenLQYSLS25"
"doi:10.1109/DAC63849.2025.11133143","Assessing Quantum Layout Synthesis Tools via Known Optimal-SWAP Cost Benchmarks","Shuohao Ping","2025","DAC","10.1109/DAC63849.2025.11133143","https://doi.org/10.1109/DAC63849.2025.11133143","conf/dac/PingLTC25"
"doi:10.1109/DAC63849.2025.11132826","Hybrid Embedding Framework for Memory-Efficient Recommendation Systems","Seung Jin Yang","2025","DAC","10.1109/DAC63849.2025.11132826","https://doi.org/10.1109/DAC63849.2025.11132826","conf/dac/YangLR25"
"doi:10.1109/DAC63849.2025.11133257","Invited paper: Enhancing Design Automation with Quantum Algorithms for Chip Design","Gabriel P. L. M. Fernandes","2025","DAC","10.1109/DAC63849.2025.11133257","https://doi.org/10.1109/DAC63849.2025.11133257","conf/dac/FernandesFVCAAVT25"
"doi:10.1109/DAC63849.2025.11133110","E-morphic: Scalable Equality Saturation for Structural Exploration in Logic Synthesis","Chen Chen","2025","DAC","10.1109/DAC63849.2025.11133110","https://doi.org/10.1109/DAC63849.2025.11133110","conf/dac/ChenHYMZ25"
"doi:10.1109/DAC63849.2025.11132967","Late Breaking Results: Fine-Tuning LLMs for Test Stimuli Generation","Hyeonwoo Park","2025","DAC","10.1109/DAC63849.2025.11132967","https://doi.org/10.1109/DAC63849.2025.11132967","conf/dac/ParkPK25"
"doi:10.1109/DAC63849.2025.11132528","PIMoE: Towards Efficient MoE Transformer Deployment on NPU-PIM System through Throttle-Aware Task Offloading","Lizhou Wu","2025","DAC","10.1109/DAC63849.2025.11132528","https://doi.org/10.1109/DAC63849.2025.11132528","conf/dac/WuZHLZC25"
"doi:10.1109/DAC63849.2025.11133374","Routability-aware Packing for High-density Nonvolatile FPGAs","Huichuan Zheng","2025","DAC","10.1109/DAC63849.2025.11133374","https://doi.org/10.1109/DAC63849.2025.11133374","conf/dac/ZhengXZZJZ25"
"doi:10.1109/DAC63849.2025.11133150","EPOC: An Efficient Pulse Generation Framework with Advanced Synthesis for Quantum Circuits","Jinglei Cheng","2025","DAC","10.1109/DAC63849.2025.11133150","https://doi.org/10.1109/DAC63849.2025.11133150","conf/dac/ChengZZRSL25"
"doi:10.1109/DAC63849.2025.11132437","MOSS: Multi-Modal Representation Learning on Sequential Circuits","Mingjun Wang","2025","DAC","10.1109/DAC63849.2025.11132437","https://doi.org/10.1109/DAC63849.2025.11132437","conf/dac/WangSMGHYZLWWGCHLLYYLL25"
"doi:10.1109/DAC63849.2025.11133133","Guarder: A Stable and Lightweight Reconfigurable RRAM-based PIM Accelerator for DNN IP Protection","Ning Lin","2025","DAC","10.1109/DAC63849.2025.11133133","https://doi.org/10.1109/DAC63849.2025.11133133","conf/dac/LinLLYHLSCQW25"
"doi:10.1109/DAC63849.2025.11132875","Cayman: Custom Accelerator Generation with Control Flow and Data Access Optimization","Youwei Xiao","2025","DAC","10.1109/DAC63849.2025.11132875","https://doi.org/10.1109/DAC63849.2025.11132875","conf/dac/XiaoCLPL25"
"doi:10.1109/DAC63849.2025.11132540","EPIC: Error PredIction and Correction for Power-Efficient Voltage Underscaling Multiply-Accumulate Unit","Tongjing Wu","2025","DAC","10.1109/DAC63849.2025.11132540","https://doi.org/10.1109/DAC63849.2025.11132540","conf/dac/WuHLLWHMJ25"
"doi:10.1109/DAC63849.2025.11132557","NoiseZO: RRAM Noise-Driven Zeroth-Order Optimization for Efficient Forward-Only Training","Shuqi Wang","2025","DAC","10.1109/DAC63849.2025.11132557","https://doi.org/10.1109/DAC63849.2025.11132557","conf/dac/WangLDZWZW25"
