"paper_id","title","authors","year","venue","doi","url","dblp_id"
"doi:10.1145/3627703.3650063","WiseGraph: Optimizing GNN with Joint Workload Partition of Graph and Operations","Kezhao Huang","2024","EuroSys","10.1145/3627703.3650063","https://doi.org/10.1145/3627703.3650063","conf/eurosys/HuangZ0WJZZZYS24"
"doi:10.1145/3627703.3629571","Core Graph: Exploiting Edge Centrality to Speedup the Evaluation of Iterative Graph Queries","Xiaolin Jiang","2024","EuroSys","10.1145/3627703.3629571","https://doi.org/10.1145/3627703.3629571","conf/eurosys/0002A0A024"
"doi:10.1145/3627703.3650076","LSGraph: A Locality-centric High-performance Streaming Graph Engine","Hao Qi","2024","EuroSys","10.1145/3627703.3650076","https://doi.org/10.1145/3627703.3650076","conf/eurosys/QiWHZLC0Z024"
"doi:10.1145/3627703.3629589","Contigra: Graph Mining with Containment Constraints","Joanna Che","2024","EuroSys","10.1145/3627703.3629589","https://doi.org/10.1145/3627703.3629589","conf/eurosys/CheJV24"
"doi:10.1145/3627703.3650062","Halflife: An Adaptive Flowlet-based Load Balancer with Fading Timeout in Data Center Networks","Sen Liu","2024","EuroSys","10.1145/3627703.3650062","https://doi.org/10.1145/3627703.3650062","conf/eurosys/LiuGCYXLYTS0024"
"doi:10.1145/3627703.3629564","Hoda: a High-performance Open vSwitch Dataplane with Multiple Specialized Data Paths","Heng Pan","2024","EuroSys","10.1145/3627703.3629564","https://doi.org/10.1145/3627703.3629564","conf/eurosys/PanHLZWZDZX24"
"doi:10.1145/3627703.3650069","Astraea: Towards Fair and Efficient Learning-based Congestion Control","Xudong Liao","2024","EuroSys","10.1145/3627703.3650069","https://doi.org/10.1145/3627703.3650069","conf/eurosys/LiaoTZW024"
"doi:10.1145/3627703.3629574","Unison: A Parallel-Efficient and User-Transparent Network Simulation Kernel","Songyuan Bai","2024","EuroSys","10.1145/3627703.3629574","https://doi.org/10.1145/3627703.3629574","conf/eurosys/BaiZ00LJXXDC24"
"doi:10.1145/3627703.3629568","Serialization/Deserialization-free State Transfer in Serverless Workflows","Fangming Lu","2024","EuroSys","10.1145/3627703.3629568","https://doi.org/10.1145/3627703.3629568","conf/eurosys/LuWH0W024"
"doi:10.1145/3627703.3650086","Occam: A Programming System for Reliable Network Management","Jiarong Xing","2024","EuroSys","10.1145/3627703.3650086","https://doi.org/10.1145/3627703.3650086","conf/eurosys/XingHXCLZC24"
"doi:10.1145/3627703.3629554","Aceso: Efficient Parallel DNN Training through Iterative Bottleneck Alleviation","Guodong Liu","2024","EuroSys","10.1145/3627703.3629554","https://doi.org/10.1145/3627703.3629554","conf/eurosys/LiuMLSMYBW24"
"doi:10.1145/3627703.3629575","Totoro: A Scalable Federated Learning Engine for the Edge","Cheng-Wei Ching","2024","EuroSys","10.1145/3627703.3629575","https://doi.org/10.1145/3627703.3629575","conf/eurosys/ChingCKJWSH24"
"doi:10.1145/3627703.3650081","FLOAT: Federated Learning Optimizations with Automated Tuning","Ahmad Faraz Khan","2024","EuroSys","10.1145/3627703.3650081","https://doi.org/10.1145/3627703.3650081","conf/eurosys/KhanKAFB024"
"doi:10.1145/3627703.3650082","DeTA: Minimizing Data Leaks in Federated Learning via Decentralized and Trustworthy Aggregation","Pau-Chen Cheng","2024","EuroSys","10.1145/3627703.3650082","https://doi.org/10.1145/3627703.3650082","conf/eurosys/ChengEGJJVV24"
"doi:10.1145/3627703.3650083","ScheMoE: An Extensible Mixture-of-Experts Distributed Training System with Tasks Scheduling","Shaohuai Shi","2024","EuroSys","10.1145/3627703.3650083","https://doi.org/10.1145/3627703.3650083","conf/eurosys/ShiPWLRHYLC24"
"doi:10.1145/3627703.3650073","Dashing and Star: Byzantine Fault Tolerance with Weak Certificates","Sisi Duan","2024","EuroSys","10.1145/3627703.3650073","https://doi.org/10.1145/3627703.3650073","conf/eurosys/DuanZSHMDW24"
"doi:10.1145/3627703.3650091","Bandle: Asynchronous State Machine Replication Made Efficient","Bo Wang","2024","EuroSys","10.1145/3627703.3650091","https://doi.org/10.1145/3627703.3650091","conf/eurosys/WangLDW0ZZ024"
"doi:10.1145/3627703.3629579","Characterization and Reclamation of Frozen Garbage in Managed FaaS Workloads","Ziming Zhao","2024","EuroSys","10.1145/3627703.3629579","https://doi.org/10.1145/3627703.3629579","conf/eurosys/0003W0Z24"
"doi:10.1145/3627703.3629556","Pronghorn: Effective Checkpoint Orchestration for Serverless Hot-Starts","Sumer Kohli","2024","EuroSys","10.1145/3627703.3629556","https://doi.org/10.1145/3627703.3629556","conf/eurosys/KohliKBC024"
"doi:10.1145/3627703.3650064","Improving Resource and Energy Efficiency for Cloud 3D through Excessive Rendering Reduction","Tianyi Liu","2024","EuroSys","10.1145/3627703.3650064","https://doi.org/10.1145/3627703.3650064","conf/eurosys/LiuL0LW024"
"doi:10.1145/3627703.3650060","Draconis: Network-Accelerated Scheduling for Microsecond-Scale Workloads","Sreeharsha Udayashankar","2024","EuroSys","10.1145/3627703.3650060","https://doi.org/10.1145/3627703.3650060","conf/eurosys/UdayashankarAMA24"
"doi:10.1145/3627703.3629577","Snatch: Online Streaming Analytics at the Network Edge","Yunming Xiao","2024","EuroSys","10.1145/3627703.3629577","https://doi.org/10.1145/3627703.3629577","conf/eurosys/XiaoZLK24"
"doi:10.1145/3627703.3629558","Blaze: Holistic Caching for Iterative Data Processing","Won Wook Song","2024","EuroSys","10.1145/3627703.3629558","https://doi.org/10.1145/3627703.3629558","conf/eurosys/SongEUJC24"
"doi:10.1145/3627703.3650066","TTLs Matter: Efficient Cache Sizing with TTL-Aware Miss Ratio Curves and Working Set Sizes","Sari Sultan","2024","EuroSys","10.1145/3627703.3650066","https://doi.org/10.1145/3627703.3650066","conf/eurosys/SultanSLCS24"
"doi:10.1145/3627703.3650072","Trinity: A Fast Compressed Multi-attribute Data Store","Ziming Mao","2024","EuroSys","10.1145/3627703.3650072","https://doi.org/10.1145/3627703.3650072","conf/eurosys/MaoSK24"
"doi:10.1145/3627703.3650078","FLOWS: Balanced MRC Profiling for Heterogeneous Object-Size Cache","Xiaojun Guo","2024","EuroSys","10.1145/3627703.3650078","https://doi.org/10.1145/3627703.3650078","conf/eurosys/GuoWZJHX24"
"doi:10.1145/3627703.3629582","CCL-BTree: A Crash-Consistent Locality-Aware B+-Tree for Reducing XPBuffer-Induced Write Amplification in Persistent Memory","Zhenxin Li","2024","EuroSys","10.1145/3627703.3629582","https://doi.org/10.1145/3627703.3629582","conf/eurosys/LiHDHZWW24"
"doi:10.1145/3627703.3629590","Wormhole Filters: Caching Your Hash on Persistent Memory","Hancheng Wang","2024","EuroSys","10.1145/3627703.3629590","https://doi.org/10.1145/3627703.3629590","conf/eurosys/WangDGL0DCCLC24"
"doi:10.1145/3627703.3629559","Dordis: Efficient Federated Learning with Dropout-Resilient Differential Privacy","Zhifeng Jiang","2024","EuroSys","10.1145/3627703.3629559","https://doi.org/10.1145/3627703.3629559","conf/eurosys/Jiang0C24"
"doi:10.1145/3627703.3629563","Accelerating Privacy-Preserving Machine Learning With GeniBatch","Xinyang Huang","2024","EuroSys","10.1145/3627703.3629563","https://doi.org/10.1145/3627703.3629563","conf/eurosys/Huang0C0JHT024"
"doi:10.1145/3627703.3650074","GMorph: Accelerating Multi-DNN Inference via Model Fusion","Qizheng Yang","2024","EuroSys","10.1145/3627703.3650074","https://doi.org/10.1145/3627703.3650074","conf/eurosys/YangYXZWS024"
"doi:10.1145/3627703.3629580","HAP: SPMD DNN Training on Heterogeneous GPU Clusters with Automated Program Synthesis","Shiwei Zhang","2024","EuroSys","10.1145/3627703.3629580","https://doi.org/10.1145/3627703.3629580","conf/eurosys/ZhangD0CW024"
"doi:10.1145/3627703.3629585","DynaPipe: Optimizing Multi-task Training through Dynamic Pipelines","Chenyu Jiang","2024","EuroSys","10.1145/3627703.3629585","https://doi.org/10.1145/3627703.3629585","conf/eurosys/JiangJ00024"
"doi:10.1145/3627703.3650088","ZKML: An Optimizing System for ML Inference in Zero-Knowledge Proofs","Bing-Jyue Chen","2024","EuroSys","10.1145/3627703.3650088","https://doi.org/10.1145/3627703.3650088","conf/eurosys/ChenWSK24"
"doi:10.1145/3627703.3629555","Puddles: Application-Independent Recovery and Location-Independent Data for Persistent Memory","Suyash Mahar","2024","EuroSys","10.1145/3627703.3629555","https://doi.org/10.1145/3627703.3629555","conf/eurosys/MaharSSIS24"
"doi:10.1145/3627703.3629561","SplitFT: Fault Tolerance for Disaggregated Datacenters via Remote Memory Logging","Xuhao Luo","2024","EuroSys","10.1145/3627703.3629561","https://doi.org/10.1145/3627703.3629561","conf/eurosys/LuoAG24"
"doi:10.1145/3627703.3629566","CSAL: the Next-Gen Local Disks for the Cloud","Yanbo Zhou","2024","EuroSys","10.1145/3627703.3629566","https://doi.org/10.1145/3627703.3629566","conf/eurosys/ZhouXZKBGMKLLYH24"
"doi:10.1145/3627703.3629586","Exploring the Asynchrony of Slow Memory Filesystem with EasyIO","Bohong Zhu","2024","EuroSys","10.1145/3627703.3629586","https://doi.org/10.1145/3627703.3629586","conf/eurosys/ZhuCS24"
"doi:10.1145/3627703.3629588","ScaleCache: A Scalable Page Cache for Multiple Solid-State Drives","Kiet Tuan Pham","2024","EuroSys","10.1145/3627703.3629588","https://doi.org/10.1145/3627703.3629588","conf/eurosys/PhamCLNYJLKS24"
"doi:10.1145/3627703.3650090","Volley: Accelerating Write-Read Orders in Disaggregated Storage","Shaoxun Zeng","2024","EuroSys","10.1145/3627703.3650090","https://doi.org/10.1145/3627703.3650090","conf/eurosys/ZengLGL24"
"doi:10.1145/3627703.3629553","Automatic Root Cause Analysis via Large Language Models for Cloud Incidents","Yinfang Chen","2024","EuroSys","10.1145/3627703.3629553","https://doi.org/10.1145/3627703.3629553","conf/eurosys/ChenXMKGSCGFWZG24"
"doi:10.1145/3627703.3629562","Finding Correctness Bugs in eBPF Verifier with Structured and Sanitized Program","Hao Sun","2024","EuroSys","10.1145/3627703.3629562","https://doi.org/10.1145/3627703.3629562","conf/eurosys/SunXLSGJ24"
"doi:10.1145/3627703.3629570","Noctua: Towards Automated and Practical Fine-grained Consistency Analysis","Kai Ma","2024","EuroSys","10.1145/3627703.3629570","https://doi.org/10.1145/3627703.3629570","conf/eurosys/Ma0ZCYC24"
"doi:10.1145/3627703.3629576","Effective Bug Detection with Unused Definitions","Li Zhong","2024","EuroSys","10.1145/3627703.3629576","https://doi.org/10.1145/3627703.3629576","conf/eurosys/ZhongXH0M024"
"doi:10.1145/3627703.3650077","SandTable: Scalable Distributed System Model Checking with Specification-Level State Exploration","Ruize Tang","2024","EuroSys","10.1145/3627703.3650077","https://doi.org/10.1145/3627703.3650077","conf/eurosys/TangS0WOM24"
"doi:10.1145/3627703.3650080","Validating Database System Isolation Level Implementations with Version Certificate Recovery","Jack Clark","2024","EuroSys","10.1145/3627703.3650080","https://doi.org/10.1145/3627703.3650080","conf/eurosys/ClarkDWR24"
"doi:10.1145/3627703.3629584","Improving GPU Energy Efficiency through an Application-transparent Frequency Scaling Policy with Performance Assurance","Yijia Zhang","2024","EuroSys","10.1145/3627703.3629584","https://doi.org/10.1145/3627703.3629584","conf/eurosys/ZhangWLXW24"
"doi:10.1145/3627703.3629560","Minuet: Accelerating 3D Sparse Convolutions on GPUs","Jiacheng Yang","2024","EuroSys","10.1145/3627703.3629560","https://doi.org/10.1145/3627703.3629560","conf/eurosys/YangGWE0P24"
"doi:10.1145/3627703.3650075","MTM: Rethinking Memory Profiling and Migration for Multi-Tiered Large Memory","Jie Ren","2024","EuroSys","10.1145/3627703.3650075","https://doi.org/10.1145/3627703.3650075","conf/eurosys/0015XRSKL24"
"doi:10.1145/3627703.3650061","Exploring Performance and Cost Optimization with ASIC-Based CXL Memory","Yupeng Tang","2024","EuroSys","10.1145/3627703.3650061","https://doi.org/10.1145/3627703.3650061","conf/eurosys/TangZZHYXLSHZCZ24"
"doi:10.1145/3627703.3629557","HD-IOV: SW-HW Co-designed I/O Virtualization with Scalability and Flexibility for Hyper-Density Cloud","Zongpu Zhang","2024","EuroSys","10.1145/3627703.3629557","https://doi.org/10.1145/3627703.3629557","conf/eurosys/ZhangCYCLLZWLG24"
"doi:10.1145/3627703.3650071","SmartNIC Security Isolation in the Cloud with S-NIC","Yang Zhou","2024","EuroSys","10.1145/3627703.3650071","https://doi.org/10.1145/3627703.3650071","conf/eurosys/ZhouWMY24"
"doi:10.1145/3627703.3629587","Atlas: Hybrid Cloud Migration Advisor for Interactive Microservices","Ka-Ho Chow","2024","EuroSys","10.1145/3627703.3629587","https://doi.org/10.1145/3627703.3629587","conf/eurosys/ChowDDS024"
"doi:10.1145/3627703.3650084","Erlang: Application-Aware Autoscaling for Cloud Microservices","Vighnesh Sachidananda","2024","EuroSys","10.1145/3627703.3650084","https://doi.org/10.1145/3627703.3650084","conf/eurosys/SachidanandaS24"
"doi:10.1145/3627703.3650079","On the Limitations of Carbon-Aware Temporal and Spatial Workload Shifting in the Cloud","Thanathorn Sukprasert","2024","EuroSys","10.1145/3627703.3650079","https://doi.org/10.1145/3627703.3650079","conf/eurosys/SukprasertSBIS24"
"doi:10.1145/3627703.3629581","TraceUpscaler: Upscaling Traces to Evaluate Systems at High Load","Sultan Mahmud Sajal","2024","EuroSys","10.1145/3627703.3629581","https://doi.org/10.1145/3627703.3629581","conf/eurosys/SajalZU024"
"doi:10.1145/3627703.3629569","Enoki: High Velocity Linux Kernel Scheduler Development","Samantha Miller","2024","EuroSys","10.1145/3627703.3629569","https://doi.org/10.1145/3627703.3629569","conf/eurosys/MillerKV0ZA24"
"doi:10.1145/3627703.3629573","Concealing Compression-accelerated I/O for HPC Applications through In Situ Task Scheduling","Sian Jin","2024","EuroSys","10.1145/3627703.3629573","https://doi.org/10.1145/3627703.3629573","conf/eurosys/JinDVWRTC24"
"doi:10.1145/3627703.3650067","NeuroFlux: Memory-Efficient CNN Training Using Adaptive Local Learning","Dhananjay Saikumar","2024","EuroSys","10.1145/3627703.3650067","https://doi.org/10.1145/3627703.3650067","conf/eurosys/SaikumarV24"
"doi:10.1145/3627703.3629565","Model Selection for Latency-Critical Inference Serving","Daniel Mendoza","2024","EuroSys","10.1145/3627703.3629565","https://doi.org/10.1145/3627703.3629565","conf/eurosys/MendozaRT24"
"doi:10.1145/3627703.3629567","Optimus: Warming Serverless ML Inference via Inter-Function Model Transformation","Zicong Hong","2024","EuroSys","10.1145/3627703.3629567","https://doi.org/10.1145/3627703.3629567","conf/eurosys/HongL0LCW024"
"doi:10.1145/3627703.3629572","CDMPP: A Device-Model Agnostic Framework for Latency Prediction of Tensor Programs","Hanpeng Hu","2024","EuroSys","10.1145/3627703.3629572","https://doi.org/10.1145/3627703.3629572","conf/eurosys/HuSZPZL024"
"doi:10.1145/3627703.3629578","Orion: Interference-aware, Fine-grained GPU Sharing for ML Applications","Foteini Strati","2024","EuroSys","10.1145/3627703.3629578","https://doi.org/10.1145/3627703.3629578","conf/eurosys/StratiMK24"
"doi:10.1145/3627703.3629583","Blox: A Modular Toolkit for Deep Learning Schedulers","Saurabh Agarwal","2024","EuroSys","10.1145/3627703.3629583","https://doi.org/10.1145/3627703.3629583","conf/eurosys/AgarwalPV24"
"doi:10.1145/3627703.3650085","Just-In-Time Checkpointing: Low Cost Error Recovery from Deep Learning Training Failures","Tanmaey Gupta","2024","EuroSys","10.1145/3627703.3650085","https://doi.org/10.1145/3627703.3650085","conf/eurosys/GuptaKKVGKRS24"
"doi:10.1145/3627703.3650065","Polynima: Practical Hybrid Recompilation for Multithreaded Binaries","Chinmay Deshpande","2024","EuroSys","10.1145/3627703.3650065","https://doi.org/10.1145/3627703.3650065","conf/eurosys/DeshpandePHF24"
"doi:10.1145/3627703.3629591","Transparent Multicore Scaling of Single-Threaded Network Functions","Lei Yan","2024","EuroSys","10.1145/3627703.3629591","https://doi.org/10.1145/3627703.3629591","conf/eurosys/YanPZCK24"
"doi:10.1145/3627703.3650087","Jade: A High-throughput Concurrent Copying Garbage Collector","Mingyu Wu","2024","EuroSys","10.1145/3627703.3650087","https://doi.org/10.1145/3627703.3650087","conf/eurosys/0001MLJLLTLTDCZ24"
"doi:10.1145/3627703.3650070","Adaptable Runtime Monitoring for Intermittent Systems","Eren Yildiz","2024","EuroSys","10.1145/3627703.3650070","https://doi.org/10.1145/3627703.3650070","conf/eurosys/YildizARGKY24"
"doi:10.1145/3627703.3650068","Save the Bruised Striver: A Reliable Live Patching Framework for Protecting Real-World PLCs","Ming Zhou","2024","EuroSys","10.1145/3627703.3650068","https://doi.org/10.1145/3627703.3650068","conf/eurosys/ZhouWLZS24"
"doi:10.1145/3627703.3650089","Efficient Auditing of Event-driven Web Applications","Ioanna Tzialla","2024","EuroSys","10.1145/3627703.3650089","https://doi.org/10.1145/3627703.3650089","conf/eurosys/TziallaWZPW24"
