"paper_id","title","authors","year","venue","doi","url","dblp_id"
"doi:10.1145/3676536.3676751","ReSCIM: Variation-Resilient High Weight-Loading Bandwidth In-Memory Computation Based on Fine-Grained Hybrid Integration of Multi-Level ReRAM and SRAM Cells","Xiaomeng Wang","2024","ICCAD","10.1145/3676536.3676751","https://doi.org/10.1145/3676536.3676751","conf/iccad/WangHSZTCT24"
"doi:10.1145/3676536.3676714","Voxel-CIM: An Efficient Compute-in-Memory Accelerator for Voxel-based Point Cloud Neural Networks","Xipeng Lin","2024","ICCAD","10.1145/3676536.3676714","https://doi.org/10.1145/3676536.3676714","conf/iccad/LinHJ24"
"doi:10.1145/3676536.3676773","Leda: Leveraging Tiling Dataflow to Accelerate SpMM on HBM-Equipped FPGAs for GNNs","Enxin Yi","2024","ICCAD","10.1145/3676536.3676773","https://doi.org/10.1145/3676536.3676773","conf/iccad/YiBNN0024"
"doi:10.1145/3676536.3676835","CoCoA: Algorithm-Hardware Co-Design for Large-Scale GNN Training using Compressed Graph","Yunki Han","2024","ICCAD","10.1145/3676536.3676835","https://doi.org/10.1145/3676536.3676835","conf/iccad/HanSPK24"
"doi:10.1145/3676536.3676737","FLOP: A Flexible Memory-Optimized Processor for Parallel Graph Mining on FPGA","Guoyu Li","2024","ICCAD","10.1145/3676536.3676737","https://doi.org/10.1145/3676536.3676737","conf/iccad/LiZYW24"
"doi:10.1145/3676536.3676712","BasisN: Reprogramming-Free RRAM-Based In-Memory-Computing by Basis Combination for Deep Neural Networks","Amro Eldebiky","2024","ICCAD","10.1145/3676536.3676712","https://doi.org/10.1145/3676536.3676712","conf/iccad/EldebikyZYZLS024"
"doi:10.1145/3676536.3676837","TP-DCIM: Transposable Digital SRAM CIM Architecture for Energy-Efficient and High Throughput Transformer Acceleration","Junwoo Park","2024","ICCAD","10.1145/3676536.3676837","https://doi.org/10.1145/3676536.3676837","conf/iccad/ParkL024"
"doi:10.1145/3676536.3676663","FSMM: An Efficient Matrix Multiplication Accelerator Supporting Flexible Sparsity","Yuxuan Qiao","2024","ICCAD","10.1145/3676536.3676663","https://doi.org/10.1145/3676536.3676663","conf/iccad/QiaoYZXYY24"
"doi:10.1145/3676536.3676687","RandOhm: Mitigating Impedance Side-channel Attacks using Randomized Circuit Configurations","Saleh Khalaj Monfared","2024","ICCAD","10.1145/3676536.3676687","https://doi.org/10.1145/3676536.3676687","conf/iccad/MonfaredFT24"
"doi:10.1145/3676536.3676708","Layout-level Hardware Trojan Prevention in the Context of Physical Design","Xingyu Tong","2024","ICCAD","10.1145/3676536.3676708","https://doi.org/10.1145/3676536.3676708","conf/iccad/TongCWCZLC24"
"doi:10.1145/3676536.3676813","A Built-In Integrated Rowhammer, Rowpress, and Leakage Detection Sensor for DRAM","Nezam Rohbani","2024","ICCAD","10.1145/3676536.3676813","https://doi.org/10.1145/3676536.3676813","conf/iccad/RohbaniPSKUS24"
"doi:10.1145/3676536.3676822","LaserEscape: Detecting and Mitigating Optical Probing Attacks","Saleh Khalaj Monfared","2024","ICCAD","10.1145/3676536.3676822","https://doi.org/10.1145/3676536.3676822","conf/iccad/MonfaredMCFT24"
"doi:10.1145/3676536.3676671","R-HLS: An IR for Dynamic High-Level Synthesis and Memory Disambiguation based on Regions and State Edges","David Metz","2024","ICCAD","10.1145/3676536.3676671","https://doi.org/10.1145/3676536.3676671","conf/iccad/0001RS24"
"doi:10.1145/3676536.3676781","HLSPilot: LLM-based High-Level Synthesis","Chenwei Xiong","2024","ICCAD","10.1145/3676536.3676781","https://doi.org/10.1145/3676536.3676781","conf/iccad/XiongLLL24"
"doi:10.1145/3676536.3676788","Balor: HLS Source Code Evaluator Based on Custom Graphs and Hierarchical GNNs","Emmet Murphy","2024","ICCAD","10.1145/3676536.3676788","https://doi.org/10.1145/3676536.3676788","conf/iccad/MurphyJ24"
"doi:10.1145/3676536.3676793","UFO-MAC: A Unified Framework for Optimization of High-Performance Multipliers and Multiply-Accumulators","Dongsheng Zuo","2024","ICCAD","10.1145/3676536.3676793","https://doi.org/10.1145/3676536.3676793","conf/iccad/ZuoZLM24"
"doi:10.1145/3676536.3676826","Spiking Transformer Hardware Accelerators in 3D Integration","Boxun Xu","2024","ICCAD","10.1145/3676536.3676826","https://doi.org/10.1145/3676536.3676826","conf/iccad/XuHVLL24"
"doi:10.1145/3676536.3676812","Neural Architecture Search for Highly Bespoke Robust Printed Neuromorphic Circuits","Priyanjana Pal","2024","ICCAD","10.1145/3676536.3676812","https://doi.org/10.1145/3676536.3676812","conf/iccad/PalZGHBT24"
"doi:10.1145/3676536.3676710","An O(m+n)-Space Spatiotemporal Denoising Filter with Cache-Like Memories for Dynamic Vision Sensors","Qinghang Zhao","2024","ICCAD","10.1145/3676536.3676710","https://doi.org/10.1145/3676536.3676710","conf/iccad/ZhaoWJWS24"
"doi:10.1145/3676536.3676691","LSMR: Synergy Randomness in Liquid State Machine and RRAM-based Analog-digital Accelerator","Ning Lin","2024","ICCAD","10.1145/3676536.3676691","https://doi.org/10.1145/3676536.3676691","conf/iccad/LinWZWHZWLLCLCX24"
"doi:10.1145/3676536.3676790","FlexInt: A New Number Format for Robust Sub-8-Bit Neural Network Inference","Minuk Hong","2024","ICCAD","10.1145/3676536.3676790","https://doi.org/10.1145/3676536.3676790","conf/iccad/HongSLL24"
"doi:10.1145/3676536.3676798","MARCA: Mamba Accelerator with Reconfigurable Architecture","Jinhao Li","2024","ICCAD","10.1145/3676536.3676798","https://doi.org/10.1145/3676536.3676798","conf/iccad/0006HXL0XD24"
"doi:10.1145/3676536.3676840","Mixed-precision Neural Networks on RISC-V Cores: ISA extensions for Multi-Pumped Soft SIMD Operations","Giorgos Armeniakos","2024","ICCAD","10.1145/3676536.3676840","https://doi.org/10.1145/3676536.3676840","conf/iccad/ArmeniakosMXS24"
"doi:10.1145/3676536.3676722","SCATTER: Algorithm-Circuit Co-Sparse Photonic Accelerator with Thermal-Tolerant, Power-Efficient In-situ Light Redistribution","Ziang Yin","2024","ICCAD","10.1145/3676536.3676722","https://doi.org/10.1145/3676536.3676722","conf/iccad/YinGZ0H024"
"doi:10.1145/3676536.3676743","FAS-Trans: Fully Exploiting FFN and Attention Sparsity for Transformer on FPGA","Hongji Wang","2024","ICCAD","10.1145/3676536.3676743","https://doi.org/10.1145/3676536.3676743","conf/iccad/WangWZY24"
"doi:10.1145/3676536.3676774","RISCSparse: Point Cloud Inference Engine on RISC-V Processor","Shangran Lin","2024","ICCAD","10.1145/3676536.3676774","https://doi.org/10.1145/3676536.3676774","conf/iccad/LinZXCZ0024"
