"paper_id","title","authors","year","venue","doi","url","dblp_id"
"dblp:conf/usenix/Tennenhouse22","Surprise-Inspired Networking","David L. Tennenhouse","2022","USENIX-ATC","","https://dblp.org/rec/conf/usenix/Tennenhouse22","conf/usenix/Tennenhouse22"
"dblp:conf/usenix/BergmanCBS22","ZNSwap: un-Block your Swap","Shai Bergman","2022","USENIX-ATC","","https://dblp.org/rec/conf/usenix/BergmanCBS22","conf/usenix/BergmanCBS22"
"dblp:conf/usenix/ZouXS0022","Building a High-performance Fine-grained Deduplication Framework for Backup Storage with High Deduplication Ratio","Xiangyu Zou","2022","USENIX-ATC","","https://dblp.org/rec/conf/usenix/ZouXS0022","conf/usenix/ZouXS0022"
"dblp:conf/usenix/Yang0L22","Secure and Lightweight Deduplicated Storage via Shielded Deduplication-Before-Encryption","Zuoru Yang","2022","USENIX-ATC","","https://dblp.org/rec/conf/usenix/Yang0L22","conf/usenix/Yang0L22"
"dblp:conf/usenix/LiC0GBTZWHG22","RunD: A Lightweight Secure Container Runtime for High-density Deployment and High-concurrency Startup in Serverless Computing","Zijun Li","2022","USENIX-ATC","","https://dblp.org/rec/conf/usenix/LiC0GBTZWHG22","conf/usenix/LiC0GBTZWHG22"
"dblp:conf/usenix/LiG0CXZSMY0G22","Help Rather Than Recycle: Alleviating Cold Startup in Serverless Computing Through Inter-Function Container Sharing","Zijun Li","2022","USENIX-ATC","","https://dblp.org/rec/conf/usenix/LiG0CXZSMY0G22","conf/usenix/LiG0CXZSMY0G22"
"dblp:conf/usenix/ZhouT22","RRC: Responsive Replicated Containers","Diyu Zhou","2022","USENIX-ATC","","https://dblp.org/rec/conf/usenix/ZhouT22","conf/usenix/ZhouT22"
"dblp:conf/usenix/GuerraouiMPXYZ22","uKharon: A Membership Service for Microsecond Applications","Rachid Guerraoui","2022","USENIX-ATC","","https://dblp.org/rec/conf/usenix/GuerraouiMPXYZ22","conf/usenix/GuerraouiMPXYZ22"
"dblp:conf/usenix/WeiL0022","KRCORE: A Microsecond-scale RDMA Control Plane for Elastic Computing","Xingda Wei","2022","USENIX-ATC","","https://dblp.org/rec/conf/usenix/WeiL0022","conf/usenix/WeiL0022"
"dblp:conf/usenix/0001W0Z22","Zero-Change Object Transmission for Distributed Big Data Analytics","Mingyu Wu","2022","USENIX-ATC","","https://dblp.org/rec/conf/usenix/0001W0Z22","conf/usenix/0001W0Z22"
"dblp:conf/usenix/MaAGGJKK22","Sift: Using Refinement-guided Automation to Verify Complex Distributed Systems","Haojun Ma","2022","USENIX-ATC","","https://dblp.org/rec/conf/usenix/MaAGGJKK22","conf/usenix/MaAGGJKK22"
"dblp:conf/usenix/Feng0WCWY0D22","Faith: An Efficient Framework for Transformer Verification on GPUs","Boyuan Feng","2022","USENIX-ATC","","https://dblp.org/rec/conf/usenix/Feng0WCWY0D22","conf/usenix/Feng0WCWY0D22"
"dblp:conf/usenix/Cui00WLZ0G22","DVABatch: Diversity-aware Multi-Entry Multi-Exit Batching for Efficient Processing of DNN Services on GPUs","Weihao Cui","2022","USENIX-ATC","","https://dblp.org/rec/conf/usenix/Cui00WLZ0G22","conf/usenix/Cui00WLZ0G22"
"dblp:conf/usenix/ChoiLKPKH22","Serving Heterogeneous Machine Learning Models on Multi-GPU Servers with Spatio-Temporal Sharing","Seungbeom Choi","2022","USENIX-ATC","","https://dblp.org/rec/conf/usenix/ChoiLKPKH22","conf/usenix/ChoiLKPKH22"
"dblp:conf/usenix/0149CH000SYG22","PilotFish: Harvesting Free Cycles of Cloud Gaming with Deep Learning Training","Wei Zhang","2022","USENIX-ATC","","https://dblp.org/rec/conf/usenix/0149CH000SYG22","conf/usenix/0149CH000SYG22"
"dblp:conf/usenix/Kuznetsov022","Privbox: Faster System Calls Through Sandboxed Privileged Execution","Dmitry Kuznetsov","2022","USENIX-ATC","","https://dblp.org/rec/conf/usenix/Kuznetsov022","conf/usenix/Kuznetsov022"
"dblp:conf/usenix/WangBFOOLCH022","BBQ: A Block-based Bounded Queue for Exchanging Data and Profiling","Jiawei Wang","2022","USENIX-ATC","","https://dblp.org/rec/conf/usenix/WangBFOOLCH022","conf/usenix/WangBFOOLCH022"
"dblp:conf/usenix/KimJLLJ22","Sibylla: To Retry or Not To Retry on Deep Learning Job Failure","Taeyoon Kim","2022","USENIX-ATC","","https://dblp.org/rec/conf/usenix/KimJLLJ22","conf/usenix/KimJLLJ22"
"dblp:conf/usenix/LiKFLL22","Speculative Recovery: Cheap, Highly Available Fault Tolerance with Disaggregated Storage","Nanqinqin Li","2022","USENIX-ATC","","https://dblp.org/rec/conf/usenix/LiKFLL22","conf/usenix/LiKFLL22"
"dblp:conf/usenix/GoukLKJ22","Direct Access, High-Performance Memory Disaggregation with DirectCXL","Donghyun Gouk","2022","USENIX-ATC","","https://dblp.org/rec/conf/usenix/GoukLKJ22","conf/usenix/GoukLKJ22"
"dblp:conf/usenix/HolzbauerULF22","Not that Simple: Email Delivery in the 21st Century","Florian Holzbauer","2022","USENIX-ATC","","https://dblp.org/rec/conf/usenix/HolzbauerULF22","conf/usenix/HolzbauerULF22"
"dblp:conf/usenix/SongY0WLDLS22","AddrMiner: A Comprehensive Global Active IPv6 Address Discovery System","Guanglei Song","2022","USENIX-ATC","","https://dblp.org/rec/conf/usenix/SongY0WLDLS22","conf/usenix/SongY0WLDLS22"
"dblp:conf/usenix/JansenNW22","Co-opting Linux Processes for High-Performance Network Simulation","Rob Jansen","2022","USENIX-ATC","","https://dblp.org/rec/conf/usenix/JansenNW22","conf/usenix/JansenNW22"
"dblp:conf/usenix/SunSLXJ22","KSG: Augmenting Kernel Fuzzing with System Call Specification Generation","Hao Sun","2022","USENIX-ATC","","https://dblp.org/rec/conf/usenix/SunSLXJ22","conf/usenix/SunSLXJ22"
"dblp:conf/usenix/BaiL022","DLOS: Effective Static Detection of Deadlocks in OS Kernels","Jia-Ju Bai","2022","USENIX-ATC","","https://dblp.org/rec/conf/usenix/BaiL022","conf/usenix/BaiL022"
"dblp:conf/usenix/KimKL22","Modulo: Finding Convergence Failure Bugs in Distributed Systems with Divergence Resync Models","Beom Heyn Kim","2022","USENIX-ATC","","https://dblp.org/rec/conf/usenix/KimKL22","conf/usenix/KimKL22"
"dblp:conf/usenix/Brewer22","Eric Brewer, VP Infrastructure, Google Fellow and Professor Emeritus, UC Berkeley","Eric A. Brewer","2022","USENIX-ATC","","https://dblp.org/rec/conf/usenix/Brewer22","conf/usenix/Brewer22"
"dblp:conf/usenix/0001CWHWNGL0022","SoftTRR: Protect Page Tables against Rowhammer Attacks using Software-only Target Row Refresh","Zhi Zhang","2022","USENIX-ATC","","https://dblp.org/rec/conf/usenix/0001CWHWNGL0022","conf/usenix/0001CWHWNGL0022"
"dblp:conf/usenix/JohnsonPC22","Hardening Hypervisors with Ombro","Ethan Johnson","2022","USENIX-ATC","","https://dblp.org/rec/conf/usenix/JohnsonPC22","conf/usenix/JohnsonPC22"
"dblp:conf/usenix/JiaLWCZYH22","HyperEnclave: An Open and Cross-platform Trusted Execution Environment","Yuekai Jia","2022","USENIX-ATC","","https://dblp.org/rec/conf/usenix/JiaLWCZYH22","conf/usenix/JiaLWCZYH22"
"dblp:conf/usenix/SangS0Z0VK22","PRIDWEN: Universally Hardening SGX Programs via Load-Time Synthesis","Fan Sang","2022","USENIX-ATC","","https://dblp.org/rec/conf/usenix/SangS0Z0VK22","conf/usenix/SangS0Z0VK22"
"dblp:conf/usenix/LiZYZL22","Tetris: Memory-efficient Serverless Inference through Tensor Sharing","Jie Li","2022","USENIX-ATC","","https://dblp.org/rec/conf/usenix/LiZYZL22","conf/usenix/LiZYZL22"
"dblp:conf/usenix/ZhouWZS22","PetS: A Unified Framework for Parameter-Efficient Transformers Serving","Zhe Zhou","2022","USENIX-ATC","","https://dblp.org/rec/conf/usenix/ZhouWZS22","conf/usenix/ZhouWZS22"
"dblp:conf/usenix/He00022","Campo: Cost-Aware Performance Optimization for Mixed-Precision Neural Network Training","Xin He","2022","USENIX-ATC","","https://dblp.org/rec/conf/usenix/He00022","conf/usenix/He00022"
"dblp:conf/usenix/HuN00022","Primo: Practical Learning-Augmented Systems with Interpretable Models","Qinghao Hu","2022","USENIX-ATC","","https://dblp.org/rec/conf/usenix/HuN00022","conf/usenix/HuN00022"
"dblp:conf/usenix/GuYZYH22","Meces: Latency-efficient Rescaling via Prioritized State Migration for Stateful Distributed Stream Processing Systems","Rong Gu","2022","USENIX-ATC","","https://dblp.org/rec/conf/usenix/GuYZYH22","conf/usenix/GuYZYH22"
"dblp:conf/usenix/LuoS0X22","DepFast: Orchestrating Code of Quorum Systems","Xuhao Luo","2022","USENIX-ATC","","https://dblp.org/rec/conf/usenix/LuoS0X22","conf/usenix/LuoS0X22"
"dblp:conf/usenix/FoutoP022","High Throughput Replication with Integrated Membership Management","Pedro Fouto","2022","USENIX-ATC","","https://dblp.org/rec/conf/usenix/FoutoP022","conf/usenix/FoutoP022"
"dblp:conf/usenix/MansiTS22","CBMM: Financial Advice for Kernel Memory Managers","Mark Mansi","2022","USENIX-ATC","","https://dblp.org/rec/conf/usenix/MansiTS22","conf/usenix/MansiTS22"
"dblp:conf/usenix/0001LLX022","EPK: Scalable and Efficient Memory Protection Keys","Jinyu Gu","2022","USENIX-ATC","","https://dblp.org/rec/conf/usenix/0001LLX022","conf/usenix/0001LLX022"
"dblp:conf/usenix/ChoiKJAJKA22","Memory Harvesting in Multi-GPU Systems with Hierarchical Unified Virtual Memory","Sangjin Choi","2022","USENIX-ATC","","https://dblp.org/rec/conf/usenix/ChoiKJAJKA22","conf/usenix/ChoiKJAJKA22"
"dblp:conf/usenix/WangMKWLSLCC22","Zero Overhead Monitoring for Cloud-native Infrastructure using RDMA","Zhe Wang","2022","USENIX-ATC","","https://dblp.org/rec/conf/usenix/WangMKWLSLCC22","conf/usenix/WangMKWLSLCC22"
"dblp:conf/usenix/0002RRPSC22","CRISP: Critical Path Analysis of Large-Scale Microservice Architectures","Zhizhou Zhang","2022","USENIX-ATC","","https://dblp.org/rec/conf/usenix/0002RRPSC22","conf/usenix/0002RRPSC22"
"dblp:conf/usenix/JiaJWXS0LCLZL022","Whale: Efficient Giant Model Training over Heterogeneous GPUs","Xianyan Jia","2022","USENIX-ATC","","https://dblp.org/rec/conf/usenix/JiaJWXS0LCLZL022","conf/usenix/JiaJWXS0LCLZL022"
"dblp:conf/usenix/GraurAKATK22","Cachew: Machine Learning Input Data Processing as a Service","Dan Graur","2022","USENIX-ATC","","https://dblp.org/rec/conf/usenix/GraurAKATK22","conf/usenix/GraurAKATK22"
"dblp:conf/usenix/HwangKKNKKSP22","CoVA: Exploiting Compressed-Domain Analysis to Accelerate Video Analytics","Jinwoo Hwang","2022","USENIX-ATC","","https://dblp.org/rec/conf/usenix/HwangKKNKKSP22","conf/usenix/HwangKKNKKSP22"
"dblp:conf/usenix/ShenQJWWCZWCLZC22","SOTER: Guarding Black-box Inference for General Neural Networks at the Edge","Tianxiang Shen","2022","USENIX-ATC","","https://dblp.org/rec/conf/usenix/ShenQJWWCZWCLZC22","conf/usenix/ShenQJWWCZWCLZC22"
"dblp:conf/usenix/KimKTOW22","IPLFS: Log-Structured File System without Garbage Collection","Juwon Kim","2022","USENIX-ATC","","https://dblp.org/rec/conf/usenix/KimKTOW22","conf/usenix/KimKTOW22"
"dblp:conf/usenix/KwonLCHJ22","Vigil-KV: Hardware-Software Co-Design to Integrate Strong Latency Determinism into Log-Structured Merge Key-Value Stores","Miryeong Kwon","2022","USENIX-ATC","","https://dblp.org/rec/conf/usenix/KwonLCHJ22","conf/usenix/KwonLCHJ22"
"dblp:conf/usenix/WangLWXHS22","Pacman: An Efficient Compaction Approach for Log-Structured Key-Value Store on Persistent Memory","Jing Wang","2022","USENIX-ATC","","https://dblp.org/rec/conf/usenix/WangLWXHS22","conf/usenix/WangLWXHS22"
"dblp:conf/usenix/Yan022","Towards Latency Awareness for Content Delivery Network Caching","Gang Yan","2022","USENIX-ATC","","https://dblp.org/rec/conf/usenix/Yan022","conf/usenix/Yan022"
"dblp:conf/usenix/XuH0YDWZPZV22","Hashing Design in Modern Networks: Challenges and Mitigation Techniques","Yunhong Xu","2022","USENIX-ATC","","https://dblp.org/rec/conf/usenix/XuH0YDWZPZV22","conf/usenix/XuH0YDWZPZV22"
"dblp:conf/usenix/Cao000X022","Firebolt: Finding Bugs in Programmable Data Plane Generators","Jiamin Cao","2022","USENIX-ATC","","https://dblp.org/rec/conf/usenix/Cao000X022","conf/usenix/Cao000X022"
"dblp:conf/usenix/Martonosi22","Margaret Martonosi, National Science Foundation","Margaret Martonosi","2022","USENIX-ATC","","https://dblp.org/rec/conf/usenix/Martonosi22","conf/usenix/Martonosi22"
"dblp:conf/usenix/LionCSY22","Investigating Managed Language Runtime Performance: Why JavaScript and Python are 8x and 29x slower than C++, yet Java and Go can be Faster?","David Lion","2022","USENIX-ATC","","https://dblp.org/rec/conf/usenix/LionCSY22","conf/usenix/LionCSY22"
"dblp:conf/usenix/DuCSM22","Automatic Recovery of Fine-grained Compiler Artifacts at the Binary Level","Yufei Du","2022","USENIX-ATC","","https://dblp.org/rec/conf/usenix/DuCSM22","conf/usenix/DuCSM22"
"dblp:conf/usenix/KhrabrovPSL22","JITServer: Disaggregated Caching JIT Compiler for the JVM in the Cloud","Alexey Khrabrov","2022","USENIX-ATC","","https://dblp.org/rec/conf/usenix/KhrabrovPSL22","conf/usenix/KhrabrovPSL22"
"dblp:conf/usenix/CurtsingerB22","Riker: Always-Correct and Fast Incremental Builds from Simple Specifications","Charlie Curtsinger","2022","USENIX-ATC","","https://dblp.org/rec/conf/usenix/CurtsingerB22","conf/usenix/CurtsingerB22"
"dblp:conf/usenix/CaiSTHY22","FlatFS: Flatten Hierarchical File System Namespace on Non-volatile Memories","Miao Cai","2022","USENIX-ATC","","https://dblp.org/rec/conf/usenix/CaiSTHY22","conf/usenix/CaiSTHY22"
"dblp:conf/usenix/Wang0L0YD22","StRAID: Stripe-threaded Architecture for Parity-based RAIDs with Ultra-fast SSDs","Shucheng Wang","2022","USENIX-ATC","","https://dblp.org/rec/conf/usenix/Wang0L0YD22","conf/usenix/Wang0L0YD22"
"dblp:conf/usenix/KalbfleischWB22","Vinter: Automatic Non-Volatile Memory Crash Consistency Testing for Full Systems","Samuel Kalbfleisch","2022","USENIX-ATC","","https://dblp.org/rec/conf/usenix/KalbfleischWB22","conf/usenix/KalbfleischWB22"
"dblp:conf/usenix/LiLWLYS22","AlNiCo: SmartNIC-accelerated Contention-aware Request Scheduling for Transaction Processing","Junru Li","2022","USENIX-ATC","","https://dblp.org/rec/conf/usenix/LiLWLYS22","conf/usenix/LiLWLYS22"
"dblp:conf/usenix/WangH00A22","FpgaNIC: An FPGA-based Versatile 100Gb SmartNIC for GPUs","Zeke Wang","2022","USENIX-ATC","","https://dblp.org/rec/conf/usenix/WangH00A22","conf/usenix/WangH00A22"
"dblp:conf/usenix/BonolaBTBS0B22","Faster Software Packet Processing on FPGA NICs with eBPF Program Warping","Marco Bonola","2022","USENIX-ATC","","https://dblp.org/rec/conf/usenix/BonolaBTBS0B22","conf/usenix/BonolaBTBS0B22"
"dblp:conf/usenix/LuX0ZWZX0W22","NVMe SSD Failures in the Field: the Fail-Stop and the Fail-Slow","Ruiming Lu","2022","USENIX-ATC","","https://dblp.org/rec/conf/usenix/LuX0ZWZX0W22","conf/usenix/LuX0ZWZX0W22"
"dblp:conf/usenix/YangPUMW22","CacheSack: Admission Optimization for Google Datacenter Flash Caches","Tzu-Wei Yang","2022","USENIX-ATC","","https://dblp.org/rec/conf/usenix/YangPUMW22","conf/usenix/YangPUMW22"
"dblp:conf/usenix/ElhemaliGGIKLMM22","Amazon DynamoDB: A Scalable, Predictably Performant, and Fully Managed NoSQL Database Service","Mostafa Elhemali","2022","USENIX-ATC","","https://dblp.org/rec/conf/usenix/ElhemaliGGIKLMM22","conf/usenix/ElhemaliGGIKLMM22"
