"paper_id","arxiv_id","s2_paper_id","title","authors","year","venue","abstract","source","categories","citation_count","url","doi","published_date","crawled_date","keep","notes"
"doi:10.1109/HPCA53966.2022.00034","","2921481df2139740374f18fd80718975613ff86c","IR-ORAM: Path Access Type Based Memory Intensity Reduction for Path-ORAM","Mehrnoosh Raoufi","2022","HPCA","Path ORAM is an effective ORAM (Oblivious RAM) primitive for protecting memory access patterns. Path ORAM converts each off-chip memory request from user program to tens to hundreds of memory accesses. While several schemes have been proposed to mitigate the total number of memory accesses, Path ORAM remains a highly memory intensive primitive that leads to large memory bandwidth occupation and performance degradation.In this paper, we propose IR-ORAM to reduce the memory intensity based on path access types in Path ORAM. Path accesses in Path ORAM, while being kept oblivious to ensure privacy protection, can be categorized to three types: paths for requested data blocks, paths for position map blocks, and dummy paths. We develop a set of techniques to reduce the memory intensity of each type while ensuring the obliviousness at the same time — we reduce the number of data blocks to access for each tree path, reduce the number of path accesses for position maps, and convert many dummy path accesses to early write-backs of dirty data in LLC. Our experimental results show that IR-ORAM achieves on average 42% performance improvement over the state-of-the-art while effectively enforcing the memory access obliviousness and the same level of security protection.","dblp","Computer Science","13","https://doi.org/10.1109/HPCA53966.2022.00034","10.1109/HPCA53966.2022.00034","2022-04-01","2026-04-08","",""
"doi:10.1109/HPCA53966.2022.00035","","51f7664f9ee2f6ae133132140d8bd8917dbb18c0","SafeGuard: Reducing the Security Risk from Row-Hammer via Low-Cost Integrity Protection","Ali Fakhrzadehgan","2022","HPCA","Row-Hammer (RH) is a DRAM data-disturbance failure that occurs when a row is activated frequently, which causes bit-flips in nearby rows. Row-Hammer is a significant security threat as an attacker can exploit the bit-flips to do privilege escalation and leak confidential data. While several solutions aim to mitigate RH, such solutions depend on the RH threshold and adversarial access patterns. Solutions developed for a given threshold become ineffective for newer devices with lower thresholds, and new attack patterns continue to break existing mitigations. Currently, there is no guaranteed solution for RH, which means that the system remains vulnerable to security threats even in the presence of RH mitigation.In this paper, we contend that simply relying on RH mitigation is insufficient to provide security in the presence of reducing threshold and motivated attackers. We propose SafeGuard, which equips the system with low-cost integrity protection as a defense against potential attacks that break the RH mitigation. As SafeGuard can detect arbitrary failures, it converts the problem of RH bit-flips from a security threat (silent consumption of corrupted data) to a reliability concern (detectable uncorrectable errors caused by integrity violation). We develop SafeGuard for systems that employ ECC modules and show that SafeGuard can provide strong detection to both SECDED (46-bit MAC per cache-line) and Chipkill (32-bit MAC per cache-line) while retaining the correction capability of conventional designs. SafeGuard avoids incurring any storage overheads in DRAM by simply reorganizing the ECC code to operate at a cache-line granularity (64 bytes) instead of a word granularity (8 bytes). Our evaluations show that SafeGuard has a negligible impact on both the system performance (0.7%) and the system reliability due to naturally occurring errors while still providing a strong defense against the security risk of RH by detecting arbitrary bit-flips.","dblp","Computer Science","56","https://doi.org/10.1109/HPCA53966.2022.00035","10.1109/HPCA53966.2022.00035","2022-04-01","2026-04-08","",""
"doi:10.1109/HPCA53966.2022.00036","2108.03708","ca00fa4cd0043c50e8cf67ddf5dbdcd41879e1b3","Detecting Qubit-coupling Faults in Ion-trap Quantum Computers","Andrii Maksymov","2022","HPCA","Ion-trap quantum computers offer a large number of possible qubit couplings, each of which requires individual calibration and can be misconfigured. To enhance the duty cycle of an ion trap, we develop a strategy that diagnoses individual miscalibrated couplings using only log-many tests. This strategy is validated on a commercial ion-trap quantum computer, where we illustrate the process of debugging faulty quantum gates. Our methodology provides a scalable pathway towards fault detections on a larger scale ion-trap quantum computers, confirmed by simulations up to 32 qubits.","dblp","Physics; Computer Science","8","https://doi.org/10.1109/HPCA53966.2022.00036","10.1109/HPCA53966.2022.00036","2021-08-08","2026-04-08","",""
"doi:10.1109/HPCA53966.2022.00037","2202.01407","d684a8b1202d17272e16960f6825ac50a0847c54","DigiQ: A Scalable Digital Controller for Quantum Computers Using SFQ Logic","Mohammad Reza Jokar","2022","HPCA","The control of cryogenic qubits in today’s super-conducting quantum computer prototypes presents significant scalability challenges due to the massive costs of generating/routing the analog control signals that need to be sent from a classical controller at room temperature to the quantum chip inside the dilution refrigerator. Thus, researchers in industry and academia have focused on designing in-fridge classical controllers in order to mitigate these challenges. Due to the maturity of CMOS logic, many industrial efforts (Microsoft, Intel) have focused on Cryo-CMOS as a near-term solution to design in-fridge classical controllers. Meanwhile, Supercon-ducting Single Flux Quantum (SFQ) is an alternative, less mature classical logic family proposed for large-scale in-fridge controllers. SFQ logic has the potential to maximize scalability thanks to its ultra-high speed and very low power consumption. However, architecture design for SFQ logic poses challenges due to its unconventional pulse-driven nature and lack of dense memory and logic. Thus, research at the architecture level is essential to guide architects to design SFQ-based classical controllers for large-scale quantum machines.In this paper, we present DigiQ, the first system-level design of a Noisy Intermediate Scale Quantum (NISQ)-friendly SFQ-based classical controller. We perform a design space exploration of SFQ-based controllers and co-design the quantum gate decompositions and SFQ-based implementation of those decompositions to find an optimal SFQ-friendly design point that trades area and power for latency and control while ensuring good quantum algorithmic performance. Our co-design results in a single instruction, multiple data (SIMD) controller architecture, which has high scalability, but imposes new challenges on the calibration of control pulses. We present software-level solutions to address these challenges, which if unaddressed would degrade quantum circuit fidelity given the imperfections of qubit hardware.To validate and characterize DigiQ, we first implement it using hardware description languages and synthesize it using state-of-the-art/validated SFQ synthesis tools. Our synthesis results show that DigiQ can operate within the tight power and area budget of dilution refrigerators at >42,000-qubit scales. Second, we confirm the effectiveness of DigiQ in running quantum algorithms by modeling the execution time and fidelity of a variety of NISQ applications. We hope that the promising results of this paper motivate experimentalists to further explore SFQ-based quantum controllers to realize large-scale quantum machines with maximized scalability.","dblp","Computer Science; Physics","44","https://doi.org/10.1109/HPCA53966.2022.00037","10.1109/HPCA53966.2022.00037","2022-02-03","2026-04-08","",""
"doi:10.1109/HPCA53966.2022.00038","","322c4dacf87408d591813ecc199db59aa3a75706","HiPerRF: A Dual-Bit Dense Storage SFQ Register File","Haipeng Zha","2022","HPCA","Single Flux Quantum (SFQ) superconducting technology provides significant power and performance benefits in the era of diminishing CMOS scaling. Recent advances in design tools and fabrication facilities have brought SFQ based computing to the forefront. One challenge faced by SFQ technology is to have a compact and robust on-chip memory, which can be used for implementing register files and cache memory. While dense memories are being investigated through the development of three-terminal devices such as Nanocryotrons, in this work, we build on a novel memory cell built using traditional Josephson junctions (JJs). In particular, we design a high capacity register file, called HiPerRF, that builds on a High Capacity Destructive ReadOut (HC-DRO) cell in SFQ technology. HC-DRO design can store up to three fluxon pulses, thereby providing the equivalent of 2-bit storage in a single cell. However, these cells provide only destructive readout capability, namely each value can be read only once. However, CPU register file contents are read multiple times in any program, and hence a destructive readout complicates register file design. HiPerRF provides the non-destructive property using a loopback write mechanism, thereby preserving the higher density of HC-DRO cells without compromising the multi-read demands of a register file. HiPerRF reduces the JJ count of the register file design, after accounting for all the peripheral access circuitry costs, by 56.1% and reduces the static power by 46.2%. Furthermore, HiPerRF reduces the JJ count by 16.3% even when considering an entire in-order RISC-V CPU core.","dblp","Computer Science","10","https://doi.org/10.1109/HPCA53966.2022.00038","10.1109/HPCA53966.2022.00038","2022-04-01","2026-04-08","",""
"doi:10.1109/HPCA53966.2022.00039","","d6ff00ccdab2e254122f3765bae5f71c9b09116d","ReGNN: A Redundancy-Eliminated Graph Neural Networks Accelerator","Cen Chen","2022","HPCA","Graph neural networks (GNNs), which extend conventional deep learning technologies to process graph-structured data, have shown its powerful graph representation learning ability. Existing typical GNNs utilize neighborhood message passing mechanism based on neural networks that updates target vertex representations by aggregating feature messages from neighboring source vertices. To accelerate the computations of GNNs, some customized accelerators, which follow the neighborhood aggregation computation pattern for each vertex, have been proposed. Through analysis, we observe that a naive implementation of the neighborhood aggregation results in redundant computations and communications.In this paper, we propose a novel redundancy-eliminated GNN accelerator, shortly termed as ReGNN. ReGNN is supported by an algorithm and architecture co-design. We first propose a dynamic redundancy-eliminated neighborhood message passing algorithm for GNNs. Then a novel architecture is designed to support the proposed algorithm and transform the redundancy elimination into performance improvement. ReGNN is also a configurable pipelined architecture that can be configured to support different GNN variants. In terms of the same computations, ReGNN provides the same accuracy as traditional GNNs. To the best of our knowledge, ReGNN is the first accelerator that can eliminate computation redundancy in GNNs. Our proposed ReGNN system gains an average of 9.1× speedup and 8.9× energy efficiency over state-of-the-art GNN accelerators.","dblp","Computer Science","48","https://doi.org/10.1109/HPCA53966.2022.00039","10.1109/HPCA53966.2022.00039","2022-04-01","2026-04-08","",""
"doi:10.1109/HPCA53966.2022.00040","","44d4b25c0d8b636ad7d291baaae95f183418c520","LISA: Graph Neural Network based Portable Mapping on Spatial Accelerators","Zhaoying Li","2022","HPCA","Spatial accelerators, such as Coarse-Grained Reconfigurable Arrays (CGRA), provide a promising pathway to scale the performance and power efficiency of computing systems. These accelerators depend on effective compilers to take advantage of the parallelism offered by the underlying architecture. Currently, the compilers are handcrafted for spatial accelerators, which is challenging from time to market perspective, especially with the rapid increase of diverse accelerators. In this paper, we present a portable compilation framework, called LISA, that can be tuned automatically to generate quality mapping for varied spatial accelerators. Our key contribution is to automatically identify the impact of the dataflow graph (DFG) structure characteristics (representing an application) on the mapping for a new accelerator. Towards this end, we abstract the DFG structure in graph attributes, use Graph Neural Network (GNN) to analyze the graph attributes, and identify the mapping impact for an accelerator architecture with an all-encompassing global view. Finally, we augment a simulated annealing-based mapping approach to take into account the impact of DFG structure in guiding the placement of the dataflow graph nodes and the routing of the dependencies on the accelerator. Our experimental evaluation concretely demonstrates the substantial benefit of our approach compared to the state-of-the-art solutions.","dblp","Computer Science","41","https://doi.org/10.1109/HPCA53966.2022.00040","10.1109/HPCA53966.2022.00040","2022-04-01","2026-04-08","",""
"doi:10.1109/HPCA53966.2022.00041","2112.11594","b30ede4a8c8cec9bbd7c4f7fdd8edfdb6c66442f","GCoD: Graph Convolutional Network Acceleration via Dedicated Algorithm and Accelerator Co-Design","Haoran You","2022","HPCA","Graph Convolutional Networks (GCNs) have emerged as the state-of-the-art graph learning model. However, it can be notoriously challenging to inference GCNs over large graph datasets, limiting their application to large real-world graphs and hindering the exploration of deeper and more sophisticated GCN graphs. This is because real-world graphs can be extremely large and sparse. Furthermore, the node degree of GCNs tends to follow the power-law distribution and therefore have highly irregular adjacency matrices, resulting in prohibitive inefficiencies in both data processing and movement and thus substantially limiting the achievable GCN acceleration efficiency. To this end, this paper proposes a GCN algorithm and accelerator Co-Design framework dubbed GCoD which can largely alleviate the aforementioned GCN irregularity and boost GCNs’ inference efficiency. Specifically, on the algorithm level, GCoD integrates a split and conquer GCN training strategy that polarizes the graphs to be either denser or sparser in local neighborhoods without compromising the model accuracy, resulting in graph adjacency matrices that (mostly) have merely two levels of workload and enjoys largely enhanced regularity and thus ease of acceleration. On the hardware level, we further develop a dedicated two-pronged accelerator with a separated engine to process each of the aforementioned denser and sparser workloads, further boosting the overall utilization and acceleration efficiency. Extensive experiments and ablation studies validate that our GCoD consistently reduces the number of off-chip accesses, leading to speedups 15286×, 294×, 7.8×, and 2.5× as compared to CPUs, GPUs, and prior-art GCN accelerators including HyGCN and AWB-GCN, respectively, while maintaining or even improving the task accuracy. Additionally, we visualize GCoD trained graph adjacency matrices for a better understanding of its advantages.","dblp","Computer Science","66","https://doi.org/10.1109/HPCA53966.2022.00041","10.1109/HPCA53966.2022.00041","2021-12-22","2026-04-08","",""
"doi:10.1109/HPCA53966.2022.00042","","14945559051095e922ffa565dc34dc016225bd46","Atomic Dataflow based Graph-Level Workload Orchestration for Scalable DNN Accelerators","Shixuan Zheng","2022","HPCA","To efficiently deploy state-of-the-art deep neural network (DNN) workloads with growing computational intensity and structural complexity, scalable DNN accelerators have been proposed in recent years, which are featured by multi-tensor engines and distributed on-chip buffers. Such spatial architectures have significantly expanded scheduling space in terms of parallelism and data reuse potentials, which demands for delicate workload orchestration. Previous works on DNN’s hardware mapping problem mainly focus on operator-level loop transformation for single array, which are insufficient for this new challenge. Resource partitioning methods for multi-engines such as CNN-partition and inter-layer pipelining have been studied. However, their intrinsic disadvantages of workload unbalance and pipeline delay still prevent scalable accelerators from releasing full potentials.In this paper, we propose atomic dataflow, a novel graph-level scheduling and mapping approach developed for DNN inference. Instead of partitioning hardware resources into fixed regions and binding each DNN layer to a certain region sequentially, atomic dataflow schedules the DNN computation graph in workload-specific granularity (atoms) to ensure PE-array utilization, supports flexible atom ordering to exploit parallelism, and orchestrates atom-engine mapping to optimize data reuse between spatially connected tensor engines. Firstly, we propose a simulated annealing based atomic tensor generation algorithm to minimize load unbalance. Secondly, we develop a dynamic programming based atomic DAG scheduling algorithm to systematically explore massive ordering potentials. Finally, to facilitate data locality and reduce expensive off-chip memory access, we present mapping and buffering strategies to efficiently utilize distributed on-chip storage. With an automated optimization framework being established, experimental results show significant improvements over baseline approaches in terms of performance, hardware utilization, and energy consumption.","dblp","Computer Science","48","https://doi.org/10.1109/HPCA53966.2022.00042","10.1109/HPCA53966.2022.00042","2022-04-01","2026-04-08","",""
"doi:10.1109/HPCA53966.2022.00043","","cf1eda4a4185898d59419025ef84c18bccd8ad57","Filesystem Encryption or Direct-Access for NVM Filesystems? Let's Have Both!","Kazi Abu Zubair","2022","HPCA","Emerging Non-Volatile Memories (NVMs) are promising candidates to build ultra-low idle power memory and storage devices in future computing systems. Unlike DRAM, NVMs do not require frequent refresh operations, and they can retain data after crashes and power loss. With such features, NVM memory modules can be used partly as a conventional memory to host memory pages and partly as file storage to host filesystems and persistent data. Most importantly, and unlike current storage technologies, NVMs can be directly attached to the memory bus and accessed through conventional load/store operations.As NVMs feature ultra-low access latency, it is necessary to minimize software overheads for accessing files to enable the full potential. In legacy storage devices, e.g., Flash and Harddisk drives, access latency dominates the software overheads. However, emerging NVMs’ performance can be burdened by the software overheads since memory access latency is minimal. Modern Operating Systems (OSes) allow direct-access (DAX) for NVM-hosted files through direct load/store operations by eliminating intermediate software layers. Unfortunately, we observe that such a direction ignores filesystem encryption and renders most of the current filesystem encryption implementations inapplicable to future NVM systems. In this paper, we propose a novel hardware/software co-design architecture that enables transparent filesystem encryption without sacrificing the direct-access feature of files in emerging NVMs with minimal change in OS and memory controller. Our proposed model incurs a negligible overall slowdown of 3.8% for workloads representative of real-world applications, while software-based encryption can incur as high as 5x slowdown for some applications.","dblp","Computer Science","2","https://doi.org/10.1109/HPCA53966.2022.00043","10.1109/HPCA53966.2022.00043","2022-04-01","2026-04-08","",""
"doi:10.1109/HPCA53966.2022.00044","","366e15c4d455394867eb80b8698bae6ab5a4e472","Efficient Bad Block Management with Cluster Similarity","Jui-Nan Yen","2022","HPCA","Process variation in the 3D flash memory architecture raises the difficulty of bad block management. Since the error characteristics vary among different blocks, it is difficult for the existing P/E cycle-based bad block management policies to decide a suitable cycle threshold. This increases the possibility of data loss and decreases the SSD’s lifetime. In this work, we characterize the 3D flash memory and observe spatial correlation among flash blocks in the aspect of error behaviors. This phenomenon is referred to as cluster similarity. A novel cluster-based bad block management policy is proposed, which treats the failure of a block as an indicator of near-future failures of its neighboring blocks. Moreover, we provide quantitative methods to enable judicious selection of the cluster size to meet the desired tradeoff between the SSD lifetime and reliability. Compared with the commonly-used cycle-based bad block management policy, our cluster-based management policy has a lifetime improvement of 2x with comparable failure rates. And with comparable lifetime, the failure rate of the cycle-based policy is 9x higher than our method. To alleviate the I/O performance impact caused by the cluster retirement, we proposes a critical-block first reallocation scheduling. Our experiments show up to two times improvement of the 95th percentile latency compared to the naive scheduling of cluster reallocation.","dblp","Computer Science","10","https://doi.org/10.1109/HPCA53966.2022.00044","10.1109/HPCA53966.2022.00044","2022-04-01","2026-04-08","",""
"doi:10.1109/HPCA53966.2022.00045","","9f5eccba1d9b5b366676d230467955570b9dde7c","Using Psychophysics to Guide Power Adaptation for Input Methods on Mobile Architectures","Xueliang Li","2022","HPCA","The predominant user activities on mobile architectures (e.g., smartphones) involve entering text in instant messaging apps, short message services, and social networking services. Recent research reveals that the normal use of input methods drains approximately half of the battery capacity due to their above-average power requirements and frequent use. In this paper, we first study the power characteristics of mobile input methods and find that they consistently over-provision resources to satisfy users. For example, the psychophysical evidence available indicates the response of spell-checking features within a time threshold makes users feel they have instant feedback. However, current systems perform it very quickly, which is imperceptible to users and costly in terms of energy use. Given this over- provisioning, the system can be slowed down to save energy while retaining the feeling of instant response. Inspired by this observation, we also exploit several other psychophysical facts to identify the exact criteria to satisfy users. As a result, we present a user experience-oriented technology, utexia, to optimize the energy use of mobile input methods. The evaluation shows that utexia conserves up to 42.9% in energy use while strictly ensuring a good user experience.","dblp","Computer Science","3","https://doi.org/10.1109/HPCA53966.2022.00045","10.1109/HPCA53966.2022.00045","2022-04-01","2026-04-08","",""
"doi:10.1109/HPCA53966.2022.00046","","f4aa21cf050e99ce4db6d4052f53f642df823e34","HD-CPS: Hardware-assisted Drift-aware Concurrent Priority Scheduler for Shared Memory Multicores","Mohsin Shan","2022","HPCA","Efficiently exploiting parallelism remains a challenging problem in multicore processors. For many algorithms, executing tasks in some priority order results in a work-efficient execution. However, searching high-priority tasks requires communication that hampers performance. A concurrent priority scheduler (CPS) selects high-priority tasks and schedules them on different cores. Modern CPS designs offer various strategies to select high-priority tasks at low communication cost for improved performance. However, they do not explicitly track the priority of tasks and cannot adjust task distribution if the cores are processing low-priority tasks. Moreover, they cannot estimate the right amount of communication required to select high-priority tasks. This paper critically observes that the cores’ priority drift can be quantified and used for better performance. A novel CPS design, HD-CPS is proposed to use priority as a signal to optimize drift and communication at runtime. Furthermore, compute-intensive task transfer and processing aspects of the CPS are offloaded to per-core local hardware at a low cost to enhance performance. HD-CPS is shown to consistently improve performance over several state-of-the-art software-based and hardware-assisted CPS designs. With hardware-assist, it approaches near-linear performance scaling as a function of core counts for large shared-memory multicores.","dblp","Computer Science","6","https://doi.org/10.1109/HPCA53966.2022.00046","10.1109/HPCA53966.2022.00046","2022-04-01","2026-04-08","",""
