"paper_id","arxiv_id","s2_paper_id","title","authors","year","venue","abstract","source","categories","citation_count","url","doi","published_date","crawled_date","keep","notes"
"doi:10.1109/HPCA53966.2022.00009","2101.08884","e23848e967ebff11c21239dce7204741b28ec9c4","Direct Spatial Implementation of Sparse Matrix Multipliers for Reservoir Computing","Matthew Denton","2022","HPCA","Reservoir computing is a nascent sub-field of machine learning which relies on the recurrent multiplication of a very large, sparse, fixed matrix. We argue that direct spatial implementation of these fixed matrices minimizes the work performed in the computation, and allows for significant reduction in latency and power through constant propagation and logic minimization. Bit-serial arithmetic enables massive static matrices to be implemented. We present the structure of our bit-serial matrix multiplier, and evaluate using canonical signed digit representation to further reduce logic utilization. We have implemented these matrices on a large FPGA and provide a cost model that is simple and extensible. These FPGA implementations, on average, reduce latency by 50x up to 86x versus GPU libraries. Comparing against a recent sparse DNN accelerator, we measure a 4.1x to 47x reduction in latency depending on matrix dimension and sparsity.","dblp","Computer Science","6","https://doi.org/10.1109/HPCA53966.2022.00009","10.1109/HPCA53966.2022.00009","2021-01-21","2026-04-08","",""
"doi:10.1109/HPCA53966.2022.00010","","325e74dd84acfc14b474736edd4db42c5c088264","uSystolic: Byte-Crawling Unary Systolic Array","Di Wu","2022","HPCA","General matrix multiply (GEMM) is an important operation in broad applications, especially the thriving deep neural networks. To achieve low power consumption for GEMM, researchers have already leveraged unary computing, which manipulates bitstreams with extremely simple logic. However, existing unary architectures are not well generalizable to varying GEMM configurations in versatile applications and incompatible to the binary computing stack, imposing challenges to execute unary GEMM effortlessly. In this work, we address the problem by architecting a hybrid unary-binary systolic array, uSystolic, to inherit the legacy-binary data scheduling with slow (thus power-efficient) data movement, i.e., data bytes are crawling out from memory to drive uSystolic. uSystolic exhibits tremendous area and power improvements as a joint effect of 1) low-power computing kernel, 2) spatial-temporal bitstream reuse, and 3) on-chip SRAM elimination. For the evaluated edge computing scenario, compared with the binary parallel design, the rated-coded uSystolic reduces the systolic array area and total on-chip area by 59.0% and 91.3%, with the on-chip energy and power efficiency improved by up to 112.2× and 44.8× for AlexNet.","dblp","Computer Science","25","https://doi.org/10.1109/HPCA53966.2022.00010","10.1109/HPCA53966.2022.00010","2022-04-01","2026-04-08","",""
"doi:10.1109/HPCA53966.2022.00011","2112.00267","730ced22261cbeffdded1029216815b54eda85d2","CAMA: Energy and Memory Efficient Automata Processing in Content-Addressable Memories","Yi Huang","2022","HPCA","Accelerating finite automata processing is critical for advancing real-time analytic in pattern matching, data mining, bioinformatics, intrusion detection, and machine learning. Recent in-memory automata accelerators leveraging SRAMs and DRAMs have shown exciting improvements over conventional digital designs. However, the bit-vector representation of state transitions used by all state-of-the-art (SOTA) designs is only optimal in processing worst-case completely random patterns, while a significant amount of memory and energy is wasted in running most real-world benchmarks.We present CAMA, a Content-Addressable Memory (CAM) enabled Automata accelerator for processing homogeneous non-deterministic finite automata (NFA). A radically different state representation scheme, along with co-designed novel circuits and data encoding schemes, greatly reduces energy, memory, and chip area for most realistic NFAs. CAMA is holistically optimized with the following major contributions: (1) a 16 × 256 8-transistor (8T) CAM array for state matching, replacing the 256 × 256 6T SRAM array or two 16×256 6T SRAM banks in state-of-the-art (SOTA) designs; (2) a novel encoding scheme that enables content searching within 8T SRAMs and adapts to different applications; (3) a reconfigurable and scalable architecture that improves efficiency on all tested benchmarks, without losing support for any NFA that’s compatible with SOTA designs; (4) an optimization framework that automates the choice of encoding schemes and maps a given NFA to the proposed hardware.Two versions of CAMA, one optimized for energy (CAMA-E) and the other for throughput (CAMA-T), are comprehensively evaluated in a 28nm CMOS process, and across 21 real-world and synthetic benchmarks. CAMA-E achieves 2.1×, 2.8 ×, and 2.04× lower energy than CA, 2-stride Impala, and eAP. CAMA-T shows 2.68×, 3.87× and 2.62 × higher average compute density than 2-stride Impala, CA, and eAP. Both versions reduce the chip area required for the largest tested benchmark by 2.48× over CA, 1.91× over 2-stride Impala, and 1.78× over eAP.","dblp","Computer Science","10","https://doi.org/10.1109/HPCA53966.2022.00011","10.1109/HPCA53966.2022.00011","2021-12-01","2026-04-08","",""
"doi:10.1109/HPCA53966.2022.00012","","45cf69d14308d81590a46192a000fc4e11d0f283","CoopMC: Algorithm-Architecture Co-Optimization for Markov Chain Monte Carlo Accelerators","Yuji Chai","2022","HPCA","Bayesian machine learning is useful for applications that may make high-risk decisions with limited, noisy, or unlabeled data, as it provides great data efficiency and uncertainty estimation. Building on previous efforts, this work presents CoopMC, an algorithm-architecture co-optimization for developing more efficient MCMC-based Bayesian inference accelerators. CoopMC utilizes dynamic normalization (DyNorm), LUT-based exponential kernels (TableExp), and log-domain kernel fusion (LogFusion) to reduce computational precision and shrink ALU area by 7.5× without noticeable reduction in model performance. Also, a Tree-based Gibbs sampler (TreeSampler) improves hardware runtime from $\mathcal{O}$(N) to $\mathcal{O}$(log(N)), an 8.7× speedup, and yields 1.9× better area efficiency than the existing state-of-the-art Gibbs sampling architecture. These methods have been tested on 10 diverse workloads using 3 different types of Bayesian models, demonstrating applicability to many Bayesian algorithms. In an end-to-end case study, these optimizations achieve a 33% logic area reduction, 62% power reduction, and 1.53× speedup over previous state-of-the-art end-to-end MCMC accelerators.","dblp","Computer Science","7","https://doi.org/10.1109/HPCA53966.2022.00012","10.1109/HPCA53966.2022.00012","2022-04-01","2026-04-08","",""
"doi:10.1109/HPCA53966.2022.00013","2105.12224","4d6eeb474f7ec161e702fbc75f72871637184f86","Leaky Frontends: Security Vulnerabilities in Processor Frontends","Shuwen Deng","2022","HPCA","This paper evaluates new security threats due to the processor frontend in modern Intel processors. The root causes of the security threats are the multiple paths in the processor frontend that the micro-operations can take: through the Micro-Instruction Translation Engine (MITE), through the Decode Stream Buffer (DSB), also called the Micro-operation Cache, or through the Loop Stream Detector (LSD). Each path has its own unique timing and power signatures, which lead to the side- and covert-channel attacks presented in this work. Especially, the switching between the different paths leads to observable timing or power differences which, as this work demonstrates, could be exploited by attackers. Because of the different paths, the switching, and way the components are shared in the frontend between hardware threads, two separate threads are able to be mutually influenced and timing or power can reveal activity on the other thread. The security threats are not limited to multi-threading, and this work further demonstrates new ways for leaking execution information about SGX enclaves or a new in-domain Spectre variant in single-thread setting. Finally, this work demonstrates a new method for fingerprinting the microcode patches of the processor by analyzing the behavior of different paths in the frontend. The findings of this work highlight the security threats associated with the processor frontend and the need for deployment of defenses for the modern processor frontend.","dblp","Computer Science","31","https://doi.org/10.1109/HPCA53966.2022.00013","10.1109/HPCA53966.2022.00013","2021-05-25","2026-04-08","",""
"doi:10.1109/HPCA53966.2022.00014","","abb422c1ca161b56ea5cffe25dc1b992c6d691e0","DPrime+DAbort: A High-Precision and Timer-Free Directory-Based Side-Channel Attack in Non-Inclusive Cache Hierarchies using Intel TSX","Sowoong Kim","2022","HPCA","Recent CPUs have begun to adopt non-inclusive cache hierarchies for more effective cache utilization. Non-inclusive cache hierarchies have an additional advantage in that they eliminate the vulnerability to cache-based side-channel attacks. In addition, precise timers are often disabled or added with noise to defeat timer-based side-channel attacks. With the combination of such countermeasures, existing cache- and directory-based side-channel attacks can robustly be defeated on commodity systems.In this work, we discover the vulnerability caused by the undocumented interactions between the coherence directories and Intel TSX transactions in latest Intel CPUs with non-inclusive cache hierarchies. Guided by the observation, we propose a high-precision and timer-free directory attack called DPrime+DAbort in non-inclusive cache hierarchies using Intel TSX, which nullifies the aforementioned countermeasures. Our quantitative evaluation conducted on real systems equipped with latest Intel CPUs in three different generations demonstrates the practicality of the DPrime+DAbort attack in that it can be used to attack cryptographic and genomesequencing applications. We also discuss potential countermeasures and evaluate the feasibility of an Intel TSX-based countermeasure against the DPrime+DAbort attack.","dblp","Computer Science","7","https://doi.org/10.1109/HPCA53966.2022.00014","10.1109/HPCA53966.2022.00014","2022-04-01","2026-04-08","",""
"doi:10.1109/HPCA53966.2022.00015","2104.08559","9bd2b2df259968a49ee156666dd47318ca4926da","Abusing Cache Line Dirty States to Leak Information in Commercial Processors","Yujie Cui","2022","HPCA","Caches have been used to construct various types of covert and side channels to leak information. Most existing cache channels exploit the timing difference between cache hits and cache misses. However, we introduce a new and broader classification of cache covert channel attacks: Hit+Miss, Hit+Hit, and Miss+Miss. We highlight that cache misses (or cache hits) for cache lines in different states may have more significant time differences, and these can be used as timing channels. Based on this classification, we propose a new stable and stealthy Miss+Miss cache channel. Write-back caches are widely deployed in modern processors. This paper presents in detail a way in which replacement latency differences can be used to construct timing-based channels (called WB channels) to leak information in a write-back cache. Any modification to a cache line by a sender will set it to the dirty state, and the receiver can observe this through measuring the latency of replacing this cache set. We also demonstrate how senders could exploit a different number of dirty cache lines in a cache set to improve transmission bandwidth with symbols encoding multiple bits. The peak transmission bandwidths of the WB channels in commercial systems can vary between 1300 and 4400 kbps per cache set in a hyper-threaded setting without shared memory between the sender and the receiver. In contrast to most existing cache channels, which always target specific memory addresses, the new WB channels focus on the cache set and cache line states, making it difficult for the channel to be disturbed by other processes on the core, and they can still work in a cache using a random replacement policy. We also analyzed the stealthiness of WB channels from the perspective of the number of cache loads and cache miss rates. We discuss and evaluate possible defenses. The paper finishes by discussing various forms of side-channel attack.","dblp","Computer Science","17","https://doi.org/10.1109/HPCA53966.2022.00015","10.1109/HPCA53966.2022.00015","2021-04-17","2026-04-08","",""
"doi:10.1109/HPCA53966.2022.00016","","d08f716046597efd59e579f7fbcd56135fce1273","unXpec: Breaking Undo-based Safe Speculation","Mengming Li","2022","HPCA","Speculative execution attacks exploiting speculative execution to leak secrets have aroused significant concerns in both industry and academia. They mainly exploit covert or side channels over microarchitectural states left by mis-speculated and squashed instructions (i.e., transient instructions). Most such attacks target cache states. Existing cache-based defenses against speculative execution attacks fall into two categories, Invisible and Undo. Most Invisible defenses buffer execution metadata of speculative instructions and place them into the cache only if the speculatively executed instructions become determined. Motivated by the fact that mis-speculations are rare cases, Undo defenses allow speculative instructions to modify cache states. Upon a mis-speculation, they rollback cache states to the ones prior to the execution of transient instructions. However, Invisible defenses have been recently found insecure by the speculative interference attack. This calls for a deep security inspection of Undo defenses against speculative execution attacks.In this paper, we present unXpec as the first attack against Undo-based safe speculation. It exploits the secret-dependent timing channel exhibited through the rollback operations of Undo defenses. Specifically, the rollback process requires both invalidating cache lines brought into the cache by transient instructions and restoring evicted cache lines from the cache by transiently loaded data. This opens up a channel that encodes secret via the timing difference between when rollback involves much invalidation and restoration or not. We further leverage eviction sets to enforce more restoration operations. This yields a longer rollback time and thus a larger secret-dependent timing difference. We demonstrate the timing channel over the open-source CleanupSpec, a representative Undo solution. A single transient load can trigger a secret-dependent timing difference of 22 cycles (without eviction sets) of 32 cycles (with eviction sets), which is sufficiently exploitable for constructing a covert channel for speculative execution attacks. We run unXpec on the gem5 simulator with CleanupSpec enabled. The results show that unXpec can leak secrets at a high rate of 140 Kbps with an accuracy over 90%. Simply enforcing constant-time rollback to mitigate unXpec may induce an over 70% performance overhead.","dblp","Computer Science","15","https://doi.org/10.1109/HPCA53966.2022.00016","10.1109/HPCA53966.2022.00016","2022-04-01","2026-04-08","",""
"doi:10.1109/HPCA53966.2022.00017","","c7daf592f31d95497e8941f0f4123665837a46c4","Cottage: Coordinated Time Budget Assignment for Latency, Quality and Power Optimization in Web Search","Liang Zhou","2022","HPCA","Most CPU power management techniques for web search assume that the time budget for a query is given a priori. However, determining the time budget on a per query granularity is challenging, because a difficult trade-off between the search latency, quality and power consumption has to be made. In this paper, we present Cottage, a coordinated time budget assignment framework between the aggregator and Index Serving Nodes (ISNs), which employs two distinct distributed search latency and quality predictors. The prediction results are integrated at a centralized optimizer for selecting the proper search time budget, while cutting off slow and low quality ISNs. Cottage also accelerates slow ISNs that have a high quality contribution, thus improving search quality. The implementation results on the Solr search engine show that Cottage outperforms state-of-the-art approaches with a 54% latency reduction and 41.3% less consumed power. In addition, the P@10 search quality with Cottage can still be as good as 0.947.","dblp","Computer Science","2","https://doi.org/10.1109/HPCA53966.2022.00017","10.1109/HPCA53966.2022.00017","2022-04-01","2026-04-08","",""
"doi:10.1109/HPCA53966.2022.00018","","cbd1588837e6c6b795d593f0269d92f295c09705","Enabling Efficient Large-Scale Deep Learning Training with Cache Coherent Disaggregated Memory Systems","Zixuan Wang","2022","HPCA","Modern deep learning (DL) training is memory-consuming, constrained by the memory capacity of each computation component and cross-device communication bandwidth. In response to such constraints, current approaches include increasing parallelism in distributed training and optimizing inter-device communication. However, model parameter communication is becoming a key performance bottleneck in distributed DL training. To improve parameter communication performance, we propose COARSE, a disaggregated memory extension for distributed DL training. COARSE is built on modern cache-coherent interconnect (CCI) protocols and MPI-like collective communication for synchronization, to allow low-latency and parallel access to training data and model parameters shared among worker GPUs. To enable high bandwidth transfers between GPUs and the disaggregated memory system, we propose a decentralized parameter communication scheme to decouple and localize parameter synchronization traffic. Furthermore, we propose dynamic tensor routing and partitioning to fully utilize the non-uniform serial bus bandwidth varied across different cloud computing systems. Finally, we design a deadlock avoidance and dual synchronization to ensure high-performance parameter synchronization. Our evaluation shows that COARSE achieves up to 48.3% faster DL training compared to the state-of-the-art MPI AllReduce communication.","dblp","Computer Science","13","https://doi.org/10.1109/HPCA53966.2022.00018","10.1109/HPCA53966.2022.00018","2022-04-01","2026-04-08","",""
"doi:10.1109/HPCA53966.2022.00019","","","Hercules: Heterogeneity-Aware Inference Serving for At-Scale Personalized Recommendation","Liu Ke","2022","HPCA","[abstract unavailable]","dblp","","0","https://doi.org/10.1109/HPCA53966.2022.00019","10.1109/HPCA53966.2022.00019","","2026-04-08","",""
"doi:10.1109/HPCA53966.2022.00020","","7b5d4bf167c50268b66e195d7fb384d56ea49d46","ReTail: Opting for Learning Simplicity to Enable QoS-Aware Power Management in the Cloud","Shuang Chen","2022","HPCA","Many cloud services have Quality-of-Service (QoS) requirements; most requests have to to complete within a given latency constraint. Recently, researchers have begun to investigate whether it is possible to meet QoS while attempting to save power on a per-request basis. Existing work shows that one can indeed hand-tune a request latency predictor offline for a particular cloud application, and consult it at runtime to modulate CPU voltage and frequency, resulting in substantial power savings.In this paper, we propose ReTail, an automated and general solution for request-level power management of latency-critical services with QoS constraints. We present a systematic process to select the features of any given application that best correlate with its request latency. ReTail uses these features to predict latency, and adjust CPU’s power consumption. ReTail’s predictor is trained fully at runtime. We show that unlike previous findings, simple techniques perform better than complex machine learning models, when using the right input features. For a web search engine, ReTail outperforms prior mechanisms based on complex hand-tuned predictors for that application domain. Furthermore, ReTail’s systematic approach also yields superior power savings across a diverse set of cloud applications.","dblp","Computer Science","29","https://doi.org/10.1109/HPCA53966.2022.00020","10.1109/HPCA53966.2022.00020","2022-04-01","2026-04-08","",""
"doi:10.1109/HPCA53966.2022.00021","","1f90fb2dcf9f957ea2103b13a0348ec4ef15ca07","ANNA: Specialized Architecture for Approximate Nearest Neighbor Search","Yejin Lee","2022","HPCA","Similarity search or nearest neighbor search is a task of retrieving a set of vectors in the (vector) database that are most similar to the provided query vector. It has been a key kernel for many applications for a long time. However, it is becoming especially more important in recent days as modern neural networks and machine learning models represent the semantics of images, videos, and documents as high-dimensional vectors called embeddings. Finding a set of similar embeddings for the provided query embedding is now the critical operation for modern recommender systems and semantic search engines. Since exhaustively searching for the most similar vectors out of billion vectors is such a prohibitive task, approximate nearest neighbor search (ANNS) is often utilized in many real-world use cases. Unfortunately, we find that utilizing the server-class CPUs and GPUs for the ANNS task leads to suboptimal performance and energy efficiency. To address such limitations, we propose a specialized architecture named ANNA (Approximate Nearest Neighbor search Accelerator), which is compatible with state-of-the-art ANNS algorithms such as Google ScaNN and Facebook Faiss. By combining the benefits of a specialized dataflow pipeline and efficient data reuse, ANNA achieves multiple orders of magnitude higher energy efficiency, 2.3-61.6× higher throughput, and 4.3-82.1× lower latency than the conventional CPU or GPU for both million- and billion-scale datasets.","dblp","Computer Science","23","https://doi.org/10.1109/HPCA53966.2022.00021","10.1109/HPCA53966.2022.00021","2022-04-01","2026-04-08","",""
"doi:10.1109/HPCA53966.2022.00022","","3b45dcb1a35bf1852ecf6ca127ddfeb92e260593","Hardware-Accelerated Hypergraph Processing with Chain-Driven Scheduling","Qinggang Wang","2022","HPCA","Beyond ordinary graphs, hypergraphs are a graph representation to flexibly express complex multilateral relationships between entities. Hypergraph processing can be used to solve many real-world problems, e.g., machine learning, VLSI design, and image retrieval. Existing hypergraph processing systems handle a hypergraph in order of its hyperedge and vertex indices. This makes processing hypergraphs on generalpurpose architectures suffer significantly from excessive offchip memory accesses, most of which however are redundant in frequently accessing overlapped hyperedges and vertices, but the index-ordered scheduling destroys this potential locality.In this paper, we propose a novel Generate-Load-Apply (GLA) execution model to improve locality in hypergraph processing. The key insight of GLA is to use a concept of chain to characterize the overlapped feature of a hypergraph, exposing data reuse opportunities missed in existing hypergraph systems. The precondition of driving GLA model is to generate expected chains on the fly, but the software solution is so expensive that its overheads may outweigh the benefits achieved from the chain-driven scheduling. We further present ChGraph, the first hardware-accelerated hypergraph processing engine near each core. ChGraph is specialized in accelerating the chain generation and the chain-guided data loading (to hide memory access latency) while the general-purpose cores are responsible only for handling the apply operations of GLA. We evaluate ChGraph against a state-of-the-art hypergraph processing system Hygra on six hypergraph algorithms using five large real-world hypergraphs. Results on a simulated 16core system show that ChGraph reduces the number of offchip memory accesses by up to 4.56× and achieves up to 4.73× speedup while introducing only 0.26% area overhead.","dblp","Computer Science","12","https://doi.org/10.1109/HPCA53966.2022.00022","10.1109/HPCA53966.2022.00022","2022-04-01","2026-04-08","",""
