"paper_id","arxiv_id","s2_paper_id","title","authors","year","venue","abstract","source","categories","citation_count","url","doi","published_date","crawled_date","keep","notes"
"doi:10.1109/HPCA53966.2022.00061","","eb77d15856bf29017f281325a7db48a450a81a94","HeteroGen: Automatic Synthesis of Heterogeneous Cache Coherence Protocols","Nicolai Oswald","2022","HPCA","We solve the two challenges architects face when designing heterogeneous processors with cache coherent shared memory. First, we develop an automated tool, called HeteroGen, for composing clusters of cores, each with its own coherence protocol. Second, we show that the output of HeteroGen adheres to a precisely defined memory consistency model that we call a compound consistency model. For a wide variety of protocols—including the MOESI variants, as well as those that are targeted towards Total Store Order and Release Consistency—we show that HeteroGen can correctly fuse them. To validate HeteroGen, we develop the first litmus tests for verifying that heterogeneous protocols satisfy compound consistency models. To understand the possible performance implications of automatic protocol generation, we compared against a publicly available manually-generated heterogeneous protocol. Our results show that performance is comparable.","dblp","Computer Science","14","https://doi.org/10.1109/HPCA53966.2022.00061","10.1109/HPCA53966.2022.00061","2022-04-01","2026-04-08","",""
"doi:10.1109/HPCA53966.2022.00062","","2844a2d146e731d92419381d3fe996fa75177121","Reliability-Aware Runahead","Ajeya Naithani","2022","HPCA","Decreasing voltage levels and continued transistor scaling have drastically increased the chance of a processor bit encountering a soft error. We find that the microarchitecture state in an out-of-order core is vulnerable to soft errors especially while waiting for data to return from memory. The severity of the problem is further aggravated by the increasingly large size of microarchitecture state with every new processor generation. Prior solutions are ineffective as they incur too high overhead in terms of chip area, energy consumption and/or performance.In this paper, we make the observation that runahead execution, which was originally conceived to improve performance, also improves soft-error reliability as an unintended side effect. While the state-of-the-art runahead technique, Precise Runahead Execution (PRE), leads to substantial performance improvements, reliability is suboptimal still. We propose Reliability-Aware Runahead (RAR) which substantially improves soft-error reliability over the current state-of-the-art by rendering the microarchitecture state non-vulnerable during runahead execution and by initiating runahead execution early. Across a set of memory-intensive applications — the primary target for runahead execution — RAR improves the mean-time-to-failure (MTTF) by on average 4.8× (and up to 35.8×) relative to an out-of-order baseline while at the same time improving performance by 33.5% on average (and up to 2.6×). Across a broader set of compute- and memory-intensive benchmarks, RAR improves MTTF by on average 2.5× while at the same time improving performance by 11.9% on average. We explore the runahead design space and conclude that RAR is the only design point that improves both reliability and performance by such a significant margin. We find that RAR is more effective for increasingly large processor architectures, making RAR an effective microarchitecture technique for future high-reliability high-performance microprocessors.","dblp","Computer Science","4","https://doi.org/10.1109/HPCA53966.2022.00062","10.1109/HPCA53966.2022.00062","2022-04-01","2026-04-08","",""
"doi:10.1109/HPCA53966.2022.00063","2111.05301","5960a70f98729785412fe3e1ba2b184b0715c664","Adaptable Register File Organization for Vector Processors","Cristóbal Ramírez Lazo","2022","HPCA","Contemporary Vector Processors (VPs) are de-signed either for short vector lengths, e.g., Fujitsu A64FX with 512-bit ARM SVE vector support, or long vectors, e.g., NEC Aurora Tsubasa with 16Kbits Maximum Vector Length (MVL1). Unfortunately, both approaches have drawbacks. On the one hand, short vector length VP designs struggle to provide high efficiency for applications featuring long vectors with high Data Level Parallelism (DLP). On the other hand, long vector VP designs waste resources and underutilize the Vector Register File (VRF) when executing low DLP applications with short vector lengths. Therefore, those long vector VP implementations are limited to a specialized subset of applications, where relatively high DLP must be present to achieve excellent performance with high efficiency. Modern scientific applications are getting more diverse, and the vector lengths in those applications vary widely. To overcome these limitations, we propose an Adaptable Vector Architecture (AVA) that leads to having the best of both worlds. AVA is designed for short vectors (MVL=16 elements) and is thus area and energy-efficient. However, AVA has the functionality to reconfigure the MVL, thereby allowing to exploit the benefits of having a longer vector of up to 128 elements microarchitecture when abundant DLP is present. We model AVA on the gem5 simulator and evaluate AVA performance with six applications taken from the RiVEC Benchmark Suite. To obtain area and power consumption metrics, we model AVA on McPAT for 22nm technology. Our results show that by reconfiguring our small VRF (8KB) plus our novel issue queue scheme, AVA yields a 2X speedup over the default configuration for short vectors. Additionally, AVA shows competitive performance when compared to a long vector VP, while saving 50% of area.","dblp","Computer Science","7","https://doi.org/10.1109/HPCA53966.2022.00063","10.1109/HPCA53966.2022.00063","2021-11-09","2026-04-08","",""
"doi:10.1109/HPCA53966.2022.00064","","70b634e2eb4b18c6c30466d89a32ea474f334547","Tacker: Tensor-CUDA Core Kernel Fusion for Improving the GPU Utilization while Ensuring QoS","Han Zhao","2022","HPCA","The proliferation of machine learning applications has promoted both CUDA Cores and Tensor Cores’ integration to meet their acceleration demands. While studies have shown that co-locating multiple tasks on the same GPU can effectively improve system throughput and resource utilization, existing schemes focus on scheduling the resources of traditional CUDA Cores and thus lack the ability to exploit the parallelism between Tensor Cores and CUDA Cores.In this paper, we propose Tacker, a static kernel fusion and scheduling approach to improve GPU utilization of both types of cores while ensuring the QoS (Quality-of-Service) of co-located tasks. Tacker consists of a Tensor-CUDA Core kernel fuser, a duration predictor for fused kernels, and a runtime QoS-aware kernel manager. The kernel fuser enables the flexible fusion of kernels that use Tensor Cores and CUDA Cores, respectively. The duration predictor precisely predicts the duration of the fused kernels. Finally, the kernel manager invokes the fused kernel or the original kernel based on the QoS headroom of latency-critical tasks to improve the system throughput. Our experimental results show that Tacker improves the throughput of best-effort applications compared with state-of-the-art solutions by 18.6% on average, while ensuring the QoS of latency-critical tasks.","dblp","Computer Science","35","https://doi.org/10.1109/HPCA53966.2022.00064","10.1109/HPCA53966.2022.00064","2022-04-01","2026-04-08","",""
"doi:10.1109/HPCA53966.2022.00065","2104.13997","a6d9938a000137ae0953e8ec029ea82f5fb4e39e","MAGMA: An Optimization Framework for Mapping Multiple DNNs on Multiple Accelerator Cores","Sheng-Chun Kao","2022","HPCA","As Deep Learning continues to drive a variety of applications in edge and cloud data centers, there is a growing trend towards building large accelerators with several sub-accelerator cores/chiplets. This work looks at the problem of supporting multi-tenancy on such accelerators. In particular, we focus on the problem of mapping jobs from several DNNs simultaneously on an accelerator. Given the extremely large search space, we formulate the search as an optimization problem and develop an optimization framework called M3E. In addition, we develop a specialized optimization algorithm called MAGMA with custom operators to enable structured sampleefficient exploration. We quantitatively compare MAGMA with several state-of-the-art methods, black-box optimization, and reinforcement learning methods across different accelerator settings (large/small accelerators) and different sub-accelerator configurations (homogeneous/heterogeneous), and observe MAGMA can consistently find better mappings.","dblp","Computer Science","68","https://doi.org/10.1109/HPCA53966.2022.00065","10.1109/HPCA53966.2022.00065","2021-04-28","2026-04-08","",""
"doi:10.1109/HPCA53966.2022.00066","","a167d0e228c1ba3d143aede86d54014acd4a46b3","SPACX: Silicon Photonics-based Scalable Chiplet Accelerator for DNN Inference","Yuan Li","2022","HPCA","In pursuit of higher inference accuracy, deep neural network (DNN) models have significantly increased in complexity and size. To overcome the consequent computational challenges, scalable chiplet-based accelerators have been proposed. However, data communication using metallic-based interconnects in these chiplet-based DNN accelerators is becoming a primary obstacle to performance, energy efficiency, and scalability. The photonic interconnects can provide adequate data communication support due to some superior properties like low latency, high bandwidth and energy efficiency, and ease of broadcast communication. In this paper, we propose SPACX: a Silicon Photonics-based Chiplet ACcelerator for DNN inference applications. Specifically, SPACX includes a photonic network design that enables seamless single-chiplet and cross-chiplet broadcast communications, and a tailored dataflow that promotes data broadcast and maximizes parallelism. Furthermore, we explore the broadcast granularities of the photonic network and implications on system performance and energy efficiency. A flexible bandwidth allocation scheme is also proposed to dynamically adjust communication bandwidths for different types of data. Simulation results using several DNN models show that SPACX can achieve 78% and 75% reduction in execution time and energy, respectively, as compared to other state-of-the-art chiplet-based DNN accelerators.","dblp","Computer Science","33","https://doi.org/10.1109/HPCA53966.2022.00066","10.1109/HPCA53966.2022.00066","2022-04-01","2026-04-08","",""
"doi:10.1109/HPCA53966.2022.00067","2110.15456","c7fe31c57af039474350b16965e66c7c86794d28","FAST: DNN Training Under Variable Precision Block Floating Point with Stochastic Rounding","Sai Qian Zhang","2022","HPCA","Block Floating Point (BFP) can efficiently support quantization for Deep Neural Network (DNN) training by providing a wide dynamic range via a shared exponent across a group of values. In this paper, we propose a Fast First, Accurate Second Training (FAST) system for DNNs, where the weights, activations, and gradients are represented in BFP. FAST supports matrix multiplication with variable precision BFP input operands, enabling incremental increases in DNN precision throughout training. By increasing the BFP precision across both training iterations and DNN layers, FAST can greatly shorten the training time while reducing overall hardware resource usage. Our FAST Multipler-Accumulator (fMAC) supports dot product computations under multiple BFP precisions. We validate our FAST system on multiple DNNs with different datasets, demonstrating a 2-6× speedup in training on a single-chip platform over prior work based on mixed-precision or block floating point number systems while achieving similar performance in validation accuracy.","dblp","Computer Science","92","https://doi.org/10.1109/HPCA53966.2022.00067","10.1109/HPCA53966.2022.00067","2021-10-28","2026-04-08","",""
"doi:10.1109/HPCA53966.2022.00068","2107.12922","bc79ffc6cb8417119f3c343914da57e73ed34ad8","Griffin: Rethinking Sparse Optimization for Deep Learning Architectures","Jong Hoon Shin","2022","HPCA","This paper examines the design space trade-offs of DNNs accelerators aiming to achieve competitive performance and efficiency metrics for all four combinations of dense or sparse activation/weight tensors. To do so, we systematically examine the overheads of supporting sparsity on top of an optimized dense core. These overheads are modeled based on parameters that indicate how a multiplier can borrow a nonzero operation from the neighboring multipliers or future cycles. As a result of this exploration, we identify a few promising designs that perform better than prior work. Our findings suggest that even the best design targeting dual sparsity yields a 20%-30% drop in power efficiency when performing on single sparse models, i.e., those with only sparse weight or sparse activation tensors. We found that one can reuse resources of the same core to maintain high performance and efficiency when running single sparsity or dense models. We call this hybrid architecture Griffin. Griffin is 1.2, 3.0, 3.1, and 1.4x more power-efficient than state-of-the-art sparse architectures, for dense, weight-only sparse, activation-only sparse, and dual sparse models, respectively.","dblp","Computer Science","12","https://doi.org/10.1109/HPCA53966.2022.00068","10.1109/HPCA53966.2022.00068","2021-07-27","2026-04-08","",""
"doi:10.1109/HPCA53966.2022.00069","","e867f531937f6e3b3ab08a3fe8e3a17f114b9b6e","CANDLES: Channel-Aware Novel Dataflow-Microarchitecture Co-Design for Low Energy Sparse Neural Network Acceleration","Sumanth Gudaparthi","2022","HPCA","Several deep neural network (DNN) accelerators have been designed to exploit the sparsity exhibited by DNN activations and weights. State-of-the-art sparse accelerators can be described as either Pixel-first or Channel-first accelerators, each with its unique dataflow and compression format aiding its dataflow. The former expends significant energy updating neuron partial sums, while the latter expends significant energy in handling the index metadata. This work introduces a novel microarchitecture and dataflow that reconciles these trade-offs by adopting a Pixel-first compression and Channel-first dataflow. The proposed microarchitecture has a simpler index-generation logic combined with an accumulator buffer hierarchy and crossbar with low wiring overhead. The compression format and dataflow promote high temporal locality in neuron updates, further lowering energy. Finally, we introduce work partitions across processing elements that naturally lead to load balance without offline analysis. Compared to four state-of-the-art baselines, the proposed architecture, CANDLES, significantly outperforms three and matches the performance of the fourth. In terms of energy, CANDLES is between 2.5× and 5.6× more energy-efficient than these four baselines.","dblp","Computer Science","18","https://doi.org/10.1109/HPCA53966.2022.00069","10.1109/HPCA53966.2022.00069","2022-04-01","2026-04-08","",""
"doi:10.1109/HPCA53966.2022.00070","","950e6ab6a889f01d3fdf0362120bbb7799ebf0ef","ASAP: A Speculative Approach to Persistence","Sujay Yadalam","2022","HPCA","Persistent memory enables a new class of applications that have persistent in-memory data structures. Recoverability of these applications imposes constraints on the ordering of writes to persistent memory. But, the cache hierarchy and memory controllers in modern systems may reorder writes to persistent memory. Therefore, programmers have to use expensive flush and fence instructions that stall the processor to enforce such ordering. While prior efforts circumvent stalling on long latency flush instructions, these designs under-perform in large-scale systems with many cores and multiple memory controllers.We propose ASAP, an architectural model in which the hardware takes an optimistic approach by persisting data eagerly, thereby avoiding any ordering stalls and utilizing the total system bandwidth efficiently. ASAP avoids stalling by allowing writes to be persisted out-of-order, speculating that all writes will eventually be persisted. For correctness, ASAP saves recovery information in the memory controllers which is used to undo the effects of speculative writes to memory in the event of a crash.Over a large number of representative workloads, ASAP improves performance over current Intel systems by 2.3 on average and performs within 3.9% of an ideal system.","dblp","Computer Science","19","https://doi.org/10.1109/HPCA53966.2022.00070","10.1109/HPCA53966.2022.00070","2022-04-01","2026-04-08","",""
"doi:10.1109/HPCA53966.2022.00071","","2cdb2b4a2ba2bf6b8b4474c03f3fff73c7e107b3","Temporal Exposure Reduction Protection for Persistent Memory","Yuanchao Xu","2022","HPCA","The long-living nature and byte-addressability of persistent memory (PM) amplifies the importance of strong memory protections. This paper develops temporal exposure reduction protection (TERP) as a framework for enforcing memory safety. Aiming to minimize the time when a PM region is accessible, TERP offers a complementary dimension of memory protection. The paper gives a formal definition of TERP, explores the semantics space of TERP constructs, and the relations with security and composability in both sequential and parallel executions. It proposes programming system and architecture solutions for the key challenges for the adoption of TERP, which draws on novel supports in both compilers and hardware to efficiently meet the exposure time target. Experiments validate the efficacy of the proposed support of TERP, in both efficiency and exposure time minimization.","dblp","Computer Science","12","https://doi.org/10.1109/HPCA53966.2022.00071","10.1109/HPCA53966.2022.00071","2022-04-01","2026-04-08","",""
"doi:10.1109/HPCA53966.2022.00072","","a93ba3180f654be43cf87be5b6fd47ace7ac2be7","MULTI-CLOCK: Dynamic Tiering for Hybrid Memory Systems","Adnan Maruf","2022","HPCA","The rapid growth of i-memory computing powered by data-intensive applications has increased demand for DRAM in servers. However, a DRAM-based system can be limiting for modern workloads because of its capacity, cost, and power consumption characteristics. Hybrid memory systems, which consist of different types of memory, such as DRAM and persistent memory, can help address many of these limitations. One promising direction that has been explored in the recent literature involves introducing persistent memory devices as a second memory tier that is directly exposed to the CPU. The resulting tiered memory design must address the fundamental challenge of placing the right data in the right memory tier at the right time while minimizing overhead. We present MULTI -CLOCK, an efficient, low-overhead hybrid memory system that relies on a unique page selection technique for tier placement. MULTl-CLOCK’s page selection captures both page access recency and frequency, and enables moving pages to appropriate tiers at the right time within hybrid memory systems. We implemented a Linux-based, NUMA-aware version of MULTI-CLOCK that is entirely transparent and backward compatible with any existing application. Our evaluation with diverse real-world applications such as graph processing and key-value stores shows that MULTI -CLOCK can improve the average throughput by as much as 352% when compared with several state-of-the-art techniques for tiered memory.","dblp","Computer Science","33","https://doi.org/10.1109/HPCA53966.2022.00072","10.1109/HPCA53966.2022.00072","2022-04-01","2026-04-08","",""
"doi:10.1109/HPCA53966.2022.00073","2109.01188","6c910011a12b5b95bf6a771b54e7253b1f98a8a4","NVMExplorer: A Framework for Cross-Stack Comparisons of Embedded Non-Volatile Memories","Lillian Pentecost","2022","HPCA","The current computing landscape is dominated by data-intensive applications, making data movement one of the most prominent performance bottlenecks. With repeated off-chip memory access to DRAM driving up power, and SRAM technology scaling and leakage power limiting the efficiency of embedded memories, there is a need for new memory systems that can enable denser, more energy-efficient future on-chip storage. The actively expanding field of emerging, embeddable non-volatile memory (eNVM) technologies is providing many potential candidates to satisfy this need. However, eNVM cell technologies are in vastly different stages of development and introduce distinct trade-offs in terms of density, read, write, and reliability characteristics.We present NVMExplorer (http://nvmexplorer.seas.harvard.edu/): a cross-stack design space exploration framework to compare and evaluate future on-chip memory solutions with system constraints and application-level impacts in-the-loop. This work uses NVMExplorer to evaluate eNVM-based storage for a range of application and system contexts including machine learning on the edge, graph analytics, and general purpose cache. Additionally, NVMExplorer provides an interactive and easily navigable set of data visualizations, which allow users to quickly answer their specific questions regarding eNVMs, filter according to system and application constraints, and efficiently iterate and refine the design space.","dblp","Computer Science","28","https://doi.org/10.1109/HPCA53966.2022.00073","10.1109/HPCA53966.2022.00073","2021-09-02","2026-04-08","",""
"doi:10.1109/HPCA53966.2022.00074","","15346674b2b7ae0c944759e9cabf2d30885ce97a","Stay in your Lane: A NoC with Low-overhead Multi-packet Bypassing","Hossein Farrokhbakht","2022","HPCA","NoCs are over-provisioned with large virtual channels to provide deadlock freedom and performance improvement. This use of virtual channels leads to considerable power and area overhead. In this paper, we introduce a novel flow control, called FastFlow, to enhance performance and avoid both protocol- and network-level deadlocks with an impressive reduction in number of virtual channels compared to the state-of-the-art NoCs. FastPass promotes a packet to traverse the network bufferlessly; the packet bypasses the routers to reach its destination. During the traversals, the packet is guaranteed to make forward progress every cycle. As a result, such a packet cannot be blocked by congestion nor deadlock. Promoting more packets to FastPass will provide higher throughput. To this end, FastPass allows multiple packets to be upgraded as FastPass packets simultaneously. To avoid any collision between these packets, FastPass provides multiple pre-defined non-overlapping lanes. Each lane is allowed to propagate only one FastPass packet. In a time-division multiplexed way, each router gets a chance to upgrade its packets to the FastPass packets and then transfer them via the pre-defined non-overlapping lanes. FastPass not only provides high throughput but also resolves both protocol-and network-level deadlocks. Compared to the state-of-the-art, FastPass presents a 1.8 × increase in throughput for synthetic traffic, 46% improvement in average packet latency for real applications, and 40% reduction in power and area consumption.","dblp","Computer Science","13","https://doi.org/10.1109/HPCA53966.2022.00074","10.1109/HPCA53966.2022.00074","2022-04-01","2026-04-08","",""
"doi:10.1109/HPCA53966.2022.00075","","90c53a2fc60a6f0c99de358c988644d4fa70ed57","FastTrackNoC: A NoC with FastTrack Router Datapaths","Ahsen Ejaz","2022","HPCA","This paper introduces FastTrackNoC, a Network-on-Chip (NoC) router architecture that reduces packet latency by bypassing its switch traversal (ST) stage. It is based on the observation that there is a bias in the direction a flit takes through a router, e.g., in a 2D mesh network, non-turning hops are preferred, especially when dimension order routing is used. FastTrackNoC capitalizes on this observation and adds to a 2D mesh router a fast-track path between the head of a single input virtual channel (VC) buffer and its most popular, opposite output. This allows non-turning flits to bypass ST logic, i.e., buffer-, input-and output multiplexing, when the required router resources are available. FastTrackNoC combines ST bypassing with existing techniques for reducing latency, namely, allocation bypassing, precomputed routing, and lookahead control signaling to allow at best incoming flits to proceed directly to link traversal (LT). Moreover, it is applied to a Dual Data Rate (DDR) router in order to maximize network throughput. Post place and route results in 28nm show the following: compared to previous DDR NoCs, FastTrackNoC offers 13-32% lower average packet latency; compared to previous multi-VC Single Data Rate (SDR) NoCs, FastTrackNoC reduces latency by 10-40% and achieves 18-21% higher throughput, and compared to single-channel SDR NoC offers up to 50% higher throughput and similar latency.","dblp","Computer Science","4","https://doi.org/10.1109/HPCA53966.2022.00075","10.1109/HPCA53966.2022.00075","2022-04-01","2026-04-08","",""
