"paper_id","arxiv_id","s2_paper_id","title","authors","year","venue","abstract","source","categories","citation_count","url","doi","published_date","crawled_date","keep","notes"
"doi:10.1109/TPDS.2021.3108893","","f2eec4c228222c147a753a35c1c340c653133863","Network Cost-Aware Geo-Distributed Data Analytics System","Kwangsung Oh","2022","IEEE-TPDS","Many geo-distributed data analytics (GDA) systems have focused on the network performance-bottleneck: inter-data center network bandwidth to improve performance. Unfortunately, these systems may encounter a <italic>cost-bottleneck</italic> (<inline-formula><tex-math notation=""LaTeX"">${\$}$</tex-math><alternatives><mml:math><mml:mi>$</mml:mi></mml:math><inline-graphic xlink:href=""oh-ieq1-3108893.gif""/></alternatives></inline-formula>) because they have not considered data transfer cost (<inline-formula><tex-math notation=""LaTeX"">${\$}$</tex-math><alternatives><mml:math><mml:mi>$</mml:mi></mml:math><inline-graphic xlink:href=""oh-ieq2-3108893.gif""/></alternatives></inline-formula>), one of the most expensive and heterogeneous resources in a multi-cloud environment. In this article, we present <italic>Kimchi</italic>, a network cost-aware GDA system to meet the cost-performance tradeoff by exploiting data transfer cost heterogeneity to avoid the cost-bottleneck. Kimchi determines cost-aware task placement decisions for scheduling tasks given inputs including data transfer cost, network bandwidth, input data size and locations, and desired cost-performance tradeoff preference. In addition, Kimchi is also mindful of data transfer cost in the presence of dynamics. Kimchi has been applied to two common GDA MapReduce models: synchronous barrier and asynchronous push-based shuffle. A Kimchi prototype has been implemented on Spark, and experiments show that it reduces cost by 5% <inline-formula><tex-math notation=""LaTeX"">$\scriptstyle \sim$</tex-math><alternatives><mml:math><mml:mstyle scriptlevel=""1"" displaystyle=""false""><mml:mo>∼</mml:mo></mml:mstyle></mml:math><inline-graphic xlink:href=""oh-ieq3-3108893.gif""/></alternatives></inline-formula> 24% without impacting performance and reduces query execution time by 45% <inline-formula><tex-math notation=""LaTeX"">$\scriptstyle \sim$</tex-math><alternatives><mml:math><mml:mstyle scriptlevel=""1"" displaystyle=""false""><mml:mo>∼</mml:mo></mml:mstyle></mml:math><inline-graphic xlink:href=""oh-ieq4-3108893.gif""/></alternatives></inline-formula> 70% without impacting cost compared to other baseline approaches centralized, vanilla Spark, and bandwidth-aware (e.g., Iridium). More importantly, Kimchi allows applications to explore a much richer cost-performance tradeoff space in a multi-cloud environment.","dblp","Computer Science","5","https://doi.org/10.1109/TPDS.2021.3108893","10.1109/TPDS.2021.3108893","2021-08-01","2026-04-08","",""
"doi:10.1109/TPDS.2021.3111810","","50af4fca5e6deb89a2398f8ca643596143801483","HSA-Net: Hidden-State-Aware Networks for High-Precision QoS Prediction","Ziliang Wang","2022","IEEE-TPDS","The high-precision QoS (quality of service) prediction is based on the comprehensive perception of state information of users and services. However, the current QoS prediction approaches have limited accuracy, for most state information of users and services (i.e., network speed, latency, network type, and more) are hidden due to privacy protection. Therefore, this article proposes a hidden-state-aware network (HSA-Net) that includes three steps called hidden state initialization, hidden state perception, and QoS prediction. A hidden state initialization approach is developed first based on the latent dirichlet allocation (LDA). After that, a hidden-state perception approach is proposed to abstract the initialized hidden state by fusing the known information (e.g., service ID and user location). The perception approach consists of four hidden-state perception (HSP) modes (i.e., known mode, object mode, hybrid mode and overall mode) implemented to generate explainable and fused features through four adaptive convolutional kernels. Finally, the relationship between the fused features and the QoS is discovered through a fully connected network to complete the high-precision QoS prediction process. The proposed HSA-Net is evaluated on two real-world datasets. According to the results, the HSA-Net's mean absolute error (MAE) index reduced by 3.67% and 28.84%, whereas the root mean squared error (RMSE) index decreased by 3.07% and 7.14% compared with ten baselines on average in the two datasets.","dblp","Computer Science","27","https://doi.org/10.1109/TPDS.2021.3111810","10.1109/TPDS.2021.3111810","2022-06-01","2026-04-08","",""
"doi:10.1109/TPDS.2021.3114984","","43d16f1695a25243dddc645e92327b0c19e24f11","Modeling Speedup in Multi-OS Environments","Brian R. Tauro","2022","IEEE-TPDS","For workloads that place strenuous demands on system software, novel operating system designs like unikernels, library OSes, and hybrid runtimes offer a promising path forward. However, while these systems can outperform general-purpose OSes, they have limited ability to support legacy applications. Multi-OS environments, where the application’s execution is split between a control plane and a data plane operating system, can address this challenge, but reasoning about the performance of applications that run in such a split execution environment is currently guided only by expert intuition and empirical analysis. As the level of specialization in system software and hardware continues to increase, there is both a pressing need and ripe opportunity for investigating analytical models that can predict application performance and guide programmers’ intuition when considering multi-OS environments. In this paper we present such a model to place bounds on application speedup, beginning with a simple, intuitive formulation, and progressing to a more refined model. We present an analysis of the model for a diverse set of benchmarks, as well as a prototype tool to project multi-OS speedups for applications on existing systems. Finally, we validate our model on state-of-the-art multi-OS systems, demonstrating that it reliably predicts speedup with 96% average accuracy.","dblp","Computer Science","1","https://doi.org/10.1109/TPDS.2021.3114984","10.1109/TPDS.2021.3114984","2022-06-01","2026-04-08","",""
"doi:10.1109/TPDS.2021.3115630","","02d5fd7b4d8946a8489d775b1104b76dbaae3728","A Survey of GPU Multitasking Methods Supported by Hardware Architecture","Chen Zhao","2022","IEEE-TPDS","The ability to support multitasking becomes more and more important in the development of graphic processing unit (GPU). GPU multitasking methods are classified into three types: temporal multitasking, spatial multitasking, and simultaneous multitasking (SMK). This article first introduces the features of some commercial GPU architectures to support multitasking and the common metrics used for evaluating the performance of GPU multitasking methods, and then reviews the GPU multitasking methods supported by hardware architecture (i.e., hardware GPU multitasking methods). The main problems of each type of hardware GPU multitasking methods to be solved are illustrated. Meanwhile, the key idea of each previous hardware GPU multitasking method is introduced. In addition, the characteristics of hardware GPU multitasking methods belonging to the same type are compared. This article also gives some valuable suggestions for the future research. An enhanced GPU simulator is needed to bridge the gap between academia and industry. In addition, it is promising to expand the research space with machine learning technologies, advanced GPU architectural innovations, 3D stacked memory, etc. Because most previous GPU multitasking methods are based on NVIDIA GPUs, this article focuses on NVIDIA GPU architecture, and uses NVIDIA's terminology. To our knowledge, this article is the first survey about hardware GPU multitasking methods. We believe that our survey can help the readers gain insights into the research field of hardware GPU multitasking methods.","dblp","Computer Science","23","https://doi.org/10.1109/TPDS.2021.3115630","10.1109/TPDS.2021.3115630","2022-06-01","2026-04-08","",""
"doi:10.1109/TPDS.2021.3111159","","bd9064f5d2119043fa975c525d86ad85d208a695","EnosLib: A Library for Experiment-Driven Research in Distributed Computing","Ronan-Alexandre Cherrueau","2022","IEEE-TPDS","Despite the importance of experiment-driven research in the distributed computing community, there has been little progress in helping researchers conduct their experiments. In most cases, they have to achieve tedious and time-consuming development and instrumentation activities to deal with the specifics of testbeds and the system under study. In order to relieve researchers of the burden of those efforts, we have developed EnosLib: a Python library that takes into account best experimentation practices and leverages modern toolkits on automatic deployment and configuration systems. EnosLib helps researchers not only in the process of developing their experimental artifacts, but also in running them over different infrastructures. To demonstrate the relevance of our library, we discuss three experimental engines built on top of EnosLib, and used to conduct empirical studies on complex software stacks between 2016 and 2019 (database systems, communication buses and OpenStack). By introducing EnosLib, our goal is to gather academic and industrial actors of our community around a library that aggregates everyday experiment-driven research operations. A library that has been already adopted by open-source projects and members of the scientific community thanks to its ease of use and extension.","dblp","Computer Science","30","https://doi.org/10.1109/TPDS.2021.3111159","10.1109/TPDS.2021.3111159","2022-06-01","2026-04-08","",""
"doi:10.1109/TPDS.2021.3116859","","fe140ed39a9812d6d0373ecff1b4c4049b198980","Coarse Grained FPGA Overlay for Rapid Just-In-Time Accelerator Compilation","Abhishek Kumar Jain","2022","IEEE-TPDS","Coarse-grained FPGA overlays built around the runtime programmable DSP blocks in modern FPGAs can achieve high throughput and improved scalability compared to traditional overlays built without detailed consideration of FPGA architecture. These overlays can be mapped to using higher level compilers, achieving fast compilation, software-like programmability and run-time management, and high-level design abstraction. OpenCL allows programs running on a host computer to launch accelerator kernels which can be compiled at run-time for a specific architecture, thus enabling portability. However, prohibitive hardware compilation times in traditional design flows mean that the tools cannot effectively use just-in-time (JIT) compilation or runtime performance scaling on FPGAs. We present an architecture-optimised FPGA overlay that exploits the capabilities of DSP blocks to maximise throughput and an associated design methodology for runtime compilation of dataflow graphs expressed as OpenCL kernels onto the overlays. The methodology benefits from the high level of abstraction afforded by using the OpenCL programming model, while the mapping to the overlay significantly reduces compilation and load times. Key characteristics of this work include highly performant DSP-optimized functional units that scale to large overlays on modern devices and the ability to perform automatic resource-aware kernel replication up to the size of the overlay for performance scaling. We demonstrate place and route times orders of magnitude better than traditional HLS flows, even when running on an embedded processor in the Xilinx Zynq.","dblp","Computer Science","12","https://doi.org/10.1109/TPDS.2021.3116859","10.1109/TPDS.2021.3116859","","2026-04-08","",""
"doi:10.1109/TPDS.2021.3116863","","41f272653e4137915587b435cacacd2868642be4","Deep Reinforcement Learning for Load-Balancing Aware Network Control in IoT Edge Systems","Qingzhi Liu","2022","IEEE-TPDS","Load balancing is directly associated with the overall performance of a parallel and distributed computing system. Although the relevant problems in communication and computation have been well studied in data center environments, few works have considered the issues in an IoT edge scenario. In fact, processing data in a load balancing way for the latter case is more challenging. The main reason is that, unlike a data center, both the data sources and the network infrastructure in an IoT edge system can be dynamic. Moreover, with different performance requirements from IoT networks and edge servers, it will be hard to characterize the performance model and to perform runtime optimization for the whole system. To tackle this problem, in this work, we propose a load-balancing aware networking approach for efficient data processing in IoT edge systems. Specifically, we introduce an IoT network dynamic clustering solution using the emerging deep reinforcement learning (DRL), which can both fulfill the communication balancing requirements from IoT networks and the computation balancing requirements from edge servers. Moreover, we implement our system with a long short term memory (LSTM) based Dueling Double Deep Q-Learning Network (D3QN) model, and our experiments with real-world datasets collected from an autopilot vehicle demonstrate that our proposed method can achieve significant performance improvement compared to a benchmark solution.","dblp","Computer Science","79","https://doi.org/10.1109/TPDS.2021.3116863","10.1109/TPDS.2021.3116863","","2026-04-08","",""
"doi:10.1109/TPDS.2021.3112604","","d25527ad58b278c98e1e7c43f3a8b309e98be5b0","A Potential Game Theoretic Approach to Computation Offloading Strategy Optimization in End-Edge-Cloud Computing","Yan Ding","2022","IEEE-TPDS","Integrating user ends (UEs), edge servers (ESs), and the cloud into end-edge-cloud computing (EECC) can enhance the utilization of resources and improve quality of experience (QoE). However, the performance of EECC is significantly affected by its architecture. In this article, we classify EECC into two computing architectures types according to the visibility and accessibility of the cloud to UEs, i.e., hierarchical end-edge-cloud computing (Hi-EECC) and horizontal end-edge-cloud computing (Ho-EECC). In Hi-EECC, UEs can offload their tasks only to ESs. When the resources of ESs are exhausted, the ESs request the cloud to provide resources to UEs. In Ho-EECC, UEs can offload their tasks directly to ESs and the cloud. In this article, we construct a potential game for the EECC environment, in which each UE selfishly minimizes its payoff, study the computation offloading strategy optimization problems, and develop two potential game-based algorithms in Hi-EECC and Ho-EECC. Extensive experiments with real-world data are conducted to demonstrate the performance of the proposed algorithms. Moreover, the scalability and applicability of the two computing architectures are comprehensively analyzed. The conclusions of our work can provide useful suggestions for choosing specific computing architectures under different application environments to improve the performance of EECC and QoE.","dblp","Computer Science","111","https://doi.org/10.1109/TPDS.2021.3112604","10.1109/TPDS.2021.3112604","2022-06-01","2026-04-08","",""
"doi:10.1109/TPDS.2021.3118610","","67a0236bbafbdeabc3574178496f2c7b61c8fcfc","Necessary Feasibility Analysis for Mixed-Criticality Real-Time Embedded Systems","Hoon Sung Chwa","2022","IEEE-TPDS","As multiple software components with different safety-criticality levels are integrated on a shared computing platform, a real-time embedded system becomes a mixed-criticality (MC) system, which should provide timing guarantees at all different levels of assurance to software components with different criticality levels. In the real-time systems community, the concept of an MC system is regarded as a promising, emerging solution to solve an inherent challenge of real-time systems: pessimistic reservation of computing resources, which yields a low resource-utilization for the sake of guaranteeing timing requirements. Since a timing guarantee should be provided before a real-time system starts to operate, its feasibility has been extensively studied for single-criticality systems; however, the same cannot be said for MC systems. In this paper, we develop necessary feasibility tests for MC real-time embedded systems, which is the first study that yields non-trivial results for MC necessary feasibility on both uniprocessor and multiprocessor platforms. To this end, we investigate characteristics of MC necessary feasibility conditions, and identify new challenges posed by the characteristics. By addressing those challenges, we develop two collective necessary feasibility tests and their simplified versions, which are able to exploit a tradeoff between capability in finding infeasible task sets and time-complexity. The simulation results demonstrate that the proposed tests find a number of additional infeasible task sets for both uniprocessor and multiprocessor platforms, which have been proven neither feasible nor infeasible by any existing studies.","dblp","Computer Science","7","https://doi.org/10.1109/TPDS.2021.3118610","10.1109/TPDS.2021.3118610","","2026-04-08","",""
"doi:10.1109/TPDS.2021.3116865","","1974269b96724ee8d50e324342a0f5dcd812e25c","Topology-Aware Neural Model for Highly Accurate QoS Prediction","Jiahui Li","2022","IEEE-TPDS","With the widespread deployment of various cloud computing and service-oriented systems, there is a rapidly increasing demand for collaborative quality-of-service (QoS) prediction. Existing QoS prediction methods have made great progress in modeling users and services as well as exploiting contexts of service invocations. However, they ignore the completion of service requests/responses relies on the underlying network topology and the complex interactions between Autonomous Systems. To tackle this challenge, we propose a topology-aware neural (TAN) model for collaborative QoS prediction. In the TAN model, the features of users, services, and intermediate nodes on the communication path are projected to a shared latent space as input features. To jointly characterize the invocation process, the path features and end-cross features are captured respectively through an explicit path modeling layer and an implicit cross-modeling layer. After that, a gating layer fuses and transmits these features to the prediction layer for estimating unknown QoS values. In this way, TAN provides a flexible framework that can comprehensively capture the invocation context for making accurate QoS prediction. Experimental results on two real-world datasets demonstrate that TAN significantly outperforms state-of-the-art methods on the tasks of response time, throughput, and reliability prediction. Also, TAN shows better extensibility of using auxiliary information.","dblp","Computer Science","57","https://doi.org/10.1109/TPDS.2021.3116865","10.1109/TPDS.2021.3116865","","2026-04-08","",""
"doi:10.1109/TPDS.2021.3119402","","3f6274082da696e91d2155dada93f36f4d38b25f","Exploring Data Analytics Without Decompression on Embedded GPU Systems","Zaifeng Pan","2022","IEEE-TPDS","With the development of computer architecture, even for embedded systems, GPU devices can be integrated, providing outstanding performance and energy efficiency to meet the requirements of different industries, applications, and deployment environments. Data analytics is an important application scenario for embedded systems. Unfortunately, due to the limitation of the capacity of the embedded device, the scale of problems handled by the embedded system is limited. In this paper, we propose a novel data analytics method, called G-TADOC, for efficient text analytics directly on compression on embedded GPU systems. A large amount of data can be compressed and stored in embedded systems, and can be processed directly in the compressed state, which greatly enhances the processing capabilities of the systems. Particularly, G-TADOC has three innovations. First, a novel fine-grained thread-level workload scheduling strategy for GPU threads has been developed, which partitions heavily-dependent loads adaptively in a fine-grained manner. Second, a GPU thread-safe memory pool has been developed to handle inconsistency with low synchronization overheads. Third, a sequence-support strategy is provided to maintain high GPU parallelism while ensuring sequence information for lossless compression. Moreover, G-TADOC involves special optimizations for embedded GPUs, such as utilizing the CPU-GPU shared unified memory. Experiments show that G-TADOC provides 13.2× average speedup compared to the state-of-the-art TADOC. G-TADOC also improves performance-per-cost by 2.6× and energy efficiency by 32.5× over TADOC.","dblp","Computer Science","32","https://doi.org/10.1109/TPDS.2021.3119402","10.1109/TPDS.2021.3119402","2022-07-01","2026-04-08","",""
"doi:10.1109/TPDS.2021.3118609","","fa2157704f32dc38c31294ce5b622d4a7f8d0f01","SaPus: Self-Adaptive Parameter Update Strategy for DNN Training on Multi-GPU Clusters","Zhaorui Zhang","2022","IEEE-TPDS","Parameter server architecture has been identified as an efficient framework for scaling DNNs training on clusters. For large-scale deployment, communication becomes the bottleneck, and the parameter updating strategy strongly impacts the training performance. Recent state-of-art solutions adopted local SGD approach, which enables workers to update their local version of models and only aggregate them to update the global parameters after finishing a number of iterations, to alleviate heavy communication pressure. We identify three limitations of these works. First, these works do not provide an approach for determining when the worker is to update the parameter with the server under asynchronous communication strategies that can guarantee the training performance. Second, local SGD suffers from the problem of unbounded gradient delay. Previous work works well for a short delay, while can not guarantee the performance with an increase of gradient delay. Third, they do not consider the system performance when determining the update interval of the local SGD, which affects the training performance extremely. We provide a self-adaptive parameter updating strategy called SaPus, which allows each worker to detect their training results through quantification of the accumulated gradient updates and determine when to update the parameter with the server individually. Theoretical lower and upper bound of the update interval is also provided. We also propose a weighted aggregation algorithm based on a global-loss window to solve the unbounded delay problem in asynchronous local SGD. To increase the robustness of our parameter updating strategy, a performance model is built to provide a resource-aware lower bound for the update interval. Extensive experimental results indicate that our model improves the training performance of DNNs, achieving up to 66.67% speedup as compared with state-of-art solutions. Further, results show the CPU utilization of server dropped by up to 81.1% and network bandwidth usage less than 1Gbps.","dblp","Computer Science","11","https://doi.org/10.1109/TPDS.2021.3118609","10.1109/TPDS.2021.3118609","","2026-04-08","",""
"doi:10.1109/TPDS.2021.3119948","","e181e526151fa52c760edb40f5effaaa31df1b55","LOCUS: User-Perceived Delay-Aware Service Placement and User Allocation in MEC Environment","Yu Chen","2022","IEEE-TPDS","In the multi-access edge computing environment, app vendors deploy their services and applications at the network edges, and edge users offload their computation tasks to edge servers. We study the user-perceived delay-aware service placement and user-allocation problem in edge environment. We model the MEC-enabled network, where the user-perceived delay consists of computing delay and transmission delay. The total cost in the offloading system is defined as the sum of service placement, edge server usage and energy consumption cost, and we need to minimize the total cost by determining the overall service-placing decision and user-allocation decision, while guaranteeing that the user-perceived delay requirement of each user is fulfilled. Our considered problem is formulated as a Mixed Integer Linear Programming problem, and we prove its NP-hardness. Due to the intractability of the considered problem, we propose a LOCal-search based algorithm for USer-perceived delay-aware service placement and user-allocation in edge environment, named LOCUS, which starts with a feasible solution and then repeatedly reduces the total cost by performing local-search steps. After that, we analyze the time complexity of LOCUS and prove that it achieves provable guaranteed performance. Finally, we compare LOCUS with other existing methods and show its good performance through experiments.","dblp","Computer Science","44","https://doi.org/10.1109/TPDS.2021.3119948","10.1109/TPDS.2021.3119948","2022-07-01","2026-04-08","",""
