"paper_id","arxiv_id","s2_paper_id","title","authors","year","venue","abstract","source","categories","citation_count","url","doi","published_date","crawled_date","keep","notes"
"doi:10.1109/TPDS.2022.3143535","","af1a476d96c72069c3a96956713534eabaa61899","Fast and Accurate Statistical Simulation of Shared-Memory Applications on Multicore Systems","Fan Jiang","2022","IEEE-TPDS","Detailed cycle-accurate simulation of multicore systems is naturally slow. Statistical simulation is one alternative that permits trading off simulation speed for accuracy. However, there is a lack of effective memory locality models for multicore applications. Hence, existing statistical simulators neglect data-sharing between threads. Additionally, the standard method to speed up statistical simulations is to blindly reduce the trace length to be synthesized. While this gives good control over the speedup, it leaves the simulation error unbounded. In this work, we introduce a novel statistical simulation methodology for exploration of shared-memory multicore systems. It includes a new <underline><bold>sha</bold></underline>ring-<underline><bold>lo</bold></underline>cality <underline><bold>m</bold></underline>odel (<italic>Shalom</italic>) that captures and reproduces data-sharing in multithread applications. Furthermore, we propose a method to bound the simulation error for a particular metric while maximizing speedup. The technique works by monitoring the convergence of the statistical synthesis. It is referred to as <underline><bold>con</bold></underline>vergence-<underline><bold>de</bold></underline>termi<underline><bold>n</bold></underline>istic <underline><bold>s</bold></underline>imulation (<italic>Condens</italic>). The combination of <italic>Shalom</italic> and <italic>Condens</italic> is around 130x faster than cycle-accurate simulations with reasonable accuracy loss. Our approach is also 5x faster than state-of-the-art sampling simulation under the same accuracy level. Compared to previous statistical simulators ignoring sharing, our approach is 2x more accurate for performance metrics and 8x more accurate for cache miss estimations.","dblp","Computer Science","4","https://doi.org/10.1109/TPDS.2022.3143535","10.1109/TPDS.2022.3143535","2022-10-01","2026-04-08","",""
"doi:10.1109/TPDS.2022.3157690","","be1e35488d5a72ccb6b7dac10274cf31f07ffa76","Jdebug: A Fast, Non-Intrusive and Scalable Fault Locating Tool for Ten-Million-Scale Parallel Applications","Dajia Peng","2022","IEEE-TPDS","This article presents Jdebug, a fast, non-intrusive and scalable fault locating tool for extreme-scale parallel applications. Large-scale debugging has drawn more attention with the increasing scale of supercomputers and applications. To eliminate program intrusion caused by traditional instrumentation or interception during debugging information acquisition, we introduce the out-of-band management into large-scale debugging. We propose a rapid information gathering scheme that separates user and debugging traffic to solve scalability problem and to eliminate program interference during merging data. Observations of Program Counters (PC) and performance characteristics in suspended applications find abnormalities and help locate abnormal threads caused by software errors or hardware failures effectively. Evaluation shows that Jdebug collects PCs of over 20 million cores on the new Sunway supercomputer within 1.97 seconds, and can locate the abnormal threads in 1.4 seconds with an accuracy of 92.5%. In the running test of three fundamental benchmarks (HPL, HPCG, Graph500) and seventeen real-world applications, Jdebug quickly and accurately locates abnormal threads to help find scalability errors and hardware failures including memory access failures, communication failures, and execution component failures, which validates its effectiveness.","dblp","Computer Science","4","https://doi.org/10.1109/TPDS.2022.3157690","10.1109/TPDS.2022.3157690","2022-12-01","2026-04-08","",""
"doi:10.1109/TPDS.2022.3168873","2204.04450","deaae0629a69b270bddbedb74973cf8fbfea4970","Distributed Evolution Strategies for Black-Box Stochastic Optimization","Xiaoyu He","2022","IEEE-TPDS","This work concerns the evolutionary approaches to distributed stochastic black-box optimization, in which each worker can individually solve an approximation of the problem with nature-inspired algorithms. We propose a distributed evolution strategy (DES) algorithm grounded on a proper modification to evolution strategies, a family of classic evolutionary algorithms, as well as a careful combination with existing distributed frameworks. On smooth and nonconvex landscapes, DES has a convergence rate competitive to existing zeroth-order methods, and can exploit the sparsity, if applicable, to match the rate of first-order methods. The DES method uses a Gaussian probability model to guide the search and avoids the numerical issue resulted from finite-difference techniques in existing zeroth-order methods. The DES method is also fully adaptive to the problem landscape, as its convergence is guaranteed with any parameter setting. We further propose two alternative sampling schemes which significantly improve the sampling efficiency while leading to similar performance. Simulation studies on several machine learning problems suggest that the proposed methods show much promise in reducing the convergence time and improving the robustness to parameter settings.","dblp","Computer Science","10","https://doi.org/10.1109/TPDS.2022.3168873","10.1109/TPDS.2022.3168873","2022-04-09","2026-04-08","",""
"doi:10.1109/TPDS.2022.3175596","2105.14157","2f0cf210d29aad7533f2f3ca925a7aa184c54763","SMURF: Efficient and Scalable Metadata Access for Distributed Applications","Bing Zhang","2022","IEEE-TPDS","In parallel with big data processing and analysis dominating the usage of distributed and Cloud infrastructures, the demand for distributed metadata access and transfer has increased. The volume of data generated by many application domains exceeds petabytes, while the corresponding metadata amounts to terabytes or even more. This paper proposes a novel solution for efficient and scalable metadata access for distributed applications across wide-area networks, dubbed SMURF. Our solution combines novel pipelining and concurrent transfer mechanisms with reliability, provides distributed continuum caching and semantic locality-aware prefetching strategies to sidestep fetching latency, and achieves scalable and high-performance metadata fetch/prefetch services in the Cloud. We incorporate the phenomenon of semantic locality awareness for increased prefetch prediction rate using real-life application I/O traces from Yahoo! Hadoop audit logs and propose a novel prefetch predictor. By effectively caching and prefetching metadata based on the access patterns, our continuum caching and prefetching mechanism significantly improves the local cache hit rate and reduces the average fetching latency. We replay approximately 20 Million metadata access operations from real audit traces, where SMURF achieves 90% accuracy during prefetch prediction and reduced the average fetch latency by 50% compared to the state-of-the-art mechanisms.","dblp","Computer Science","5","https://doi.org/10.1109/TPDS.2022.3175596","10.1109/TPDS.2022.3175596","2021-05-29","2026-04-08","",""
"doi:10.1109/TPDS.2022.3173707","","5fbb06a78408991afbd6d87f643214c9823f4908","PhaST: Hierarchical Concurrent Log-Free Skip List for Persistent Memory","Zhenxin Li","2022","IEEE-TPDS","Skip list (skiplist) is a competitive index structure that offers superior concurrency and excellent performance but with high memory overhead and low access locality. Emerging persistent memory (PM) technologies present an opportunity to mitigate the capacity constraint of DRAM. However, data consistency in PM typically results in excessive write overheads. In addition, fast concurrent access to an index is critical to the throughput on high-end contemporary computer systems. In this paper, we propose a Partitioned HierArchical SkiplisT called PHAST, which can simultaneously reduce the skiplist height and improve its access locality, through its hierarchy of component structures, while enabling fast parallel recovery in case of failure. To ensure high concurrency and fast data consistency, we also have developed writelock-free failure-atomic concurrent insert and log-free atomic split. Furthermore, we have developed a durable lock-free concurrent search that can discern transient structural inconsistencies and deliver highly concurrent read operations. We have conducted an extensive evaluation of PHAST compared to state-of-the-art studies such as NV-Skiplist, wB+-Tree, FPTree, and FAST-FAIR. Our evaluation results show PHAST outperforms other indexing structures by up to 2.75 and 1.86 in single threaded inserts and searches, and achieves 1.56 and 2.62 improvements in concurrent inserts and searches.","dblp","Computer Science","12","https://doi.org/10.1109/TPDS.2022.3173707","10.1109/TPDS.2022.3173707","","2026-04-08","",""
"doi:10.1109/TPDS.2022.3176665","","57cea8a474b9a6e5a0c6354e224031f8fd0aed5c","Busy-Time Scheduling on Heterogeneous Machines: Algorithms and Analysis","Mozhengfu Liu","2022","IEEE-TPDS","We study a generalized busy-time scheduling model on heterogeneous machines. The input to the model includes a set of jobs and a set of machine types. Each job has a size and a time interval during which it should be processed. Each job is to be placed on a machine for execution. Different types of machines have distinct capacities and cost rates. The total size of the jobs running on a machine must always be kept within the machine's capacity, giving rise to placement restrictions for jobs of various sizes among the machine types. Each machine used is charged according to the time duration in which it is busy, i.e., it is processing jobs. The objective is to schedule the jobs into machines to minimize the total cost of all the machines used. We develop an O(1)-approximation algorithm in the offline setting and an O(μ)-competitive algorithm in the online setting (where μ is the max/min job length ratio), both of which are asymptotically optimal. This paper significantly improves the analysis of the algorithms over our preliminary work.","dblp","Computer Science","2","https://doi.org/10.1109/TPDS.2022.3176665","10.1109/TPDS.2022.3176665","","2026-04-08","",""
"doi:10.1109/TPDS.2022.3177957","","6d3eaede423aaa8dadb94fd694e6762aa112da6d","Run-Time Remapping Algorithm of Dataflow Actors on NoC-Based Heterogeneous MPSoCs","Mostafa Rizk","2022","IEEE-TPDS","Multiprocessor system-on-chip (MPSoC) platforms have been emerging as the main solution to cope with processor frequency ceiling and power density issues while still improving performances. Then, network-on-chip (NoC) has been adopted to provide the increasing number of processors with the required communication bandwidth as well as with the necessary flexibility. Video processing and streaming applications are adopting dynamic dataflow model of computation as the need for high performance parallel computing is growing. Dataflow applications executed on modern MPSoC-based architectures are becoming increasingly dynamic and more data-dependent. Different tasks execute concurrently with significant modifications in their workloads and resource demanding over time depending on the input data. Hence, adopting any static or offline dynamic scheduling for mapping tasks will not cope with the computation variations. This paper introduces an original run-time mapping algorithm based on the Move Based (MB) method targeting a dedicated heterogeneous NoC-based MPSoC architecture to achieve workload balancing and optimized communication traffic. The performance of the proposed algorithm is verified by conducting cycle-accurate SystemC simulations of the adopted NoC implementing a real MPEG4-SP decoder. The obtained results reveal the effectiveness of our proposed algorithm. For various real-life videos, the proposed algorithm systematically succeeded to enhance significantly the performance.","dblp","Computer Science","3","https://doi.org/10.1109/TPDS.2022.3177957","10.1109/TPDS.2022.3177957","","2026-04-08","",""
"doi:10.1109/TPDS.2022.3177291","","54ad09612a053dd9c8f2e8a5a766835f1bd2a167","VCSR: An Efficient GPU Memory-Aware Sparse Format","Elmira Karimi","2022","IEEE-TPDS","The Sparse Matrix-Vector Multiplication (SpMV) kernel is used in a broad class of linear algebra computations. SpMV computations result in a performance bottleneck in many high performance applications, so optimizing SpMV performance is paramount. While implementing this kernel on a GPU can potentially boost performance significantly, current GPU libraries either provide modest performance gains or are burdened with high sparse format conversion overhead.","dblp","Computer Science","15","https://doi.org/10.1109/TPDS.2022.3177291","10.1109/TPDS.2022.3177291","","2026-04-08","",""
"doi:10.1109/TPDS.2022.3175666","","b21f8190ccada52f3deb391735236c4d2b1ab39b","Optimized Page Fault Handling During RDMA","Antonis Psistakis","2022","IEEE-TPDS","Remote Direct Memory Access (RDMA) is widely used in High Performance Computing (HPC) while making inroads in datacenters and accelerators. State-of-the-art RDMA Engines typically do not endure page faults, therefore users are forced to pin their buffers, which complicates the programming model, limits the memory utilization, and moves the pressure to the Network Interface Cards (NICs). In this paper we introduce a mechanism for handling dynamic page faults during RDMA (PART), suitable for emerging processors that also integrate the Network Interface. PART leverages the IOMMU already present in modern processors for translations. PART avoids the pinning overheads, allows any buffer to be used for communication, and enables overlapping page fault handling with serving subsequent RDMA transfers. We implement and optimize PART for a cluster of ARMv8 cores with tightly-coupled network interfaces. Handling a minor page-fault of a small transfer at the destination takes approximately 38 $\mu$ secs, while there is no noticeable performance degradation when running three full MPI applications in 16 nodes and 64 cores. Detailed breakdown uncovers the hardware and system software components of this delay and was used to further optimize the system. A 4MB RDMA transfer performs 1.46x better over pinning.","dblp","Computer Science","6","https://doi.org/10.1109/TPDS.2022.3175666","10.1109/TPDS.2022.3175666","","2026-04-08","",""
"doi:10.1109/TPDS.2022.3178443","","fc2a748eb279159f7a359acead5359b164703616","Adaptive Vertical Federated Learning on Unbalanced Features","Jie Zhang","2022","IEEE-TPDS","Most of the existing FL systems focus on a data-parallel architecture where training data are partitioned by samples among several parties. In some real-life applications, however, partitioning by features is also of practical relevance and the number of features is usually unbalanced among parties. The corresponding learning framework is referred to as Vertical Federated Learning (VFL). Though some pioneering work focused on VFL, the convergence properties of VFL on unbalanced features, especially when parties conduct different numbers of local updates concerning heterogeneous computational capabilities are still unknown. In this paper, we propose a new learning framework to improve the training efficiency of VFL on unbalanced features. Given the number of features and the computational capability owned by each party, our thorough theoretical analysis exhibits that the number of local updates conducted by each party has a great effect on the convergence rate and the computational complexity, both of which jointly determine the overall training efficiency in an interrelated and sophisticated way. Based on our theoretical findings, we formulate an optimization problem and derive the optimal solution by selecting an adaptive number of local training rounds for each party. Extensive experiments on various datasets and models demonstrate that our approach significantly improves the training efficiency of VFL.","dblp","Computer Science","42","https://doi.org/10.1109/TPDS.2022.3178443","10.1109/TPDS.2022.3178443","","2026-04-08","",""
"doi:10.1109/TPDS.2022.3177046","","8390a8d2a5677afcfd95ce6ebbfe30508d1d1d9e","DAG Scheduling and Analysis on Multi-Core Systems by Modelling Parallelism and Dependency","Shuai Zhao","2022","IEEE-TPDS","With ever more complex functionalities being implemented in emerging real-time applications, multi-core systems are demanded for high performance, with directed acyclic graphs (DAG) being used to model functional dependencies. For a single DAG task, our previous work presented a concurrent provider and consumer (CPC) model that captures the node-level dependency and parallelism, which are the two key factors of a DAG. Based on the CPC, scheduling and analysis methods were constructed to reduce makespan and tighten the analytical bound of the task. However, the CPC-based methods cannot support multi-DAGs as the interference between DAGs (i.e., inter-task interference) is not taken into account. To address this limitation, this paper proposes a novel multi-DAG scheduling approach which specifies the number of cores a DAG can utilise so that it does not incur the inter-task interference. This is achieved by modelling and understanding the workload distribution of the DAG and the system. By avoiding the inter-task interference, the constructed schedule provides full compatibility for the CPC-based methods to be applied on each DAG and reduces the pessimism of the existing analysis. Experimental results show that the proposed multi-DAG method achieves an improvement up to 80% in schedulability against the original work that it extends, and outperforms the existing multi-DAG methods by up to 60% for tightening the interference.","dblp","Computer Science","38","https://doi.org/10.1109/TPDS.2022.3177046","10.1109/TPDS.2022.3177046","","2026-04-08","",""
"doi:10.1109/TPDS.2022.3177782","","217ef2269bf441d32df5971e6fdc3ca39ba1e3fb","CNNPC: End-Edge-Cloud Collaborative CNN Inference With Joint Model Partition and Compression","Shusen Yang","2022","IEEE-TPDS","Edge Intelligence (EI) aims at addressing concerns like response latency risen by the conflict between predominating Cloud-based deployments of computationally intensive AI applications and the expensive uploading of explosive end data. Convolutional Neural Networks (CNNs) leading the latest flourish of AI inevitably suffer from the aforementioned conflict. There emerge increasing EI-driven attempts on fast CNN inference with high accuracy in the End-Edge-Cloud (EEC) collaborative computing paradigm, where, however, neither model compression approaches for on-device inference nor collaborative inference methods across devices can effectively achieve the trade-off between latency and accuracy of End-to-End (E2E) inference. In this paper, we present CNNPC that jointly partitions and compresses CNNs for fast inference with high accuracy in collaborative EEC systems. We implemented CNNPC (source code available at https://github.com/IoTDATALab/CNNPC) and evaluated its performance within extensive real-world EEC scenarios. Experimental results demonstrate that, compared with state-of-the-art single-end and collaborative approaches, without obvious accuracy loss, collaborative inference based on CNNPC is up to 1.6x and 5.61.6× and 5.6× faster, and requires as low as 4.30% and 6.48% communications, respectively. Besides, when determines the optimal strategy, CNNPC requires as low as 0.1% actual compression operations that the traversal method (the only viable method providing the theoretically optimal strategy) requires.","dblp","Computer Science","52","https://doi.org/10.1109/TPDS.2022.3177782","10.1109/TPDS.2022.3177782","","2026-04-08","",""
"doi:10.1109/TPDS.2022.3177811","","7c6ed0ff29cb7298082527c4cba6f9869097a05b","Exploring Query Processing on CPU-GPU Integrated Edge Device","Jiesong Liu","2022","IEEE-TPDS","Huge amounts of data have been generated on edge devices every day, which requires efficient data analytics and management. However, due to the limited computing capacity of these edge devices, query processing at the edge faces tremendous pressure. Fortunately, in recent years, hardware vendors have integrated heterogeneous coprocessors, such as GPUs, into the edge device, which can provide much more computing power. Furthermore, the CPU-GPU integrated edge device has shown significant benefits in a variety of situations. Therefore, the exploration of query processing on such CPU-GPU integrated edge devices becomes an urgent need. In this paper, we develop a fine-grained query processing engine, called FineQuery, which can perform efficient query processing on CPU-GPU integrated edge devices. Particularly, FineQuery can take advantage of both architectural features of edge devices and query characteristics by performing fine-grained workload scheduling between the CPU and the GPU. Experiments show that on TPC-H workloads, FineQuery reduces 42.81% latency and improves 2.39× bandwidth utilization on average compared to the implementation of using only GPU or CPU. Furthermore, query processing at the edge can bring significant performance-per-cost benefits and energy efficiency. On average, FineQuery at the edge brings a 21× performance-per-cost ratio and 4× energy efficiency compared with processing the data on a discrete GPU platform.","dblp","Computer Science","20","https://doi.org/10.1109/TPDS.2022.3177811","10.1109/TPDS.2022.3177811","","2026-04-08","",""
"doi:10.1109/TPDS.2022.3179316","","e0c2ca3eccf7c54eeca80b758e20dee5a8003a9e","Highly Accurate Clock Synchronization With Drift Correction for the Controller Area Network","Murat Akpinar","2022","IEEE-TPDS","Modern vehicles, that have to be considered as safety-critical cyber-physical systems, require highly accurate clock synchronization (CS) among their distributed computing devices. Since Controller Area Network (CAN) is the predominant in-vehicle communication bus, it is highly relevant to support CS for CAN. This paper proposes an original CS method for distributed in-vehicle networks based on CAN with both offset and drift correction. While offset correction is performed based on timestamps in periodic reference messages (RMs), our new method benefits from the re-synchronization mechanism of the CAN bit timing to apply highly accurate driftcorrection. Our algorithm does not make any modifications to the CAN protocol but requires the measurement of the phase error from the CAN controller. We derive analytical bounds for the expected clock differences and further validate the practicability of the proposed method by comprehensive experiments. As the main result, our method achieves a clock accuracy below 2μs independent of important parameters such as the bit rate, RM period, bus utilization and time-varying clock drifts.","dblp","Computer Science","9","https://doi.org/10.1109/TPDS.2022.3179316","10.1109/TPDS.2022.3179316","","2026-04-08","",""
"doi:10.1109/TPDS.2022.3181096","","550194772ed9f104c3103055935a6042e84c26e2","Energy-Aware Non-Preemptive Task Scheduling With Deadline Constraint in DVFS-Enabled Heterogeneous Clusters","Qiang Wang","2022","IEEE-TPDS","[abstract unavailable]","dblp","Computer Science","25","https://doi.org/10.1109/TPDS.2022.3181096","10.1109/TPDS.2022.3181096","","2026-04-08","",""
"doi:10.1109/TPDS.2022.3179328","","a76313eae46b4e9d161a8fc6fc4247fd423e94ed","Real-Time Scheduling of Parallel Task Graphs With Critical Sections Across Different Vertices","Xu Jiang","2022","IEEE-TPDS","All existing work on real-time scheduling of parallel task graph models with shared resources assumes that a critical section must be contained inside a single vertex. However, this assumption does not hold in many realistic parallel real-time software. In this work, we conduct the first study on real-time scheduling and analysis of parallel task graphs where critical sections are allowed to cross different vertices. We show that allowing this may potentially lead to deadlocks and the so-called resource unrelated blocking time problem. We formalize the conditions for the deadlocks and resource unrelated blocking time to happen, and propose two different solutions to address them and develop corresponding schedulability analysis techniques.We conduct comprehensive experiments to evaluate our method. The results indicate that there is a significant impact to the system schedulability when tasks incur deadlock and resource unrelated blocking. Moreover, the schedulability can benefit from the execution of workload in parallel with critical sections if tasks can be carefully designed so that all deadlocks and resource unrelated blocking time can be avoided, and our methods are efficient to determine the schedulability of systems where critical sections across different vertices exist","dblp","Computer Science","2","https://doi.org/10.1109/TPDS.2022.3179328","10.1109/TPDS.2022.3179328","","2026-04-08","",""
