"paper_id","arxiv_id","s2_paper_id","title","authors","year","venue","abstract","source","categories","citation_count","url","doi","published_date","crawled_date","keep","notes"
"doi:10.1109/TVLSI.2025.3619126","","3eaa5e623a20c7bf0c125b75d82c1825883367ce","A Buffer-in-Loop NS-SAR ADC With CDAC Sharing-Error Feedback Structure and kT/C Noise Cancellation in 0.18-μm CMOS Technology","Zirui Cui","2026","IEEE-TVLSI","Analog-to-digital converters (ADCs) with a wide input range and power efficiency are highly desired in various applications like robust industrial sensor data acquisition and bioelectrical signal monitoring, where successive approximation register (SAR) ADCs fabricated in mature process nodes account for a large proportion. This brief presents a buffer-in-loop (BIL) noise-shaping (NS) SAR ADC with a proposed CDAC sharing (CS)-error-feedback (EF) structure and <italic>kT</italic>/<inline-formula> <tex-math notation=""LaTeX"">$C$ </tex-math></inline-formula> cancellation method in 180 nm. Compared with traditional EF methods, this CS-EF NS scheme takes advantage of the simple BIL structure and reduces the input signal degradation problem due to charge sharing with the input signal or parasitic capacitor of the series EF capacitor in the signal path, and enhances the system robustness. Combined with the <italic>kT</italic>/<inline-formula> <tex-math notation=""LaTeX"">$C$ </tex-math></inline-formula> cancellation and coarse-to-fine conversion techniques, this BIL NS-SAR reduces the noise from sampling, buffer, and pre-amp. The measured peak signal-to-noise-and-distortion ratio (SNDR) is 74.9 dB with a bandwidth of 0.6 MHz, and this ADC consumes <inline-formula> <tex-math notation=""LaTeX"">$218.7~\mu $ </tex-math></inline-formula>W without the buffer.","dblp","Computer Science","0","https://doi.org/10.1109/TVLSI.2025.3619126","10.1109/TVLSI.2025.3619126","2026-01-01","2026-04-08","",""
"doi:10.1109/TVLSI.2025.3622252","","1b8ebd3864f104a4f3b96d44dfa35e9660032843","A 15-bit ROIC With Current-Mode Folding Integration Technique for Microbolometer Thermal Imagers","John Carl Joel Salao Marquez","2026","IEEE-TVLSI","This article presents a 52-mK noise-equivalent temperature difference (NETD) reference-cell-free wide temperature sensing range readout integrated circuit (ROIC) for a microbolometer thermal imager. The proposed ROIC utilizes a 15-bit hybrid analog-to-digital converter (ADC) that employs the current-mode folding integration (CMFI) technique for the coarse conversion and single-slope (SS) operation for the fine conversion. With the proposed coarse CMFI operation, the ROIC achieves a <inline-formula> <tex-math notation=""LaTeX"">$300\times $ </tex-math></inline-formula> larger conversion range and <inline-formula> <tex-math notation=""LaTeX"">$300\times $ </tex-math></inline-formula> higher conversion gain compared to the conventional nonfolding integration (NFI) technique. Moreover, due to the extended conversion range, the ROIC is able to cover the sensor’s PVT variations without any signal saturation. With the hybrid operation of CMFI and SS, the ROIC achieves a differential nonlinearity (DNL) and an integral nonlinearity (INL) of <inline-formula> <tex-math notation=""LaTeX"">$\pm 0.04~^{\circ }$ </tex-math></inline-formula>C and <inline-formula> <tex-math notation=""LaTeX"">$\pm 0.12~^{\circ }$ </tex-math></inline-formula>C, respectively. Furthermore, it achieves a wide temperature sensing range from <inline-formula> <tex-math notation=""LaTeX"">$- 20~^{\circ }$ </tex-math></inline-formula>C to <inline-formula> <tex-math notation=""LaTeX"">$107~^{\circ }$ </tex-math></inline-formula>C while considering ±15% chip-to-chip and ±3% cell-to-cell sensor variations.","dblp","Computer Science","0","https://doi.org/10.1109/TVLSI.2025.3622252","10.1109/TVLSI.2025.3622252","2026-02-01","2026-04-08","",""
"doi:10.1109/TVLSI.2025.3621694","","ef05ed6c9017babc2d5699df11f892d274af51b9","A 40-nm Embedded Flash With Highly Reliable Bitline Transmission and Low-Voltage Current Sense Amplifier","Tao Xu","2026","IEEE-TVLSI","A novel read circuit for embedded flash memory operating from a single 1.1-V supply is presented, featuring a negative-voltage dual-MOS transmission structure for bitline (BL) transfer and a low-voltage, high-reliability current–voltage sense amplifier (SA). This approach effectively addresses the issue of reduced read window size due to decreased BL voltage as supply voltage decreases. The proposed circuit is integrated into a 4.5-Mbit embedded flash memory test chip, fabricated using a 40-nm CMOS process. Experimental results show a read access time of 18.5 ns at a supply voltage of 0.9 V, with a read throughput of 7.78 Gbit/s and a bit density of 3.414 Mbit/mm2.","dblp","Computer Science","0","https://doi.org/10.1109/TVLSI.2025.3621694","10.1109/TVLSI.2025.3621694","2026-02-01","2026-04-08","",""
"doi:10.1109/TVLSI.2025.3625215","","a11e59e83a8c940616bbafbc541152c8663debfb","12-bit SAR ADC Employing a 9-bit CDAC in Vanilla CMOS 40-nm Technology","Amr W. Hassan","2026","IEEE-TVLSI","This article presents a 130-MS/s successive approximation register (SAR) analog-to-digital converter (ADC) architecture that uses a 9-bit capacitive DAC (CDAC) and innovative techniques that include passive amplification circuitry without engaging active components and the strategic connection of a unity capacitor to multiple reference voltages, to achieve a total of 12 bits. The proposed passive amplification technique saves 27% of the ADC area through reducing the CDAC size by 50% compared to a conventional 10-bit CDAC +2-bit voltage reference design for a 12-bit resolution. Compared with the conventional 12-bit C-DAC SAR, the proposed SAR-ADC saves over 75% of the active area. The measurement results reveal that the core of the proposed ADC architecture dissipates 3 mW. Fabricated in a mainstream 40-nm CMOS technology, the proposed ADC attains SNDR/SFDR ratios as high as 63.5/72.13 dB for a 10-MHz sinusoidal test tone; the SAR active area is about $0.00966~\text {mm}^{2}$ . Furthermore, this architecture yields favorable results regarding the Walden figure-of-merit of approximately 26.5 fJ/conv-step while maintaining Schreier FOM around 165.37 dB when measured at 10 MHz.","dblp","Computer Science","0","https://doi.org/10.1109/TVLSI.2025.3625215","10.1109/TVLSI.2025.3625215","2026-02-01","2026-04-08","",""
"doi:10.1109/TVLSI.2025.3625787","","5796e4f7a2933b52e2b7463d64524cca9c6561bd","60-Gb/s 1:4 Demultiplexer in 22-nm FD-SOI Technology Using TSPC Logic: A Circuit-to-System-Level Analysis and Design","Babak Sadiye","2026","IEEE-TVLSI","This article presents a 1:4 single-ended binary-tree demultiplexer. The entire design, including true single-phase clock (TSPC) flip-flops, latches, and frequency divider, is composed of gated inverter blocks. The causes of voltage dip formation in flip-flops are analyzed and effectively eliminated. The setup time, hold time, and delay criteria of individual components are investigated and optimized over a variety of back-gate bias schemes as well as different supply voltages. Finally, a timing constraint is derived for the top-level demultiplexer architecture. The demultiplexer operates across a wide range of inputs from 1.6 to 60 Gb/s providing a selection of potential supply voltages ranging from 0.6 to 1.2 V. The chip’s power dissipation is mainly due to the dynamic power of the switching inverters and is self-adjustable on the basis of the input data rate. The circuit is designed and fabricated in 22-nm fully depleted silicon-on-insulator (FD-SOI) CMOS technology with a chip area of 0.033 mm2.","dblp","Computer Science","0","https://doi.org/10.1109/TVLSI.2025.3625787","10.1109/TVLSI.2025.3625787","2026-02-01","2026-04-08","",""
"doi:10.1109/TVLSI.2025.3629557","","8bfe809744cbecb81669c3679e0774ba7bcf4c40","A Sampling-Settling-Merged Technique Enabling an ELDC-Free Continuous-Time Delta-Sigma Modulator With a Pole-Optimized NS-SAR Quantizer","Weihao Wang","2026","IEEE-TVLSI","This article presents a hybrid third-order continuous-time delta–sigma modulator (CT DSM) with a 5-MHz bandwidth, tailored for low-power applications. The design is facilitated by a passive pole-optimized second-order noise-shaping successive-approximation register (NS SAR) quantizer. A sampling–settling-merged technique is proposed with the assistance of a canceling conductance output stage, leading to significantly suppressed sampling errors and an extension of the available time budget for the NS SAR quantizer. The technique merges the NS SAR quantizer’s sampling phase with the settling phase of the integration of the continuous-time (CT) feedback digital-to-analog converter (DAC), achieving a power-efficient integration and sampling process. This approach relaxes the operational transconductance amplifier (OTA) requirements in the CT loop and enhances both the resolution and power efficiency of the DSM. The NS SAR quantizer, featuring left-half-circle (LHC) poles, enables complex conjugate poles optimization for the noise transfer function, enabling an excess loop delay compensation (ELDC)-free design. Fabricated in a 65-nm CMOS process, the prototype analog-to-digital converter achieves a 71.6-dB signal-to-noise and distortion ratio within the 5-MHz bandwidth at an oversampling ratio of 20. The design consumes 0.6 mW of power, achieving a Schreier figure of merit (FoM) of 170.8 dB and Walden FoM of 19.3 fJ/conv., demonstrating state-of-the-art energy efficiency.","dblp","Computer Science","0","https://doi.org/10.1109/TVLSI.2025.3629557","10.1109/TVLSI.2025.3629557","2026-02-01","2026-04-08","",""
"doi:10.1109/TVLSI.2025.3647670","","45e97825c5d77aac5d73a7511bff0f963591d215","A Fully Integrated Storage-Free Energy Harvesting System With Voltage Self-Regulation and Dual-Channel Power Extraction","Jian Guan","2026","IEEE-TVLSI","With the growing demand for self-powered operation in Internet of Things (IoT) nodes and microsensors, photovoltaic energy harvesting (EH) systems have become a key research focus. Although triple-well on-chip solar cells improve photovoltaic conversion efficiency, their multiport output characteristics pose design challenges: conventional parallel output schemes cannot address the mismatch in maximum power point (MPP) voltages among ports, thereby limiting energy extraction efficiency. Moreover, fully integrated EH systems lack external storage, and input–output coupling renders traditional voltage regulation unsuitable. To address these challenges, this article presents a fully integrated dual-channel EH system that employs a dual-port, independently boosted parallel architecture combined with a frequency-driven lightweight self-regulation mechanism, eliminating the need for conventional regulators. Measurement results show that the system achieves a stable output voltage of approximately 1.22 V, a peak end-to-end efficiency of 63.97%, and a 6.31% improvement in maximum output power, while also exhibiting reliable start-up and ripple suppression, providing valuable guidance for the design of efficient power extraction and self-regulation in on-chip photovoltaic EH systems.","dblp","Computer Science","0","https://doi.org/10.1109/TVLSI.2025.3647670","10.1109/TVLSI.2025.3647670","2026-02-01","2026-04-08","",""
"doi:10.1109/TVLSI.2025.3621624","","cbfc3329b4a2eeae8bae86c26adb753ca7adc277","AHCO-YOLO: An Algorithm-Hardware Co-Optimization Framework for Energy-Efficient and Real-Time Object Detection on Edge Devices","Jaemyung Kim","2026","IEEE-TVLSI","Real-time object detection on edge devices operates under tight computational, memory, and power budgets. Prior work typically treats model compression and hardware acceleration independently, yielding suboptimal trade-offs among accuracy, latency, and energy. We present AHCO-YOLO, an algorithm–hardware co-optimization framework (AHCO) that unifies model design, quantization, design space exploration (DSE), and hardware implementation. This approach overcomes the limitations of isolated methods and delivers synergistic gains. We introduce a hardware-friendly, lightweight You Only Look Once (YOLO) model with batch normalization (BN)-preserving quantization method that reduces the model size while maintaining accuracy at low precision. In addition, we propose a layer-specific resource–latency-aware DSE (LSRLA-DSE) method that selects the optimal dataflow based on layer-wise features and searches hardware design parameters under latency and resource constraints. Furthermore, we propose a FIFO-based streaming architecture with layer-wise dynamic dataflows that maintains high processing element (PE) utilization while minimizing off-chip traffic. Moreover, we introduce a semantic partition and regrouping strategy (SPRG) that improves resource efficiency and throughput. Implemented on a Xilinx ZCU104 FPGA, AHCO-YOLO-T achieves 79.8 FPS at 64.8% mAP, delivering 41.9 FPS/W and 80.5 GOPS/W. Across comparisons with existing YOLO accelerators, AHCO-YOLO achieves state-of-the-art efficiency, demonstrating suitability for real-time, energy-efficient object detection on edge platforms.","dblp","Computer Science","0","https://doi.org/10.1109/TVLSI.2025.3621624","10.1109/TVLSI.2025.3621624","2026-02-01","2026-04-08","",""
"doi:10.1109/TVLSI.2025.3625748","","f2f3e89c900d2bee7bb1c781e1d7f676c4288b8c","E2CAP: An Energy-Efficient FPGA Accelerator for Deep Reinforcement Learning With Experience Compression and Configurable PE Array","Fen Ge","2026","IEEE-TVLSI","Deep reinforcement learning (DRL) has emerged as a powerful tool for solving complex decision-making tasks in domains such as robotics, autonomous systems, and gaming. However, accelerating DRL on hardware platforms faces three major challenges: 1) large memory footprint of experience replay data; 2) inefficient weight access due to weight transposition; and 3) computational imbalance across processing elements during deep neural network (DNN) inference and training. To address these issues, we propose E2CAP, an energy-efficient field-programmable gate array (FPGA) accelerator tailored for DRL workloads. E2CAP integrates a compression strategy that significantly reduces the data volume of the experience pool in the DRL model, enabling on-chip deployment of the experience pool. In addition, E2CAP features a configurable array processing core (CAP) based on configurable processing elements (CPEs) that support both intra-PE and inter-PE configurability. This design effectively addresses the issues of weight trans position and computational imbalance, improving computational efficiency and hardware resources utilization. We implement full on-chip DRL inference and training using the DQN algorithm on E2CAP. Experimental results demonstrate a 98.19% compression ratio for experience replay data. Compared to the state-of-the-art CPU and GPU, E2CAP achieves $33.01\times $ and $17.72\times $ higher energy efficiency, respectively, while outperforming existing FPGA-based DRL accelerators in multidimensional performance.","dblp","Computer Science","0","https://doi.org/10.1109/TVLSI.2025.3625748","10.1109/TVLSI.2025.3625748","2026-02-01","2026-04-08","",""
"doi:10.1109/TVLSI.2025.3629750","","b42198db2552b4b763644df33afa2a8a60f1afe8","SConvNSys: Accelerating Spiking Convolutional Neural Networks With a Reconfigurable Neuromorphic Architecture for Diverse Applications","Wujian Ye","2026","IEEE-TVLSI","In recent years, spiking neural networks (SNNs) have progressively closed the performance gap with convolutional neural networks (CNNs), which are renowned for their success in complex artificial intelligence tasks. However, most existing SNN accelerators suffer from limited flexibility, lacking support for diverse convolutional topologies and struggling to deploy complex SNN models. To address these challenges, this article proposes a reconfigurable neuromorphic architecture, SConvNSys, tailored for accelerating spiking CNNs (SCNNs) across a wide range of applications. A fast, sparse detection technique, coupled with a dedicated sparse response unit, is introduced to effectively exploit the spatio-temporal sparsity inherent in spike-based computation. On this basis, a reconfigurable spiking convolution dataflow is designed to optimize computation across various SCNN structures. The proposed architecture supports multiple convolution types, including standard, transposed, dilated, and residual convolutions. Implemented on a field-programmable gate array (FPGA), SConvNSys achieves competitive results: for image classification, it attains recognition accuracies of 91.48% on CIFAR-10 and 68.54% on CIFAR-100, with a power consumption of just 1.8 W and a processing rate of 73 frames/s. In image segmentation tasks, it reaches 99.00% segmentation accuracy at 153 frames/s. For object detection, the proposed detection model achieves a mean intersection over union (MIoU) of 74.20%, with 0.11 giga operations (GOP) of convolutional computation, resulting in a throughput of 27.4 giga operations per second (GOPS) and an energy efficiency of 15.23 GOPS/W.","dblp","Computer Science","1","https://doi.org/10.1109/TVLSI.2025.3629750","10.1109/TVLSI.2025.3629750","2026-02-01","2026-04-08","",""
"doi:10.1109/TVLSI.2025.3630337","","9c5808df03292ab4283c8b2a1dd9f23e2d1b0ea9","Weightless Neural Networks on Flexible Substrates: A Novel Approach to Wearable Machine Learning","Igor D. S. Miranda","2026","IEEE-TVLSI","In this article, we present a novel approach that seamlessly integrates machine learning (ML) algorithms into wearable technology through the use of weightless neural networks (WNNs) and flexible integrated circuits (FlexICs). Our methodology employs combinational intelligent networks (COIN) for edge inference on resource-constrained devices, highlighting the advantages of WNNs in terms of power efficiency and minimal hardware requirements. We propose an automated design flow for implementing COIN as FlexICs aimed at developing scalable, cost-effective, and environmentally sustainable wearable monitoring solutions. As a proof-of-concept demonstrator, an arrhythmia detection FlexIC was fabricated using COIN to meet the stringent requirements of medium-complexity wearable applications, offering a promising path toward personalized and accessible healthcare solutions.","dblp","Computer Science","0","https://doi.org/10.1109/TVLSI.2025.3630337","10.1109/TVLSI.2025.3630337","2026-02-01","2026-04-08","",""
"doi:10.1109/TVLSI.2025.3628634","","1055052a26a0fa66196836a38655653d35968f81","A High-Order High-Throughput Multibank FFT Engine With Optimized Floating-Point Radix-2 Butterfly Units","Ibrahim Tastan","2026","IEEE-TVLSI","Many communications systems like 3G and 4G-LTE require the fast Fourier transform (FFT) up to 4096 points, but applications such as synthetic aperture radar, frequency-modulated continuous-wave (FMCW) radar, and spectrum analyzers require much higher-order FFTs. This article addresses this demand by presenting an efficient architecture for high-throughput computation of large-scale FFTs, supporting sizes up to 32K points while also covering 4K, 8K, and 16K-point FFTs with coarse-grained flexibility. The design features a memory-based structure with 64 banks fully utilized by 32 radix-2 butterfly units (BFUs) to achieve a very high throughput. BFUs are built with a novel $m^{2}\text {acc}^{2}$ unit that optimizes floating-point operations to gain more precision—that is, a better signal to quantization noise ratio (SQNR)—with approximately 20% less resources. An optimized addressing scheme, which dramatically reduces the amount of address signals to two 9-bit signals shared by all 64 memory banks without requiring any permutations or dynamic access methodologies, is complemented by a simple data controller to efficiently maximize throughput per clock cycle. A read-only memory (ROM)-based twiddle-factor generator supports the high data-rate demands of all BFUs without introducing latency. The architecture is validated on an FPGA and implemented as an ASIC in Global Foundries (GF)’ 22-nm FDSOI technology, achieving a throughput of 4.26 GS/s at 1 GHz for the 32K-point FFT. Compared to existing solutions, this design delivers a notable 45% improvement in normalized throughput per area, demonstrating its effectiveness for high-performance large-size FFT calculations.","dblp","Computer Science","0","https://doi.org/10.1109/TVLSI.2025.3628634","10.1109/TVLSI.2025.3628634","2026-02-01","2026-04-08","",""
"doi:10.1109/TVLSI.2025.3629742","","44569c73842c9ee03886362b02cce8f5573c2a78","Weighted Coding Scheme for Noise Reduction in Silicon Interposer of HBM","Sangouk Jeon","2026","IEEE-TVLSI","High-bandwidth memory (HBM) has enabled substantial advancements in bandwidth-intensive applications, including large-scale artificial intelligence models. HBM is typically integrated with other systems-on-chip (SoCs) through a silicon interposer, and the primary bottleneck in aggressively scaling the bandwidth in next-generation HBM systems stems from significant crosstalk caused by closely spaced, high-density parallel interconnects in the interposer. While crosstalk avoidance code (CAC) has emerged as a promising solution, prior CAC schemes suffer from low bit efficiency and considerable hardware overhead. This article proposes an efficient CAC scheme, WITCH, which employs a novel weighted coding strategy. Unlike prior approaches that consider all channels identically, WITCH assigns different weights to channels based on their relative positions in the array, enabling more bit-efficient crosstalk suppression. We also present WITCH with additional shielding (WITCH-AS), an extension of WITCH that incorporates additional shielding to further reduce crosstalk levels. Our coding schemes achieve high bit efficiency, up to 17.3% higher than state-of-the-art techniques while providing an identical level of crosstalk reduction. Simulation results using an industry-proven channel model demonstrate that WITCH and WITCH-AS improve eye height by 10.1%–49.4% and 17.1%–51.1%, respectively. Furthermore, we propose an area- and energy-efficient hardware implementation that can be integrated into real-world HBM systems. The design reduces area and critical path delay by 31.0% and 28.2%, respectively, compared with conventional designs. Finally, we propose a compatible simultaneous switching output (SSO) noise mitigation technique that can be seamlessly integrated into WITCH to further enhance signal integrity under high-speed, high-density operating conditions.","dblp","Computer Science","0","https://doi.org/10.1109/TVLSI.2025.3629742","10.1109/TVLSI.2025.3629742","2026-02-01","2026-04-08","",""
"doi:10.1109/TVLSI.2025.3624400","2506.14364","d9b2464c56ecc8462f2fc85194c159a06ab7b628","Tensor Manipulation Unit (TMU): Reconfigurable, Near-Memory Tensor Manipulation for High-Throughput AI SoC","Weiyu Zhou","2026","IEEE-TVLSI","While recent advances in AI SoC design have focused heavily on accelerating tensor computation, the equally critical task of tensor manipulation (TM)—centered on high-volume data movement with minimal computation—remains underexplored. This work addresses that gap by introducing the TM unit (TMU): a reconfigurable, near-memory hardware block designed to execute data-movement-intensive (DMI) operators efficiently. The TMU manipulates long datastreams in a memory-to-memory fashion using a RISC-inspired execution model and a unified addressing abstraction, enabling support for both a wide range of coarse- and fine-grained tensor transformations. The proposed architecture integrates the TMU alongside a TPU within a high-throughput AI system-on-chip (SoC), leveraging double buffering and output forwarding to improve pipeline utilization. The TMU, synthesized under the SMIC 40-nm standard cell library, occupies only <inline-formula> <tex-math notation=""LaTeX"">$0.019~\mathrm {\text {mm}^{2}}$ </tex-math></inline-formula> while supporting over 10 representative DMI operators. Benchmarking shows that the TMU alone achieves up to <inline-formula> <tex-math notation=""LaTeX"">$82.42\times $ </tex-math></inline-formula> and <inline-formula> <tex-math notation=""LaTeX"">$11.06\times $ </tex-math></inline-formula> operator-level latency reduction over ARM A72 and NVIDIA Jetson TX2, respectively. When integrated with the in-house TPU, the complete system achieves a 22.89% reduction in end-to-end inference latency, demonstrating the effectiveness in reducing inference latency and the scalability of the TMU architecture across diverse tensor operators.","dblp","Computer Science","2","https://doi.org/10.1109/TVLSI.2025.3624400","10.1109/TVLSI.2025.3624400","2025-06-17","2026-04-08","",""
