"paper_id","arxiv_id","s2_paper_id","title","authors","year","venue","abstract","source","categories","citation_count","url","doi","published_date","crawled_date","keep","notes"
"doi:10.1109/TPDS.2021.3128945","2111.10027","f3628c556c9dbfc475f5d5eb3102bd0776e1bb59","E3NE: An End-to-End Framework for Accelerating Spiking Neural Networks With Emerging Neural Encoding on FPGAs","Daniel Gerlinghoff","2022","IEEE-TPDS","Compiler frameworks are crucial for the widespread use of FPGA-based deep learning accelerators. They allow researchers and developers, who are not familiar with hardware engineering, to harness the performance attained by domain-specific logic. There exists a variety of frameworks for conventional artificial neural networks. However, not much research effort has been put into the creation of frameworks optimized for spiking neural networks (SNNs). This new generation of neural networks becomes increasingly interesting for the deployment of AI on edge devices, which have tight power and resource constraints. Our end-to-end framework E3NE automates the generation of efficient SNN inference logic for FPGAs. Based on a PyTorch model and user parameters, it applies various optimizations and assesses trade-offs inherent to spike-based accelerators. Multiple levels of parallelism and the use of an emerging neural encoding scheme result in an efficiency superior to previous SNN hardware implementations. For a similar model, E3NE uses less than 50\% of hardware resources and 20\% less power, while reducing the latency by an order of magnitude. Furthermore, scalability and generality allowed the deployment of the large-scale SNN models AlexNet and VGG.","dblp","Computer Science","36","https://doi.org/10.1109/TPDS.2021.3128945","10.1109/TPDS.2021.3128945","2021-11-19","2026-04-08","",""
"doi:10.1109/TPDS.2021.3138862","","d5d75546d79d6ded143bfb3c32425779297b5644","NeoFlow: A Flexible Framework for Enabling Efficient Compilation for High Performance DNN Training","Size Zheng","2022","IEEE-TPDS","Deep neural networks (DNNs) are increasingly deployed in various image recognition and natural language processing applications. The continuous demand for accuracy and high performance has led to innovations in DNN design and a proliferation of new operators. However, existing DNN training frameworks such as PyTorch and TensorFlow only support a limited range of operators and rely on hand-optimized libraries to provide efficient implementations for these operators. To evaluate novel neural networks with new operators, the programmers have to either replace the holistic new operators with existing operators or provide low-level implementations manually. Therefore, a critical requirement for DNN training frameworks is to provide high-performance implementations for the neural networks containing new operators automatically in the absence of efficient library support. In this paper, we introduce NeoFlow, which is a flexible framework for enabling efficient compilation for high-performance DNN training. NeoFlow allows the programmers to directly write customized expressions as new operators to be mapped to graph representation and low-level implementations automatically, providing both high programming productivity and high performance. First, NeoFlow provides expression-based automatic differentiation to support customized model definitions with new operators. Then, NeoFlow proposes an efficient compilation system that partitions the neural network graph into subgraphs, explores optimized schedules, and generates high-performance libraries for subgraphs automatically. Finally, NeoFlow develops an efficient runtime system to combine the compilation and training as a whole by overlapping their execution. In the experiments, we examine the numerical accuracy and performance of NeoFlow. The results show that NeoFlow can achieve similar or even better performance at the operator and whole graph level for DNNs compared to deep learning frameworks. Especially, for novel networks training, the geometric mean speedups of NeoFlow to PyTorch, TensorFlow, and CuDNN are 3.16X, 2.43X, and 1.92X, respectively.","dblp","Computer Science","17","https://doi.org/10.1109/TPDS.2021.3138862","10.1109/TPDS.2021.3138862","","2026-04-08","",""
"doi:10.1109/TPDS.2021.3137837","","bdf338a802ba4e330b94a1f64b43b95a18be7f6a","Heterogeneous Multi-Agent System for Brain-Computer Interaction in Routing and Forwarding With Memristive Neuron Networks","Yuxuan Zhou","2022","IEEE-TPDS","In this research, we aimed to design a architecture of brain-computer interaction (BCI) in routing nodes routing and forwarding mechanism by exploring the memristive neuron networks (MNN) among heterogeneous multi-agent system (HMAS). In recent years, field programmable gate array (FPGA) has become a popular choice to construct a heterogeneous network system for routing and forwarding mechanism due to its ability to describe a hardware information system in a software defined method. However, most BCI approaches focus only on capturing the dynamics of EEG signal by simply receiving all wave of individual or making up them as a single system. Such methods neglect the existing problems of traditional BCI mode. To this moment, we propose a novel Heterogeneous Multi-Agent System (HMAS) to model the MNN among a group of logic units for realizing the multi-agent system in BCI approach. Specifically, we first feed each agent's non-linear feature into a routing node to model the routing and forwarding functions. Subsequently, at one time step, the outputs of all testing routers are fed into a heterogeneous network space, which mainly consists of multiple sub-agents, a new forward port, and some memory memristive neuron which build a non-linear network system to set up a multiple agent in MNN environment. In the FPGA logic unit, each sub-memory unit stores individual motion information, while these programmable units selectively integrates and stores a huge number of motion information between multiple interacting persons from multiple sub-memory units via the forwarding ports and MNN storage unit, respectively. According to the extensive experimental results on several experimental datasets validate the effectiveness of the proposed HMAS-BCI by comparing against a optimization method of the experimental scene.","dblp","Computer Science","6","https://doi.org/10.1109/TPDS.2021.3137837","10.1109/TPDS.2021.3137837","","2026-04-08","",""
"doi:10.1109/TPDS.2022.3149787","2009.13108","7343a3d36b79fedb0d9e5e5eaf80d6f508107c6f","NITI: Training Integer Neural Networks Using Integer-Only Arithmetic","Maolin Wang","2022","IEEE-TPDS","Low bitwidth integer arithmetic has been widely adopted in hardware implementations of deep neural network inference applications. However, despite the promised energy-efficiency improvements demanding edge applications, the use of low bitwidth integer arithmetic for neural network training remains limited. Unlike inference, training demands high dynamic range and numerical accuracy for high quality results, making the use of low-bitwidth integer arithmetic particularly challenging. To address this challenge, we present a novel neural network training framework called NITI that exclusively utilizes low bitwidth integer arithmetic. NITI stores all parameters and accumulates intermediate values as 8-bit integers while using no more than 5 bits for gradients. To provide the necessary dynamic range during the training process, a per-layer block scaling exponentiation scheme is utilized. By deeply integrating with the rounding procedures and integer entropy loss calculation, the proposed scaling scheme incurs only minimal overhead in terms of storage and additional computation. Furthermore, a hardware-efficient pseudo-stochastic rounding scheme that eliminates the need for external random number generation is proposed to facilitate conversion from wider intermediate arithmetic results to lower precision for storage. Since NITI operates only with standard 8-bit integer arithmetic and storage, it is possible to accelerate it using existing low bitwidth operators originally developed for inference in commodity accelerators. To demonstrate this, an open-source software implementation of end-to-end training, using native 8-bit integer operations in modern GPUs is presented. In addition, experiments have been conducted on an FPGA-based training accelerator to evaluate the hardware advantage of NITI. When compared with an equivalent training setup implemented with floating point storage and arithmetic, NITI has no accuracy degradation on the MNIST and CIFAR10 datasets. On ImageNet, NITI achieves similar accuracy as state-of-the-art integer training frameworks without relying on full-precision floating-point first and last layers.","dblp","Computer Science","51","https://doi.org/10.1109/TPDS.2022.3149787","10.1109/TPDS.2022.3149787","2020-09-28","2026-04-08","",""
"doi:10.1109/TPDS.2022.3148985","","6870975f7f4db00ad1e2fa041545b67c6e8ef73c","Decentralized Application Placement in Fog Computing","Zoltán Ádám Mann","2022","IEEE-TPDS","In recent years, cloud computing concepts have been extended towards the network edge, leading to paradigms like fog and edge computing. As a result, applications can be placed on a variety of resources, including fog nodes and cloud data centers. Application placement has significant impact on important metrics like latency. Finding an optimal application placement is computationally challenging, particularly because of the potentially huge number of infrastructure nodes and application components. To overcome the limited scalability of application placement algorithms, optimization can be decentralized, i.e., performed separately for different parts of the infrastructure. The infrastructure can be split into fog colonies, where a fog colony consists of the computational resources in a given geographical region. Application placement can then be performed for the individual fog colonies, thus mitigating the scalability problem. However, independent optimization of application placement in different fog colonies may lead to missed synergies and thus to sub-optimal overall results. Hence, some kind of coordination between fog colonies may be beneficial. In this article, we analyze the effects of decentralization and coordination on the optimization results. In particular, we compare empirically four different approaches: (i) centralized decision-making, where decisions are made in one go for the entire infrastructure, (ii) independent fog colonies, where optimization is carried out in each fog colony independently from each other, (iii) fog colonies with communication, where excess application components in one fog colony can be sent to a neighboring fog colony, and (iv) fog colonies with overlaps, where shared resources may be dynamically distributed between neighboring fog colonies. Our experiments show that, for large problem instances, decentralization combined with coordination leads to the best results.","dblp","Computer Science","36","https://doi.org/10.1109/TPDS.2022.3148985","10.1109/TPDS.2022.3148985","2022-12-01","2026-04-08","",""
"doi:10.1109/TPDS.2022.3151499","","099c1385ee58d4653a3f63eff0a6683b2da9a708","DHash: Dynamic Hash Tables With Non-Blocking Regular Operations","Junchang Wang","2022","IEEE-TPDS","Once started, existing hash tables cannot change their pre-defined hash functions, even if the incoming data cannot be evenly distributed to the hash table buckets. In this paper, we present DHash, a type of hash table for shared memory systems, that can change its hash function and rebuild the hash table on the fly, without noticeably degrading its service. The major technical novelty of DHash stems from an efficient distributing mechanism that can atomically distribute every node when rebuilding, without locking the corresponding hash table buckets. This not only enables non-blocking lookup, insert, and delete operations, but more importantly, makes DHash independent of the implementation of hash table buckets, such that DHash allows programmers to select the set algorithms that meet their requirements best from a variety of existing lock-free and wait-free set algorithms. Evaluations show that DHash can efficiently change its hash function on the fly. Moreover, when rebuilding, DHash consistently outperforms the state-of-the-art hash tables in terms of throughput and response time of concurrent operations, at different concurrency levels, and with different operation mixes and average load factors.","dblp","Computer Science","6","https://doi.org/10.1109/TPDS.2022.3151499","10.1109/TPDS.2022.3151499","2022-12-01","2026-04-08","",""
"doi:10.1109/TPDS.2022.3150579","2203.01214","ebc47a0578c06a0799225b12c341ef253e920ece","Towards Efficient and Stable K-Asynchronous Federated Learning With Unbounded Stale Gradients on Non-IID Data","Zihao Zhou","2022","IEEE-TPDS","Federated learning (FL) is an emerging privacy-preserving paradigm that enables multiple participants collaboratively to train a global model without uploading raw data. Considering heterogeneous computing and communication capabilities of different participants, asynchronous FL can avoid the stragglers effect in synchronous FL and adapts to scenarios with vast participants. Both staleness and non-IID data in asynchronous FL would reduce the model utility. However, there exists an inherent contradiction between the solutions to the two problems. That is, mitigating the staleness requires selecting less but consistent gradients while coping with non-IID data demands more comprehensive gradients. To address the dilemma, we propose a two-stage weighted K asynchronous FL with adaptive learning rate (WKAFL). By selecting consistent gradients and adjusting learning rate adaptively, WKAFL utilizes stale gradients and mitigates the impact of non-IID data, which can achieve multifaceted enhancement in training speed, prediction accuracy and training stability. We also present the convergence results for WKAFL under the assumption of unbounded staleness to understand the impact of staleness and non-IID data. Experiments implemented on two benchmark FL datasets and two synthetic FL datasets show that WKAFL has the best overall performance compared with existing algorithms.","dblp","Computer Science","43","https://doi.org/10.1109/TPDS.2022.3150579","10.1109/TPDS.2022.3150579","2022-03-02","2026-04-08","",""
"doi:10.1109/TPDS.2022.3151853","","f5fe1c12e235aaa807818fa7b0ed362d12487722","A Bayesian Approach To Distributed Anomaly Detection In Edge AI Networks","Murugaraj Odiathevar","2022","IEEE-TPDS","The challenge of anomaly detection is to obtain an accurate understanding of expected behaviour which is intensified when the data are distributed heterogeneously. Transmitting raw data to a central site incurs high communication overhead and raises privacy issues. The concept of Edge AI allows computation to be performed at the edge site allowing for quick decision making in mission critical scenarios such as self-driving cars. A model is learnt locally and its parameters are transmitted and aggregated. However, existing methods of aggregation do not account for variance and heterogeneous distribution of data. They also do not consider edge constraints such as limited computational, memory and communication capabilities of edge devices. In this work, a fully Bayesian approach is employed by means of a Bayesian Random Vector Functional Link AutoEncoder being incorporated with Expectation Propagation for distributed training. Our anomaly detection system operates without any transmission of raw data, is robust under inhomogeneous network densities and under uneven and biased data distributions. It allows for asynchronous updates to converge in a few iterations and is a relatively simple neural network addressing edge constraints without compromising on performance as compared to existing more complex models.","dblp","Computer Science","18","https://doi.org/10.1109/TPDS.2022.3151853","10.1109/TPDS.2022.3151853","2022-12-01","2026-04-08","",""
"doi:10.1109/TPDS.2022.3151194","2105.01976","f930fe86da74a48556b6c8b6af23a1a595747a3f","GraphOpt: Constrained-Optimization-Based Parallelization of Irregular Graphs","Nimish Shah","2022","IEEE-TPDS","Sparse, irregular graphs show up in various applications like linear algebra, machine learning, engineering simulations, robotic control, etc. These graphs have a high degree of parallelism, but their execution on parallel threads of modern platforms remains challenging due to the irregular data dependencies. The execution performance can be improved by efficiently partitioning the graphs such that the communication and thread synchronization overheads are minimized without hurting the utilization of the threads. To achieve this, this article proposes GraphOpt, a tool that models the graph parallelization as a constrained optimization problem and uses the open Google OR-Tools solver to find good partitions. Several scalability techniques are developed to handle large real-world graphs with millions of nodes and edges. Extensive experiments are performed on the graphs of sparse matrix triangular solves (linear algebra) and sum-product networks (machine learning), respectively, showing a mean speedup of 2.0× and 1.8× over previous state-of-the-art libraries, demonstrating the effectiveness of the constrained-optimization-based graph parallelization.","dblp","Computer Science","7","https://doi.org/10.1109/TPDS.2022.3151194","10.1109/TPDS.2022.3151194","2021-05-05","2026-04-08","",""
"doi:10.1109/TPDS.2022.3153061","","d9f02613086aa13534e91f1ba44113b49e7f1568","Bandwidth-Aware Scheduling Repair Techniques in Erasure-Coded Clusters: Design and Analysis","Hai Zhou","2022","IEEE-TPDS","Erasure codes offer a storage-efficient redundancy mechanism for maintaining data availability guarantees in storage clusters, yet also incur high network traffic consumption and recovery time in failure repair. Extensive research has been carried out to reduce the recovery time. However, previous works either target specific erasure code constructions which are not commonly used in todays distributed storage clusters or neglect the bandwidth heterogeneous property in real network environments. Since erasure-coded clusters are typically composed of multi-node with heterogeneous bandwidth and accessed in parallel, the whole recovery time is mainly restricted by the low-bandwidth links. In this paper, we propose SMFRepair, a single-node multi-level forwarding repair technique that is designed to improve the performance in heterogeneous networks based on Reed-Solomon codes for general fault tolerance. SMFRepair carefully selects the helper nodes and uses idle nodes to bypass low-bandwidth links. Idle nodes have sufficient and unused network bandwidth. It also pipelines the repair links that are optimized by idle nodes. Furthermore, a multi-node scheduling repair technique, called MSRepair, is proposed. MSRepair carefully schedules the multi-node repair link to saturate the most unoccupied bandwidth and transfers data from as large-bandwidth links as possible, with the primary objective of minimizing the recovery time. Large-scale simulation and Amazon EC2 real experiments show that compared to state-of-the-art repair techniques, SMFRepair can accelerate the single-node recovery by up to 47.69%, and MSRepair can reduce the multi-node recovery time by 33.78%~67.53%.","dblp","Computer Science","19","https://doi.org/10.1109/TPDS.2022.3153061","10.1109/TPDS.2022.3153061","","2026-04-08","",""
"doi:10.1109/TPDS.2022.3151512","","3adea3b0a632509125244d7c0330c9d2768f521c","Coordinating Fast Concurrency Adapting With Autoscaling for SLO-Oriented Web Applications","Jianshu Liu","2022","IEEE-TPDS","Cloud providers tend to support dynamic computing resources reallocation (e.g., Autoscaling) to handle the bursty workload for web applications (e.g., e-commerce) in the cloud environment. Nevertheless, we demonstrate that directly scaling a bottleneck server without quickly adjusting its soft resources (e.g., server threads and database connections) can cause significant response time fluctuations of the target web application. Since soft resources determine the request processing concurrency of each server in the system, simply scaling out/in the bottleneck service can unintentionally change the concurrency level of related services, inducing either under- or over-utilization of the critical hardware resource. In this paper, we propose the Scatter-Concurrency-Throughput (SCT) model, which can rapidly identify the near-optimal soft resource allocation of each server in the system using the measurement of each server’s real-time throughput and concurrency. Furthermore, we implement a Concurrency-aware autoScaling (ConScale) framework that integrates the SCT model to quickly reallocate the soft resources of the key servers in the system to best utilize the new hardware resource capacity after the system scaling. Based on extensive experimental comparisons with two widely used hardware-only scaling mechanisms for web applications: EC2-AutoScaling (VM-based autoscaler) and Kubernetes HPA (container-based autoscaler), we show that ConScale can successfully mitigate the response time fluctuations over the system scaling phase in both VM-based and container-based environments.","dblp","Computer Science","13","https://doi.org/10.1109/TPDS.2022.3151512","10.1109/TPDS.2022.3151512","2022-12-01","2026-04-08","",""
"doi:10.1109/TPDS.2022.3153113","","61b75f7dd85b95f0db9379d864c1ada53e47bd22","A Native Tensor-Vector Multiplication Algorithm for High Performance Computing","Pedro J. Martínez-Ferrer","2022","IEEE-TPDS","Tensor computations are important mathematical operations for applications that rely on multidimensional data. The tensor-vector multiplication (TVM) is the most memory-bound tensor contraction in this class of operations. This paper proposes an open-source TVM algorithm which is much simpler and efficient than previous approaches, making it suitable for integration in the most popular BLAS libraries available today. Our algorithm has been written from scratch and features unit-stride memory accesses, cache awareness, mode obliviousness, full vectorization and multi-threading as well as NUMA awareness for non-hierarchically stored dense tensors. Numerical experiments are carried out on tensors up to order 10 and various compilers and hardware architectures equipped with traditional DDR and high bandwidth memory (HBM). For large tensors the average performance of the TVM ranges between 62% and 76% of the theoretical bandwidth for NUMA systems with DDR memory and remains independent of the contraction mode. On NUMA systems with HBM the TVM exhibits some mode dependency but manages to reach performance figures close to peak values. Finally, the higher-order power method is benchmarked with the proposed TVM kernel and delivers on average between 58% and 69% of the theoretical bandwidth for large tensors.","dblp","Computer Science","2","https://doi.org/10.1109/TPDS.2022.3153113","10.1109/TPDS.2022.3153113","","2026-04-08","",""
"doi:10.1109/TPDS.2022.3149003","","c8ce649dded1e464855c04d8eb7f1ae681ba60be","FenceKV: Enabling Efficient Range Query for Key-Value Separation","Chenlei Tang","2022","IEEE-TPDS","LSM-tree is widely used in key-value stores for big data storage, but it suffers from write amplification brought by frequent compaction operations. An effective solution for this problem is key-value separation, which decouples values from the LSM-tree and stores them in a separate value log. However, existing key-value separation schemes achieve poor range query performance, especially for small key-value pairs, because they focus on mitigating write amplification but neglect access characteristics of the SSD. In this article, we propose FenceKV, which aims to achieve better range query performance while maintaining reasonable update performance for update-intensive workloads. FenceKV employs a new partition method to map values to the storage space based on the key-range to achieve efficient update and range query. Moreover, it adopts a key-range garbage collection policy to mitigate the garbage collection overhead and maintain sequential access for range queries. We compare FenceKV with modern key-value stores with various workloads, and results show that FenceKV can improve the range query performance significantly, while maintaining reasonable update performance compared to the existing designs of key-value separation.","dblp","Computer Science","32","https://doi.org/10.1109/TPDS.2022.3149003","10.1109/TPDS.2022.3149003","2022-12-01","2026-04-08","",""
