"paper_id","arxiv_id","s2_paper_id","title","authors","year","venue","abstract","source","categories","citation_count","url","doi","published_date","crawled_date","keep","notes"
"doi:10.1109/TPDS.2021.3085210","","2dc38d6fdd2e0f6ea644b1b717e9f9df05ac52f5","DeTraS: Delaying Stores for Friendly-Fire Mitigation in Hardware Transactional Memory","J. Rubén Titos Gil","2022","IEEE-TPDS","Commercial Hardware Transactional Memory (HTM) systems are best-effort designs that leverage the coherence substrate to detect conflicts eagerly. Resolving conflicts in favor of the requesting core is the simplest option for ensuring deadlock freedom, yet it is prone to livelocks. In this work, we propose and evaluate DeTraS (Delayed Transactional Stores), an HTM-aware store buffer design aimed at mitigating such livelocks. DeTraS takes advantage of the fact that modern commercial processors implement a large store buffer, and uses it to prevent transactional stores predicted to conflict from performing early in the transaction. By leveraging existing processor structures, we propose a simple design that improves the ability of requester-wins HTM systems to achieve forward progress in spite of high contention while side-stepping the performance penalty of falling back to mutual exclusion. With just over 50 extra bytes, DeTraS captures the advantages of lazy conflict management without the complexity brought into the coherence fabric by commit arbitration schemes nor the relaxation of the single-writer invariant of prior works. Through detailed simulations of a 16-core tiled CMP using gem5, we demonstrate that DeTraS brings reductions in average execution time of 25 percent when compared to an Intel RTM-like design.","dblp","Computer Science","5","https://doi.org/10.1109/TPDS.2021.3085210","10.1109/TPDS.2021.3085210","2022-01-01","2026-04-08","",""
"doi:10.1109/TPDS.2021.3084104","","0d8fed747302bed033c2d92f84ffd5a25180da6b","Error-Compensated Sparsification for Communication-Efficient Decentralized Training in Edge Environment","Haozhao Wang","2022","IEEE-TPDS","Communication has been considered as a major bottleneck in large-scale decentralized training systems since participating nodes iteratively exchange large amounts of intermediate data with their neighbors. Although compression techniques like sparsification can significantly reduce the communication overhead in each iteration, errors caused by compression will be accumulated, resulting in a severely degraded convergence rate. Recently, the error compensation method for sparsification has been proposed in centralized training to tolerate the accumulated compression errors. However, the analog technique and the corresponding theory about its convergence in decentralized training are still unknown. To fill in the gap, we design a method named ECSD-SGD that significantly accelerates decentralized training via error-compensated sparsification. The novelty lies in that we identify the component of the exchanging information in each iteration (i.e., the sparsified model update) and make targeted error compensation over the component. Our thorough theoretical analysis shows that ECSD-SGD supports arbitrary sparsification ratio and achieves the same convergence rate as the non-sparsified decentralized training methods. We also conduct extensive experiments on multiple deep learning models to validate our theoretical findings. Results show that ECSD-SGD outperforms all the start-of-the-art sparsified methods in terms of both the convergence speed and the final generalization accuracy.","dblp","Computer Science","30","https://doi.org/10.1109/TPDS.2021.3084104","10.1109/TPDS.2021.3084104","2022-01-01","2026-04-08","",""
"doi:10.1109/TPDS.2021.3084816","","ebd31e323ad6688f332d69a1d2bf025de5b2e16e","Capelin: Data-Driven Compute Capacity Procurement for Cloud Datacenters Using Portfolios of Scenarios","Georgios Andreadis","2022","IEEE-TPDS","[abstract unavailable]","dblp","Computer Science","4","https://doi.org/10.1109/TPDS.2021.3084816","10.1109/TPDS.2021.3084816","2022-01-01","2026-04-08","",""
"doi:10.1109/TPDS.2021.3086274","","cf4e8f4166ee06eb8baec8dd9ce737304c2a6b18","$run$ runData: Re-Distributing Data via Piggybacking for Geo-Distributed Data Analytics Over Edges","Yibo Jin","2022","IEEE-TPDS","[abstract unavailable]","dblp","Computer Science","1","https://doi.org/10.1109/TPDS.2021.3086274","10.1109/TPDS.2021.3086274","2022-01-01","2026-04-08","",""
"doi:10.1109/TPDS.2021.3087352","","582ca060a72a4d8bb41f5586f17f22651ff32a89","Optimal Repair-Scaling Trade-off in Locally Repairable Codes: Analysis and Evaluation","Si Wu","2022","IEEE-TPDS","How to improve the repair performance of erasure-coded storage is a critical issue for maintaining high reliability of modern large-scale storage systems. Locally repairable codes (LRC) are one popular family of repair-efficient erasure codes that mitigate the repair bandwidth and are deployed in practice. To adapt to the changing demands of access efficiency and fault tolerance, modern storage systems also conduct frequent scaling operations on erasure-coded data. In this article, we analyze the optimal trade-off between the repair and scaling performance of LRC in clustered storage systems. Specifically, we focus on two optimal repair-scaling trade-offs, and design placement strategies that operate along the two optimal repair-scaling trade-off curves subject to the fault tolerance constraints. We prototype and evaluate our placement strategies on a LAN testbed, and show that they outperform the conventional placement schemes in repair and scaling operations.","dblp","Computer Science","7","https://doi.org/10.1109/TPDS.2021.3087352","10.1109/TPDS.2021.3087352","2022-01-01","2026-04-08","",""
"doi:10.1109/TPDS.2021.3084813","","e8139f15ab7354cb451f4c2240741a7d05223a80","Optimizing Depthwise Separable Convolution Operations on GPUs","Gangzhao Lu","2022","IEEE-TPDS","[abstract unavailable]","dblp","Computer Science","64","https://doi.org/10.1109/TPDS.2021.3084813","10.1109/TPDS.2021.3084813","2022-01-01","2026-04-08","",""
"doi:10.1109/TPDS.2021.3079202","","8b67d9535efd60194d37f6c76b67d53bd8015be5","Horus: Interference-Aware and Prediction-Based Scheduling in Deep Learning Systems","Gingfung Yeung","2022","IEEE-TPDS","[abstract unavailable]","dblp","Computer Science","78","https://doi.org/10.1109/TPDS.2021.3079202","10.1109/TPDS.2021.3079202","2022-01-01","2026-04-08","",""
"doi:10.1109/TPDS.2021.3087349","2104.14392","8557d9505a7e1b09dced5b019259004d56cc1b95","COSCO: Container Orchestration Using Co-Simulation and Gradient Based Optimization for Fog Computing Environments","Shreshth Tuli","2022","IEEE-TPDS","Intelligent task placement and management of tasks in large-scale fog platforms is challenging due to the highly volatile nature of modern workload applications and sensitive user requirements of low energy consumption and response time. Container orchestration platforms have emerged to alleviate this problem with prior art either using heuristics to quickly reach scheduling decisions or AI driven methods like reinforcement learning and evolutionary approaches to adapt to dynamic scenarios. The former often fail to quickly adapt in highly dynamic environments, whereas the latter have run-times that are slow enough to negatively impact response time. Therefore, there is a need for scheduling policies that are both reactive to work efficiently in volatile environments and have low scheduling overheads. To achieve this, we propose a Gradient Based Optimization Strategy using Back-propagation of gradients with respect to Input (GOBI). Further, we leverage the accuracy of predictive digital-twin models and simulation capabilities by developing a Coupled Simulation and Container Orchestration Framework (COSCO). Using this, we create a hybrid simulation driven decision approach, GOBI*, to optimize Quality of Service (QoS) parameters. Co-simulation and the back-propagation approaches allow these methods to adapt quickly in volatile environments. Experiments conducted using real-world data on fog applications using the GOBI and GOBI* methods, show a significant improvement in terms of energy consumption, response time, Service Level Objective and scheduling time by up to 15, 40, 4, and 82 percent respectively when compared to the state-of-the-art algorithms.","dblp","Computer Science","101","https://doi.org/10.1109/TPDS.2021.3087349","10.1109/TPDS.2021.3087349","2021-04-29","2026-04-08","",""
"doi:10.1109/TPDS.2021.3090315","","dff8d573b9afc58ce7c030f94ae7f97eeb8a2563","FlitZip: Effective Packet Compression for NoC in MultiProcessor System-on-Chip","Dipika Deb","2022","IEEE-TPDS","[abstract unavailable]","dblp","Computer Science","15","https://doi.org/10.1109/TPDS.2021.3090315","10.1109/TPDS.2021.3090315","2022-01-01","2026-04-08","",""
"doi:10.1109/TPDS.2021.3090759","","05e2ef1ecbea6c72bc466a4400ad9c639160197e","Efficient Distributed Approaches to Core Maintenance on Large Dynamic Graphs","Tongfeng Weng","2022","IEEE-TPDS","[abstract unavailable]","dblp","Computer Science","36","https://doi.org/10.1109/TPDS.2021.3090759","10.1109/TPDS.2021.3090759","2022-01-01","2026-04-08","",""
"doi:10.1109/TPDS.2021.3064966","","5df9e659ee931c4aed4ea5ce6ba514fbe0a51e3d","Elastic Deep Learning in Multi-Tenant GPU Clusters","Yidi Wu","2022","IEEE-TPDS","[abstract unavailable]","dblp","Computer Science","51","https://doi.org/10.1109/TPDS.2021.3064966","10.1109/TPDS.2021.3064966","2022-01-01","2026-04-08","",""
"doi:10.1109/TPDS.2021.3090328","","dabb102ae61a06bfb45f174081dd57f1768f6e6a","A Pattern-Based SpGEMM Library for Multi-Core and Many-Core Architectures","Zhen Xie","2022","IEEE-TPDS","[abstract unavailable]","dblp","Computer Science","22","https://doi.org/10.1109/TPDS.2021.3090328","10.1109/TPDS.2021.3090328","2022-01-01","2026-04-08","",""
"doi:10.1109/TPDS.2021.3090330","","d349a582787ce6cbd93d900695d8bb98727e74d0","Scalable, Confidential and Survivable Software Updates","Federico Magnanini","2022","IEEE-TPDS","[abstract unavailable]","dblp","Computer Science","2","https://doi.org/10.1109/TPDS.2021.3090330","10.1109/TPDS.2021.3090330","2022-01-01","2026-04-08","",""
"doi:10.1109/TPDS.2021.3090331","2012.06706","20181828c54899e2fd6cc083694c8986e31ebbe6","Communication-Efficient Federated Learning With Compensated Overlap-FedAvg","Yuhao Zhou","2022","IEEE-TPDS","While petabytes of data are generated each day by a number of independent computing devices, only a few of them can be finally collected and used for deep learning (DL) due to the apprehension of data security and privacy leakage, thus seriously retarding the extension of DL. In such a circumstance, federated learning (FL) was proposed to perform model training by multiple clients’ combined data without the dataset sharing within the cluster. Nevertheless, federated learning with periodic model averaging (FedAvg) introduced massive communication overhead as the synchronized data in each iteration is about the same size as the model, and thereby leading to a low communication efficiency. Consequently, variant proposals focusing on the communication rounds reduction and data compression were proposed to decrease the communication overhead of FL. In this article, we propose Overlap-FedAvg, an innovative framework that loosed the chain-like constraint of federated learning and paralleled the model training phase with the model communication phase (i.e., uploading local models and downloading the global model), so that the latter phase could be totally covered by the former phase. Compared to vanilla FedAvg, Overlap-FedAvg was further developed with a hierarchical computing strategy, a data compensation mechanism, and a nesterov accelerated gradients (NAG) algorithm. In Particular, Overlap-FedAvg is orthogonal to many other compression methods so that they could be applied together to maximize the utilization of the cluster. Besides, the theoretical analysis is provided to prove the convergence of the proposed framework. Extensive experiments conducting on both image classification and natural language processing tasks with multiple models and datasets also demonstrate that the proposed framework substantially reduced the communication overhead and boosted the federated learning process.","dblp","Computer Science","179","https://doi.org/10.1109/TPDS.2021.3090331","10.1109/TPDS.2021.3090331","2020-12-12","2026-04-08","",""
"doi:10.1109/TPDS.2021.3090587","","7ae159c26a5141459cf99500c63f6d6588286934","Energy-Efficient Cache-Aware Scheduling on Heterogeneous Multicore Systems","Saad Zia Sheikh","2022","IEEE-TPDS","[abstract unavailable]","dblp","Computer Science","10","https://doi.org/10.1109/TPDS.2021.3090587","10.1109/TPDS.2021.3090587","2022-01-01","2026-04-08","",""
"doi:10.1109/TPDS.2021.3090784","2006.07505","84d2ecc3ee035a800c41499e28f923852af46838","PLVER: Joint Stable Allocation and Content Replication for Edge-Assisted Live Video Delivery","Huan Wang","2022","IEEE-TPDS","Live streaming services have gained extreme popularity in recent years. Due to the spiky traffic patterns of live videos, utilizing distributed edge servers to improve viewers’ quality of experience (QoE) has become a common practice nowadays. Nevertheless, the current client-driven content caching mechanism does not support pre-caching from the cloud to the edge, resulting in a considerable amount of cache misses in live video delivery. By jointly considering the features of live videos and edge servers, we propose PLVER, a proactive live video push scheme to address the cache miss problem in live video delivery. Specifically, PLVER first conducts a one-to-multiple stable allocation between edge clusters and user groups to balance the load of live traffic over the edge servers. It then adopts proactive video replication algorithms to speed up video replication among the edge servers. We conduct extensive trace-driven evaluation, covering 0.3 million Twitch viewers and more than 300 Twitch channels. The results demonstrate that with PLVER, edge servers can carry 28 and 82 percent more traffic than the auction-based replication (ABR) method and the caching on requested time (CORT) method, respectively.","dblp","Computer Science","14","https://doi.org/10.1109/TPDS.2021.3090784","10.1109/TPDS.2021.3090784","2020-06-12","2026-04-08","",""
"doi:10.1109/TPDS.2021.3091400","","6718de1a347458ade4c3a9c4a281af0c25d09c79","Taming System Dynamics on Resource Optimization for Data Processing Workflows: A Probabilistic Approach","Amelie Chi Zhou","2022","IEEE-TPDS","[abstract unavailable]","dblp","Computer Science","3","https://doi.org/10.1109/TPDS.2021.3091400","10.1109/TPDS.2021.3091400","2022-01-01","2026-04-08","",""
"doi:10.1109/TPDS.2021.3087360","","fade8c6102a4d4fd70f728d69ce1215e9412f155","EdgeDR: An Online Mechanism Design for Demand Response in Edge Clouds","Shutong Chen","2022","IEEE-TPDS","[abstract unavailable]","dblp","Computer Science","38","https://doi.org/10.1109/TPDS.2021.3087360","10.1109/TPDS.2021.3087360","2021-06-08","2026-04-08","",""
"doi:10.1109/TPDS.2021.3091408","","8bdeb2d792f6cc4bd96c0fee562d6d05a9129953","Optimization of Reactive Force Field Simulation: Refactor, Parallelization, and Vectorization for Interactions","Ping Gao","2022","IEEE-TPDS","[abstract unavailable]","dblp","Computer Science","6","https://doi.org/10.1109/TPDS.2021.3091408","10.1109/TPDS.2021.3091408","2022-02-01","2026-04-08","",""
"doi:10.1109/TPDS.2021.3092266","","8a03d6d5c5787c8a3eb22ea3c13623e2070d4b84","PostMan: Rapidly Mitigating Bursty Traffic via On-Demand Offloading of Packet Processing","Yipei Niu","2022","IEEE-TPDS","[abstract unavailable]","dblp","Computer Science","10","https://doi.org/10.1109/TPDS.2021.3092266","10.1109/TPDS.2021.3092266","2022-02-01","2026-04-08","",""
"doi:10.1109/TPDS.2021.3093231","","3a1a0e52ad77ae4d9b5ee4eedcddeff5ce09ae7c","Repurposing GPU Microarchitectures with Light-Weight Out-Of-Order Execution","Konstantinos Iliakis","2022","IEEE-TPDS","[abstract unavailable]","dblp","Computer Science","5","https://doi.org/10.1109/TPDS.2021.3093231","10.1109/TPDS.2021.3093231","2022-02-01","2026-04-08","",""
"doi:10.1109/TPDS.2021.3093232","","d526e0dc63b8a2cf52dec21d570b0cf0db558de5","Optimizing Network Transfers for Data Analytic Jobs Across Geo-Distributed Datacenters","Li Chen","2022","IEEE-TPDS","[abstract unavailable]","dblp","Computer Science","19","https://doi.org/10.1109/TPDS.2021.3093232","10.1109/TPDS.2021.3093232","2022-02-01","2026-04-08","",""
"doi:10.1109/TPDS.2021.3093243","","545c93ce90ec1313e8f81517e02a1116dcb48148","A Pessimistic Fault Diagnosability of Large-Scale Connected Networks via Extra Connectivity","Limei Lin","2022","IEEE-TPDS","[abstract unavailable]","dblp","Computer Science","27","https://doi.org/10.1109/TPDS.2021.3093243","10.1109/TPDS.2021.3093243","2022-02-01","2026-04-08","",""
"doi:10.1109/TPDS.2021.3093239","","c7dd157a7a8b5b23256f45c9b8440326dbea8ba0","Tensorox: Accelerating GPU Applications via Neural Approximation on Unused Tensor Cores","Nhut-Minh Ho","2022","IEEE-TPDS","[abstract unavailable]","dblp","Computer Science","8","https://doi.org/10.1109/TPDS.2021.3093239","10.1109/TPDS.2021.3093239","2022-02-01","2026-04-08","",""
"doi:10.1109/TPDS.2021.3093240","2009.12457","da6888d5e284cafd9f9f4652d964d3fc5961be6e","A Block-Based Triangle Counting Algorithm on Heterogeneous Environments","Abdurrahman Yasar","2022","IEEE-TPDS","Triangle counting is a fundamental building block in graph algorithms. In this article, we propose a block-based triangle counting algorithm to reduce data movement during both sequential and parallel execution. Our block-based formulation makes the algorithm naturally suitable for heterogeneous architectures. The problem of partitioning the adjacency matrix of a graph is well-studied. Our task decomposition goes one step further: it partitions the set of triangles in the graph. By streaming these small tasks to compute resources, we can solve problems that do not fit on a device. We demonstrate the effectiveness of our approach by providing an implementation on a compute node with multiple sockets, cores and GPUs. The current state-of-the-art in triangle enumeration processes the Friendster graph in 2.1 seconds, not including data copy time between CPU and GPU. Using that metric, our approach is 20 percent faster. When copy times are included, our algorithm takes 3.2 seconds. This is 5.6 times faster than the fastest published CPU-only time.","dblp","Computer Science","17","https://doi.org/10.1109/TPDS.2021.3093240","10.1109/TPDS.2021.3093240","2020-09-01","2026-04-08","",""
"doi:10.1109/TPDS.2021.3093234","","2443bb3198b15a5e0139f89b90d9b26020a011e3","POCLib: A High-Performance Framework for Enabling Near Orthogonal Processing on Compression","Feng Zhang","2022","IEEE-TPDS","[abstract unavailable]","dblp","Computer Science","88","https://doi.org/10.1109/TPDS.2021.3093234","10.1109/TPDS.2021.3093234","2022-02-01","2026-04-08","",""
"doi:10.1109/TPDS.2021.3094126","","d1cc0c01890eb1e5117b901b385812d6624bb3dc","A Practical and Efficient Bidirectional Access Control Scheme for Cloud-Edge Data Sharing","Jie Cui","2022","IEEE-TPDS","[abstract unavailable]","dblp","Computer Science","36","https://doi.org/10.1109/TPDS.2021.3094126","10.1109/TPDS.2021.3094126","2022-02-01","2026-04-08","",""
"doi:10.1109/TPDS.2021.3093148","","283b631023152c55c2b188fee4ec3e4d8fb44e1f","Guest Editorial: Special Section on Parallel and Distributed Computing Techniques for Non-Von Neumann Technologies","Scott Pakin","2022","IEEE-TPDS","[abstract unavailable]","dblp","Computer Science","0","https://doi.org/10.1109/TPDS.2021.3093148","10.1109/TPDS.2021.3093148","2022-02-01","2026-04-08","",""
"doi:10.1109/TPDS.2021.3065365","","0030eb063de448e1e17f933b65dd8e1ff3938d6f","Silent-PIM: Realizing the Processing-in-Memory Computing With Standard Memory Requests","Chang Hyun Kim","2022","IEEE-TPDS","The Deep Neural Network (DNN), Recurrent Neural Network (RNN) applications, rapidly becoming attractive to the market, process a large amount of low-locality data; thus, the memory bandwidth limits their peak performance. Therefore, many data centers actively adapt high-bandwidth memory like HBM2/HBM2E to resolve the problem. However, this approach would not provide a complete solution since it still transfers the data from the memory to the computing unit. Thus, processing-in-memory (PIM), which performs the computation inside memory, has attracted attention. However, most previous methods require the modification or the extension of core pipelines and memory system components like memory controllers, making the practical implementation of PIM very challenging and expensive in development. In this article, we propose a Silent-PIM that performs the PIM computation with standard DRAM memory requests; thus, requiring no hardware modifications and allowing the PIM memory device to perform the computation while servicing non-PIM applications’ memory requests. We can achieve our design goal by preserving the standard memory request behaviors and satisfying the DRAM standard timing requirements. In addition, using standard memory requests makes it possible to use DMA as a PIM’s offloading engine, resulting in processing the PIM memory requests fast and making a core perform other tasks. We compared the performance of three Long Short-Term Memory models (LSTM) kernels on real platforms, such as the Silent-PIM modeled on the FPGA, GPU, and CPU. For <inline-formula><tex-math notation=""LaTeX"">$(p \times 512) \times (512 \times 2048)$</tex-math><alternatives><mml:math><mml:mrow><mml:mo>(</mml:mo><mml:mi>p</mml:mi><mml:mo>×</mml:mo><mml:mn>512</mml:mn><mml:mo>)</mml:mo><mml:mo>×</mml:mo><mml:mo>(</mml:mo><mml:mn>512</mml:mn><mml:mo>×</mml:mo><mml:mn>2048</mml:mn><mml:mo>)</mml:mo></mml:mrow></mml:math><inline-graphic xlink:href=""kim-ieq1-3065365.gif""/></alternatives></inline-formula> matrix multiplication with a batch size <inline-formula><tex-math notation=""LaTeX"">$p$</tex-math><alternatives><mml:math><mml:mi>p</mml:mi></mml:math><inline-graphic xlink:href=""kim-ieq2-3065365.gif""/></alternatives></inline-formula> varying from 1 to 128, the Silent-PIM performed up to 16.9x and 24.6x faster than GPU and CPU, respectively, <inline-formula><tex-math notation=""LaTeX"">$p=1$</tex-math><alternatives><mml:math><mml:mrow><mml:mi>p</mml:mi><mml:mo>=</mml:mo><mml:mn>1</mml:mn></mml:mrow></mml:math><inline-graphic xlink:href=""kim-ieq3-3065365.gif""/></alternatives></inline-formula>, which was the case without having any data reuse. At <inline-formula><tex-math notation=""LaTeX"">$p=128$</tex-math><alternatives><mml:math><mml:mrow><mml:mi>p</mml:mi><mml:mo>=</mml:mo><mml:mn>128</mml:mn></mml:mrow></mml:math><inline-graphic xlink:href=""kim-ieq4-3065365.gif""/></alternatives></inline-formula>, the highest data reuse case, the GPU performance was the highest, but the PIM performance was still higher than the CPU execution. Similarly, at <inline-formula><tex-math notation=""LaTeX"">$(p \times 2048)$</tex-math><alternatives><mml:math><mml:mrow><mml:mo>(</mml:mo><mml:mi>p</mml:mi><mml:mo>×</mml:mo><mml:mn>2048</mml:mn><mml:mo>)</mml:mo></mml:mrow></mml:math><inline-graphic xlink:href=""kim-ieq5-3065365.gif""/></alternatives></inline-formula> element-wise multiplication and addition, where there was no data reuse, the Silent-PIM always achieved higher than both CPU and GPU. It also showed that when the PIM’s EDP performance was superior to the others in all the cases having no data reuse.","dblp","Computer Science","21","https://doi.org/10.1109/TPDS.2021.3065365","10.1109/TPDS.2021.3065365","2022-02-01","2026-04-08","",""
