"paper_id","arxiv_id","s2_paper_id","title","authors","year","venue","abstract","source","categories","citation_count","url","doi","published_date","crawled_date","keep","notes"
"doi:10.1109/TVLSI.2025.3629045","","13c6095fc99870ce73cbd63bba05639a95b9a50c","A Wide Fault Coverage Pre-Bond TSV Test Method Based on Ring Oscillator Using Variable Discharge Path","Xu Fang","2026","IEEE-TVLSI","Through silicon via (TSV), serving as the vertical signal path in 3-D integrated circuits (3D-ICs), must be tested prior to die bonding (pre-bond). Most conventional pre-bond TSV test methods are often limited in terms of leakage fault detection range, hybrid fault detection capability, and fault parameter diagnosability. To address these challenges, we propose a pre-bond TSV test method based on ring oscillator (RO) circuits using a variable discharge path, capable of detecting and diagnosing a wide range of TSV faults, including open, leakage, and hybrid open-leakage faults with high resolution. The entire DfT framework employs standard digital cells to construct all test structures, facilitating its application in diverse testing scenarios. The effectiveness of the proposed method is evaluated through HSPICE simulations. The simulation results demonstrate that, in the presence of PVT variation, the proposed method can effectively detect and diagnose open faults occurring within the first 96.7% tail section of TSV with a maximum diagnosing error of 3.71 fF. Additionally, it can accurately identify leakage faults exceeding 2.5 nS with a maximum diagnosing error of 13.5%.","dblp","Computer Science","0","https://doi.org/10.1109/TVLSI.2025.3629045","10.1109/TVLSI.2025.3629045","2026-02-01","2026-04-08","",""
"doi:10.1109/TVLSI.2025.3621655","","df13752a5cef9d43f621d4cd7505bffd4a7ab31f","An Efficient VLSI Architecture for Hammerstein-Type Spline Adaptive Filters","Pavan Kumar Ganjimala","2026","IEEE-TVLSI","The Hammerstein spline adaptive filter (HSAF) is a class of nonlinear adaptive filters (NAFs), known for its flexible nonlinear modeling and low complexity in applications, such as self-interference cancellation in wireless communications. This brief proposes a delayed dual-weight update reformulation for the HSAF and its efficient high-throughput and low-power architecture. We also propose hardware-efficient techniques for mapping spline interpolation and updating the spline control points in HSAF. The proposed delayed HSAF (DHSAF) architecture is synthesized using Cadence Genus in 45-nm CMOS technology. Synthesis results show that the proposed DHSAF achieves significantly higher throughput compared to the basic HSAF, with only minimal area and power overhead. Furthermore, the proposed DHSAF outperforms the state-of-the-art RFF-KLMS architecture in terms of both area and power efficiency.","dblp","Computer Science","0","https://doi.org/10.1109/TVLSI.2025.3621655","10.1109/TVLSI.2025.3621655","2026-02-01","2026-04-08","",""
"doi:10.1109/TVLSI.2025.3624380","","f6c2e6aa93e41a25ee4f4ecb347a5e1ddadd0c34","Area-Time Efficient Formula-Based BCH Decoder With Trace Mechanism for WBAN Applications","Vinh T. Nguyen","2026","IEEE-TVLSI","This brief presents the area-time efficient decoding algorithm and architecture for the double error correcting $(63,51)$ Bose–Chaudhuri–Hocquenghem (BCH) code with applications to wireless body area networks (WBANs). The formula for finding the roots of an error locator polynomial (ELP) is rederived to reduce the decoding complexity. The trace constraint for this formula is also taken into consideration to avoid the performance loss of bit error rate (BER). Hardware implementation results reveal that the proposed architecture surpasses the well-known Chien search-based and searchless decoders by the improvements of at least 50.89% and 29.35%, respectively, in terms of area-time complexity.","dblp","Computer Science","0","https://doi.org/10.1109/TVLSI.2025.3624380","10.1109/TVLSI.2025.3624380","2026-02-01","2026-04-08","",""
"doi:10.1109/TVLSI.2025.3624842","","80075df2034a487a8e8a23e697bb0cb618b9df0b","A 0.31-V 16-Kb 9T SRAM With Enhanced Sensing Margin and Read Performance for Low-Power Applications","Pengyuan Zhao","2026","IEEE-TVLSI","This brief presents a low-power 9T static random access memory (SRAM) with enhanced read sensing margin and read performance. The read decoupled port of the proposed 9T SRAM cell achieves the enhanced sensing margin by mitigating the read bitline (RBL) leakage and improves the read performance through using one-transistor read path. The multithreshold voltage devices are used in SRAM cell for improving the leakage power and performance of SRAM. Additionally, an interleaved write wordline (WWL) structure is implemented to address the write half-select issue. The measurement results of the test chip fabricated in the 22-nm FDSOI technology demonstrate that the designed 9T SRAM achieves a minimum operation voltage of 0.31 V at 1.05 MHz and can operate at 60.5 MHz when the supply voltage is 0.5 V. The minimum active energy of 18.56 fJ/access-bit is obtained at 0.33 V. Furthermore, the designed SRAM exhibits a minimum leakage power of 0.11 pW/bitcell in the retention mode.","dblp","Computer Science","0","https://doi.org/10.1109/TVLSI.2025.3624842","10.1109/TVLSI.2025.3624842","2026-02-01","2026-04-08","",""
"doi:10.1109/TVLSI.2025.3627654","","d6b83099ff478093b79128941230186b9e1ce4b8","An LSGQ-FFS Framework for Adaptive Optimization of Hybrid INT-CIM Architecture","Shaochen Li","2026","IEEE-TVLSI","Hybrid computing-in-memory (CIM) has recently gained significant attention due to its ability to leverage the strengths of both digital CIM (DCIM) and analog CIM (ACIM). The multibit fusion (MF) scheme enhances energy efficiency by fusing low-bit results, which typically require multiple read-out cycles, into a single-cycle read out. However, the relationship between hybrid INT-CIM circuit design and network performance based on the MF scheme has not yet been systematically explored. In addition, we investigate how different MF configurations affect the performance of various neural networks. To address this gap, we first propose a less-significant group quantization (LSGQ) model, which defines and explores the design space of hybrid INT-CIM. Second, we develop a FastFuse-Search (FFS) algorithm, which optimizes configurations for different networks to strike a better balance between model accuracy and energy efficiency. Based on the experimental results, some key considerations on hybrid CIM design are derived. FFS yields a $1.72\times $ energy-efficiency boost with negligible accuracy loss. Finally, we fabricate a 28-nm hybrid INT-CIM test chip, achieving 59.74 TOPS/W and 0.96 TOPS/mm2, with performance metrics of 23.21 perplexity for GPT-2, 68.69% accuracy for ResNet18, and 80.53% accuracy for ViT.","dblp","Computer Science","0","https://doi.org/10.1109/TVLSI.2025.3627654","10.1109/TVLSI.2025.3627654","2026-02-01","2026-04-08","",""
"doi:10.1109/TVLSI.2025.3627560","","292ca946ac9e17f0da132510a618c0aab6f4c2d5","A Crosstalk Suppressed Reconfigurable Fully Passive Multichannel Noise-Shaping SAR ADC","Yu Lu","2026","IEEE-TVLSI","This brief presents a reconfigurable multichannel noise-shaping (NS) SAR analog-to-digital converter (ADC) with crosstalk suppression. All nonmemory blocks are multiplexed among all channels assisted by the proposed timing control scheme, enabling reconfiguration with negligible power and hardware cost. A novel approach to determine the design parameters of nonideal loop filters is proposed, and a crosstalk suppressed multichannel fully passive loop filter is developed based on this method. A memoryless binary dynamic element matching (DEM) is also adopted to suppress the nonlinearity of each channel. The ADC achieves a typical SNDR of 77.49/72.17/66.62 dB with a 20-kHz bandwidth under one-/two-/four-channel modes, respectively, realizing typical Schreier FoMs of 169.54, 167.20, and 164.64 dB. Averaged interchannel crosstalks are −79.17 and −77.37 dB with −2.5-dBFS inputs in all input channels under two- and four-channel modes.","dblp","Computer Science","0","https://doi.org/10.1109/TVLSI.2025.3627560","10.1109/TVLSI.2025.3627560","2026-02-01","2026-04-08","",""
"doi:10.1109/TVLSI.2025.3627973","","1b78d48d52ba3ca888378eadb089604771b2dff7","A Tri-Band Two-Stage LNA With Simultaneous Linearity and Gain Enhancement for WiFi","Teng-Shen Yang","2026","IEEE-TVLSI","This brief presents a tri-band, two-stage compact low-noise amplifier (LNA) that simultaneously enhances linearity, gain, and noise performance for WiFi applications. The second stage adopts a dual-path architecture, consisting of a main amplifier and an additional amplifier. The additional amplifier, biased in the subthreshold region, suppresses third-order nonlinearity and enhances gain without increasing power consumption. The first-stage LNA reduces the noise contribution from the second stage, improving overall noise performance. To further minimize power consumption, an inverter-based topology is employed. Fabricated in a 90-nm CMOS process, the proposed LNA achieves an $S_{11}$ below −5 dB at 2.4, 5, and 6 GHz, covering key WiFi bands. At 6-GHz band, it delivers 13.5-dB gain, 3.2-dBm third-order input intercept point (IIP3), and 3.1-dB noise figure (NF). At 5-GHz band, it achieves 15-dB gain, 0.7-dBm IIP3, and 2.76-dB NF. At 2.4-GHz band, it provides 20.66-dB gain, −7-dBm IIP3, and 2.7-dB NF. The circuit consumes only 3 mW of dc power. Measurements at 6 GHz show that the dual-path technique in the second stage improves IIP3 by 8.6 dB, increases gain by 1.5 dB, and reduces NF by 0.6 dB, all without additional power or area overhead.","dblp","Computer Science","0","https://doi.org/10.1109/TVLSI.2025.3627973","10.1109/TVLSI.2025.3627973","2026-02-01","2026-04-08","",""
"doi:10.1109/TVLSI.2025.3633693","","9ff158bab5674f3b504e4ead20e9dbe6cb32af52","EDMOT: A 25-65 ns Latency Event-Driven Multiobject Tracker for Dynamic Vision Sensors","Feiqiang Li","2026","IEEE-TVLSI","Dynamic vision sensors (DVSs), renowned for their low latency and sparse event-driven output, have garnered significant attention in machine vision applications, particularly in latency-sensitive applications like object tracking. However, current DVS-based object tracking systems have not fully utilized the advantages of DVS due to their frame-based processing or the high computing intensity of their algorithms. This brief presents EDMOT, a fully event-driven multiobject tracking system for DVS, achieving 25–65 ns latency at 200 MHz. EDMOT introduces three key innovations: 1) a novel event-driven update mechanism that processes only the latest event and the expired oldest event, minimizing computational overhead; 2) a dual-threshold tracking strategy that decouples object formation and motion phases, significantly improving tracking accuracy; and 3) a row–column feature memory with flag registers, enabling object separation within eight clock cycles. The proposed EDMOT is evaluated on public datasets, demonstrating superior tracking accuracy compared to prior methods. Finally, EDMOT was implemented at the HLMC 55 nm, supporting 20–100 Me/s throughput. To the best of our knowledge, this is a multiobject tracking system with minimal delay and the highest event processing throughput.","dblp","Computer Science","0","https://doi.org/10.1109/TVLSI.2025.3633693","10.1109/TVLSI.2025.3633693","2026-02-01","2026-04-08","",""
"doi:10.1109/TVLSI.2025.3634734","","defaa829b9ebb0bd23619f9607133b521ba3450b","A 0.38-mW, 50-MS/s, 2.3-μApp Current-Integration SAR-Based Current-to-Digital Converter for Real-Time OCT Imaging","Xiao Wang","2026","IEEE-TVLSI","This brief presents an amplifierless current-to-digital converter (CDC) that uniquely integrates an open-loop pseudo-differential current mirror with a current-integration successive-approximation-register analog-to-digital converter (ADC). The proposed architecture enables the CDC to achieve high-speed operation at low power consumption, which is critical for the intended applications in dynamic optical coherence tomography (OCT) systems. Fabricated in 65-nm CMOS, the prototype occupies 0.019 mm2, consumes $380~\mu $ W from a 1-V supply, and achieves a 47-dB dynamic range (DR) with a 50-MS/s sample rate. It achieves Walden’s and Schreier’s figures of merit of 92 fJ/step and 148 dB, respectively, both being the best among reported CDCs.","dblp","Computer Science","0","https://doi.org/10.1109/TVLSI.2025.3634734","10.1109/TVLSI.2025.3634734","2026-02-01","2026-04-08","",""
"doi:10.1109/TVLSI.2025.3637272","","fc7ec37875c0225511b61691e5b34265c403fb34","An Analytical Model of Mismatch Dominance Crossover in High-Speed Flash ADC Cores","Shatadal Chatterjee","2026","IEEE-TVLSI","The flash analog-to-digital converters (ADCs), essential for high-speed embedded systems, face inherent linearity constraints due to device mismatch in the resistor ladder and comparator stages. While individual analytical models exist for these mismatch sources, designers rely on Monte Carlo simulations to evaluate the combined errors. This brief introduces a unified analytical framework with closed-form expressions that capture both mismatch sources, enabling efficient estimation of root mean square (rms) integral nonlinearity/differential nonlinearity (INL/DNL). Validated against circuit simulations, the model achieves a mean absolute error (MAE) of 2.71% (<inline-formula> <tex-math notation=""LaTeX"">$\boldsymbol {\sigma _{\textbf {DNL}}}$ </tex-math></inline-formula>) and 2.51% (<inline-formula> <tex-math notation=""LaTeX"">$\sigma _{\text {INL}}$ </tex-math></inline-formula>), and the maximum absolute error (MaxE) remains within 5.44%. This predictive capability guides high-yield, precision, power, and area (PPA)-optimized system-on-chip (SoC) design, enabling over <inline-formula> <tex-math notation=""LaTeX"">$3{\times }$ </tex-math></inline-formula> silicon area reduction through application-specific optimization.","dblp","Computer Science","0","https://doi.org/10.1109/TVLSI.2025.3637272","10.1109/TVLSI.2025.3637272","2026-02-01","2026-04-08","",""
"doi:10.1109/TVLSI.2025.3640215","","98a28e6a327c744573f6ec8092061c38b7b9b318","FADE: Fault-Aware Adaptive On-Die ECC for Improving Robustness","Youngki Moon","2026","IEEE-TVLSI","The increasing density of dynamic random access memory (DRAM) renders permanent faults and soft errors more prevalent, which critically reduces yield and reliability. Although error correction code (ECC) can mitigate this issue, existing ECCs are not optimized for fault correction. As a result, fault tolerance remains insufficient, and the error correction capability in the presence of faults is degraded. Therefore, to improve DRAM robustness by efficiently addressing both permanent faults and soft errors, this brief proposes a fault-aware adaptive on-die ECC (FADE) in which two ECC engines independently operate in either fault mode (FM) or error mode (EM) according to the number of faulty symbols (FSs). In FM, a fault polynomial is reconstructed by reusing the fault addresses that the built-in self-repair (BISR) stores in content-addressable memory (CAM). To calculate the corresponding fault magnitudes, a modified decoding equation is employed. As a result, the number of correctable FSs in FM doubles compared to the conventional ECC. Moreover, with the proposed symbol-based fault isolation, both fault tolerance and error correction capability in the presence of faults are drastically enhanced. Additionally, the experimental results show that the proposed design can be implemented with a reasonable overhead in terms of delay and area.","dblp","Computer Science","0","https://doi.org/10.1109/TVLSI.2025.3640215","10.1109/TVLSI.2025.3640215","2026-02-01","2026-04-08","",""
"doi:10.1109/TVLSI.2025.3639588","","f7aa44d3d53ee3d2e23277be0328ac4cad4e1d6f","A Pattern-Dependent Pulse Filtering Technique for Low-Jitter Injection-Locked CDR in 28-nm CMOS","Junhak Kim","2026","IEEE-TVLSI","This work presents a ring oscillator (RO)-based low-jitter injection-locked clock and data recovery (ILCDR) with a pattern-dependent pulse filtering (PDPF) technique. The conventional ILCDR has a drawback that data jitter is transferred to the recovered clock. To reduce jitter, the PDPF technique is employed to filter out the injection pulses occurring in data patterns that cause high data-dependent jitter (DDJ). Adopting the PDPF technique with an injection timing control loop, the ILCDR optimizes injection timing and maximizes timing margin. Fabricated in a 28-nm CMOS technology, the proposed ILCDR occupies an active area of 0.03 mm<sup>2</sup> and consumes 13.6 mW at 10 Gb/s. The measured jitter tolerance (JTOL) is 1 UI<sub>pp</sub> at 35 MHz with a bit error rate (BER) of <inline-formula> <tex-math notation=""LaTeX"">$10^{-12}$ </tex-math></inline-formula>.","dblp","Computer Science","0","https://doi.org/10.1109/TVLSI.2025.3639588","10.1109/TVLSI.2025.3639588","2026-02-01","2026-04-08","",""
"doi:10.1109/TVLSI.2025.3649174","","fb2c5f7ed1967516a17bf93ead404927f0d5c23a","Multiparameter Dynamic Mode Decomposition for Electrothermal Analysis of Chiplet Systems","Qiuyue Wu","2026","IEEE-TVLSI","Chiplet employs advanced packaging techniques to heterogeneously integrate chips with different processes and functions, featuring multidie integration and high density. However, the increased power density and thermal coupling within these systems introduce significant electrothermal issues, leading to heat accumulation and power management complexities. Meanwhile, due to the complex multilayer heterogeneous integration and multiscale geometric features of chiplet systems, the number of degrees of freedom increases sharply, resulting in significant computational challenges and high demands for computational resources. Traditional numerical methods, such as finite element analysis (FEA), although capable of providing high-accuracy results, are computationally expensive. This work proposes a parametric dynamic mode decomposition (DMD)-based reduced-order modeling method for the electrothermal analysis, extending DMD to handle variations in parameters such as convection coefficients and thermal conductivity, thereby enabling robust analysis for diverse design requirements. As a matrix decomposition technique based on singular value decomposition (SVD), DMD extracts low-rank structures that capture both temporal dynamics and spatial correlations. The numerical results show that the proposed method provides an efficient and reliable solution for electrothermal analysis of chiplets, achieving a 4–9 times speedup over commercial software like COMSOL Multiphysics, making it an alternative for optimization design and reliability analysis of advanced systems.","dblp","Computer Science","0","https://doi.org/10.1109/TVLSI.2025.3649174","10.1109/TVLSI.2025.3649174","2026-03-01","2026-04-08","",""
"doi:10.1109/TVLSI.2026.3656525","","a0dd24528be753fc4efafddba73bec902f834ac9","HFMLLR: Heterogeneous Feature Mining for Low-Overhead Latency Reduction Scheme of LDPC Codes in 3-D TLC nand Flash Memory","Yongchao Wang","2026","IEEE-TVLSI","Low-density parity-check (LDPC) codes have been widely adopted in 3-D nand flash memory systems to enhance data storage reliability. However, when the raw bit error rate (RBER) during data read operations is high, the LDPC decoding process often incurs significant iterative latency, which severely impacts system performance. To address this challenge, this article introduces a novel heterogeneous feature mining for low-overhead latency reduction (HFMLLR) scheme. This scheme reconstructs data based on the distinct characteristics of LDPC codes and flash memory and then further leverages log-likelihood ratio (LLR) and interframe error properties to achieve an organic integration of these features. In detail, this scheme first systematically analyzes the divergent impact of information bits versus check bits on reliability within LDPC codes. By leveraging the inherent characteristic disparity between pages in 3-D TLC nand flash, it proposes a disparity characteristic-based data reconstruction (DCDR) scheme. This approach naturally creates a reliability gradient within data frames without adding extra storage overhead. Furthermore, this article explores the mechanism by which the LLR influences decoding convergence. By taking advantage of the spatial correlation between multiframe errors within the same flash page, the HFMLLR scheme optimizes the decoding process, significantly reducing the number of iterations with minimal computational and storage overhead. Experimental results demonstrate that, compared to traditional schemes, the HFMLLR scheme achieves up to an 83.4% reduction in decoding iteration latency, highlighting its remarkable latency reduction capabilities and practical value.","dblp","Computer Science","0","https://doi.org/10.1109/TVLSI.2026.3656525","10.1109/TVLSI.2026.3656525","2026-03-01","2026-04-08","",""
"doi:10.1109/TVLSI.2025.3649058","","11f0dec8ae72ef80864c8a4dc53f39dc7185fa2b","High-Speed Floating Voltage Level Shifter With Self-Locked Noise Immunity for High-Side Gate Driver","Xupeng Wang","2026","IEEE-TVLSI","Level shifters (LSs) are essential circuit elements within high-side gate drivers, responsible for translating logic signals from a low-voltage (LV) domain to a high-voltage (HV) domain. However, high-frequency gate drivers impose stringent requirements on the propagation delay and reliability of LSs. This article presents a novel high-speed floating voltage LS that achieves subnanosecond propagation delays and enhanced noise immunity. The proposed structure, termed the common-mode self-locking (CMSL) LS, mitigates both common-mode (CM) and differential-mode (DM) noise. The proposed architecture incorporates two complementary techniques: a cross-coupled current mirror topology to suppress CM transient noise, and a combination of resistive signal sensing and a self-locking (SL) mechanism to provide DM transient noise immunity. The proposed technique achieves subnanosecond propagation delay while ensuring high noise immunity and maintaining excellent tolerance to negative voltage swings on the floating supply rail. The design is implemented in a 0.18-<inline-formula> <tex-math notation=""LaTeX"">$\mu $ </tex-math></inline-formula>m bipolar CMOS–DMOS on the silicon-on-insulator (BCD-on-SOI) process. Simulation results demonstrate that the final LS achieves an average propagation delay as low as 410 ps. The figure of merit (FOM) is 0.057 ns/(<inline-formula> <tex-math notation=""LaTeX"">$\mu $ </tex-math></inline-formula>m<inline-formula> <tex-math notation=""LaTeX"">$\cdot $ </tex-math></inline-formula>V), indicating superior performance compared to existing solutions. The experimental results validate the LS’s performance, demonstrating an overall propagation delay of less than 19 ns and a dV/dt noise immunity of up to 42.8 V/ns. The design supports a negative VS swing of −4.12 V at a 5-V supply voltage. Furthermore, verification in a 600-V BCD process confirms the architecture’s intrinsic robustness and superior immunity performance suitable for HV applications.","dblp","Computer Science","0","https://doi.org/10.1109/TVLSI.2025.3649058","10.1109/TVLSI.2025.3649058","2026-03-01","2026-04-08","",""
"doi:10.1109/TVLSI.2025.3644687","","0c82d4dc45560856683a5d0fc1f2307ff65c9615","An Independently Programmable Multioutput SAR SC DC-DC Converter","Abhishek Pradhan","2026","IEEE-TVLSI","This article presents an integrated independently programmable multioutput (MO) successive approximation (SAR) switched-capacitor (SC) DC-DC converter with two independently programmable output channels ranging outputs between 0.4 V and <inline-formula> <tex-math notation=""LaTeX"">$V_{\text {BAT}}$ </tex-math></inline-formula> with resolution of <inline-formula> <tex-math notation=""LaTeX"">$V_{\text {BAT}}/{3^{N}}$ </tex-math></inline-formula> where <inline-formula> <tex-math notation=""LaTeX"">$V_{\text {BAT}}$ </tex-math></inline-formula> is the input voltage and N is the number of SC units cascaded in SAR structure. A modified dual-output (DO) SC DC-DC converter unit cell is proposed with reduced ripple at its output and is integrated in the SAR-SC structure to deliver a wide input and output voltage range. The modified DO-SC units are cascaded via switch boxes to yield a fine-grain voltage resolution. The 1357 ordered pairs of conversion ratios (CRs) ensure that the two output channels are orthogonal and have near-zero crosstalk under varying load conditions. The proposed converter is fabricated in 180 nm CMOS process and achieves a peak efficiency of 94% across a combined load variation of 10 to <inline-formula> <tex-math notation=""LaTeX"">$800{\,}\mu $ </tex-math></inline-formula>A.","dblp","Computer Science","0","https://doi.org/10.1109/TVLSI.2025.3644687","10.1109/TVLSI.2025.3644687","2026-03-01","2026-04-08","",""
