"paper_id","arxiv_id","s2_paper_id","title","authors","year","venue","abstract","source","categories","citation_count","url","doi","published_date","crawled_date","keep","notes"
"doi:10.1109/IPDPS64566.2025.00070","","b50a060069ff1b3bbffcc3e8d022ff88e86d5f75","Reducing the End-to-End Latency of DNN-Based Recommendation Systems in GPU Pools","Guangqiang Luan","2025","IPDPS","While intelligent applications (e.g., recommendation systems) prefer different CPU-GPU ratios, GPU pooling technique that decouples the GPU and CPU resources yields substantial flexibility when serving diverse applications. With such architecture, DNN-based recommendation services often offload the compute-intensive neural network layers to the remote GPU pool for high resource utilization. However, such a paradigm results in the long end-to-end latency due to two causes: 1) the intermediate data is copied for multiple times during the entire process in current GPU pooling practices, incurring heavy overheads; 2) the content transferred to the GPU pool involves multiple small tensors, suffering from poor bandwidth efficiency. To solve these problems, we design Zero, a runtime system that incorporates a zero-copy transmission mechanism as well as a dynamic tensor merging policy. The zero-copy transmission mechanism unifies memory management across the inference framework and the RPC framework, accompanied by an elaborated serialization protocol to fully eliminate redundant data copying. Meanwhile, the tensor merging policy deliberately organizes small tensors into larger data blocks, so as to transfer them with higher efficiency. Experimental results show that, compared with prior work, Zero reduces the latency of typical recommendation models by up to 15.1% (10.1% on average).","dblp","Computer Science","0","https://doi.org/10.1109/IPDPS64566.2025.00070","10.1109/IPDPS64566.2025.00070","2025-06-03","2026-04-08","",""
"doi:10.1109/IPDPS64566.2025.00071","","48dae8f7f253e6496985bc600eedc2613c359a66","Improving Accuracy and Efficiency of Graph Embedding Training with Fine-Grained Parameter Management","Lihan Hu","2025","IPDPS","Efficient and accurate graph embedding learning is crucial for various real-world applications. However, the large-scale nature of graph embeddings poses significant challenges, particularly in managing the massive amount of embedding parameters across CPU and GPU memories. This paper presents a fine-grained parameter management technique that significantly improves the accuracy and efficiency of graph embedding learning. Our approach leverages parameter duplication and a novel precaching strategy, which minimizes the overhead of data movement between CPU and GPU while preventing stale data usage during training. We introduce an analytical model to estimate the access frequency of embeddings, allowing for the optimal placement of embedding data between CPU and GPU. Using a zero-copy data access mechanism, our system effectively reduces training time while maintaining high accuracy. Experimental results on multiple large-scale knowledge graphs demonstrate that our approach achieves substantial performance gains compared to existing methods with improved Mean Reciprocal Rank (MRR).","dblp","Computer Science","0","https://doi.org/10.1109/IPDPS64566.2025.00071","10.1109/IPDPS64566.2025.00071","2025-06-03","2026-04-08","",""
"doi:10.1109/IPDPS64566.2025.00072","","db6fe0e7d3171893bb5ea57150562fff4a7482ca","A Deep Look into the Temporal I/O Behavior of HPC Applications","Francieli Boito","2025","IPDPS","The increasing gap between compute and I/O speeds in high-performance computing (HPC) systems imposes the need for techniques to improve applications' I/O performance. Such techniques must rely on assumptions about I/O behavior in order to efficiently allocate I/O resources such as burst buffers, to schedule accesses to the shared parallel file system or to delay certain applications at the batch scheduler level to prevent contention, for instance. In this paper, we verify these common assumptions about I/O behavior, specifically about temporal behavior, using over 440,000 traces from real HPC systems. By combining traces from diverse systems, we characterize the behaviors observed in real HPC workloads. Among other findings, we show that I/O activity tends to last for a few seconds, and that periodic jobs are the minority, but responsible for a large portion of the I/O time. Furthermore, we make projections for the expected improvement yielded by popular approaches for I/O performance improvement. Our work provides valuable insights to everyone working to alleviate the I/O bottleneck in HPC.","dblp","Computer Science","2","https://doi.org/10.1109/IPDPS64566.2025.00072","10.1109/IPDPS64566.2025.00072","2025-06-03","2026-04-08","",""
"doi:10.1109/IPDPS64566.2025.00074","2602.22409","3d31f043aa0e539a857e53ce1ef48f1f3cd92015","AdapTBF: Decentralized Bandwidth Control via Adaptive Token Borrowing for HPC Storage","Md. Hasanur Rashid","2025","IPDPS","Modern high-performance computing (HPC) applications run on compute resources but share global storage systems. This design can cause problems when applications consume a disproportionate amount of storage bandwidth relative to their allocated compute resources. For example, an application running on a single compute node can issue many small, random writes and consume excessive I/O bandwidth from a storage server. This can hinder larger jobs that write to the same storage server and are allocated many compute nodes, resulting in significant resource waste. A straightforward solution is to limit each application's I/O bandwidth on storage servers in proportion to its allocated compute resources. This approach has been implemented in parallel file systems using Token Bucket Filter (TBF). However, strict proportional limits often reduce overall I/O efficiency because HPC applications generate short, bursty I/O. Limiting bandwidth can waste server capacity when applications are idle or prevent applications from temporarily using higher bandwidth during bursty phases. We argue that I/O control should maximize per-application performance and overall storage efficiency while ensuring fairness (e.g., preventing small jobs from blocking large-scale ones). We propose AdapTBF, which builds on TBF in modern parallel file systems (e.g., Lustre) and introduces a decentralized bandwidth control approach using adaptive borrowing and lending. We detail the algorithm, implement AdapTBF in Lustre, and evaluate it using synthetic workloads modeled after real-world scenarios. Results show that AdapTBF manages I/O bandwidth effectively while maintaining high storage utilization, even under extreme conditions.","dblp","Computer Science; Engineering","3","https://doi.org/10.1109/IPDPS64566.2025.00074","10.1109/IPDPS64566.2025.00074","2025-06-03","2026-04-08","",""
"doi:10.1109/IPDPS64566.2025.00075","","a93dce3f690d48d53d0463b94fef9647742afebe","A New Spin on the Fast Multipole Method for GPUS: Rethinking the Far-Field Operators","Arijus Lengvenis","2025","IPDPS","The Fast Multipole Method (FMM) is an optimally efficient algorithm for solving N -body problems: a fundamental challenge in fields like astrophysics, plasma physics and molecular dynamics. It is particularly suited for computing $1 / \mathrm{r}$ potentials present in Coulomb and gravitational particle systems. Despite the near-field phase being trivially parallelisable, the far-field phase of the $1 / \mathrm{r}$ FMM currently lacks an efficient, massively parallel GPU algorithm fitting for the era of Exascale computing. Current state-of-the-art approaches either favor highly parallel but inefficient expansion shift operators or asymptotically efficient but poorly parallelisable rotation-based ones. Recently, a breakthrough was made with the re-evaluation of a rotation operator variant called fast rotation, which dramatically increases caching effectiveness and marries the advantages of both methods. Thus, this paper incorporates this approach to create fast rotation-based operators that facilitate an efficient far-field algorithm for the FMM on GPUs. Additionally, a warpcentric data access scheme is co-developed alongside a matching octree design, which yields coalesced memory access patterns for the bottleneck operators of the far-field phase. The fast rotation algorithm is enhanced with a cache-tiling mechanism, maximising GPU cache utilisation. Compared to the state-of-theart GPU FMM far-field implementation, our algorithm achieves lower running times across the board and a 2.47 x speedup for an increased precision simulation, with the performance improvement growing as precision increases, providing concrete proof of efficacy for dense particle systems.","dblp","Computer Science","0","https://doi.org/10.1109/IPDPS64566.2025.00075","10.1109/IPDPS64566.2025.00075","2025-06-03","2026-04-08","",""
"doi:10.1109/IPDPS64566.2025.00076","2501.03061","1d9295ea8c467d9d00a218b0a076c5de521e7933","Large Scale Finite-Temperature Real-Time Time Dependent Density Functional Theory Calculation with Hybrid Functional on ARM and GPU Systems","Rongrong Liu","2025","IPDPS","Ultra-fast electronic phenomena originating from finite temperature, such as nonlinear optical excitation, can be simulated with high fidelity via real-time time dependent density functional theory (rt-TDDFT) calculations with hybrid functional. However, previous rt-TDDFT simulations of real materials using the optimal gauge-known as the parallel transport gauge-have been limited to low-temperature systems with band gaps. In this paper, we introduce the parallel transport-implicit midpoint (PT-IM) method, which significantly accelerates finitetemperature rt-TDDFT calculations of real materials with hybrid function. We first implement PT-IM with hybrid functional in our plane wave code PWDFT, and optimized it on both GPU and ARM platforms to build a solid baseline code. Next, we propose a diagonalization method to reduce computation and communication complexity, and then, we employ adaptively compressed exchange (ACE) method to reduce the frequency of the most expensive Fock exchange operator. Finally, we adopt the ring_based method and the shared memory mechanism to overlap computation and communication and alleviate memory consumption respectively. Numerical results show that our optimized code can reach 3072 atoms for rt-TDDFT simulation with hybrid functional at finite temperature on 192 computing nodes, the time-to-solution for one time step is 429.3 s, which is 41.4 times faster compared to the baseline.","dblp","Computer Science; Physics","1","https://doi.org/10.1109/IPDPS64566.2025.00076","10.1109/IPDPS64566.2025.00076","2025-01-06","2026-04-08","",""
"doi:10.1109/IPDPS64566.2025.00077","","6fb198a67583e99e054f6bce8f76ad7081e9563b","Improving Parallel Scalability for Molecular Dynamics Simulations in the Exascale Era","Brian C. Dandurand","2025","IPDPS","Molecular Dynamics (MD) simulations are timeconsuming as they simulate particle-to-particle interactions for increasingly larger particle counts. Applications split these interactions into short-range and long-range interactions at large counts as long-range ones can be approximated with a fundamentally different computation. State-of-the-art implementations map these computations to different processes, often on different nodes, which results in heterogeneous processes with disparate parallel scaling properties, with periodic information exchanges between them. This split and the communication that it requires creates a richer performance optimization space. Our fundamentally novel approach increases asynchrony between the process classes, which implies that up-to-date grid potentials are not always available and so we instead model evolving potentials based on their histories. We provide an analysis of the accuracy of our approach and assess the accuracy of trajectories and maintenance of simulation invariants. We implement our approach in the open-source LAMMPS MD code. Experimental timing measurements indicate up to 80 % speedup in those configurations where synchrony is a substantial bottleneck.","dblp","Computer Science","0","https://doi.org/10.1109/IPDPS64566.2025.00077","10.1109/IPDPS64566.2025.00077","2025-06-03","2026-04-08","",""
"doi:10.1109/IPDPS64566.2025.00078","","de11c006f9e46d56f7f09fffe3ece475eefea6b5","Phase-Based Frequency Scaling for Energy-Efficient Heterogeneous Computing","Lorenzo Carpentieri","2025","IPDPS","Energy efficiency has been a major challenge for exascale computing. Frequency scaling is a powerful technique to achieve energy savings in modern heterogeneous systems, and can be applied either at a coarse granularity, by application, or at a fine granularity, by setting the frequency for each computational kernel. The chosen granularity significantly impacts the performance and energy consumption of applications due to frequency-change overhead. We propose a novel phase-based method that minimizes the frequency-change overhead and improves performance and energy efficiency on heterogeneous multi-GPU systems. Our approach detects different phases through application profiling and DAG analysis, and sets an optimal frequency for each phase. Our methodology also considers MPI programs, where the overhead can be hidden by overlapping frequency-change with communication. Experimental results show up to 37 % energy saving and $1.87 \times$ speedup for various benchmarks on a single GPU, and 68 % energy saving and $3.63 \times$ speedup on two multiGPU applications.","dblp","Computer Science","0","https://doi.org/10.1109/IPDPS64566.2025.00078","10.1109/IPDPS64566.2025.00078","2025-06-03","2026-04-08","",""
"doi:10.1109/IPDPS64566.2025.00079","","576deb3aee29980ef03c4b41ee13d5869f42d95d","GNNPerf: Towards Effective Performance Profiling and Analysis Across GNN Frameworks","Kejie Ma","2025","IPDPS","Graph Neural Networks (GNNs) have been successfully adopted in various application domains and accelerated by parallel processors such as GPUs. Despite the existence of popular frameworks such as Deep Graph Library (DGL) and PyTorch Geometric (PyG), the inconsistent programming paradigms and the lack of a unified analysis toolkit both hinder effective performance comparison among different GNN frameworks. This missing capability not only complicates the selection of the most suitable framework for users, but also impedes developers from optimizing framework implementations. In this paper, we propose GNNPerf, a performance profiling and analysis toolkit for effective performance comparison across GNN frameworks. GNNPerf provides a domain-specific language enabling unified GNN design expression and automatic generation to frameworkspecific implementations. GNNPerf also provides full workflow support for comprehensively evaluating GNN models with easy-to-use profiling, visualization, and analysis. The experimental results demonstrate that the GNNPerf can identify performance bottlenecks and empower users to derive actionable insights, enhancing both GNN model design and framework implementation.","dblp","Computer Science","1","https://doi.org/10.1109/IPDPS64566.2025.00079","10.1109/IPDPS64566.2025.00079","2025-06-03","2026-04-08","",""
"doi:10.1109/IPDPS64566.2025.00080","","2b2ad6bf6ba5bdd4fdf5451525b4d11b4cce238c","Graph Neural Network-Based Latency Prediction for Stream Processing Task","Zheng Chu","2025","IPDPS","Latency prediction for stream processing tasks (SPTs) is a critical challenge in stream computing due to the real-time, mutable, unordered, infinite, and dynamically influential characteristics of such tasks. Existing mechanical, statistical machine learning, and non-graph structured methods inadequately address the long-dependence problem of multivariate time series features. Therefore, this paper proposes a novel model, GNN4LP, based on graph neural networks for accurate latency prediction by capturing spatial-temporal dependencies. The proposed model initially employs multiple 1D convolutional layers to extract temporal features from multivariate time series data. Subsequently, it utilizes several graph convolutional layers to capture spatial features from the directed acyclic graph (DAG). These temporal and spatial features are then integrated into deep spatial-temporal features, and fully connected layers are employed to output the latency values. Extensive experiments conducted on six real-world datasets demonstrate the superior performance of the proposed model in predicting SPT latency.","dblp","Computer Science","1","https://doi.org/10.1109/IPDPS64566.2025.00080","10.1109/IPDPS64566.2025.00080","2025-06-03","2026-04-08","",""
"doi:10.1109/IPDPS64566.2025.00081","","f36930eb49e223df3499331d4d6f5d3b9b0ed387","Next-gen Infrastructure for Scalable Generative AI: Focus on Advances in Storage, Computing and Orchestration","Robert Haas","2025","IPDPS","[abstract unavailable]","dblp","Computer Science","0","https://doi.org/10.1109/IPDPS64566.2025.00081","10.1109/IPDPS64566.2025.00081","2025-06-03","2026-04-08","",""
"doi:10.1109/IPDPS64566.2025.00082","2410.23497","691c6cf53bdf1d9e35dba4f8698dbe9d18f58f11","To Compress or Not to Compress: Energy Trade-Offs and Benefits of Lossy Compressed I/O","Grant Wilkins","2025","IPDPS","Modern scientific simulations generate massive volumes of data, creating significant challenges for I/O and storage systems. Error-bounded lossy compression (EBLC) offers a solution by reducing data set sizes while preserving data quality within user-specified limits. This study provides the first comprehensive energy characterization of state-of-the-art EBLC algorithms-SZ2, SZ3, ZFP, QoZ, and SZx-across various scientific data sets, CPU generations, and parallel/serial modes. We analyze the energy consumption patterns of compression and decompression operations, as well as the energy trade-offs in data I/O scenarios. Our work demonstrates the relationships between compression ratios, runtime, energy efficiency, and data quality, highlighting the importance of considering compressors and error bounds for specific use cases. We demonstrate that EBLC can significantly reduce I/O energy consumption, with savings of up to two orders of magnitude compared to uncompressed I/O for large data sets. In multi-node HPC environments, we observe energy reductions of approximately 25 % when using EBLC. We also show that EBLC can achieve compression ratios of $10-100 \times$, potentially reducing storage device requirements by nearly two orders of magnitude. This work provides a framework for system operators and computational scientists to make informed decisions about implementing EBLC for energy-efficient data management in HPC environments.","dblp","Computer Science","2","https://doi.org/10.1109/IPDPS64566.2025.00082","10.1109/IPDPS64566.2025.00082","2024-10-30","2026-04-08","",""
"doi:10.1109/IPDPS64566.2025.00083","","69a746a5c603eda9a723fb857ef3c391e958b071","Fast and Effective Lossy Compression on GPUs and CPUs with Guaranteed Error Bounds","Alex Fallin","2025","IPDPS","—High-throughput data compression is increasingly important for large scientific projects. This paper presents PFPL, a lossy floating-point data compressor with guaranteed error bounds that is fully compatible between CPUs and GPUs. Despite this compatibility, PFPL delivers some of the highest compression and decompression speeds and compression ratios on both single-and double-precision data. For example, using an absolute error bound of 1E-3, it yields a single-precision compression throughput on the SDRBench inputs of 5 GB/s on a Ryzen 2950X CPU and 423 GB/s on an RTX 4090 GPU. This is at least 4.6 times higher than the throughput of seven leading compressors on both devices. Moreover, PFPL’s compression ratio is higher than that of all tested GPU codes.","dblp","Computer Science","7","https://doi.org/10.1109/IPDPS64566.2025.00083","10.1109/IPDPS64566.2025.00083","2025-06-03","2026-04-08","",""
"doi:10.1109/IPDPS64566.2025.00085","","ddce4fecc371cb71f8219b1b455dc68c1cfd0b3e","BRP-SpMM: Block-Row Partition Based Sparse Matrix Multiplication with Tensor and CUDA Cores","Yukang Dong","2025","IPDPS","Sparse-Dense Matrix Multiplication (SpMM) is a fundamental computational operation in various domains, and leveraging Tensor cores or CUDA cores on GPU to accelerate SpMM has become common practice. While Tensor cores offer notable advantages in dense matrix multiplication, their efficiency significantly decreases when handling sparse matrices. Besides, the computational power of CUDA cores should not be overlooked. Nevertheless, the differences in supported data formats present challenges in effectively leveraging both types of cores to accelerate SpMM. To this end, we propose BRP-SpMM, a block and row partition approach designed for efficient SpMM on GPU. BRP-Sp partitions the sparse matrix into two parts: TC Block and Residual Row part, which are computed on Tensor cores and CUDA cores separately. Meanwhile, a customized storage format is proposed to manage these two distinct parts. Our two GPU kernels incorporate several advanced techniques including load balance, register remapping, and 1-D tiling. BRP-SpMM can achieve higher memory access efficiency and more rational computing resource utilization of GPU. Extensive experiments on modern NVIDIA A800 GPU show that BRPSpMM outperforms SOTA libraries by up to $2.9 \times$ (on average $2.1 \times)$. Furthermore, BRP-SpMM accelerates end-to-end GNN training by up to $1.9 \times$ compared to popular frameworks.","dblp","Computer Science","1","https://doi.org/10.1109/IPDPS64566.2025.00085","10.1109/IPDPS64566.2025.00085","2025-06-03","2026-04-08","",""
"doi:10.1109/IPDPS64566.2025.00086","","40e227cb289c565fdc5f781a4af01423c92b8bf7","Graph Input-Aware Matrix Multiplication for Pruned Graph Neural Network Acceleration","Hanan Khan","2025","IPDPS","Graphs-based neural networks are powerful tools for analyzing intricate non-euclidean data structures to solve complex real-world problems bounded by latency and throughput constraints. However, the computation structures operate on ultra-sparse and unstructured matrices resulting in load balancing and data locality challenges for the sparse matrixmatrix multiplication (SpMM) in massively parallel processors. To overcome these challenges, researchers have turned to model pruning techniques that effectively compress the hidden dimensions in the dense matrices without compromising model accuracy. However, exploiting sparsity for performance becomes challenging when the compressed dimensions cannot exploit the full potential of vector-level parallelism in single instruction multiple thread (SIMT) processors. We propose to virtualize the vector unit into virtual SIMT slots to map the low-dimensional SpMM computations, and improve parallel hardware utilization. The key challenge is to find parallel work to occupy the exposed virtualized slots. A static slot mapping strategy exposes parallelism by trading off load-balancing, memory coalescing, and data locality when distributing work among the slots. The key insight is that work efficiency and parallelism are highly input graph dependent, and static schemes cannot optimally exploit performance. An input-aware slot mapping strategy is proposed that adapts to the input graph's characteristics at SIMT granularity to expose maximum parallelism at runtime. The evaluation with an NVIDIA H100 GPU shows improved performance scaling using the proposed input-aware slot mapping heuristic compared to the static baseline.","dblp","Computer Science","0","https://doi.org/10.1109/IPDPS64566.2025.00086","10.1109/IPDPS64566.2025.00086","2025-06-03","2026-04-08","",""
"doi:10.1109/IPDPS64566.2025.00087","2503.01253","4d0de40cc001f7f2d3c5fa0cee2a1eb5f3ee5b4c","NM-SpMM: Accelerating Matrix Multiplication Using N: M Sparsity with GPGPU","Cong Ma","2025","IPDPS","Deep learning demonstrates effectiveness across a wide range of tasks. However, the dense and over-parameterized nature of these models results in significant resource consumption during deployment. In response to this issue, weight pruning, particularly through $N: M$ sparsity matrix multiplication, offers an efficient solution by transforming dense operations into semisparse ones. $N: M$ sparsity provides an option for balancing performance and model accuracy, but introduces more complex programming and optimization challenges. To address these issues, we design a systematic top-down performance analysis model for $N: M$ sparsity. Meanwhile, NM-SpMM is proposed as an efficient general $N: M$ sparsity implementation. Based on our performance analysis, NM-SpMM employs a hierarchical blocking mechanism as a general optimization to enhance data locality, while memory access optimization and pipeline design are introduced as sparsity-aware optimization, allowing it to achieve close-to-theoretical peak performance across different sparsity levels. Experimental results show that NM-SpMM is 2.1x faster than nmSPARSE (the state-of-the-art for general $N: M$ sparsity) and 1.4× to 6.3× faster than cuBLAS's dense GEMM operations, closely approaching the theoretical maximum speedup resulting from the reduction in computation due to sparsity. NM-SpMM is open source and publicly available at https://github.com/M-H482/NM-SpMM.","dblp","Computer Science","4","https://doi.org/10.1109/IPDPS64566.2025.00087","10.1109/IPDPS64566.2025.00087","2025-03-03","2026-04-08","",""
