"paper_id","arxiv_id","s2_paper_id","title","authors","year","venue","abstract","source","categories","citation_count","url","doi","published_date","crawled_date","keep","notes"
"doi:10.1109/IPDPS64566.2025.00053","","d4dbc6c75a152631d1eda6bc3279997972eb6164","IP-FL: Incentive-Driven Personalization in Federated Learning","Ahmad Faraz Khan","2025","IPDPS","— Federated Learning (FL) is an approach for privacy-preserving Machine Learning (ML), enabling model training across multiple clients without centralized data collection. Existing incentive solutions for traditional Federated Learning (FL) focus on individual contributions to a single global objective, neglecting the nuances of clustered personalization with multiple cluster-level models and the non-monetary incentives such as personalized model appeal for clients. In this paper, we first propose to treat incentivization and personalization as interrelated challenges and solve them with an incentive mechanism that fosters personalized learning. Additionally, current methods depend on an aggregator for client clustering, which is limited by a lack of access to clients’ confidential information due to privacy constraints, leading to inaccurate clustering. To overcome this, we propose direct client involvement, allowing clients to indicate their cluster membership preferences based on data distribution and incentive-driven feedback. Our approach enhances the personalized model appeal for self-aware clients with high-quality data leading to their active and consistent participation. Our evaluation demonstrates significant improvements in test accuracy (8–45%), personalized model appeal (3–38%), and participation rates (31–100%) over existing FL models, including those addressing data heterogeneity and personalization. Index Terms","dblp","Computer Science","0","https://doi.org/10.1109/IPDPS64566.2025.00053","10.1109/IPDPS64566.2025.00053","2025-06-03","2026-04-08","",""
"doi:10.1109/IPDPS64566.2025.00054","","bb691596f023039ea9a8898146b0e56a92c6f626","Leveraging Compilation Statistics for Compiler Phase Ordering","Jiayu Zhao","2025","IPDPS","Choosing the optimal order and combination of compiler optimization passes - known as phase ordering - can enhance the performance of compiled binaries. However, existing approaches struggle to capture the subtle interaction between compiler passes and waste time on low-profitable pass sequences. We introduce CITROEN, a better approach for compiler phase ordering. CITROEN leverages pass-related compilation statistics to reject low-profitable compiler pass sequences to reduce the overhead of phase ordering search. It employs Bayesian optimization to navigate the search space, using compilation statistics instead of traditional tuning parameters to build an online cost model that provides both the performance prediction and the prediction uncertainty of compilation configurations. It dynamically allocates search iterations across source files to optimize search time in multi-file programs. We evaluate CITROEN by integrating it with the LLVM compiler and applying it to benchmarks from cBench and SPEC CPU 2017. CITROEN outperforms existing autotuning methods, discovering high-performing configurations quicker with fewer search iterations.","dblp","Computer Science","3","https://doi.org/10.1109/IPDPS64566.2025.00054","10.1109/IPDPS64566.2025.00054","2025-06-03","2026-04-08","",""
"doi:10.1109/IPDPS64566.2025.00055","","f5790b69ab69f0bea0f4304215dcc207e5df22dc","PCEBench: A Multi-Dimensional Benchmark for Evaluating Large Language Models in Parallel Code Generation","Le Chen","2025","IPDPS","The increasing complexity of software systems and advancements in hardware architectures have intensified the demand for efficient parallel code generation. While parallel programming offers significant performance benefits, it requires extensive expertise and effort due to the intricacies of synchronization, data management, and optimizations. To address these challenges, recent studies have explored the application of machine learning (ML) techniques in parallel code generation, aiming to reduce manual efforts and enhance performance outcomes. Large language models (LLMs) have recently revolutionized natural language processing (NLP) and demonstrated remarkable capabilities in code generation. However, evaluating their ability to generate high-performance parallel code presents unique challenges. Unlike sequential code evaluation, the evaluation of LLM-generated parallel code requires consideration of not only correctness but also efficiency and scalability in utilizing parallel resources. Concretely, existing benchmarks for LLM-generated parallel code evaluation are limited in size and scope compared to their sequential counterparts. To address this evaluation gap, we introduce PCEBench, a novel benchmark designed to assess LLMs' capabilities in generating parallel code. PCEBench focuses on multi-tasking and multidimensional performance evaluation, leveraging an LLM-based approach to generate verified prompts for parallel code generation. The benchmark incorporates scripts compatible with compilers and data race checkers, enabling comprehensive testing across critical dimensions such as compilability, executability, code self-correctness, functional correctness, data race detection, and speedup over serial implementations. By examining these multiple dimensions, PCEBench not only facilitates a thorough evaluation of LLMs in parallel code generation but also provides valuable insights for developers to enhance model performance in this challenging task. This comprehensive approach contributes to advancing the field of automated parallel programming and supports the development of more efficient and scalable software systems.","dblp","Computer Science","2","https://doi.org/10.1109/IPDPS64566.2025.00055","10.1109/IPDPS64566.2025.00055","2025-06-03","2026-04-08","",""
"doi:10.1109/IPDPS64566.2025.00056","2502.11407","2f0ca165c78aa654adbda65dfca14d23f017b0fe","Gensor: A Graph-Based Construction Tensor Compilation Method for Deep Learning","Hangda Liu","2025","IPDPS","High-performance deep learning depends on efficient tensor programs. In recent years, automatic tensor program optimization, also known as tensor compilation, has emerged as the primary approach to generating efficient tensor programs. However, how to generate kernels with higher performance in a shorter time is still the key challenge. In this paper, we present Gensor, a graph-based construction tensor compilation method for deep learning, to further improve the performance of construction tensor compilation. Unlike existing tree-based methods, Gensor abstracts construction space into a graph structure. Gensor then explores the construction space with Markov analysis. Gensor takes tensor programs as states and models scheduling primitives as transition actions between these states. Therefore, the process of tensor program construction optimization is abstracted as a graph traversal process. This approach expands the optimization space, improving operator performance while ensuring rapid optimization. Extensive experiments with typical operators demonstrate that Gensor significantly outperforms the state-of-the-art methods on GPUs for both cloud servers and edge devices. As a result, Gensor can generate operator kernels in seconds, with performance increasing by 18 % on average, reaching a maximum of 30 %. It also achieves high speedup for end-to-end models like ResNet50 and GPT-2, with an average acceleration of 20 %.","dblp","Computer Science","2","https://doi.org/10.1109/IPDPS64566.2025.00056","10.1109/IPDPS64566.2025.00056","2025-02-17","2026-04-08","",""
"doi:10.1109/IPDPS64566.2025.00057","","25e927483fe47fc363ff9993822a535b35a7877e","SPRT2: Scalable, Parallel, and Real-Time fMRI Data Analysis on Heterogeneous Architectures","Weicong Chen","2025","IPDPS","[abstract unavailable]","dblp","Computer Science","0","https://doi.org/10.1109/IPDPS64566.2025.00057","10.1109/IPDPS64566.2025.00057","2025-06-03","2026-04-08","",""
"doi:10.1109/IPDPS64566.2025.00058","2505.03269","f8ba5cf665789139a66f2db4a3a025784cf7a5f3","The Tensor-Core Beamformer: A High-Speed Signal-Processing Library for Multidisciplinary Use","Leon C. Oostrum","2025","IPDPS","Beamforming is a well-known technique to combine signals from multiple sensors. It has a wide range of application domains. This paper introduces the Tensor-Core Beamformer: a generic, optimized beamformer library that harnesses the computational power of GPU tensor cores to accelerate beamforming computations. The library hides the complexity of tensor cores from the user, and supports 16-bit and 1-bit precision. An extensive performance evaluation on NVIDIA and AMD GPUs shows that the library outperforms traditional beamforming on regular GPU cores by a wide margin, at much higher energy efficiency. In the 16-bit mode, it achieves over 600 TeraOps/s on an AMD MI300X GPU, while approaching $1 \text{TeraOp} / \mathrm{J}$. In the 1-bit mode, it breaks the 3 PetaOps/s barrier and achieves over 10 TeraOps/J on an NVIDIA A100 GPU. The beamforming library can be easily integrated into existing pipelines. We demonstrate its use for medical ultrasound and radio-astronomical instruments.","dblp","Computer Science; Physics","2","https://doi.org/10.1109/IPDPS64566.2025.00058","10.1109/IPDPS64566.2025.00058","2025-05-06","2026-04-08","",""
"doi:10.1109/IPDPS64566.2025.00059","","","Parallel-in-Time Kalman Smoothing Using Orthogonal Transformations","Shahaf Gargir","2025","IPDPS","[abstract unavailable]","dblp","","0","https://doi.org/10.1109/IPDPS64566.2025.00059","10.1109/IPDPS64566.2025.00059","","2026-04-08","",""
"doi:10.1109/IPDPS64566.2025.00060","","e5a5ae4118cc1f113991bdbd1a59858785db834c","FLAME: Federated Learning for Attack Mitigation and Evasion","Diletta Chiaro","2025","IPDPS","In today's interconnected cyber landscape, Distributed Denial of Service (DDoS) attacks represent a significant threat to the smooth functioning of online infrastructures. The nature of DDoS attacks, characterized by their distributed and dynamic nature, poses significant challenges for traditional centralized approaches to model training; however, the challenges of collaborative DDoS detection are compounded by stringent data privacy regulations, leaving mitigation efforts largely reliant on standalone and inflexible firewalls. Federated Learning (FL) represents a cutting-edge innovation in cybersecurity, presenting a revolutionary method for collectively training deep learning models without compromising sensitive data. Despite its promise, practical hurdles remain, particularly the reliance of most FL algorithms on centralized, server-side data for model evalu-ation-though some approaches avoid this centralized testing dependency. This limitation hinders the applicability of FL, especially in scenarios involving zero-day attacks on clients. Our paper examines a key hypothesis: whether the aggregated information from multiple clients can be effectively utilized to develop a global model that is inherently more resilient to zeroday attacks compared to models trained solely on individual client data. To investigate this, we introduce a methodology wherein FL models are trained on established DDoS attacks and subsequently evaluated against entirely novel, unencountered attacks, simulating zero-day scenarios at the client level. To ensure that each client contributes effectively to the training process, we utilize Jensen-Shannon Divergence (JSD) to evaluate and filter client updates based on their alignment with the global model. Building on this, we implement a kernel density estimation-based aggregation method to effectively mitigate feature distribution bias-a common issue in DDoS detection within FL environments. This approach forms a core component of our proposed framework, FLAME, which is built using the distributed framework Flower to realistically simulate FL in a decentralized setting. The code for our implementation can be found at: https://github.com/MODAL-UNINA/FLAME.","dblp","Computer Science","1","https://doi.org/10.1109/IPDPS64566.2025.00060","10.1109/IPDPS64566.2025.00060","2025-06-03","2026-04-08","",""
"doi:10.1109/IPDPS64566.2025.00061","","7bacbe4f54feffa64972c5aba50263da56692720","Hybrid-Granularity Parallelism Support for Fast Transaction Processing in Blockchain-Based Federated Learning","Mulin Li","2025","IPDPS","Blockchain-based Federated Learning (BCFL) is widely recognized as a promising solution for collaboratively training machine learning models while maintaining system security. Since blockchain systems are transaction-driven, the efficiency of transaction processing is directly related to the performance and availability of the BCFL system. Previous research has primarily focused on optimizing storage mechanisms or integrating Trusted Execution Environment (TEE) to reduce transaction processing pressure. However, the performance of BCFL remains constrained by slow transaction processing. This critical bottleneck arises from scalar instruction operations in transaction execution engines and the inherent serial transaction processing mechanism. In this paper, we propose a novel hybrid-granularity parallelism architecture, HGP, to greatly accelerate transaction processing in BCFL systems. HGP achieves this through three major innovations: (1) a suite of extended vector instructions, which reduces the instruction number and execution latency by enabling vectorized data I/O and computation using very long instruction word (VLIW) techniques, (2) the scalable transaction grouping method that generates parallelizable transaction groups through transaction signature verification and read-write conflict detection, and (3) the multi-EVM (Ethereum Virtual Machine) parallel processing mechanism that processes a group of transactions using multiple execution engine threads, and maintains global consistency through group scheduling. Through these optimizations, HGP accelerates the transaction processing with both data-level and thread-level parallelism. We evaluate HGP by executing BCFL tasks over classic ResNet18, MobileNet, and SqueezeNet. The experimental results demonstrate that HGP achieves up to a $3.8 \times$ improvement in CPU utilization and a $1.6 \times$ improvement in memory utilization. Furthermore, HGP significantly speeds up the transaction processing performance of three critical tasks by up to $24.5 \times, 12.4 \times$, and $2.8 \times$, respectively.","dblp","Computer Science","0","https://doi.org/10.1109/IPDPS64566.2025.00061","10.1109/IPDPS64566.2025.00061","2025-06-03","2026-04-08","",""
"doi:10.1109/IPDPS64566.2025.00062","","a57842ef5cdb433f52040f152cbe029dac788ed1","Pair-Then-Aggregate: Simplified and Efficient Parallel Programming Paradigm for Secure Multi-Party Computation","Xiaoyu Fan","2025","IPDPS","Pair-then-Aggregate (PtA) introduces a programming paradigm and an automated parallel execution engine for large-scale secure multi-party (MPC) computations, drawing inspiration from the widely-used yet not explicitly defined Table-Generation-and-Look-up (TGL) pattern in privacy-preserving algorithm design. PtA offers an easy-to-use API and a versatile execution engine that harnesses various levels of parallelism and adapts to different MPC deployments, algorithms, and input sizes. Evaluations on a real-world MPC platform demonstrate significant enhancements in scalability, adaptability, and ease of programming. PtA can process one billion input elements with 3-23 lines of C++ code in 5-74 seconds. It outperforms state-of-the-art implementations in 91.4 % of 35 test cases, achieving up to a $12.4 \times$ speedup with much less coding effort. 11Our code is provided in https://github.com/Fannxy/Pair-then-Aggregate","dblp","Computer Science","1","https://doi.org/10.1109/IPDPS64566.2025.00062","10.1109/IPDPS64566.2025.00062","2025-06-03","2026-04-08","",""
"doi:10.1109/IPDPS64566.2025.00064","","eb032ff932fc5a1b169939a63683a8afb2f78194","LaOvl: Lifecycle-Aware Overlay File System for Efficient Container I/O in Cloud Computing","Zhuo Yuan","2025","IPDPS","Containers have become a critical component of cloud computing, offering lightweight virtualization for flexible deployment, elastic computing, and dynamic migration. However, the widespread adoption of the Overlay File System (OverlayFS) to provide file system services for containers faces significant I/O performance challenges in high-density and high-concurrency environments. The LRU page cache strategy is poorly suited to the memory access patterns of containers, and OverlayFS unnecessarily persists copy-on-write data. Furthermore, concurrent requests from multiple containers for host file system resources cause interference, further degrading performance on public cloud platforms. This paper proposes the Lifecycle-Aware Overlay File System (LaOvl), which leverages OverlayFS's redirection operations to accelerate container I/O in three key stages. LaOvl accurately senses the container lifecycle, enabling pre-loading of the page cache before startup, fine-grained temporary copy-on-write during runtime, and timely recycling of cold memory upon container destruction. Our evaluation, which includes micro-benchmarks and real-world applications, demonstrates that LaOvl significantly optimizes container I/O and achieves $\mathbf{9 5. 4 \%}$ improvement over the original OverlayFS, outperforming state-of-the-art solutions.","dblp","Computer Science","0","https://doi.org/10.1109/IPDPS64566.2025.00064","10.1109/IPDPS64566.2025.00064","2025-06-03","2026-04-08","",""
"doi:10.1109/IPDPS64566.2025.00065","","ee20cc5dc96be0a724aa3c2d4858721de4dda51f","KVACCEL: A Novel Write Accelerator for LSM-Tree-Based KV Stores with Host-SSD Collaboration","Kihwan Kim","2025","IPDPS","Log-Structured Merge (LSM) tree-based Key-Value Stores (KVSs) are widely adopted for their high performance in write-intensive environments, but they often face performance degradation due to write stalls during compaction. Prior solutions, such as regulating I/O traffic or using multiple compaction threads, can cause unexpected drops in throughput or increase host CPU usage, while hardware-based approaches using FPGA, GPU, and DPU aimed at reducing compaction duration introduce additional hardware costs. In this study, we propose KVACCEL, a novel hardware-software co-design framework that bypasses write stalls by leveraging a dual-interface SSD. KVACCEL allocates logical NAND flash space to support both block and key-value interfaces, using the key-value interface as a temporary write buffer during write stalls. This strategy significantly reduces write stalls, optimizes resource usage, and ensures consistency between the host and device by implementing an in-device LSM-based write buffer with an iterator-based range scan mechanism. Our extensive evaluation shows that for write-intensive workloads, KVACCEL outperforms ADOC by up to 17 % in terms of throughput and performance-to-CPU-utilization efficiency. For mixed read-write workloads, both demonstrate comparable performance.","dblp","Computer Science","1","https://doi.org/10.1109/IPDPS64566.2025.00065","10.1109/IPDPS64566.2025.00065","2025-06-03","2026-04-08","",""
"doi:10.1109/IPDPS64566.2025.00066","2502.20412","4bd6505b999f9421f92cb4da43bbb3ad7ba4bf83","Accelerating the Dutch Atmospheric Large-Eddy Simulation (DALES) Model with OpenACC","Lucas Esclapez","2025","IPDPS","This paper presents the GPU porting through OpenACC directives of the Dutch Atmospheric Large-Eddy Simulation (DALES) application, a high-resolution atmospheric model. The code is written in Fortran 90 and features parallel (distributed) execution through spatial domain decomposition. We assess the performance of the GPU offloading, comparing the time-to-solution on regular and accelerated HPC nodes. A weak scaling analysis is conducted and portability across NVIDIA A100 and H100 hardware is discussed. Finally, we show how targeted kernels can benefit from further optimization with Kernel Tuner, a GPU kernels auto-tuning package.","dblp","Computer Science; Physics","0","https://doi.org/10.1109/IPDPS64566.2025.00066","10.1109/IPDPS64566.2025.00066","2025-02-21","2026-04-08","",""
"doi:10.1109/IPDPS64566.2025.00067","2312.13094","8474b38ef2e6c6f10fc2176c61223142b1e5f7ef","Automated MPI-X Code Generation for Scalable Finite-Difference Solvers","George Bisbas","2025","IPDPS","Partial differential equations (PDEs) are crucial in modeling diverse phenomena across scientific disciplines, including seismic and medical imaging, computational fluid dynamics, image processing, and neural networks. Solving these PDEs at scale is an intricate and time-intensive process that demands careful tuning. This paper introduces automated codegeneration techniques specifically tailored for distributed memory parallelism (DMP) to execute explicit finite-difference (FD) stencils at scale, a fundamental challenge in numerous scientific applications. These techniques are implemented and integrated into the Devito DSL and compiler framework, a well-established solution for automating the generation of FD solvers based on a high-level symbolic math input. Users benefit from modeling simulations for real-world applications at a high-level symbolic abstraction and effortlessly harnessing HPC-ready distributedmemory parallelism without altering their source code. This results in drastic reductions both in execution time and developer effort. A comprehensive performance evaluation of Devito's DMP via MPI demonstrates highly competitive strong and weak scaling on CPU and GPU clusters, proving its effectiveness and capability to meet the demands of large-scale scientific simulations.","dblp","Computer Science","3","https://doi.org/10.1109/IPDPS64566.2025.00067","10.1109/IPDPS64566.2025.00067","2023-12-20","2026-04-08","",""
"doi:10.1109/IPDPS64566.2025.00068","2501.08293","b579fba39fa960c82c74be55794b1fa809e961ce","A GPU-Accelerated Distributed Algorithm for Optimal Power Flow in Distribution Systems","Minseok Ryu","2025","IPDPS","We propose a GPU-accelerated distributed optimization algorithm for controlling multi-phase optimal power flow in active distribution systems with dynamically changing topologies. To handle varying network configurations and enable adaptable decomposition, we advocate a componentwise decomposition strategy. However, this approach can lead to a prolonged computation time mainly due to the excessive iterations required for achieving consensus among a large number of fine-grained components. To overcome this, we introduce a technique that segregates equality constraints from inequality constraints, enabling GPU parallelism to reduce per-iteration time by orders of magnitude, thereby significantly accelerating the overall computation. Numerical experiments on IEEE test systems ranging from 13 to 8500 buses demonstrate the superior scalability of the proposed approach compared to its CPU-based counterparts.","dblp","Computer Science; Mathematics","2","https://doi.org/10.1109/IPDPS64566.2025.00068","10.1109/IPDPS64566.2025.00068","2025-01-14","2026-04-08","",""
"doi:10.1109/IPDPS64566.2025.00069","","040ecb1ce29e9bb7290e67bb27802e91052031ee","PredTOP: Latency Predictor Utilizing DAG Transformers for Distributed Deep Learning Training with Operator Parallelism","Dipak Acharya","2025","IPDPS","With the increasing sizes of deep learning (DL) models, distributed training with various parallelization techniques, such as pipeline, model, and tensor parallelism, has become an absolute necessity. Accurately and efficiently predicting iteration latency for distributed DL training is critical for high-quality application scheduling, resource allocation, and automatic performance optimization. Unfortunately, existing latency predictors for distributed DL training mainly consider data parallelism, but fail to be applied for DL training optimized by other parallelization techniques. Also, the latency prediction of large-scale distributed DL training with hybrid parallelism is very challenging due to the extremely high measurement cost for one-time execution and the prohibitively huge search space of combinations from multiple parallelization techniques. In this paper, we propose PredTOP, a framework to accurately and efficiently predict the iteration latency of distributed DL training with different types of parallelization techniques. First, we numerically formulate the end-to-end time of pipeline parallelism using stage latency to leverage the low cost of white-box modeling. Then, we adopt a black-box modeling technique to predict the latency of each stage in pipeline parallelism. Specifically, we utilize Transformers over directed acyclic graphs to improve prediction accuracy. The performance superiority of our PredTOP is validated by extensive experimental results with two real-world benchmarks in comparison with state-of-the-art approaches and illustrated in a realistic automatic parallelization plan generation system.","dblp","Computer Science","1","https://doi.org/10.1109/IPDPS64566.2025.00069","10.1109/IPDPS64566.2025.00069","2025-06-03","2026-04-08","",""
