"paper_id","arxiv_id","s2_paper_id","title","authors","year","venue","abstract","source","categories","citation_count","url","doi","published_date","crawled_date","keep","notes"
"doi:10.1109/IPDPS64566.2025.00035","2403.12231","1cfbbe6920ada8226002b544aa0706bda6e1950e","Edge-Disjoint Spanning Trees on Star Products","Kelly Isham","2025","IPDPS","A star-product operation may be used to create large graphs from smaller factor graphs. Network topologies based on star-products demonstrate several advantages including lowdiameter, high scalability, modularity and others. Many state-of-the-art diameter-2 and −3 topologies (Slim Fly, Bundlefly, PolarStar etc.) can be represented as star products. In this paper, we explore constructions of edge-disjoint spanning trees (EDSTs) in star-product topologies. EDSTs expose multiple parallel disjoint pathways in the network and can be leveraged to accelerate collective communication, enhance fault tolerance and network recovery, and manage congestion. Our EDSTs have provably maximum or near-maximum cardinality which amplifies their benefits. We further analyze their depths and show that for one of our constructions, all trees have order of the depth of the EDSTs of the factor graphs, and for all other constructions, a large subset of the trees have that depth.","dblp","Computer Science; Mathematics","0","https://doi.org/10.1109/IPDPS64566.2025.00035","10.1109/IPDPS64566.2025.00035","2024-03-18","2026-04-08","",""
"doi:10.1109/IPDPS64566.2025.00036","2602.22017","e465bd8e0bd5e2c83287fc345be5f0eeb17d09c5","IOAgent: Democratizing Trustworthy HPC I/O Performance Diagnosis Capability via LLMs","Chris Egersdoerfer","2025","IPDPS","As the complexity of the HPC storage stack rapidly grows, domain scientists face increasing challenges in effectively utilizing HPC storage systems to achieve their desired I/O performance. To identify and address I/O issues, scientists largely rely on I/O experts to analyze their I/O traces and provide insights into potential problems. However, with a limited number of I/O experts and the growing demand for dataintensive applications, inaccessibility has become a major bottleneck, hindering scientists from maximizing their productivity. The recent rapid progress in large language models (LLMs) opens the door to creating an automated tool that democratizes trustworthy I/O performance diagnosis capabilities to domain scientists. However, LLMs face significant challenges in this task, such as the inability to handle long context windows, a lack of accurate domain knowledge about HPC I/O, and the generation of hallucinations during complex interactions. In this work, we propose IOAgent as a systematic effort to address these challenges. IOAgent integrates various new designs, including a module-based pre-processor, a RAG-based domain knowledge integrator, and a tree-based merger to accurately diagnose I/O issues from a given Darshan trace file. Similar to an I/O expert, IOAgent provides detailed justifications and references for its diagnoses and offers an interactive interface for scientists to continue asking questions about the diagnosis. To evaluate IOAgent, we collected a diverse set of labeled job traces and released the first open diagnosis test suite, TraceBench. Based on this test suite, extensive evaluations were conducted, demonstrating that IOAgent matches or outperforms state-of-the-art I/O diagnosis tools with accurate and useful diagnosis results. We also show that IOAgent is not tied to specific LLMs, performing similarly well with both proprietary and open-source LLMs. We believe IOAgent has the potential to become a powerful tool for scientists navigating complex HPC I/O subsystems in the future.","dblp","Computer Science","4","https://doi.org/10.1109/IPDPS64566.2025.00036","10.1109/IPDPS64566.2025.00036","2025-06-03","2026-04-08","",""
"doi:10.1109/IPDPS64566.2025.00037","","c031e8c22fdb0108d6503590b26f5a7096f3479c","DeepBAT: Performance and Cost Optimization of Serverless Inference Using Transformers","Bowen Sun","2025","IPDPS","Serverless computing is an autoscaling pay-as-yougo paradigm that can efficiently support machine learning inference especially under bursty workload conditions. Within the serverless paradigm, batching ML inference requests before serving them is widely adopted. Thanks to its parallelism properties, batching can highly improve inference performance while reducing the monetary cost of serverless. Identifying the correct serverless parameterization to simultaneously meet conflicting targets (i.e., keep monetary cost at a minimum while meeting pre-defined service level objectives, SLO) may be cast as a resource allocation problem. In this paper, we illustrate that a deep surrogate model can quickly discover optimized serverless configurations by learning the relationship among the workload patterns and achieve performance measures. We develop DeepBAT, an SLO-aware framework that leverages the Transformer encoder and multi-head attention mechanism to optimize the performance of serverless inference subject to bursty and previously unobserved workloads. We illustrate the effectiveness of DeepBAT on a set of case studies and show that for the problem of inference serving on AWS Lambda, DeepBAT can speed up the solution time of state-of-the-art analytic solutions by over 55 times while generalizing remarkably well on unseen workloads.","dblp","Computer Science","0","https://doi.org/10.1109/IPDPS64566.2025.00037","10.1109/IPDPS64566.2025.00037","2025-06-03","2026-04-08","",""
"doi:10.1109/IPDPS64566.2025.00039","","aecc0c74cf7c7c106f8c7ad13faf7012f36f99a9","FlexRLHF: A Flexible Placement and Parallelism Framework for Efficient RLHF Training","Youshao Xiao","2025","IPDPS","Recently, ChatGPT or InstructGPT like large language models (LLM) has made a significant impact in the AI world. Many works have attempted to reproduce the complex InstructGPT's training pipeline, namely Reinforcement Learning with Human Feedback (RLHF). However, the mainstream distributed RLHF training methods typically adopt a fixed model placement strategy, referred to as the All-colocated strategy. This strategy treats all four interdependent models involved in RLHF as a single entity, distributing them across all devices and applying parallelism techniques designed for a single model, regardless of the workload heterogeneity inherent to each model. As a result, this strategy exacerbates memory constraints and generation bottlenecks in RLHF training. To address these issues, we propose a flexible model placement framework that offers two general and agile model placement strategies. The Interleaving strategy helps improve memory utilization and communication efficiency of RLHF training by placing models without dependencies on exclusive devices with careful orchestration. On the other hand, the Disaggregated strategy improves the throughput of model training by separating the training and inference runtime of the RLHF pipeline with additional shadow models. Furthermore, our framework provides a simple user interface and guidelines to easily and flexibly configure these strategies in various training scenarios. Our experiments have shown that our strategy can achieve notable improvements up to $12\times$, compared to Deepspeed-Chat or trlX. The results highlight the effectiveness and adaptability of our methods in accelerating the training of distributed RLHF.","dblp","Computer Science","1","https://doi.org/10.1109/IPDPS64566.2025.00039","10.1109/IPDPS64566.2025.00039","2025-06-03","2026-04-08","",""
"doi:10.1109/IPDPS64566.2025.00040","","cc597f329da8582d217bc06b7bdb7600510a331d","Enabling Efficient Error-Controlled Lossy Compression for Unstructured Scientific Data","Xuan Wu","2025","IPDPS","[abstract unavailable]","dblp","Computer Science","3","https://doi.org/10.1109/IPDPS64566.2025.00040","10.1109/IPDPS64566.2025.00040","2025-06-03","2026-04-08","",""
"doi:10.1109/IPDPS64566.2025.00041","","5d86c4fddeb4ead860149d633ff7eba1963d4471","PolyMorphous: An MLIR-Based Polyhedral Compiler with Loop Transformation Primitives","Jinman Zhao","2025","IPDPS","We present PolyMorphous, an MLIR-based polyhedral compiler that exposes a set of loop-based scheduling primitives, providing users with ample control over optimizations for input code. The primitives are expressed in a new Schedule dialect that is based on MLIR's Transform dialect. PolyMorphous' polyhedral engine collapses the primitives into a polyhedral schedule and checks for its legality. If necessary, and possible, the engine corrects an illegal schedule into a legal one. PolyMorphous is evaluated using the PolyBench suite. The evaluation validates PolyMorphous' approach in two ways. First, it shows that PolyMorphous enables users to explore the optimization space, and that it results in well-optimized code. Second, it shows that PolyMorphous' correction of illegal schedules enables users to optimize code with fewer primitives and improves their productivity by alleviating the need for manual correction. Specifically, the evaluation shows that PolyMorphous optimized code performs as well as code optimized by Pluto+ with its optimization flags tuned to achieve the best performance for each benchmark. Further, for several benchmarks, PolyMorphous optimized code performs better, confirming the value of providing users with control over optimizations. Averaged over all the benchmarks, PolyMorphous optimized code has a speedup of $1.24 \mathrm{x} / 1.25 \mathrm{x}$ over that optimized by Pluto+ on Arm/X86 systems. PolyMorphous brings the approach of empowering users of polyhedral compilers with control over optimizations to a community-developed infrastructure, promoting the approach's adoptability. It does so while delivering performant code.","dblp","Computer Science","1","https://doi.org/10.1109/IPDPS64566.2025.00041","10.1109/IPDPS64566.2025.00041","2025-06-03","2026-04-08","",""
"doi:10.1109/IPDPS64566.2025.00042","","b8d005eb9382e8f104cf436a0b4918b53469b29c","Parallel Scheduling of Task Graphs with Minimal Memory Requirements","Pascal Fradet","2025","IPDPS","Many computing systems are constrained by the amount of available shared memory they are allowed to use. Modeling an application with a task graph makes it possible to analyze and optimize its memory usage. We therefore address the problem of finding a parallel schedule of a given task graph that minimizes its memory peak (the maximum memory usage at any point), which is an NP-complete problem. We start by reusing a previous technique that is able to find the optimal sequential schedule for a large class of task graphs, optimal in the sense that the memory peak is the smallest possible one. From this optimal sequential schedule, a dynamic parallel schedule can be derived with a list scheduling algorithm, which we adapt to take into account memory requirements. Provided that the memory constraint is equal to the memory peak of the sequential schedule, our approach always succeeds in producing a parallel schedule that meets the given memory constraint, and that enjoys relatively good speedup (2.68 on average for 4 processors). When the memory constraint is less harsh, the resulting speedup is significantly more substantial (3.57 on average for 4 processors). We compare with the previous state of the art on multiple applications expressed as task graphs, scientific workflows and signal processing filters. When the given memory constraint is close to the minimum, our approach always succeeds in finding a parallel schedule meeting this constraint, whereas the other approaches mostly fail. When the given memory constraint is significantly higher, our approach is comparable to others in terms of speedup, but much faster and it can deal successfully with very large task graphs (up to 50,000 nodes) using a naive Python implementation.","dblp","Computer Science","0","https://doi.org/10.1109/IPDPS64566.2025.00042","10.1109/IPDPS64566.2025.00042","2025-06-03","2026-04-08","",""
"doi:10.1109/IPDPS64566.2025.00043","2501.03383","aeaf39ad099a915ef80f5d0a2e79c065848c5c21","The Artificial Scientist: in-Transit Machine Learning of Plasma Simulations","Jeffrey Kelling","2025","IPDPS","Large-scale simulations or scientific experiments produce petabytes of data per run. This poses massive challenges for I/O and storage when scientific analysis workflows are run manually offline. Unsupervised deep learning-based techniques to extract patterns and non-linear relations from these large amounts of data provide a way to build scientific understanding from raw data, reducing the need for manual pre-selection of analysis steps, but require exascale compute and memory to process the full dataset available. In this paper, we demonstrate a heterogeneous streaming workflow in which plasma simulation data is streamed directly to a Machine Learning (ML) application training a model on the simulation data in-transit, completely circumventing the capacity-constrained filesystem bottleneck. This workflow employs openPMD to provide a high level interface to describe scientific data and also uses ADIOS2, to transfer volumes of data that exceed the capabilities of the filesystem. We employ experience replay to avoid catastrophic forgetting in learning from this non-steady state process in a continual manner and adapt it to improve model convergence while learning in-transit. As a proof-of-concept, we approach the ill-posed inverse problem of predicting particle dynamics from radiation in a particle-incell (PIConGPU) simulation of the Kelvin-Helmholtz instability (KHI). We detail hardware-software co-design challenges as we scale PIConGPU to full Frontier, the Top-1 system as of June 2024 Top500 list.","dblp","Computer Science; Physics","2","https://doi.org/10.1109/IPDPS64566.2025.00043","10.1109/IPDPS64566.2025.00043","2025-01-06","2026-04-08","",""
"doi:10.1109/IPDPS64566.2025.00044","","c4508e5696110c275e1477af75d3fca3ea265abb","The Power of Parallelism: Accelerating Discovery in the Biosciences","Srinivas Aluru","2025","IPDPS","[abstract unavailable]","dblp","Computer Science","0","https://doi.org/10.1109/IPDPS64566.2025.00044","10.1109/IPDPS64566.2025.00044","2025-06-03","2026-04-08","",""
"doi:10.1109/IPDPS64566.2025.00045","","da7bcb9d0146a5ec657e61be696eec953e77b5d0","FlowForecaster: Automatically Inferring Detailed & Interpretable Workflow Scaling Models for Forecasts","Hyungro Lee","2025","IPDPS","Distributed scientific workflows underpin many areas of scientific exploration. To enable good scheduling decisions, we introduce a novel method for predicting their expected task dependences and data flow when scaling data sizes and task parallelism. Most workflows, following the 80-20% rule, execute in predictable patterns relative to concurrency and input data sizes. We develop FlowForecaster, an efficient method for automatically inferring detailed and interpretable workflow scaling models from a few empirical task property graphs (3–5). Our model is an abstract directed acyclic graph (DAG) with analytical expressions to describe how the DAG scales and how data flows along edges. Importantly, our expression language and rules can explain data dependent structure and flow. Our model inference finds repeated substructure, infers analytical rules to explain substructure scaling (edge branching and joining), and predicts edge properties such as data accesses, access size, and data volume. From the model, we can predict entire DAG substructures. We validate FlowForecaster on several workflows and find that we can use interpretable rules to explain 97% of observed results on task and data scaling.","dblp","Computer Science","1","https://doi.org/10.1109/IPDPS64566.2025.00045","10.1109/IPDPS64566.2025.00045","2025-06-03","2026-04-08","",""
"doi:10.1109/IPDPS64566.2025.00046","2303.11499","b9f7010fc00c352af30bfe063313d9f1b6108989","Cello: Co-Designing Schedule and Hybrid Implicit/Explicit Buffer for Complex Tensor Reuse","Raveesh Garg","2025","IPDPS","Tensor algebra accelerators have been gaining popularity for running high-performance computing (HPC) workloads. Identifying optimal schedules for individual tensor operations and designing hardware to run these schedules is an active area of research. Unfortunately, operators in HPC workloads such as Conjugate Gradient often have operators with skewed shapes, fundamentally limiting the reuse any schedule can leverage. Moreover, the operators form a complex DAG of dependencies, making it challenging to apply simple fusion/pipelining techniques to extract inter-operation reuse. To address these challenges, this work proposes an accelerator Cello. Cello uses a novel on-chip buffer mechanism called Chord co-designed with a novel scheduler called Score, which together enables identifying and exploiting reuse over complex DAGs of tensor operations. Cello provides 4x geomean speedup and 4x energy efficiency over state-of-the-art accelerators across HPC workloads.","dblp","Computer Science","1","https://doi.org/10.1109/IPDPS64566.2025.00046","10.1109/IPDPS64566.2025.00046","2023-03-20","2026-04-08","",""
"doi:10.1109/IPDPS64566.2025.00047","","1d60f9eee77fa30ce02844df7ed879643f8485fb","Locality Aware Process Remapping for Distributed-Memory Graph Workloads","Md Nahid Newaz","2025","IPDPS","[abstract unavailable]","dblp","Computer Science","0","https://doi.org/10.1109/IPDPS64566.2025.00047","10.1109/IPDPS64566.2025.00047","2025-06-03","2026-04-08","",""
"doi:10.1109/IPDPS64566.2025.00048","","5f429f9f31edefe8a992d84b447a0dc665d291f6","A Work-Optimal Parallel Algorithm for Aligning Sequences to Genome Graphs","Aranya Banerjee","2025","IPDPS","Representing genetic variations among a population of individuals in the form of a genome graph, and using the graph as a reference instead of the genome of a single individual, are central techniques in the fast-emerging area of pangenomics. A fundamental problem in pangenomics is to align a DNA sequence simultaneously against all reference genomes through sequence-to-graph alignment. The sequential approach to the problem uses dynamic programming and takes $O(m\vert E\vert)$ time, where $m$ is the length of the DNA sequence that is aligned and $\vert E\vert$ is the number of edges in the genome graph. In this paper, we present ParSGA, the first parallel algorithm for the sequence-to-graph alignment problem. Prior works on parallelization only addressed the embarrassingly parallel problem of mapping numerous DNA sequences independently, but each sequentially, to the genome graph. In contrast, ParSGA aligns a single sequence in parallel, which is required in cases involving long or ultra-long DNA sequences, or in applications involving successively mapping and incorporating DNA sequences into an evolving graph, or to improve available parallelism for multiple sequence-to-graph alignments even further. ParSGA is work-optimal, and its design provides a high degree of parallelism. On a 128 -core AMD Epyc processor, ParSGA achieves $81 \times$ speedup compared to serial execution of itself, and $43 \times$ speedup compared to the sequential algorithm, when aligning 250bp reads to human Chromosome 1 variation graph. In the popularly used billion cell updates per second (GCUPS) metric, ParSGA achieves 6.14 GCUPS. The C++ implementation of ParSGA is available at https://github.com/ParBLiSS/ParSGA.","dblp","Computer Science","0","https://doi.org/10.1109/IPDPS64566.2025.00048","10.1109/IPDPS64566.2025.00048","2025-06-03","2026-04-08","",""
"doi:10.1109/IPDPS64566.2025.00049","2505.04431","66aec8be781518ed74164b96988531eaafe67172","An Asynchronous Distributed-Memory Parallel Algorithm for $k$-Mer Counting","Souvadra Hati","2025","IPDPS","This paper describes a new asynchronous algorithm and implementation for the problem of $\boldsymbol{k}$-mer counting $(\text{KC})$, which concerns quantifying the frequency of length $k$ substrings in a DNA sequence. This operation is common to many computational biology workloads and can take up to 77 % of the total runtime of de novo genome assembly. The performance and scalability of the current state-of-the-art distributed-memory KC algorithm are hampered by multiple rounds of Many-To-Many collectives. Therefore, we develop an asynchronous algorithm (DAKC) that uses fine-grained, asynchronous messages to obviate most of this global communication while utilizing network bandwidth efficiently via custom message aggregation protocols. DAKC can perform strong scaling up to 256 nodes (512 sockets $/ 6 ~\mathrm{K}$ cores) and can count $k$-mers up to $9 \times$ faster than the state-of-the-art distributed-memory algorithm, and up to $100 \times$ faster than the shared-memory alternative. We also provide an analytical model to understand the hardware resource utilization of our asynchronous KC algorithm and provide insights on the performance.","dblp","Computer Science; Biology","1","https://doi.org/10.1109/IPDPS64566.2025.00049","10.1109/IPDPS64566.2025.00049","2025-05-07","2026-04-08","",""
"doi:10.1109/IPDPS64566.2025.00050","2401.08124","868b06a881c807d37c99706222858c6c4ee1f3f5","Pandemics in Silico: Scaling Agent-Based Simulations on Realistic Social Contact Networks","Joy Kitson","2025","IPDPS","Preventing the spread of infectious diseases requires implementing interventions at various levels of government and evaluating the potential impact and efficacy of those preemptive measures. Agent-based modeling can be used for detailed studies of the spread of such diseases in the presence of possible interventions. The computational cost of modeling epidemic diffusion through large social contact networks necessitates the use of parallel algorithms and resources in order to achieve quick turnaround times. In this work, we present Loimos, a scalable parallel framework for simulating epidemic diffusion. Loimos uses a hybrid of time-stepping and discrete event simulation to model disease spread, and is implemented on top of Charm++, an asynchronous, many-task runtime that enables over-decomposition and adaptive overlap of computation and communication. We demonstrate that Loimos is able to achieve significant speedups while scaling to large core counts. In particular, Loimos is able to simulate 200 days of a COVID19 outbreak on a digital twin of California in about 42 seconds, for an average of 4.6 billion traversed edges per second (TEPS), using 4096 cores on Perlmutter at NERSC.","dblp","Computer Science","2","https://doi.org/10.1109/IPDPS64566.2025.00050","10.1109/IPDPS64566.2025.00050","2024-01-16","2026-04-08","",""
"doi:10.1109/IPDPS64566.2025.00052","2503.05755","34ca344620763fc3d7ac5571c7ea37690a0514c5","SEAFL: Enhancing Efficiency in Semi-Asynchronous Federated Learning Through Adaptive Aggregation and Selective Training","Md Sirajul Islam","2025","IPDPS","Federated Learning (FL) is a promising distributed machine learning framework that allows collaborative learning of a global model across decentralized devices without uploading their local data. However, in real-world FL scenarios, the conventional synchronous FL mechanism suffers from inefficient training caused by slow-speed devices, commonly known as stragglers, especially in heterogeneous communication environments. Though asynchronous FL effectively tackles the efficiency challenge, it induces substantial system overheads and model degradation. Striking for a balance, semi-asynchronous FL has gained increasing attention, while still suffering from the open challenge of stale models, where newly arrived updates are calculated based on outdated weights that easily hurt the convergence of the global model. In this paper, we present SEAFL, a novel FL framework designed to mitigate both the straggler and the stale model challenges in semi-asynchronous FL. SEAFL dynamically assigns weights to uploaded models during aggregation based on their staleness and importance to the current global model. We theoretically analyze the convergence rate of SEAFL and further enhance the training efficiency with an extended variant that allows partial training on slower devices, enabling them to contribute to global aggregation while reducing excessive waiting times. We evaluate the effectiveness of SEAFL through extensive experiments on three benchmark datasets. The experimental results demonstrate that SEAFL outperforms its closest counterpart by up to $\sim 22 \%$ in terms of the wall-clock training time required to achieve target accuracy.","dblp","Computer Science","0","https://doi.org/10.1109/IPDPS64566.2025.00052","10.1109/IPDPS64566.2025.00052","2025-02-22","2026-04-08","",""
