"paper_id","arxiv_id","s2_paper_id","title","authors","year","venue","abstract","source","categories","citation_count","url","doi","published_date","crawled_date","keep","notes"
"doi:10.1109/SC41404.2022.00061","","1c9102f03a0d50a6351b8cda426f285a26653d1a","MetaWBC: POSIX-Compliant Metadata Write-Back Caching for Distributed File Systems","Yingjin Qian","2022","SC","In parallel and distributed file systems, caching can improve data performance and metadata operations. Currently, most distributed file systems adopt a write-back data cache for performance and a write-through metadata cache for simplifying consistency. However, with modern file systems scales and workloads, write-through metadata caching can impact overall file system performance, e.g., through lock contention and heavy RPC loads required for namespace synchronization and transaction serialization. This paper proposes a novel metadata write-back caching (MetaWBC) mechanism to improve the performance of metadata operations in distributed environments. To achieve extreme metadata performance, we developed a fast, lightweight, and POSIXcompatible memory file system as a metadata cache. Further, we designed a file caching state machine and included other performance optimizations. We coupled MetaWbc with Lustre and evaluated that MetaWbc can outperform the native parallel file system by up to 8x for metadata-intensive benchmarks, and up to 7x for realistic workloads in throughput.","dblp","Computer Science","6","https://doi.org/10.1109/SC41404.2022.00061","10.1109/SC41404.2022.00061","2022-11-01","2026-04-08","",""
"doi:10.1109/SC41404.2022.00062","","0f8f7e4579563e6be86794a2abcddaaf8c3c4369","GUFI: Fast, Secure File System Metadata Search for Both Privileged and Unprivileged Users","Dominic Manno","2022","SC","Modern High-Performance Computing (HPC) data centers routinely store massive data sets resulting in millions of directories and billions of files. To efficiently search and sift through these files and directories we present the Grand Unified File Index (GUFI), a novel file system metadata index that enables both privileged and regular users to rapidly locate and characterize data sets of interest. GUFI uses a hierarchical index that preserves file access permissions such that the index can be securely accessed by users while still enabling efficient, advanced analysis of storage system usage by cluster administrators. Compared with the current state-of-the-art indexing for file system metadata, GUFI is able to provide speedups of 1.5× to 230× for queries executed by administrators on a real production file system namespace. Queries executed by users, which typically cannot rely on cluster-wide indexing, see even greater speedups using GUFI.","dblp","Computer Science","2","https://doi.org/10.1109/SC41404.2022.00062","10.1109/SC41404.2022.00062","2022-11-01","2026-04-08","",""
"doi:10.1109/SC41404.2022.00063","2202.10297","5d5b39966ebf81d222cecfe173a3e2b3433ffbcb","AD for an Array Language with Nested Parallelism","Robert Schenck","2022","SC","We present a technique for applying reverse mode automatic differentiation (AD) on a non-recursive second-order functional array language that supports nested parallelism and is primarily aimed at efficient GPU execution. The key idea is to eliminate the need for a tape by relying on redundant execution to bring into each new scope all program variables that may be needed by the differentiated code. Efficient execution is enabled by the observation that perfectly nested scopes do not introduce re-execution and that such perfect nests can be readily produced by application of known compiler transformations. Our technique differentiates loops and bulk-parallel operators-e.g., map, reduce(-by-index), scan, and scatter-by specific rewrite rules and aggressively optimizes the resulting nested-parallel code. We report an evaluation that compares with established AD solutions and demonstrates competitive performance on ten common benchmarks from recent applied AD literature.","dblp","Computer Science","14","https://doi.org/10.1109/SC41404.2022.00063","10.1109/SC41404.2022.00063","2022-02-21","2026-04-08","",""
"doi:10.1109/SC41404.2022.00064","2207.13901","e9c83fb33f44b590fd2580e61a3f4dc45858efcd","SpDISTAL: Compiling Distributed Sparse Tensor Computations","Rohan Yadav","2022","SC","We introduce SpDISTAL, a compiler for sparse tensor algebra that targets distributed systems. SpDISTAL combines separate descriptions of tensor algebra expressions, sparse data structures, data distribution, and computation distribution. Thus, it enables distributed execution of sparse tensor algebra expressions with a wide variety of sparse data structures and data distributions. SpDISTAL is implemented as a C++ library that targets a distributed task-based runtime system and can generate code for nodes with both multi-core CPUs and multiple GPUs. SpDISTAL generates distributed code that achieves performance competitive with hand-written distributed functions for specific sparse tensor algebra expressions and that outperforms general interpretation-based systems by one to two orders of magnitude.","dblp","Computer Science","18","https://doi.org/10.1109/SC41404.2022.00064","10.1109/SC41404.2022.00064","2022-07-28","2026-04-08","",""
"doi:10.1109/SC41404.2022.00065","","f3799abf4522945f0a559a8fc1e05f806a44f1b8","Scalable Automatic Differentiation of Multiple Parallel Paradigms through Compiler Augmentation","William S. Moses","2022","SC","Derivatives are key to numerous science, engineering, and machine learning applications. While existing tools generate derivatives of programs in a single language, modern parallel applications combine a set of frameworks and languages to leverage available performance and function in an evolving hardware landscape. We propose a scheme for differentiating arbitrary DAG-based parallelism that preserves scalability and efficiency, implemented into the LLVM-based Enzyme automatic differentiation framework. By integrating with a full-fledged compiler backend, Enzyme can differentiate numerous parallel frameworks and directly control code generation. Combined with its ability to differentiate any LLVM-based language, this flexibility permits Enzyme to leverage the compiler tool chain for parallel and differentiation-specitic optimizations. We differentiate nine distinct versions of the LULESH and miniBUDE applications, written in different programming languages (C++, Julia) and parallel frameworks (OpenMP, MPI, RAJA, Julia tasks, MPI.jl), demonstrating similar scalability to the original program. On benchmarks with 64 threads or nodes, we find a differentiation overhead of 3.4–6.8× on C++ and 5.4–12.5× on Julia.","dblp","Computer Science","33","https://doi.org/10.1109/SC41404.2022.00065","10.1109/SC41404.2022.00065","2022-11-01","2026-04-08","",""
"doi:10.1109/SC41404.2022.00066","2206.14761","ab259ed9ce0ab288e6186b5f501237eaeac5bd5b","Accelerating Parallel Write via Deeply Integrating Predictive Lossy Compression with HDF5","Sian Jin","2022","SC","Lossy compression is one of the most efficient solutions to reduce storage overhead and improve I/O performance for HPC applications. However, existing parallel I/O libraries cannot fully utilize lossy compression to accelerate parallel write due to the lack of deep understanding on compression-write performance. To this end, we propose to deeply integrate predictive lossy compression with HDF5 to significantly improve the parallel-write performance. Specifically, we propose analytical models to predict the time of compression and parallel write before the actual compression to enable compression-write overlapping. We also introduce an extra space in the process to handle possible data overflows resulting from prediction uncertainty in compression ratios. Moreover, we propose an optimization to reorder the compression tasks to increase the overlapping efficiency. Experiments with up to 4,096 cores from Summit show that our solution improves the write performance by up to $4.5\times$ and $2.9\times$ over the non-compression and lossy compression solutions, respectively, with only 1.5% storage overhead (compared to original data) on two real-world HPC applications.","dblp","Computer Science","32","https://doi.org/10.1109/SC41404.2022.00066","10.1109/SC41404.2022.00066","2022-06-29","2026-04-08","",""
"doi:10.1109/SC41404.2022.00067","2310.14133","04b10120caa2e0c81b8674adcfeff12a378de061","Dynamic Quality Metric Oriented Error Bounded Lossy Compression for Scientific Datasets","Jinyang Liu","2022","SC","With ever-increasing execution scale of the high performance computing (HPC) applications, vast amount of data are being produced by scientific research every day. Error-bounded lossy compression has been considered a very promising solution to address the big-data issue for scientific applications, because it can significantly reduce the data volume with low time cost meanwhile allowing users to control the compression errors with a specified error bound. The existing error-bounded lossy compressors, however, are all developed based on inflexible designs or compression pipelines, which cannot adapt to diverse compression quality requirements/metrics favored by different application users. In this paper, we propose a novel dynamic quality metric oriented error-bounded lossy compression frame-work, namely QoZ. The detailed contribution is three fold. (1) We design a novel highly-parameterized multi-level interpolation-based data predictor, which can significantly improve the overall compression quality with the same compressed size. (2) We design the error bounded lossy compression framework QoZ based on the adaptive predictor, which can auto-tune the critical parameters and optimize the compression result according to user-specified quality metrics during online compression. (3) We evaluate QoZ carefully by comparing its compression quality with multiple state-of-the-arts on various real-world scientific application datasets. Experiments show that, compared with the second best lossy compressor, QoZ can achieve up to 70% compression ratio improvement under the same error bound, up to 150% compression ratio improvement under the same PSNR, or up to 270% compression ratio improvement under the same SSIM.","dblp","Computer Science","43","https://doi.org/10.1109/SC41404.2022.00067","10.1109/SC41404.2022.00067","2022-11-01","2026-04-08","",""
"doi:10.1109/SC41404.2022.00068","","9b88ebb60ea5d6ae7e6eed94d5f65dbff05a8501","vGraph: Memory-Efficient Multicore Graph Processing for Traversal-Centric Algorithms","Menghan Jia","2022","SC","To lower the monetary/energy cost, single-machine multicore graph processing is gaining increasing attention for a wide range of traversal-centric graph algorithms such as BFS, SSSP, CC, and PageRank, of which the processing is relatively simple and the topology data (vertices and edges) dominates the memory footprint. This paper presents $v$ Graph, a NUMA-aware, memory-efficient multicore graph processing system for traversal-centric algorithms. $v$ Graph proposes an ultralight NUMA-aware graph preprocessing scheme which eliminates almost all complex preprocessing steps and pipelines per-NUMA graph loading and compressing, to effectively reduce inter-NUMA memory accesses while keeping both preprocessing cost and peak memory footprint low. We further optimize $v$ Graph with effective HPC techniques including prefetching and work-stealing. Evaluation on a 384GB-memory, four-NUMA machine shows that compared to the state-of-the-art NUMA-aware/-unaware systems, $v$ Graph can process much larger real-world and synthetic graphs with various traversal-centric algorithms, achieving significantly higher memory efficiency and lower processing time.","dblp","Computer Science","2","https://doi.org/10.1109/SC41404.2022.00068","10.1109/SC41404.2022.00068","2022-11-01","2026-04-08","",""
"doi:10.1109/SC41404.2022.00069","2207.07433","a05bf88334eb36102d2aab4832384946b0ac3461","Boosting Performance Optimization with Interactive Data Movement Visualization","Philipp Schaad","2022","SC","Optimizing application performance in today's hardware architecture landscape is an important, but increasingly complex task, often requiring detailed performance analyses. In particular, data movement and reuse play a crucial role in optimization and are often hard to improve without detailed program inspection. Performance visualizations can assist in the diagnosis of performance problems, but generally rely on data gathered through lengthy program executions. In this paper, we present a performance visualization geared towards analyzing data movement and reuse to inform impactful optimization decisions, without requiring program execution. We propose an approach that combines static dataflow analysis with parameterized program simulations to analyze both global data movement and fine-grained data access and reuse behavior, and visualize insights in-situ on the program representation. Case studies analyzing and optimizing real-world applications demonstrate our tool's effectiveness in guiding optimization decisions and making the performance tuning process more interactive.","dblp","Computer Science","8","https://doi.org/10.1109/SC41404.2022.00069","10.1109/SC41404.2022.00069","2022-06-21","2026-04-08","",""
"doi:10.1109/SC41404.2022.00070","2208.11035","e22673476e051c8d9077b0e36a346944b385d8e7","Not All GPUs Are Created Equal: Characterizing Variability in Large-Scale, Accelerator-Rich Systems","Prasoon Sinha","2022","SC","Scientists are increasingly exploring and utilizing the massive parallelism of general-purpose accelerators such as GPUs for scientific breakthroughs. As a result, datacenters, hyperscalers, national computing centers, and supercomputers have procured hardware to support this evolving application paradigm. These systems contain hundreds to tens of thousands of accelerators, enabling peta- and exa-scale levels of compute for scientific workloads. Recent work demonstrated that power management (PM) can impact application performance in CPU-based HPC systems, even when machines have the same architecture and SKU (stock keeping unit). This variation occurs due to manufacturing variability and the chip's PM. However, while modern HPC systems widely employ accelerators such as GPUs, it is unclear how much this variability affects applications. Accordingly, we seek to characterize the extent of variation due to GPU PM in modern HPC and supercomputing systems. We study a variety of applications that stress different GPU components on five large-scale computing centers with modern GPUs: Oak Ridge's Summit, Sandia's Vortex, TACC's Frontera and Longhorn, and Livermore's Corona. These clusters use a variety of cooling methods and GPU vendors. In total, we collect over 18,800 hours of data across more than 90% of the GPUs in these clusters. Regardless of the application, cluster, GPU vendor, and cooling method, our results show significant variation: 8% (max 22%) average performance variation even though the GPU architecture and vendor SKU are identical within each cluster, with outliers up to 1.5× slower than the median GPU. These results highlight the difficulty in efficiently using existing GPU clusters for modern HPC and scientific workloads, and the need to embrace variability in future accelerator-based systems.","dblp","Computer Science","35","https://doi.org/10.1109/SC41404.2022.00070","10.1109/SC41404.2022.00070","2022-08-23","2026-04-08","",""
"doi:10.1109/SC41404.2022.00071","2212.10432","656c7ced1692bbb288225b87884200e00333775b","AlphaSparse: Generating High Performance SpMV Codes Directly from Sparse Matrices","Zhen Du","2022","SC","Sparse Matrix-Vector multiplication (SpMV) is an essential computational kernel in many application scenarios. Tens of sparse matrix formats and implementations have been proposed to compress the memory storage and speed up SpMV performance. We develop AlphaSparse, a superset of all existing works that goes beyond the scope of human-designed format(s) and implementation(s). AlphaSparse automatically creates novel machine-designed formats and SpMV kernel implementations en-tirely from the knowledge of input sparsity patterns and hard-ware architectures. Based on our proposed Operator Graph that expresses the path of SpMV format and kernel design, AlphaS-parse consists of three main components: Designer, Format & Kernel Generator, and Search Engine. It takes an arbitrary sparse matrix as input while outputs the performance machine-designed format and SpMV implementation. By extensively evaluating 843 matrices from SuiteSparse Matrix Collection, AlphaSparse achieves significant performance improvement by 3.2 × on average compared to five state-of-the-art artificial formats and 1.5 × on average (up to 2.7×) over the up-to-date implementation of traditional auto-tuning philosophy.","dblp","Computer Science","33","https://doi.org/10.1109/SC41404.2022.00071","10.1109/SC41404.2022.00071","2022-11-01","2026-04-08","",""
"doi:10.1109/SC41404.2022.00072","","9e24ddff75190910f242ca35475bb77d5331fca0","Approximate Computing Through the Lens of Uncertainty Quantification","Konstantinos Parasyris","2022","SC","As computer system technology approaches the end of Moore's law, new computing paradigms that improve performance become a necessity. One such paradigm is approximate computing (AC). AC can present significant performance improvements, but a challenge lies in providing confidence that approximations will not overly degrade the application output quality. In AC, application domain experts manually identify code regions amenable to approximation. However, automatically guiding a developer where to apply AC is still a challenge. We propose Puppeteer, a novel method to rank code regions based on amenability to approximation. Puppeteer uses uncertainty quantification methods to measure the sensitivity of application outputs to approximation errors. A developer annotates possible application code regions and Puppeteer estimates the sensitivity of each region. Puppeteer successfully identifies insensitive regions on different benchmarks. We utilize AC on these regions and we obtain speedups of $1.18\times, 1.8\times$, and $1.3\times$ for HPCCG. DCT, and BlackScholes, respectively.","dblp","Computer Science","5","https://doi.org/10.1109/SC41404.2022.00072","10.1109/SC41404.2022.00072","2022-11-01","2026-04-08","",""
"doi:10.1109/SC41404.2022.00073","","3ea311ab9e5073aad0ca1d2ff77985fbc10949f9","Positive-Phase Temperature Scaling for Quantum-Assisted Boltzmann Machine Training","Jose P. Pinilla","2022","SC","Quantum-assisted sampling is a promising technique to enable training probabilistic ML models, which otherwise depend on slow-mixing classical sampling methods; such as, the use of Quantum Annealing Processors (QAP) to train Boltzmann Machines (BMs). Previous work has shown that QAPs can sample from a Boltzmann distribution, although, at an unknown instance-dependent temperature. Due to this distribution divergence, existing training algorithms have resorted to negative-phase temperature scaling. This method, although effective under arduous tuning, introduces unwanted noise to the sampleset due to the quantization errors caused by the underutilization of the QAP bias ranges; and is prone to bias overflow. We introduce a change in the training algorithm to allow positive-phase temperature scaling; an approach that reduces the impact of quantization noise, while still incorporating temperature scaling. As a result, we see an overall improvement in the convergence rate and testing accuracy, when compared to the state-of-the-art approach.","dblp","Computer Science","1","https://doi.org/10.1109/SC41404.2022.00073","10.1109/SC41404.2022.00073","2022-11-01","2026-04-08","",""
"doi:10.1109/SC41404.2022.00074","","0405dce559ecf175de9b995567d8211211e106e3","QoS-Aware Irregular Collaborative Inference for Improving Throughput of DNN Services","Kaihua Fu","2022","SC","With collaborative DNN inference, part of queries run on their source edge device to reduce latencies. Because edges show diverse performance and network conditions, different layers should run on different devices, and queries on the datacenter show irregular structures. However, emerging schemes are not able to process such irregular queries. We propose ICE, a collaborative inference service scheme that effectively supports irregular queries. ICE comprises a query slicer, a query manager, and a lag enhancer. The query slicer maps the execution of queries based on the edges' performance and network conditions. The query manager batches irregular queries adaptively and schedules the irregular queries based on their progress. The lag enhancer reduces the QoS violation when queries run slower due to interference on the edge. Experiments show that ICE improves the supported peak load of the datacenter by 43.2% on average while guaranteeing the required 99%-ile latencies compared with state-of-the-art techniques.","dblp","Computer Science","13","https://doi.org/10.1109/SC41404.2022.00074","10.1109/SC41404.2022.00074","2022-11-01","2026-04-08","",""
"doi:10.1109/SC41404.2022.00075","","c07d4ba65797335fbc640869934fe00056e1bb02","EL-Rec: Efficient Large-Scale Recommendation Model Training via Tensor-Train Embedding Table","Zheng Wang","2022","SC","Deep learning Recommendation Models (DLRMs) plays an important role in various application domains. However, existing DLRM training systems require a large number of GPUs due to the memory-intensive embedding tables. To this end, we propose EL-Rec, an efficient computing framework harnessing the Tensor-train (TT) technique to democratize the training of large-scale DLRMs with limited GPU resources. Specifically, EL-Rec optimizes TT decomposition based on key computation primitives of embedding tables and implements a high-performance compressed embedding table which is a drop-in replacement of Pytorch API. EL-Rec introduces an index reordering technique to harvest the performance gains from both local and global information of training inputs. EL-Rec also highlights a pipeline training paradigm to eliminate the communication overhead between the host memory and the training worker. Comprehensive experiments demonstrate that EL-Rec can handle the largest publicly available DLRM dataset with a single GPU and achieves 3× speedup over the state-of-the-art DLRM frameworks.","dblp","Computer Science","17","https://doi.org/10.1109/SC41404.2022.00075","10.1109/SC41404.2022.00075","2022-11-01","2026-04-08","",""
"doi:10.1109/SC41404.2022.00076","","1a6a7fe065e42365515ccf7d0b5d1225b8088464","STRONGHOLD: Fast and Affordable Billion-Scale Deep Learning Model Training","Xiaoyang Sun","2022","SC","Deep neural networks (DNNs) with billion-scale parameters have demonstrated impressive performance in solving many tasks. Unfortunately, training a billion-scale DNN is out of the reach of many data scientists because it requires high-performance GPU servers that are too expensive to purchase and maintain. We present STRONGHOLD, a novel approach for enabling large DNN model training with no change to the user code. STRONGHOLD scales up the largest trainable model size by dynamically offloading data to the CPU RAM and enabling the use of secondary storage. It automatically determines the minimum amount of data to be kept in the GPU memory to minimize GPU memory usage. Compared to state-of-the-art offloading-based solutions, STRONGHOLD improves the trainable model size by 1.9x~6. Sx on a 32GB V100 GPU, with 1.2x~3.7x improvement on the training throughput. It has been deployed into production to successfully support large-scale DNN training.","dblp","Computer Science","26","https://doi.org/10.1109/SC41404.2022.00076","10.1109/SC41404.2022.00076","2022-11-01","2026-04-08","",""
"doi:10.1109/SC41404.2022.00077","","4d468c7b4345fcd25d40ca67313a743e6e164444","HGL: Accelerating Heterogeneous GNN Training with Holistic Representation and Optimization","Yuntao Gui","2022","SC","Graph neural networks (GNNs) have shown to significantly improve graph analytics. Existing systems for GNN training are primarily designed for homogeneous graphs. In industry, however, most graphs are actually heterogeneous in nature (i.e., having multiple types of nodes and edges). Existing systems train a heterogeneous GNN (HetGNN) as a composition of homogeneous GNN (HomoGNN) and thus suffer from critical limitations such as lack of memory optimization and limited operator parallelism. To address these limitations, we propose HGL - a heterogeneity-aware system for GNN training. At the core of HGL is an intermediate representation, called HIR, which provides a holistic representation for GNNs and enables cross-relation optimization in HetGNN training. We devise tailored optimizations on HIR, including graph stitching, operator fusion and operator bundling. Compared with DGL and PyG, HGL achieves a speedup from 7 to 22 times for training HetGNNs.","dblp","Computer Science","12","https://doi.org/10.1109/SC41404.2022.00077","10.1109/SC41404.2022.00077","2022-11-01","2026-04-08","",""
