"paper_id","arxiv_id","s2_paper_id","title","authors","year","venue","abstract","source","categories","citation_count","url","doi","published_date","crawled_date","keep","notes"
"doi:10.1109/SC41404.2022.00006","2303.01845","1bd34ccf12c7d443ea229acedf2cf125c440eb49","Extreme-Scale Many-against-Many Protein Similarity Search","Oguz Selvitopi","2022","SC","Similarity search is one of the most fundamental computations that are regularly performed on ever-increasing protein datasets. Scalability is of paramount importance for uncovering novel phenomena that occur at very large scales. We unleash the power of over 20,000 GPUs on the Summit system to perform all-vs-all protein similarity search on one of the largest publicly available datasets with 405 million proteins, in less than 3.5 hours, cutting the time-to-solution for many use cases from weeks. The variability of protein sequence lengths, as well as the sparsity of the space of pairwise comparisons, make this a challenging problem in distributed memory. Due to the need to construct and maintain a data structure holding indices to all other sequences, this application has a huge memory footprint that makes it hard to scale the problem sizes. We overcome this memory limitation by innovative matrix-based blocking techniques, without introducing additional load imbalance.","dblp","Computer Science; Biology","7","https://doi.org/10.1109/SC41404.2022.00006","10.1109/SC41404.2022.00006","2022-11-01","2026-04-08","",""
"doi:10.1109/SC41404.2022.00007","","ab0ff20d9367ce998fc892a5250909abd10b0347","Reshaping Geostatistical Modeling and Prediction for Extreme-Scale Environmental Applications","Qinglei Cao","2022","SC","We extend the capability of space-time geostatistical modeling using algebraic approximations, illustrating application-expected accuracy worthy of double precision from majority low-precision computations and low-rank matrix approximations. We exploit the mathematical structure of the dense covariance matrix whose inverse action and determinant are repeatedly required in Gaussian log-likelihood optimization. Geostatistics augments first-principles modeling approaches for the prediction of environmental phenomena given the availability of measurements at a large number of locations; however, traditional Cholesky-based approaches grow cubically in complexity, gating practical extension to continental and global datasets now available. We combine the linear algebraic contributions of mixed-precision and low-rank computations within a tile based Cholesky solver with on-demand casting of precisions and dynamic runtime support from PaRSEC to orchestrate tasks and data movement. Our adaptive approach scales on various systems and leverages the Fujitsu A64FX nodes of Fugaku to achieve up to 12X performance speedup against the highly optimized dense Cholesky implementation.","dblp","Computer Science","30","https://doi.org/10.1109/SC41404.2022.00007","10.1109/SC41404.2022.00007","2022-11-01","2026-04-08","",""
"doi:10.1109/SC41404.2022.00008","","ca9c11f140e9714e74079084ce3be368f8f068de","Pushing the Frontier in the Design of Laser-Based Electron Accelerators with Groundbreaking Mesh-Refined Particle-In-Cell Simulations on Exascale-Class Supercomputers","Luca Fedeli","2022","SC","(150 word max) We present a first-of-kind mesh-refined (MR) massively parallel Particle-In-Cell (PIC) code for kinetic plasma simulations optimized on the Frontier, Fugaku, Summit, and Perlmutter supercomputers. Major innovations, implemented in the WarpX PIC code, include: (i) a three level parallelization strategy that demonstrated performance portability and scaling on millions of A64FX cores and tens of thousands of AMD and Nvidia GPUs (ii) a groundbreaking mesh refinement capability that provides between 1.5 x to 4 x savings in computing requirements on the science case reported in this paper, (iii) an efficient load balancing strategy between multiple MR levels. The MR PIC code enabled 3D simulations of laser-matter interactions on Frontier, Fugaku, and Summit, which have so far been out of the reach of standard codes. These simulations helped remove a major limitation of compact laser-based electron accelerators, which are promising candidates for next generation high-energy physics experiments and ultra-high dose rate FLASH radiotherapy.","dblp","Computer Science","102","https://doi.org/10.1109/SC41404.2022.00008","10.1109/SC41404.2022.00008","2022-11-01","2026-04-08","",""
"doi:10.1109/SC41404.2022.00009","","c21118f3cd789525445e9b96ef211ea1e8388a2f","Extreme Scale Earthquake Simulation with Uncertainty Quantification","Tsuyoshi Ichimura","2022","SC","We develop a stochastic finite element method with ultra-large degrees of freedom that discretize probabilistic and physical spaces using unstructured second-order tetrahedral elements with double precision using a mixed-precision implicit iterative solver that scales to the full Fugaku system and enables fast Uncertainty Quantification (UQ). The developed solver designed to attain high performance on a variety of CPU/GPU-based supercomputers enabled solving 37 trillion degrees-of-freedom problem with 19.8% peak FP64 performance on full Fugaku (89.8 PFLOPS) with 87.7% weak scaling efficiency, corresponding to 224-fold speedup over the state of the art solver running on full Summit. This method, which has shown its effectiveness via solving huge (32-trillion degrees-of-freedom) practical problems, is expected to be a breakthrough in damage mitigation, and is expected to facilitate the scientific understanding of earthquake phenomena and have a ripple effect on other fields that similarly require UQ.","dblp","Computer Science","3","https://doi.org/10.1109/SC41404.2022.00009","10.1109/SC41404.2022.00009","2022-11-01","2026-04-08","",""
"doi:10.1109/SC41404.2022.00010","","24f21bbb128bd7c86a099b82d7d0de9d6c87af85","2.5 Million-Atom Ab Initio Electronic-Structure Simulation of Complex Metallic Heterostructures with DGDFT","Wei Hu","2022","SC","Over the past three decades, ab initio electronic structure calculations of large, complex and metallic systems are limited to tens of thousands of atoms in computational accuracy and efficiency on leadership supercomputers. We present a massively parallel discontinuous Galerkin density functional theory (DGDFT) implementation, which adopts adaptive local basis functions to discretize the Kohn-Sham equation, resulting in a block-sparse Hamiltonian matrix. A highly efficient pole expansion and selected inversion (PEXSI) sparse direct solver is implemented in DGDFT to achieve O(N1.5) scaling for quasi two-dimensional systems. DGDFT allows us to compute the electronic structures of complex metallic heterostructures with 2.5 million atoms (17.2 million electrons) using 35.9 million cores on the new Sunway supercomputer. The peak performance of PEXSI can achieve 64 PFLOPS (~5% of theoretical peak), which is un-precedented for sparse direct solvers. This accomplishment paves the way for quantum mechanical simulations into mesoscopic scale for designing next-generation electronic devices.","dblp","Computer Science","19","https://doi.org/10.1109/SC41404.2022.00010","10.1109/SC41404.2022.00010","2022-11-01","2026-04-08","",""
"doi:10.1109/SC41404.2022.00011","","6aa80409e058464f77a4b663e6f476d1829b44e7","Exaflops Biomedical Knowledge Graph Analytics","Ramakrishnan Kannan","2022","SC","We are motivated by newly proposed methods for mining large-scale corpora of scholarly publications (e.g., full biomedical literature), which consists of tens of millions of papers spanning decades of research. In this setting, analysts seek to discover relationships among concepts. They construct graph representations from annotated text databases and then formulate the relationship-mining problem as an all-pairs shortest paths (APSP) and validate connective paths against curated biomedical knowledge graphs (e.g., Spoke). In this context, we present Coast (Exascale Communication-Optimized All-Pairs Shortest Path) and demonstrate 1.004 EF/s on 9,200 Frontier nodes (73,600 GCDs). We develop hyperbolic performance models (HYPERMOD), which guide optimizations and parametric tuning. The proposed Coast algorithm achieved the memory constant parallel efficiency of 99% in the single-precision tropical semiring. Looking forward, Coast will enable the integration of scholarly corpora like PubMed into the Spoke biomedical knowledge graph.","dblp","Computer Science","4","https://doi.org/10.1109/SC41404.2022.00011","10.1109/SC41404.2022.00011","2022-11-01","2026-04-08","",""
"doi:10.1109/SC41404.2022.00012","","63e0f90f4561656e9b86fcde9fa8cb29a35a05d9","Scaling Correlated Fragment Molecular Orbital Calculations on Summit","Giuseppe M. J. Barca","2022","SC","Correlated electronic structure calculations enable an accurate prediction of the physicochemical properties of complex molecular systems; however, the scale of these calculations is limited by their extremely high computational cost. The Fragment Molecular Orbital (FMO) method is arguably one of the most effective ways to lower this computational cost while retaining predictive accuracy. In this paper, a novel distributed many-GPU algorithm and implementation of the FMO method are presented. When applied in tandem with the Hartree-Fock and RI-MP2 methods, the new implementation enables correlated calculations on 623,016 electrons and 146,592 atoms in less than 45 minutes using 99.8% of the Summit supercomputer (27,600 GPUs). The implementation demonstrates remarkable speedups with respect to other current GPU and CPU codes, and excellent strong scalability on Summit achieving 94.6 % parallel efficiency on 4600 nodes. This work makes feasible correlated quantum chemistry calculations on significantly larger molecular systems than before and with higher accuracy.","dblp","Computer Science","8","https://doi.org/10.1109/SC41404.2022.00012","10.1109/SC41404.2022.00012","2022-11-01","2026-04-08","",""
"doi:10.1109/SC41404.2022.00013","","","Image Gradient Decomposition for Parallel and Memory-Efficient Ptychographic Reconstruction","Xiao Wang","2022","SC","[abstract unavailable]","dblp","","0","https://doi.org/10.1109/SC41404.2022.00013","10.1109/SC41404.2022.00013","","2026-04-08","",""
"doi:10.1109/SC41404.2022.00014","","b0711b3de380a445dd5341cf67c713e2daed17c4","P-Massive: A Real-Time Search Engine for a Multi-Terabyte Mass Spectrometry Database","Narangerelt Batsoyol","2022","SC","Queries of multi-TB Mass Spectrometry (MS) repositories provide deep insights into biological processes and pose challenging data processing problems. The key bottleneck for running these queries is the number of small random reads. Byte-addressable persistent main memory (PMEM) technologies enable real-time MS search systems by delivering low-latency, high-bandwidth storage. This work presents P-Massive, real-time multi-terabyte scale MS search system. P-Massive takes advantage of PMEM and the underlying nature of its data access patterns to maximize performance. We evaluate P-Massive across various storage hierarchies and project forward over the next decade to understand how MS query systems might evolve. Our evaluation shows that P-Massive offers a cost-effective solution that achieves near-DRAM performance. A single query takes 1.7 seconds in P-Massive, 69× faster than state-of-the-art implementation. In an end-to-end, user-facing application, P-Massive delivers a 90% shorter wait time than the latest MS search tool, returning results within seconds rather than minutes.","dblp","Computer Science","10","https://doi.org/10.1109/SC41404.2022.00014","10.1109/SC41404.2022.00014","2022-11-01","2026-04-08","",""
"doi:10.1109/SC41404.2022.00015","2206.10007","a86590b1b429d6d4c8d664c2f0aebc7011940f14","Building Blocks for Network-Accelerated Distributed File Systems","Salvatore Di Girolamo","2022","SC","High-performance clusters and datacenters pose increasingly demanding requirements on storage systems. If these systems do not operate at scale, applications are doomed to become I/O bound and waste compute cycles. To accelerate the data path to remote storage nodes, remote direct memory access (RDMA) has been embraced by storage systems to let data flow from the network to storage targets, reducing overall latency and CPU utilization. Yet, this approach still involves CPUs on the data path to enforce storage policies such as authentication, replication, and erasure coding. We show how storage policies can be offloaded to fully programmable SmartNICs, without involving host CPUs. By using PsPIN, an open-hardware SmartNIC, we show latency improvements for writes (up to 2x), data replication (up to 2x), and erasure coding (up to 2x), when compared to respective CPU- and RDMA-based alternatives.","dblp","Computer Science","11","https://doi.org/10.1109/SC41404.2022.00015","10.1109/SC41404.2022.00015","2022-06-20","2026-04-08","",""
"doi:10.1109/SC41404.2022.00016","2209.01346","1ad7a323cebbd186a6f3c9a1f0caf0af94ce91bd","HammingMesh: A Network Topology for Large-Scale Deep Learning","Torsten Hoefler","2022","SC","Numerous microarchitectural optimizations unlocked tremendous processing power for deep neural networks that in turn fueled the AI revolution. With the exhaustion of such optimizations, the growth of modern AI is now gated by the performance of training systems, especially their data movement. Instead of focusing on single accelerators, we investigate data-movement characteristics of large-scale training at full system scale. Based on our workload analysis, we design HammingMesh, a novel network topology that provides high bandwidth at low cost with high job scheduling flexibility. Specifically, HammingMesh can support full bandwidth and isolation to deep learning training jobs with two dimensions of parallelism. Furthermore, it also supports high global bandwidth for generic traffic. Thus, HammingMesh will power future large-scale deep learning systems with extreme bandwidth requirements.","dblp","Computer Science","37","https://doi.org/10.1109/SC41404.2022.00016","10.1109/SC41404.2022.00016","2022-09-03","2026-04-08","",""
"doi:10.1109/SC41404.2022.00017","2208.01695","a70ed90dff89a52d819967219d35feaac4634a5d","PolarFly: A Cost-Effective and Flexible Low-Diameter Topology","Kartik Lakhotia","2022","SC","In this paper we present PolarFly, a diameter-2 network topology based on the Erdos-Renyi family of polarity graphs from finite geometry. This is the first known diameter-2 topology that asymptotically reaches the Moore bound on the number of nodes for a given network degree and diameter. PolarFly achieves high Moore bound efficiency even for the moderate radixes commonly seen in current and near-future routers, reaching more than 96% of the theoretical peak. It also offers more feasible router degrees than the state-of-the-art solutions, greatly adding to the selection of scalable diameter-2 networks. PolarFly enjoys many other topological properties highly relevant in practice, such as a modular design and expandability that allow incremental growth in network size without rewiring the whole network. Our evaluation shows that PolarFly outperforms competitive networks in terms of scalability, cost and performance for various traffic patterns.","dblp","Computer Science","32","https://doi.org/10.1109/SC41404.2022.00017","10.1109/SC41404.2022.00017","2022-08-02","2026-04-08","",""
"doi:10.1109/SC41404.2022.00018","","89a0cb5176e67d3dd8c50db49e47e19d0d168373","Combining Hard and Soft Constraints in Quantum Constraint-Satisfaction Systems","Ellis Wilson","2022","SC","This work presents a generalization of NchooseK, a constraint satisfaction system designed to target both quantum circuit devices and quantum annealing devices. Previously, NchooseK supported only hard constraints, which made it suitable for expressing problems in NP (e.g., 3-SAT) but not NP-hard problems (e.g., minimum vertex cover). In this paper we show how support for soft constraints can be added to the model and implementation, broadening the classes of problems that can be expressed elegantly in NchooseK without sacrificing portability across different quantum devices. Through a set of examples, we argue that this enhanced version of NchooseK enables problems to be expressed in a more concise, less error-prone manner than if these problems were encoded manually for quantum execution. We include an empirical evaluation of performance, scalability, and fidelity on both a large IBM Q system and a large D- Wave system.","dblp","Computer Science","7","https://doi.org/10.1109/SC41404.2022.00018","10.1109/SC41404.2022.00018","2022-11-01","2026-04-08","",""
"doi:10.1109/SC41404.2022.00019","2207.03711","18359f2b58df45135c7961d2b6829c9ff1ee2700","Large-Scale Simulation of Quantum Computational Chemistry on a New Sunway Supercomputer","Honghui Shang","2022","SC","Quantum computational chemistry (QCC) is the use of quantum computers to solve problems in computational quantum chemistry. We develop a high performance variational quantum eigensolver (VQE) simulator for simulating quantum computational chemistry problems on a new Sunway supercomputer. The major innovations include: (1) a Matrix Product State (MPS) based VQE simulator to reduce the amount of memory needed and increase the simulation efficiency; (2) a combination of the Density Matrix Embedding Theory with the MPS-based VQE simulator to further extend the simulation range; (3) A three-level parallelization scheme to scale up to 20 million cores; (4) Usage of the Julia script language as the main programming language, which both makes the programming easier and enables cutting edge performance as native C or Fortran; (5) Study of real chemistry systems based on the VQE simulator, achieving nearly linearly strong and weak scaling. Our simulation demonstrates the power of VQE for large quantum chemistry systems, thus paves the way for large-scale VQE experiments on near-term quantum computers.","dblp","Physics; Computer Science","35","https://doi.org/10.1109/SC41404.2022.00019","10.1109/SC41404.2022.00019","2022-07-08","2026-04-08","",""
"doi:10.1109/SC41404.2022.00020","2211.09903","dd1e51f9c9693129d9b9d77475e4d49fa55beb7b","Charter: Identifying the Most-Critical Gate Operations in Quantum Circuits via Amplified Gate Reversibility","Tirthak Patel","2022","SC","When quantum programs are executed on noisy intermediate-scale quantum (NISQ) computers, they experience hardware noise; consequently, the program outputs are often erroneous. To mitigate the adverse effects of hardware noise, it is necessary to understand the effect of hardware noise on the program output and more fundamentally, understand the impact of hardware noise on specific regions within a quantum program. Identifying and optimizing regions that are more noise-sensitive is the key to expanding the capabilities of NISQ computers. Toward achieving that goal, we propose Charter, a novel technique to pinpoint specific gates and regions within a quantum program that are the most affected by the hardware noise and that have the highest impact on the program output. Using Charter's methodology, programmers can obtain a precise understanding of how different components of their code affect the output and optimize those components without the need for non-scalable quantum simulation on classical computers.","dblp","Computer Science; Physics","10","https://doi.org/10.1109/SC41404.2022.00020","10.1109/SC41404.2022.00020","2022-11-01","2026-04-08","",""
"doi:10.1109/SC41404.2022.00021","2204.08180","7b5268f1acf3e97bd578660075c00ba405cb6164","A Taxonomy of Error Sources in HPC I/O Machine Learning Models","Mihailo Isakov","2022","SC","I/O efficiency is crucial to productivity in scientific computing, but the growing complexity of HPC systems and applications complicates efforts to understand and optimize I/O behavior at scale. Data-driven machine learning-based I/O throughput models offer a solution: they can be used to identify bottlenecks, automate I/O tuning, or optimize job scheduling with minimal human intervention. Unfortunately, current state-of-the-art I/O models are not robust enough for production use and underperform after being deployed. We analyze four years of application, scheduler, and storage system logs on two leadership-class HPC platforms to understand why I/O models underperform in practice. We propose a taxonomy consisting of five categories of I/O modeling errors: poor application and system modeling, inadequate dataset coverage, I/O contention, and I/O noise. We develop litmus tests to quantify each category, allowing researchers to narrow down failure modes, enhance I/O throughput models, and improve future generations of HPC logging and analysis tools.","dblp","Computer Science","6","https://doi.org/10.1109/SC41404.2022.00021","10.1109/SC41404.2022.00021","2022-04-18","2026-04-08","",""
"doi:10.1109/SC41404.2022.00022","","3ac8aa5f4463a239d441d0e6a191d4cbc5bb7208","Mitigating Silent Data Corruptions in HPC Applications across Multiple Program Inputs","Yafan Huang","2022","SC","With the ever-shrinking size of transistors, silent data corruptions (SDCs) are becoming a common yet serious issue in HPC. Selective instruction duplication (SID) is a widely used fault-tolerance technique that can obtain high SDC coverage with low performance overhead. However, existing SID methods are confined to single program input in its assessment, assuming that error resilience of a program remains similar across inputs. Nevertheless, we observe that the assumption cannot always hold, leading to a drastic loss in SDC coverage across different inputs, compromising HPC reliability. We notice that the SDC coverage loss correlates with a small set of instructions - we call them incubative instructions, which reveal elusive error propagation characteristics across multiple inputs. We propose Minpsid, an automated SID framework that automatically identifies and re-prioritizes incubative instructions in a given program to enhance SDC coverage. Evaluation shows Minpsid can effectively mitigate the loss of SDC coverage across multiple inputs.","dblp","Computer Science","20","https://doi.org/10.1109/SC41404.2022.00022","10.1109/SC41404.2022.00022","2022-11-01","2026-04-08","",""
"doi:10.1109/SC41404.2022.00023","","5c03e7f2146a80d9917c9761e8337b810a467e99","Optimizing Random Access to Hierarchically-Compressed Data on GPU","Feng Zhang","2022","SC","GPU's powerful computational capacity holds great potentials for processing hierarchically-compressed data without decompression in data science domain. Unfortunately, existing GPU approaches offer only traversal-based data analytics; random access is extremely inefficient, substantially limiting their utility. To solve this problem, we develop a novel and broadly applicable optimization that enables efficient random access to hierarchically-compressed data without decompression in GPU memory. We address three major challenges for enabling efficient random access to compressed data on GPUs. The first challenge is designing GPU data structures that support random access. The second challenge is efficiently generating data structures on GPU. Generating data structures for random access is costly on the CPU, and the inefficiency increases dramatically when PCIe data transmission is incorporated. The third challenge is query processing on compressed data in GPU memory. Random accesses, including data updates, result in significant conflicts between massive threads. To solve the first challenge, we propose and modify a number of compressed data structures, including indexing within the complicated GPU memory hierarchy. To address the second challenge, we develop a two-phase process for generating these data structures on the GPU. To handle the third challenge, we propose a double-parsing design to avoid data conflicts. We evaluate our solution on two GPU platforms using five real-world datasets. Experiments show that the random access operations on GPU can achieve 65.04x average speedup compared to the state-of-the-art method.","dblp","Computer Science","5","https://doi.org/10.1109/SC41404.2022.00023","10.1109/SC41404.2022.00023","2022-11-01","2026-04-08","",""
"doi:10.1109/SC41404.2022.00024","","a6e98711629d173205fbc7dd28110f408121c01d","Scaling Graph 500 SSSP to 140 Trillion Edges with over 40 Million Cores","Yuanwei Wang","2022","SC","The SSSP kernel was first introduced into the Graph 500 benchmark in 2017. However, there has been no result from a full-scale world-top supercomputer. The primary reason is the poor work-inefficiency of existing algorithms at large scales. In this paper, we propose an SSSP implementation for The Newest Generation Sunway Supercomputer,including an SSSP algorithm to achieve work-efficiency, along with an adaptive dense/sparse-mode selection approach to achieve communication-efficiency. Our implementation reaches 7638 GTEPS, with 103158 processors (over 40 million cores), and achieves 3.7× in performance and 512× in graph size compared with the current top one on the Graph 500 SSSP list. Based on our experience of running extreme-scale SSSP, we uncover the root cause of its poor scalability: the weight distribution allows edges with weights close to zero, making the SSSP tree deeper on larger graphs. We further explore a scalability-friendly weight distribution by setting a non-zero lower bound to the edge weights.","dblp","Computer Science","8","https://doi.org/10.1109/SC41404.2022.00024","10.1109/SC41404.2022.00024","2022-11-01","2026-04-08","",""
