"paper_id","arxiv_id","s2_paper_id","title","authors","year","venue","abstract","source","categories","citation_count","url","doi","published_date","crawled_date","keep","notes"
"doi:10.1109/SC41404.2022.00025","2403.16288","585d820c5d493958dadfb93101be117447f8cc1c","Study of Workload Interference with Intelligent Routing on Dragonfly","Yao Kang","2022","SC","Dragonfly interconnect is a crucial network technol-ogy for supercomputers. To support exascale systems, network resources are shared such that links and routers are not dedicated to any node pair. While link utilization is increased, workload performance is often offset by network contention. Recently, intelligent routing built on reinforcement learning demonstrates higher network throughput with lower packet latency. However, its effectiveness in reducing workload interference is unknown. In this work, we present extensive network simulations to study multi-workload contention under different routing mechanisms, intelligent routing and adaptive routing, on a large-scale Dragon-fly system. We develop an enhanced network simulation toolkit, along with a suite of workloads with distinctive communication patterns. We also present two metrics to characterize application communication intensity. Our analysis focuses on examining how different workloads interfere with each other under different routing mechanisms by inspecting both application-level and network-level metrics. Several key insights are made from the analysis.","dblp","Computer Science","14","https://doi.org/10.1109/SC41404.2022.00025","10.1109/SC41404.2022.00025","2022-11-01","2026-04-08","",""
"doi:10.1109/SC41404.2022.00026","","7a2806479115502ff6c24ee20e4de36109371103","SERVIZ: A Shared In Situ Visualization Service","Srinivasan Ramesh","2022","SC","Inline and in transit visualization are popular in situ visualization models for high performance computing (HPC) applications. Inline visualization is invoked through a library call on the HPC application (simulation), while in transit methods invoke a visualization module running on in transit resources. In transit methods can offer better efficiency than inline by running the visualization at a lower concurrency level than the simulation. State-of-the-art in transit schemes are limited to employing a dedicated in transit resource for every simulation. The resulting idle time on the in transit resource can severely limit the cost savings over inline methods. This research proposes SERVIZ, an in transit visualization service that can be shared amongst multiple simulations to reduce idle time, thereby efficiently using in transit resources. SERVIZ achieves cost savings of up to 26% over inline and up to $4\mathbf{x}$ reduction in idle time compared to a dedicated in transit implementation.","dblp","Computer Science","7","https://doi.org/10.1109/SC41404.2022.00026","10.1109/SC41404.2022.00026","2022-11-01","2026-04-08","",""
"doi:10.1109/SC41404.2022.00027","","dfa329adfdf3bc21b4503a5237f4a55225a78d35","DayDream: Executing Dynamic Scientific Workflows on Serverless Platforms with Hot Starts","Rohan Basu Roy","2022","SC","HPC applications are increasingly being designed as dynamic workflows for the ease of development and scaling. This work demonstrates how the serverless computing model can be leveraged for efficient execution of complex, real-world scientific workflows, although serverless computing was not originally designed for executing scientific workflows. This work characterizes, quantifies, and improves the execution of three real-world, complex, dynamic scientific workflows: ExaFEL (workflow for investigating the molecular structures via X-Ray diffraction), Cosmoscout-Vr(workflow for large scale virtual reality simulation), and Core Cosmology Library (a cosmology workflow for investigating dark matter). The proposed technique, DayDream, employs the hot start mechanism for warming up the components of the workflows by decoupling the runtime environment from the component function code to mitigate cold start overhead. DayDream optimizes the service time and service cost jointly to reduce the service time by 45% and service cost by 23% over the state-of-the-art HPC workload manager.","dblp","Computer Science","35","https://doi.org/10.1109/SC41404.2022.00027","10.1109/SC41404.2022.00027","2022-11-01","2026-04-08","",""
"doi:10.1109/SC41404.2022.00028","","844a325624d21b1869cf4241f5fea4e75282741c","LabStor: A Modular and Extensible Platform for Developing High-Performance, Customized I/O Stacks in Userspace","Luke Logan","2022","SC","Traditionally, I/O systems have been developed within the confines of a centralized OS kernel. This led to monolithic and rigid storage systems that are limited by low development speed, expressiveness, and performance. Various assumptions are imposed including reliance on the UNIX-file abstraction, the POSIX standard, and a narrow set of I/O policies. However, this monolithic design philosophy makes it difficult to develop and deploy new I/O approaches to satisfy the rapidly-evolving I/O requirements of modern scientific applications. To this end, we propose LabStor: a modular and extensible platform for developing high-performance, customized I/O stacks. Single-purpose I/O modules (e.g, I/O schedulers) can be developed in the comfort of userspace and released as plug-ins, while end-users can compose these modules to form workload- and hardware-specific I/O stacks. Evaluations show that by switching to a fully modular design, tailored I/O stacks can yield performance improvements of up to 60% in various applications.","dblp","Computer Science","7","https://doi.org/10.1109/SC41404.2022.00028","10.1109/SC41404.2022.00028","2022-11-01","2026-04-08","",""
"doi:10.1109/SC41404.2022.00029","","d7dc2ea9c8bdcc32fc70bb05d4e8bfc683d01d02","Towards Scalable Resource Management for Supercomputers","Yiqin Dai","2022","SC","Today's supercomputers offer massive computation resources to execute a large number of user jobs. Effectively managing such large-scale hardware parallelism and workloads is essential for supercomputers. However, existing HPC resource management (RM) systems fail to capitalize on the hardware parallelism by following a centralized design used decades ago. They give poor scalability and inefficient performance on today's supercomputers, which will worsen in exascale computing. We present ESlurm, a better RM for supercomputers. As a departure from existing HPC RMs, ESlurm implements a distributed communication structure. It employs a new communication tree strategy and uses job runtime estimation to improve communications and job scheduling efficiency. ESlurm is deployed into production in a real supercomputer. We evaluate ESlurm on up to 20K nodes. Compared to state-of-the-art RM solutions, ESlurm exhibits better scalability, significantly reducing the resource usage of master nodes and improving data transfer and job scheduling efficiency by a large margin.","dblp","Computer Science","15","https://doi.org/10.1109/SC41404.2022.00029","10.1109/SC41404.2022.00029","2022-11-01","2026-04-08","",""
"doi:10.1109/SC41404.2022.00030","2206.08301","125ef3b1d566163a143987ce264fe764ad012596","Deinsum: Practically I/O Optimal Multi-Linear Algebra","Alexandros Nikolaos Ziogas","2022","SC","Multilinear algebra kernel performance on modern massively-parallel systems is determined mainly by data movement. However, deriving data movement-optimal distributed schedules for programs with many high-dimensional inputs is a notoriously hard problem. State-of-the-art libraries rely on heuristics and often fall back to suboptimal tensor folding and BLAS calls. We present Deinsum, an automated framework for distributed multilinear algebra computations expressed in Einstein notation, based on rigorous mathematical tools to address this problem. Our framework automatically derives data movement-optimal tiling and generates corresponding distributed schedules, further optimizing the performance of local computations by increasing their arithmetic intensity. To show the benefits of our approach, we test it on two important tensor kernel classes: Matricized Tensor Times Khatri-Rao Products and Tensor Times Matrix chains. We show performance results and scaling on the Piz Daint supercomputer, with up to 19x speedup over state-of-the-art solutions on 512 nodes.","dblp","Computer Science","6","https://doi.org/10.1109/SC41404.2022.00030","10.1109/SC41404.2022.00030","2022-06-16","2026-04-08","",""
"doi:10.1109/SC41404.2022.00031","","488a311e997505a08ea292212839cf4fe43f0e41","Addressing Irregular Patterns of Matrix Computations on GPUs and Their Impact on Applications Powered by Sparse Direct Solvers","Ahmad Abdelfattah","2022","SC","Many scientific applications rely on sparse direct solvers for their numerical robustness. However, performance optimization for these solvers remains a challenging task, especially on GPUs. This is due to workloads of small dense matrices that are different in size. Matrix decompositions on such irregular workloads are rarely addressed on GPUs. This paper addresses irregular workloads of matrix computations on GPUs, and their application to accelerate sparse direct solvers. We design an interface for the basic matrix operations supporting problems of different sizes. The interface enables us to develop irrLU-GPU, an LU decomposition on matrices of different sizes. We demonstrate the impact of irrLU-GPU on sparse direct LU solvers using NVIDIA and AMD GPUs. Experimental results are shown for a sparse direct solver based on a multifrontal sparse LU decomposition applied to linear systems arising from the simulation, using finite element discretization on unstructured meshes, of a high-frequency indefinite Maxwell problem.","dblp","Computer Science","7","https://doi.org/10.1109/SC41404.2022.00031","10.1109/SC41404.2022.00031","2022-11-01","2026-04-08","",""
"doi:10.1109/SC41404.2022.00032","","b2abdd549ef01dbb9d9500556f42ccc1b1b4b89e","Accelerating Elliptic Curve Digital Signature Algorithms on GPUs","Zonghao Feng","2022","SC","The Elliptic Curve Digital Signature Algorithm (ECDSA) is an essential building block of various cryptographic protocols. In particular, most blockchain systems adopt it to ensure transaction integrity. However, due to its high computational intensity, ECDSA is often the performance bottleneck in blockchain transaction processing. Recent work has accelerated ECDSA algorithms on the CPU; in contrast, success has been limited on the GPU, which has great potential for parallelization but is challenging for implementing elliptic curve functions. In this paper, we propose RapidEC, a GPU-based ECDSA implementation for SM2, a popular elliptic curve. Specifically, we design architecture-aware parallel primitives for elliptic curve point operations, and parallelize the processing of a single SM2 request as well as batches of requests. Consequently, our GPU-based RapidEC outperformed the state-of-the-art CPU-based algorithm by orders of magnitude. Additionally, our GPU-based modular arithmetic functions as well as point operation primitives can be applied to other computation tasks.","dblp","Computer Science","4","https://doi.org/10.1109/SC41404.2022.00032","10.1109/SC41404.2022.00032","2022-11-01","2026-04-08","",""
"doi:10.1109/SC41404.2022.00033","","8eb7191e3611f1724965387576bd93363ff82bec","CA3DMM: A New Algorithm Based on a Unified View of Parallel Matrix Multiplication","Hua Huang","2022","SC","This paper presents the Communication-Avoiding 3D Matrix Multiplication (CA3DMM) algorithm, a simple and novel algorithm that has optimal or near-optimal communication cost. CA3DMM is based on a unified view of parallel matrix multiplication. Such a view generalizes 1D, 2D, and 3D matrix multiplication algorithms to reduce the data exchange volume for different shapes of input matrices. CA3DMM further minimizes the actual communication costs by carefully organizing its communication patterns. CA3DMM is much simpler than some other generalized 3D algorithms, and CA3DMM does not require low-level optimization. Numerical experiments show that CA3DMM has good parallel scalability and has similar or better performance when compared to state-of-the-art PGEMM implementations for a wide range of matrix dimensions and number of processes.","dblp","Computer Science","4","https://doi.org/10.1109/SC41404.2022.00033","10.1109/SC41404.2022.00033","2022-11-01","2026-04-08","",""
"doi:10.1109/SC41404.2022.00034","","ab63166111c0c1cf7b65429bccfaff38ff2c15c6","Symmetric Block-Cyclic Distribution: Fewer Communications Leads to Faster Dense Cholesky Factorization","Olivier Beaumont","2022","SC","We consider the distributed Cholesky factorization on homogeneous nodes. Inspired by recent progress on asymptotic lower bounds on the total communication volume required to perform Cholesky factorization, we present an original data distribution, Symmetric Block Cyclic (SBC), designed to take advantage of the symmetry of the matrix. We prove that SBC reduces the overall communication volume between nodes by a factor of square root of 2 compared to the standard 2D block-cyclic distribution. SBC can easily be implemented within the paradigm of task-based runtime systems. Experiments using the Chameleon library over the StarPU runtime system demonstrate that the SBC distribution reduces the communication volume as expected, and also achieves better performance and scalability than the classical 2D block-cyclic allocation scheme in all configurations. We also propose a 2.5D variant of SBC and prove that it further improves the communication and performance benefits.","dblp","Computer Science","8","https://doi.org/10.1109/SC41404.2022.00034","10.1109/SC41404.2022.00034","2022-11-01","2026-04-08","",""
"doi:10.1109/SC41404.2022.00035","","766d0fb80e5c73b39b019e0fd7f38b3b717539a4","Scalable Distributed High-Order Stencil Computations","Mathias Jacquelin","2022","SC","Stencil computations lie at the heart of many scientific and industrial applications. Stencil algorithms pose several challenges on machines with cache based memory hierarchy, due to low re-use of memory accesses if special care is not taken to optimize them. This work shows that for stencil computation a novel algorithm that leverages a localized communication strategy effectively exploits the second generation Cerebras Wafer-Scale Engine (WSE-2), which has no cache hierarchy. This study focuses on a 25-point stencil finite-difference method for the 3D wave equation, a kernel frequently used in earth modeling as numerical simulation. In essence, the algorithm trades memory accesses for data communication and takes advantage of the fast communication fabric provided by the architecture. The algorithm -historically memory-bound- becomes compute-bound. This allows the implementation to achieve near perfect weak scaling, reaching up to 503 TFLOPs on WSE-2, a figure that only full clusters can eventually yield.","dblp","Computer Science","27","https://doi.org/10.1109/SC41404.2022.00035","10.1109/SC41404.2022.00035","2022-11-01","2026-04-08","",""
"doi:10.1109/SC41404.2022.00036","","d0acd6475d2460fb8247909d6dd11fb97045d096","Memory Optimizations in an Array Language","Philip Munksgaard","2022","SC","We present a technique for introducing and op-timizing the use of memory in a functional array language, aimed at GPU execution, that supports correct-by-construction parallelism. Using linear memory access descriptors as building blocks, we define a notion of memory in the compiler IR that enables cost-free change-of-layout transformations (e.g., slicing, transposition), whose results can even be carried across control flow such as ifs/loops without manifestation in memory. The memory notion allows a graceful transition to an unsafe IR that is automatically optimized (1) to mix reads and writes to the same array inside a parallel construct, and (2) to map semantically different arrays to the same memory block. The result is code similar to what imperative users would write. Our evaluation shows that our optimizations have significant impact (1.1 x -2 x) and result in performance competitive to hand-written code from challenging benchmarks, such as Rodinia's NW, LUD, Hotspot.","dblp","Computer Science","11","https://doi.org/10.1109/SC41404.2022.00036","10.1109/SC41404.2022.00036","2022-11-01","2026-04-08","",""
"doi:10.1109/SC41404.2022.00037","","a9c270ca04954427deee8d41b495947c50790f3c","Vectorizing Sparse Matrix Computations with Partially-Strided Codelets","Kazem Cheshmi","2022","SC","The compact data structures and irregular computation patterns in sparse matrix computations introduce challenges to vectorizing these codes. Available approaches primarily vec-torize strided computation regions of a sparse code. In this work, we propose a locality-based codelet mining (LCM) algorithm that efficiently searches for strided and partially strided regions in sparse matrix computations for vectorization. We also present a classification of partially strided codelets and a differentiation-based approach to generate codelets from memory accesses in the sparse computation. LCM is implemented as an inspector-executor framework called LCM I/E that generates vectorized code for the sparse matrix-vector multiplication (SpMV), sparse matrix times dense matrix (SpMM), and sparse triangular solver (SpTRSV). LCM I/E outperforms the MKL library with an average speedup of 1.67x, 4.1x, and 1.75x for SpMV, SpTRSV, and SpMM, respectively. It is also faster than the state-of-the-art inspector-executor framework Sympiler [1] for the SpTRSV kernel with an average speedup of 1.9 x.","dblp","Computer Science","17","https://doi.org/10.1109/SC41404.2022.00037","10.1109/SC41404.2022.00037","2022-11-01","2026-04-08","",""
"doi:10.1109/SC41404.2022.00038","","66f2cb1048cbfc309eb829c3cbd9b833b1e8976b","Finding Inputs that Trigger Floating-Point Exceptions in GPUs via Bayesian Optimization","Ignacio Laguna","2022","SC","Testing code for floating-point exceptions is crucial as exceptions can quickly propagate and produce unreliable numerical answers. The state-of-the-art to test for floating-point exceptions in GPUs is quite limited and solutions require the ap-plication's source code, which precludes their use in accelerated libraries where the source is not publicly available. We present an approach to find inputs that trigger floating-point exceptions in black-box GPU functions, i.e., functions where the source code and information about input bounds are unavailable. Our approach is the first to use Bayesian optimization (BO) to identify such inputs and uses novel strategies to overcome the challenges that arise in applying BO to this problem. We implement our approach in the XSCOPE framework and demonstrate it on 58 functions from the CUDA Math Library and functions from ten HPC programs. XSCOPE is able to identify inputs that trigger exceptions in about 72% of the tested functions.","dblp","Computer Science","11","https://doi.org/10.1109/SC41404.2022.00038","10.1109/SC41404.2022.00038","2022-11-01","2026-04-08","",""
"doi:10.1109/SC41404.2022.00039","2211.05118","8dc200c2672c55ef9573a8206c158f1522724c55","Mapping Out the HPC Dependency Chaos","Farid Zakaria","2022","SC","High Performance Computing (HPC) software stacks have become complex, with the dependencies of some applications numbering in the hundreds. Packaging, distributing, and administering software stacks of that scale is a complex undertaking anywhere. HPC systems deal with esoteric compilers, hardware, and a panoply of uncommon combinations. In this paper, we explore the mechanisms available for packaging software to find its own dependencies in the context of a taxonomy of software distribution, and discuss their benefits and pitfalls. We discuss workarounds for some common problems caused by using these composed stacks and introduce Shrinkwrap: A solution to producing binaries that directly load their dependencies from precise locations and in a precise order. Beyond simplifying the use of the binaries, this approach also speeds up loading as much as 7× for a large dynamically-linked MPI application in our evaluation.","dblp","Computer Science","9","https://doi.org/10.1109/SC41404.2022.00039","10.1109/SC41404.2022.00039","2022-10-22","2026-04-08","",""
"doi:10.1109/SC41404.2022.00040","2210.08404","85c1dbbe7bc046401bdd2ac1b408f6c5646177aa","Using Answer Set Programming for HPC Dependency Solving","Todd Gamblin","2022","SC","Modern scientific software stacks have become extremely complex, using many programming models and libraries to exploit a growing variety of GPUs and accelerators. Package managers can mitigate this complexity using dependency solvers, but they are reaching their limits. Finding compatible dependency versions is NP-complete, and modeling the semantics of package compatibility modulo build-time options, GPU runtimes, flags, and other parameters is extremely difficult. Within this enormous configuration space, defining a “good” configuration is daunting. We tackle this problem using Answer Set Programming (ASP), a declarative model for combinatorial search problems. We show, using the Spack package manager, that ASP programs can concisely express the compatibility rules of HPC software stacks and provide strong quality-of-solution guarantees. Using ASP, we can mix new builds with preinstalled binaries, and solver performance is acceptable even when considering tens of thousands of packages.","dblp","Computer Science","13","https://doi.org/10.1109/SC41404.2022.00040","10.1109/SC41404.2022.00040","2022-10-16","2026-04-08","",""
"doi:10.1109/SC41404.2022.00041","2111.14345","04029cb70ab0441cd9711c3ad2a15e5d6a85b7ff","SPATL: Salient Parameter Aggregation and Transfer Learning for Heterogeneous Federated Learning","Sixing Yu","2022","SC","Federated learning (FL) facilitates the training and deploying AI models on edge devices. Preserving user data privacy in FL introduces several challenges, including expensive communication costs, limited resources, and data heterogeneity. In this paper, we propose SPATL, an FL method that addresses these issues by: (a) introducing a salient parameter selection agent and communicating selected parameters only; (b) splitting a model into a shared encoder and a local predictor, and transferring its knowledge to heterogeneous clients via the locally customized predictor. Additionally, we leverage a gradient control mechanism to further speed up model convergence and increase robustness of training processes. Experiments demonstrate that SPATL reduces communication overhead, accelerates model inference, and enables stable training processes with better results compared to state-of-the-art methods. Our approach reduces communication cost by up to 86.45%, accelerates local inference by reducing up to 39.7% FLOPs on VGG-11, and requires 7.4× less communication overhead when training ResNet-20.11Code is available at: https://github.com/yusx-swapp/SPATL","dblp","Computer Science","27","https://doi.org/10.1109/SC41404.2022.00041","10.1109/SC41404.2022.00041","2021-11-29","2026-04-08","",""
"doi:10.1109/SC41404.2022.00042","2209.06979","99934ef57a75f49afe68736cbc7dbf480687b552","Efficient Quantized Sparse Matrix Operations on Tensor Cores","Shigang Li","2022","SC","The exponentially growing model size drives the continued success of deep learning, but it brings prohibitive computation and memory cost. From the algorithm perspective, model sparsification and quantization have been studied to alleviate the problem. From the architecture perspective, hardware vendors provide Tensor cores for acceleration. However, it is very challenging to gain practical speedups from sparse, low-precision matrix operations on Tensor cores, because of the strict requirements for data layout and lack of support for efficiently manipulating the low-precision integers. We propose Magicube, a high-performance sparse-matrix library for low-precision integers on Tensor cores. Magicube supports SpMM and SDDMM, two major sparse operations in deep learning with mixed precision. Experimental results on an NVIDIA A100show that Magicube achieves on average 1.44x (up to 2.37x) speedup over the vendor-optimized library for sparse kernels, and 1.43x speedup over the state-of-the-art with a comparable accuracy for end-to-end sparse Transformer inference.","dblp","Computer Science","50","https://doi.org/10.1109/SC41404.2022.00042","10.1109/SC41404.2022.00042","2022-09-14","2026-04-08","",""
