"paper_id","arxiv_id","s2_paper_id","title","authors","year","venue","abstract","source","categories","citation_count","url","doi","published_date","crawled_date","keep","notes"
"doi:10.1109/SC41404.2022.00043","2110.05722","952305d9bbdaeaf7adb7ef12b94f221570c5d52d","LightSeq2: Accelerated Training for Transformer-Based Models on GPUs","Xiaohui Wang","2022","SC","Transformer-based neural models are used in many AI applications. Training these models is expensive, as it takes huge GPU resources and long duration. It is challenging because typical data like sentences have variable lengths, and Transformer's computation patterns are more complex than convolutional neural networks. Existing systems either only focus on model inference or optimization for only BERT-like encoder models. In this paper, we present LightSeq2, a system to accelerate training for a general family of Transformer models on GPUs. We propose a series of GPU optimization techniques tailored to the specific computation flow and memory access patterns of Transformer models. LightSeq2 supports many model architectures, including BERT (encoder-only), GPT (decoder-only), Transformer (encoder-decoder), and vision Transformer. Our experiments for a variety of models and benchmarks show that LightSeq2 is consistently faster (1.4-3.5 x) than previous systems on different GPUs. In particular, it gains 308 % training speedup compared with existing systems on a large public machine translation benchmark (WMTI4 English-German).","dblp","Computer Science","37","https://doi.org/10.1109/SC41404.2022.00043","10.1109/SC41404.2022.00043","2021-10-12","2026-04-08","",""
"doi:10.1109/SC41404.2022.00044","","38621d7f2f792dd8025ef3e7dd0374fb7aacee5a","CoGNN: Efficient Scheduling for Concurrent GNN Training on GPUs","Qingxiao Sun","2022","SC","Graph neural networks (GNNs) suffer from low GPU utilization due to frequent memory accesses. Existing concurrent training mechanisms cannot be directly adapted to GNNs because they fail to consider the impact of input irregularity. This requires pre-profiling the memory footprint of concurrent tasks based on input dimensions to ensure successful co-location on GPU. Moreover, massive training tasks generated from scenarios such as hyper-parameter tuning require flexible scheduling strategies. To address these problems, we propose CoGNN that enables efficient management of GNN training tasks on GPUs. Specifically, the CoGNN organizes the tasks in a queue and estimates the memory consumption of each task based on cost functions at operator basis. In addition, the CoGNN implements scheduling policies to generate task groups, which are iteratively submitted for execution. The experiment results show that the CoGNN can achieve shorter completion and queuing time for training tasks from diverse GNN models.","dblp","Computer Science","15","https://doi.org/10.1109/SC41404.2022.00044","10.1109/SC41404.2022.00044","2022-11-01","2026-04-08","",""
"doi:10.1109/SC41404.2022.00045","2211.00717","c6e45bed75fc52041e0d6f1cd55c2c4000566957","Using Unused: Non-Invasive Dynamic FaaS Infrastructure with HPC-Whisk","Bartlomiej Przybylski","2022","SC","Modern HPC workload managers and their careful tuning contribute to the high utilization of HPC clusters. However, due to inevitable uncertainty it is impossible to completely avoid node idleness. Although such idle slots are usually too short for any HPC job, they are too long to ignore them. Function-as-a-Service (FaaS) paradigm promisingly fills this gap, and can be a good match, as typical FaaS functions last seconds, not hours. Here we show how to build a FaaS infrastructure on idle nodes in an HPC cluster in such a way that it does not affect the performance of the HPC jobs significantly. We dynamically adapt to a changing set of idle physical machines, by integrating open-source software Slurm and OpenWhisk. We designed and implemented a prototype solution that allowed us to cover up to 90% of the idle time slots on a 50k-core cluster that runs production workloads.","dblp","Computer Science","12","https://doi.org/10.1109/SC41404.2022.00045","10.1109/SC41404.2022.00045","2022-11-01","2026-04-08","",""
"doi:10.1109/SC41404.2022.00046","","f0f891888058853f8f291c51d09ce2d331dc8121","Canary: Fault-Tolerant FaaS for Stateful Time-Sensitive Applications","Moiz Arif","2022","SC","Function-as-a-Service (FaaS) platforms have recently gained rapid popularity. Many stateful applications have been migrated to FaaS platforms due to their ease of deployment, scalability, and minimal management overhead. However, failures in FaaS have not been thoroughly investigated, thus making these desirable platforms unreliable for guaranteeing function execution and ensuring performance requirements. In this paper, we propose Canary, a highly resilient and fault-tolerant framework for FaaS that mitigates the impact of failures and reduces the overhead of function restart. Canary utilizes replicated container runtimes and application-level checkpoints to reduce application recovery time over FaaS platforms. Our evaluations using representative stateful FaaS applications show that Canary reduces the application recovery time and dollar cost by up to 83% and 12%, respectively over the default retry-based strategy. Moreover, it improves application availability with an additional average execution time and cost overhead of 14% and 8%, respectively, as compared to the ideal failure-free execution.","dblp","Computer Science","12","https://doi.org/10.1109/SC41404.2022.00046","10.1109/SC41404.2022.00046","2022-11-01","2026-04-08","",""
"doi:10.1109/SC41404.2022.00047","2209.01709","39d6e833bbbbb9257e7550ecb632333986b83f9a","SFS: Smart OS Scheduling for Serverless Functions","Yuqi Fu","2022","SC","Serverless computing enables a new way of building and scaling cloud applications by allowing developers to write fine-grained serverless or cloud functions. The execution duration of a cloud function is typically short-ranging from a few milliseconds to hundreds of seconds. However, due to resource contentions caused by public clouds' deep consolidation, the function execution duration may get significantly prolonged and fail to accurately account for the function's true resource usage. We observe that the function duration can be highly unpredictable with huge amplification of more than 50× for an open-source FaaS platform (OpenLambda). Our experiments show that the OS scheduling policy of cloud functions' host server can have a crucial impact on performance. The default Linux scheduler, CFS (Completely Fair Scheduler), being oblivious to workloads, frequently context-switches short functions, causing a turnaround time that is much longer than their service time. We propose SFS (Smart Function Scheduler), which works entirely in the user space and carefully orchestrates existing Linux FIFO and CFS schedulers to approximate Shortest Remaining Time First (SRTF). SFS uses two-level scheduling that seamlessly combines a new FILTER policy with Linux CFS, to trade off increased duration of long functions for significant performance improvement for short functions. We implement SFS in the Linux user space and port it to OpenLambda. Evaluation results show that SFS significantly improves short functions' duration with a small impact on relatively longer functions, compared to CFS.","dblp","Computer Science","29","https://doi.org/10.1109/SC41404.2022.00047","10.1109/SC41404.2022.00047","2022-09-04","2026-04-08","",""
"doi:10.1109/SC41404.2022.00048","2208.11469","7e3b8a70d72a0ba4c7f189991d912822a1f2959d","ProbGraph: High-Performance and High-Accuracy Graph Mining with Probabilistic Set Representations","Maciej Besta","2022","SC","Important graph mining problems such as Clustering are computationally demanding. To significantly accelerate these problems, we propose ProbGraph: a graph representation that enables simple and fast approximate parallel graph mining with strong theoretical guarantees on work, depth, and result accuracy. The key idea is to represent sets of vertices using probabilistic set representations such as Bloom filters. These representations are much faster to process than the original vertex sets thanks to vectorizability and small size. We use these representations as building blocks in important parallel graph mining algorithms such as Clique Counting or Clustering. When enhanced with ProbGraph, these algorithms significantly outperform tuned parallel exact baselines (up to nearly 50 x on 32 cores) while ensuring accuracy of more than 90% for many input graph datasets. Our novel bounds and algorithms based on probabilistic set representations with desirable statistical properties are of separate interest for the data analytics community. Proofs of theorems & more results: http://arxiv.org/abs/2208.11469","dblp","Computer Science","13","https://doi.org/10.1109/SC41404.2022.00048","10.1109/SC41404.2022.00048","2022-08-24","2026-04-08","",""
"doi:10.1109/SC41404.2022.00049","","5260729df0136607caf81dff33bd94ee7654bebb","Blaze: Fast Graph Processing on Fast SSDs","Juno Kim","2022","SC","Out-of-core graph processing is an attractive solution for processing very large graphs that do not fit in the memory of a single machine. The new class of ultra-low-latency SSDs should expand the impact and utility of out-of-core graph processing systems. However, current out-of-core systems cannot fully leverage the high IOPS these devices can deliver. We introduce Blaze, a new out-of-core graph processing system optimized for ultra-low-latency SSDs. Blaze offers high-performance out-of-core graph analytics by constantly saturating these fast SSDs with a new scatter-gather technique called online binning that allows value propagation among graph vertices without atomic synchronization. Blaze offers succinct APIs to allow programmers to write efficient out-of-core graph algorithms without the burden to manage complex IO executions. Our evaluation shows that Blaze outperforms current out-of-core systems by a wide margin on seven datasets and a set of representative graph queries on Intel Optane SSD.","dblp","Computer Science","14","https://doi.org/10.1109/SC41404.2022.00049","10.1109/SC41404.2022.00049","2022-11-01","2026-04-08","",""
"doi:10.1109/SC41404.2022.00050","","13cce4bbc706426f67558dd7bf41136513c3e2ce","GraphFly: Efficient Asynchronous Streaming Graphs Processing via Dependency-Flow","Dan Chen","2022","SC","Existing streaming graph processing systems typically adopt two phases of refinement and recomputation to ensure the correctness of the incremental computation. However, severe redundant memory accesses exist due to the unnecessary synchronization among independent edge updates. In this paper, we present GraphFly, a high-performance asynchronous streaming graph processing system based on dependency-flows. GraphFly features three key designs: 1) Dependency trees (D-trees), which helps quickly identify independent graph updates with low cost; 2) Dependency-flow based processing model, which exploits the space-time dependent co-scheduling for cache efficiency; 3) Specialized graph data layout, which further reduces memory accesses. We evaluate GraphFly, and the results show that GraphFly significantly outperforms state-of-the-art systems KickStarter and GraphBolt by 5.81× and 1.78× on average, respectively. Also, GraphFly scales well with different sizes of update batch and compute resources.","dblp","Computer Science","18","https://doi.org/10.1109/SC41404.2022.00050","10.1109/SC41404.2022.00050","2022-11-01","2026-04-08","",""
"doi:10.1109/SC41404.2022.00051","2207.00032","c022f75b00d795c6297d6a9ea948856ea4d365a1","DeepSpeed- Inference: Enabling Efficient Inference of Transformer Models at Unprecedented Scale","Reza Yazdani Aminabadi","2022","SC","The landscape of transformer model inference is increasingly diverse in model size, model characteristics, latency and throughput requirements, hardware requirements, etc. With such diversity, designing a versatile inference system is challenging. DeepSpeed-Inference addresses these challenges by (1) a multi-GPU inference solution to minimize latency while maximizing throughput for both dense and sparse transformers when the model fits in aggregate GPU memory, and (2) a heterogeneous inference solution that leverages CPU/NVMe/GPU memory to enable high-throughput inference for models larger than aggregate GPU memory. DeepSpeed-Inference reduces latency by 6.4× and increases throughput by 1.5 ×over the state-of-the-art. It enables trillion parameter scale inference under real-time latency constraints by leveraging hundreds of GPUs, an unprecedented scale for inference. It can inference 25 ×larger models than with GPU-only solutions, while delivering a high throughput of 84 TFLOPS (over 50% of A6000 peak).","dblp","Computer Science","554","https://doi.org/10.1109/SC41404.2022.00051","10.1109/SC41404.2022.00051","2022-06-30","2026-04-08","",""
"doi:10.1109/SC41404.2022.00052","","29edee9ceb217b1da4e9fb60a41c996ec9745d7f","HyLo: A Hybrid Low-Rank Natural Gradient Descent Method","Baorun Mu","2022","SC","This work presents a Hybrid Low-Rank Natural Gradient Descent method, called HyLo, that accelerates the training time of deep neural networks. Natural gradient descent (NGD) requires computing the inverse of the Fisher information matrix (FIM), which is typically expensive at largescale. Kronecker factorization methods such as KFAC attempt to improve NGD's running time by approximating the FIM with Kronecker factors. However, the size of Kronecker factors increases quadratically as the model size grows. Instead, in HyLo, we use the Sherman-Morrison-Woodbury variant of NGD (SNGD) and propose a reformulation of SNGD to resolve its scalability issues. HyLo uses a computationally-efficient low-rank factorization to achieve superior timing for Fisher inverses. We evaluate HyLo on large models including ResNet-50, U-Net, and ResNet-32 on up to 64 GPUs. HyLo converges 1.4×-2.1× faster than the state-of-the-art distributed implementation of KFAC and reduces the computation and communication time up to 350 × and 10.7× on ResNet-50.","dblp","Computer Science","6","https://doi.org/10.1109/SC41404.2022.00052","10.1109/SC41404.2022.00052","2022-11-01","2026-04-08","",""
"doi:10.1109/SC41404.2022.00053","","ca880d29fe2e575458edab63f57c4871a0057a59","AI for Quantum Mechanics: High Performance Quantum Many-Body Simulations via Deep Learning","Xuncheng Zhao","2022","SC","Solving quantum many-body problems is one of the most fascinating research fields in condensed matter physics. An efficient numerical method is crucial to understand the mechanism of novel physics, such as the high Tc superconductivity, as one has to find the optimal solution in the exponentially large Hilbert space. The development of Artificial Intelligence (AI) provides a unique opportunity to solve the quantum many-body problems, but there is still a large gap from the goal. In this work, we present a novel computational framework, and adapt it to the Sunway supercomputer. With highly efficient scalability up to 40 million heterogeneous cores, we can drastically increase the number of variational parameters, which greatly improves the accuracy of the solutions. The investigations of the spin-1/2 J1-J2 model and the t-J model achieve unprecedented accuracy and time-to-solution far beyond the previous state of the art.","dblp","Computer Science","7","https://doi.org/10.1109/SC41404.2022.00053","10.1109/SC41404.2022.00053","2022-11-01","2026-04-08","",""
"doi:10.1109/SC41404.2022.00054","","92d35ab671fb6dc16ac44ef1dcd92f0bb2033462","UniQ: A Unified Programming Model for Efficient Quantum Circuit Simulation","Chen Zhang","2022","SC","Quantum circuit simulation is critical for verifying quantum computers. Given exponential complexity in the simulation, existing simulators use different architectures to accelerate the simulation. However, due to the variety of both simulation methods and modern architectures, it is challenging to design a high-performance yet portable simulator. In this work, we propose UniQ, a unified programming model for multiple simulation methods on various hardware architectures. We provide a unified application abstraction to describe different applications, and a unified hierarchical hardware abstraction upon different hardware. Based on these abstractions, UniQ can perform various circuit transformations without being aware of either concrete application or architecture detail, and generate high-performance execution schedules on different platforms without much human effort. Evaluations on CPU, GPU, and Sunway platforms show that UniQ can accelerate quantum circuit simulation by up to 28.59× (4.47× on average) over state-of-the-art frameworks, and successfully scale to 399,360 cores on 1,024 nodes.","dblp","Computer Science","17","https://doi.org/10.1109/SC41404.2022.00054","10.1109/SC41404.2022.00054","2022-11-01","2026-04-08","",""
"doi:10.1109/SC41404.2022.00055","","6c8d5a08ff6d2c24d5af63e16962282f56995f02","Scalable Irregular Parallelism with GPUs: Getting CPUs Out of the Way","Yuxin Chen","2022","SC","We present Atos, a dynamic scheduling framework for multi-node-GPU systems that supports PGAS-style lightweight one-sided memory operations within and between nodes. Atos's lightweight GPU-to-GPU communication enables latency hiding and can smooth the interconnection usage for bisection-limited problems. These benefits are significant for dynamic, irregular applications that often involve fine-grained communication at unpredictable times and without predetermined patterns. Some principles for high performance: (1) do not involve the CPU in the communication control path; (2) allow GPU communication within kernels, addressing memory consistency directly rather than relying on synchronization with the CPU; (3) perform dynamic communication aggregation when interconnections have limited bandwidth. By lowering the overhead of communication and allowing it within GPU kernels, we support large, high-utilization GPU kernels but with more frequent communication. We evaluate Atos on two irregular problems: Breadth-First-Search and PageRank. Atos outperforms the state-of-the-art graph libraries Gunrock, Groute and Galois on both single-node-multi-GPU and multi-node-GPU settings.","dblp","Computer Science","11","https://doi.org/10.1109/SC41404.2022.00055","10.1109/SC41404.2022.00055","2022-11-01","2026-04-08","",""
"doi:10.1109/SC41404.2022.00056","","2d8574e22e21d6eaf32f8f1414111f060dc4c28c","Parla: A Python Orchestration System for Heterogeneous Architectures","Hochan Lee","2022","SC","Python's ease of use and rich collection of numeric libraries make it an excellent choice for rapidly developing scientific applications. However, composing these libraries to take advantage of complex heterogeneous nodes is still difficult. To simplify writing multi-device code, we created Parla, a heterogeneous task-based programming framework that fully supports Python's scientific programming stack. Parla's API is based on Python decorators and allows users to wrap code in Parla tasks for parallel execution. Parla arrays enable automatic movement of data between devices. The Parla runtime handles resource-aware mapping, scheduling, and execution of tasks. Compared to other Python tasking systems, Parla is unique in its parallelization of tasks within a single process, its GPU context and resource-aware runtime, and its design around gradual adoption to provide easy migration of and integration into existing Python applications. We show that Parla can achieve performance competitive with hand-optimized code while improving ease of development.","dblp","Computer Science","9","https://doi.org/10.1109/SC41404.2022.00056","10.1109/SC41404.2022.00056","2022-11-01","2026-04-08","",""
"doi:10.1109/SC41404.2022.00057","","4badcfd0f63b309f4d447af3f06ce3a0199158d2","VSGM: View-Based GPU-Accelerated Subgraph Matching on Large Graphs","Guanxian Jiang","2022","SC","Subgraph matching is a fundamental building block in graph analytics. Due to its high time complexity, GPU-based solutions have been proposed for sub graph matching. Most existing GPU-based works can only cope with relatively small graphs that fit in GPU memory. To support efficient subgraph matching on large graphs, we propose a view-based method to hide communication overhead and improve GPU utilization. We develop VSGM, a sub graph matching framework that supports efficient pipelined execution and multi-GPU architecture. Ex-tensive experimental evaluation shows that VSGM significantly outperforms the state-of-the-art solutions.","dblp","Computer Science","9","https://doi.org/10.1109/SC41404.2022.00057","10.1109/SC41404.2022.00057","2022-11-01","2026-04-08","",""
"doi:10.1109/SC41404.2022.00058","","27efc6391c56eeb6a05b617241d030c11eeba070","STMatch: Accelerating Graph Pattern Matching on GPU with Stack-Based Loop Optimizations","Yihua Wei","2022","SC","Graph pattern matching is a fundamental task in many graph analytics and graph mining applications. As an NP-hard problem, it is often a performance bottleneck in these applications. Previous work has proposed to use GPU to accelerate the computation. However, we find that the existing GPU solutions fail to show a performance advantage over the state-of-the-art CPU implementation due to their subgraph-centric design. This work proposes a novel stack-based graph pattern matching system on GPU that avoids the synchronization and memory consumption issues of the previous subgraph-centric systems. We also propose a two-level work-stealing and a loop-unrolling technique to improve the inter-warp and intra-warp GPU resource utilization of our system. The experiments show that our system significantly advances the state-of-the-art for graph pattern matching on GPU.","dblp","Computer Science","25","https://doi.org/10.1109/SC41404.2022.00058","10.1109/SC41404.2022.00058","2022-11-01","2026-04-08","",""
"doi:10.1109/SC41404.2022.00059","","e2b4fe32e257d859e02abbf1f2677b7662cb82f3","WholeGraph: A Fast Graph Neural Network Training Framework with Multi-GPU Distributed Shared Memory Architecture","Dongxu Yang","2022","SC","Graph neural networks (GNNs) are prevalent to deal with graph-structured datasets, encoding graph data into low dimensional vectors. In this paper, we present a fast training graph neural network framework, i.e., WholeGraph, based on a multi-GPU distributed shared memory architecture. Whole-Graph consists of partitioning the graph and corresponding node or edge features to multi-GPUs, eliminating the bottleneck of communication between CPU and GPUs during the training process. And the communication between different GPUs is implemented by GPUDirect Peer-to-Peer (P2P) memory access technology. Furthermore, WholeGraph provides several optimized computing operators. Our evaluations show that on large-scale graphs WholeGraph outperforms state-of-the-art GNN frameworks, such as Deep Graph Library (DGL) and Pytorch Geometric (PyG). The speedups of WholeGraph are up to $57.32\mathrm{x}$ and $242.98\mathrm{x}$ compared with DGL and PyG on a single machine multi-GPU node, respectively. The ratio of GPU utilization can sustain above 95% during GNN training process.","dblp","Computer Science","25","https://doi.org/10.1109/SC41404.2022.00059","10.1109/SC41404.2022.00059","2022-11-01","2026-04-08","",""
"doi:10.1109/SC41404.2022.00060","","5b790a87a64d42254bc3c209753e48d1ec5e2e25","SeqDLM: A Sequencer-Based Distributed Lock Manager for Efficient Shared File Access in a Parallel File System","Qi Chen","2022","SC","Distributed locks are used to guarantee the distributed client-cache coherence in parallel file systems. However, they lead to poor performance in the case of parallel writes under high-contention workloads. We analyze the distributed lock manager and find out that lock conflict resolution is the root cause of the poor performance, which involves frequent lock revocations and slow data flushing from client caches to data servers. We design a distributed lock manager named SeqDLM by exploiting the sequencer mechanism. SeqDLM mitigates the lock conflict resolution overhead using early grant and early revocation while keeping the same semantics as traditional distributed locks. To evaluate SeqDLM, we have implemented a parallel file system called ccPFS using both SeqDLM and traditional distributed locks. Evaluations on 96 nodes show SeqDLM outperforms the traditional distributed locks by up to $\boldsymbol{10.3}\times$ for high-contention parallel writes on a shared file with multiple stripes.","dblp","Computer Science","1","https://doi.org/10.1109/SC41404.2022.00060","10.1109/SC41404.2022.00060","2022-11-01","2026-04-08","",""
