"paper_id","arxiv_id","s2_paper_id","title","authors","year","venue","abstract","source","categories","citation_count","url","doi","published_date","crawled_date","keep","notes","relevance_score","matched_keywords","relevance"
"doi:10.1145/3779212.3790189","2601.10823","54bd18d1f83543282dec05294fed3c32e6736c9a","Mugi: Value Level Parallelism For Efficient LLMs","Daniel Price","2026","ASPLOS","Value level parallelism (VLP) has been proposed to improve the efficiency of large-batch, low-precision general matrix multiply (GEMM) between symmetric activations and weights. In transformer based large language models (LLMs), there exist more sophisticated operations beyond activation-weight GEMM. In this paper, we explore how VLP benefits LLMs. First, we generalize VLP for nonlinear approximations, outperforming existing nonlinear approximations in end-to-end LLM accuracy, performance, and efficiency. Our VLP approximation follows a value-centric approach, where important values are assigned with greater accuracy. Second, we optimize VLP for small-batch GEMMs with asymmetric inputs efficiently, which leverages timely LLM optimizations, including weight-only quantization, key-value (KV) cache quantization, and group query attention. Finally, we design a new VLP architecture, Mugi, to encapsulate the innovations above and support full LLM workloads, while providing better performance, efficiency and sustainability. Our experimental results show that Mugi can offer significant improvements on throughput and energy efficiency, up to 45× and 668× for nonlinear softmax operations, and 2.07× and 3.11× for LLMs, and also decrease operational carbon for LLM operation by 1.45× and embodied carbon by 1.48×.","dblp","Computer Science","0","https://doi.org/10.1145/3779212.3790189","10.1145/3779212.3790189","2026-01-15","2026-04-08","skip","","11","GEMM, quantization, low-precision, transformer, matrix","High"
"doi:10.1145/3779212.3790250","2603.17435","6af4018d0df0b81a3e58e8f58d5e2aa9ac80985e","ZipServ: Fast and Memory-Efficient LLM Inference with Hardware-Aware Lossless Compression","Ruibo Fan","2026","ASPLOS","Lossless model compression holds tremendous promise for alleviating the memory and bandwidth bottlenecks in bit-exact Large Language Model (LLM) serving. However, existing approaches often result in substantial inference slowdowns due to fundamental design mismatches with GPU architectures: at the kernel level, variable-length bitstreams produced by traditional entropy codecs break SIMT parallelism; at the system level, decoupled pipelines lead to redundant memory traffic. We present ZipServ, a lossless compression framework co-designed for efficient LLM inference. ZipServ introduces Tensor-Core-Aware Triple Bitmap Encoding (TCA-TBE), a novel fixed-length format that enables constant-time, parallel decoding, together with a fused decompression-GEMM (ZipGEMM) kernel that decompresses weights on-the-fly directly into Tensor Core registers. This '' load-compressed, compute-decompressed '' design eliminates intermediate buffers and maximizes compute intensity. Experiments show that ZipServ reduces the model size by up to 30%, achieves up to 2.21× kernel-level speedup over NVIDIA's cuBLAS, and expedites end-to-end inference by an average of 1.22× over vLLM. ZipServ is the first lossless compression system that provides both storage savings and substantial acceleration for LLM inference on GPUs.","dblp","Computer Science","1","https://doi.org/10.1145/3779212.3790250","10.1145/3779212.3790250","2026-03-18","2026-04-08","skip","","11","tensor, GEMM, LLM inference, inference","High"
"doi:10.1145/3649329.3655905","","32f2a03ea69537f05ca94a3fda65ac47ff38b279","MoC: A Morton-Code-Based Fine-Grained Quantization for Accelerating Point Cloud Neural Networks","Xueyuan Liu","2024","DAC","Point Cloud Neural Network (PCNN) plays an essential role in various 3D applications, with some of them even being time-sensitive and safety-critical. However, the large scale of unordered points with lengthy features results in heavy computational workloads, making them far from real-time processing. To address this challenge, we propose MoC, a Morton-code-based fine-grained quantization for accelerating PCNNs. Specifically, we utilize Morton code to capture the spatial locality among points. Then, we gather nearby points with similar features into a region. Considering the similarity in features of nearby points, we propose to decompose features into base and offsets, where the offsets fall within a narrow range. Building upon this, we introduce a two-level mixed-precision quantization. In the first level, we quantize offsets with low precision, while keeping the base in high precision to ensure accuracy. For the second level, noticing the different data distribution of offsets across various regions, we employ two types of low precision at the region level, which provides opportunities to further accelerate feature computations. To support our algorithm, we design a hardware architecture that parallelizes the Morton code path with the critical path. In our extensive experiments on various datasets, our algorithm-architecture co-designed method demonstrates 12×, 6.3×, 4.7×, 3.8×, 3.4× and 2.8× speedup and 19.3×, 9.7×, 6.0×, 5.2×, 4.6× and 4.1× energy savings over CPU, Server and Edge GPUs, state-of-the-art ASICs (incl. PointAcc, MARS, PRADA) with negligible accuracy loss.","dblp","Computer Science","6","https://doi.org/10.1145/3649329.3655905","10.1145/3649329.3655905","2024-06-23","2026-04-08","skip","","11","CPU, quantization, mixed-precision, accelerate, neural","High"
"doi:10.1145/3649329.3658254","","c88c8bb95e7fc5b4750a6fd4a2638c77a8a43375","An Efficient Hardware Accelerator Design for Dynamic Graph Convolutional Network (DGCN) Inference","Yingnan Zhao","2024","DAC","Dynamic graph convolutional networks (DGCNs) have been increasingly used to extend machine learning techniques to applications that involve graph-structured data with temporal changes. A typical DGCN model is comprised of graph convolutional network (GCN) layers to capture spatial information, followed by recurrent network (RNN) layers for temporal information. Designing a high-performance and energy-efficient DGCN accelerator is challenging due to the distinct computation and communication requirements of the GCN and RNN layers. Specifically, the computation of GCN layers can be abstracted as Sparse-dense and General Matrix-matrix Multiplication (SpMM and GeMM), while RNN layers involve extensive element-wise addition and Hadamard product in addition to SpMM and GeMM. For data communication, GCN layers necessitate irregular data memory access due to the unstructured distribution of vertices involved in graphs, whereas RNN layers exhibit a predictable memory access pattern. We propose E-DGCN, a high-performance and energy-efficient accelerator design for improved DGCN inference. The proposed E-DGCN comprises reconfigurable processing elements that efficiently support diverse types of data computations required by GCN and RNN layers, a flexible on-chip interconnection design with an adaptive dataflow to improve data reuse during DGCN inference, and a lightweight vertex caching algorithm to leverage data locality and reduce off-chip memory access while processing temporal information. Experimental results show that the E-DGCN achieves 2.2x speed-up and 2.6x energy savings on average as compared to existing DGCN accelerators.","dblp","Computer Science","3","https://doi.org/10.1145/3649329.3658254","10.1145/3649329.3658254","2024-06-23","2026-04-08","skip","","11","GEMM, accelerator, dataflow, matrix, inference","High"
"doi:10.1109/DAC63849.2025.11133363","","b92a5309238a1935b8b5c123b9011d02eb89c9d7","XShift: FPGA-efficient Binarized LLM with Joint Quantization and Sparsification","Shuai Zhou","2025","DAC","Binarization is a promising approach to significantly reduce computational complexity by replacing multiplications with hardwareefficient XNOR operations. However, the binarization of LLM activations often leads to severe accuracy degradation, while weight-only binarization fails to eliminate multipliers due to the Self-Attention mechanism. Furthermore, LLMs exhibit distinctive channel-level data distribution characteristics and differing computational and memory requirements between the Pre-fill and Decoding stages, necessitating a specialized inference framework. In response, we introduce XShift, an algorithm-hardware co-design framework optimized for efficient binarized LLM inference on FPGAs. XShift incorporates three key contributions: (1) a hardwarefriendly XNOR-Shift Encoding (XSE) format that transforms traditional multiplications into XNOR and shift operations, ensuring scalability and precision; (2) Hardware Adaptive Outlier and Sparsity (HAOS) techniques, which exploit channel-level data distribution and systolic array architectures for optimized quantization and sparsification; and (3) a dedicated hardware accelerator featuring an XNOR-Shift Systolic Array (XSSA) and an enhanced Base-2 SoftMax Converter (BSMC), designed to address the specific computational demands of binarized LLMs. Experimental evaluations on the Alveo U280 and U50 FPGA demonstrate that XShift achieves a $\mathbf{1 0 - 1 5 x}$ reduction in DSP resource usage while surpassing existing accelerators and GPUs in inference performance. Specifically, XShift delivers an average speedup of 4.174.76 x and a 14.29-6.95 x improvement in energy efficiency, alongside lower perplexity compared to other low-precision LLM techniques. These results underscore the potential of XShift for edge deployment of LLMs.","dblp","Computer Science","0","https://doi.org/10.1109/DAC63849.2025.11133363","10.1109/DAC63849.2025.11133363","2025-06-22","2026-04-08","skip","","11","accelerator, systolic array, quantization, low-precision, LLM inference, inference","High"
"doi:10.1109/DAC63849.2025.11132753","","58f311f13c00079b470e089a34460d208ec14ca4","SynGPU: Synergizing CUDA and Bit-Serial Tensor Cores for Vision Transformer Acceleration on GPU","Yuanzheng Yao","2025","DAC","Vision Transformers (ViTs) have demonstrated remarkable performance in computer vision tasks by effectively extracting global features. However, their self-attention mechanism suffers from quadratic time and memory complexity as image resolution or video duration increases, leading to inefficiency on GPUs. To accelerate ViTs, existing works mainly focus on pruning tokens based on value-level sparsity. However, they miss the chance to achieve peak performance as they overlook the bit-level sparsity. Instead, we propose Inter-token Bit-sparsity Awareness (IBA) algorithm to accelerate ViTs by exploring bit-sparsity from similar tokens. Next, we implement IBA on GPUs that synergize CUDA and Tensor Cores by addressing two issues: firstly, the bandwidth congestion of the Register File hinders the parallel ability of CUDA and Tensor Cores. Secondly, due to the varying exponent of floating-point vectors, it is hard to accelerate bitsparse matrix multiplication and accumulation (MMA) in Tensor Core through fixed-point-based bit-level circuits. Therefore, we present SynGPU, an algorithm-hardware co-design framework, to accelerate ViTs. SynGPU enhances data reuse by a novel data mapping to enable full parallelism of CUDA and Tensor Cores. Moreover, it introduces Bit-Serial Tensor Core (BSTC) that supports fixed- and floating-point MMA by combining the fixedpoint Bit-Serial Dot Product (BSDP) and exponent alignment techniques. Extensive experiments show that SynGPU achieves an average of $2.15 \times \sim 3.95 \times$ speedup and $2.49 \times \sim 3.81 \times$ compute density over A100 GPU.","dblp","Computer Science","1","https://doi.org/10.1109/DAC63849.2025.11132753","10.1109/DAC63849.2025.11132753","2025-06-22","2026-04-08","skip","","11","tensor, MMA, transformer, accelerate, matrix","High"
"doi:10.1109/DAC63849.2025.11132895","","ed96f0f640b5855526ccb3abb5cdc3ec92dcc476","MambaOPU: An FPGA Overlay Processor for State-space-duality-based Mamba Models","Shaoqiang Lu","2025","DAC","State-space models (SSMs), such as Mamba, have emerged as a promising alternative to Transformers. However, the recently developed Mamba2, based on state space duality (SSD), is highly memorybound and suffers from limited computation efficiency. This inefficiency arises from its irregular broadcast element-wise multiplications and structured sparse computations. In this work, we propose MambaOPU, an FPGA overlay processor, to accelerate SSD. First, to reduce memory overhead, we introduce a software-hardware co-optimized operator fusion framework. Specifically, operator merging combines adjacent broadcast multiplication and summation operations into a single descriptor, while operator backward shifting embeds segment multiplication into subsequent operations. Both techniques shorten the computation path and improve computation efficiency. Second, to enhance sparse computation efficiency, we skip zero-region computations using a tensor-reorder-and-group algorithm combined with a sparse-predefined data fetcher. Additionally, since Mamba integrates linear operations with SSD, we develop a reconfigurable systolic array to improve data reuse across different computation modes. Extensive experiment results demonstrate that MambaOPU achieves up to $1812 \times$ and $880.79 \times$ higher normalized throughput and up to $12908 \times$ and $24.27 \times$ higher energy efficiency over Intel Xeon Gold 6348 CPU and NVIDIA A100 GPU, respectively.","dblp","Computer Science","0","https://doi.org/10.1109/DAC63849.2025.11132895","10.1109/DAC63849.2025.11132895","2025-06-22","2026-04-08","skip","","11","tensor, CPU, systolic array, accelerate","High"
"doi:10.23919/DATE54114.2022.9774727","","e1fc23a7cb90780e7951dcf813581ffe2d2569d8","AdaFlow: A Framework for Adaptive Dataflow CNN Acceleration on FPGAs","Guilherme Korol","2022","DATE","To meet latency and privacy requirements, resource-hungry deep learning applications have been migrating to the Edge, where IoT devices can offload the inference processing to local Edge servers. Since FPGAs have successfully accelerated an increasing number of deep learning applications (especially CNN-based ones), they emerge as an effective alternative for Edge platforms. However, Edge applications may present highly unpredictable workloads, requiring runtime adaptability in the inference processing. Although some works apply model switching on CPU and GPU platforms by exploiting different pruning rates at runtime, so the inference can adapt according to some quality-performance trade-off, FPGA-based accelerators refrain from this approach since they are synthesized to specific CNN models. In this context, this work enables model switching on FPGAs by adding to the well-known FINN accelerator an extra level of adaptability (i.e., flexibility) and support to the dynamic use of pruning via fast model switch on flexible accelerators, at the cost of some extra logic, or via FPGA reconfigurations of fixed accelerators. From that, we developed AdaFlow: a framework that automatically builds, at design time, a library from these new available versions (flexible and fixed, pruned or not) that will be used, at runtime, to dynamically select a given version according to a user-configurable accuracy threshold and current workload conditions. We have evaluated AdaFlow under a smart Edge surveillance application with two CNN models and two datasets, showing that AdaFlow processes, on average, 1.3× more inferences and increases, on average, 1.4× the power efficiency over state-of-the-art statically deployed dataflow accelerators.","dblp","Computer Science","16","https://doi.org/10.23919/DATE54114.2022.9774727","10.23919/DATE54114.2022.9774727","2022-03-14","2026-04-08","skip","","11","CPU, accelerator, dataflow, deep learning, inference","High"
"doi:10.23919/DATE54114.2022.9774692","","d84b292c2e90d0b0edfedc33141d305d8e9de5df","DTQAtten: Leveraging Dynamic Token-based Quantization for Efficient Attention Architecture","Tao Yang","2022","DATE","Models based on the attention mechanism, i.e. transformers, have shown extraordinary performance in Natural Language Processing (NLP) tasks. However, their memory footprint, inference latency, and power consumption are still prohibitive for efficient inference at edge devices, even at data centers. To tackle this issue, we present an algorithm-architecture co-design with dynamic and mixed-precision quantization, DTQAtten. We present empirically that the tolerance to the noise varies from token to token in attention-based NLP models. This finding leads us to quantize different tokens with mixed levels of bits. Thus, we design a compression framework that (i) dynamically quantizes tokens while they are forwarded in the models and (ii) jointly determines the ratio of each precision. Moreover, due to the dynamic mixed-precision tokens caused by our framework, previous matrix-multiplication accelerators (e.g. systolic array) cannot effectively exploit the benefit of the compressed attention computation. We thus design our accelerator with the variable-speed systolic array (VSSA) and propose an effective optimization strategy to alleviate the pipeline-stall problem in VSSA without hardware overhead. We conduct experiments with existing attention-based NLP models, including BERT and GPT-2 on various language tasks. Our results show that DTQAtten outperforms the previous neural network accelerator Eyeriss by 13.12× in terms of speedup and 3.8× in terms of energy-saving. Compared with the state-of-the-art attention accelerator SpAtten, our DTQAtten achieves at least 2.65× speedup and 3.38× energy efficiency improvement.","dblp","Computer Science","30","https://doi.org/10.23919/DATE54114.2022.9774692","10.23919/DATE54114.2022.9774692","2022-03-14","2026-04-08","skip","","11","accelerator, systolic array, quantization, mixed-precision, matrix, neural, inference","High"
"doi:10.23919/DATE64628.2025.10992890","","92ae9fb41ea243120acc41e81e20490777864537","LT-OAQ: Learnable Threshold Based Outlier-Aware Quantization and its Energy-Efficient Accelerator for Low-Precision On-Chip Training","Qinkai Xu","2025","DATE","Low-precision training has emerged as a powerful technique for reducing computational and storage costs in Deep Neural Network (DNN) model training, enabling on-chip training or fine-tuning on edge devices. However, existing low-precision training methods often require higher bit-widths to maintain accuracy as model sizes increase. In this paper, we introduce an outlier-aware quantization strategy for low-precision training. While traditional value-aware quantization methods require costly online distribution statistics operations on computational data, impeding the efficiency gains of low-precision training, our approach addresses this challenge through a novel Learnable Threshold based Outlier-Aware Quantization (LT-OAQ) training framework. This method concurrently updates outlier thresholds and model weights through gradient descent, eliminating the need for costly data-statistics operations. To efficiently support the LT-OAQ training framework, we designed a hardware accelerator based on the systolic array architecture. This accelerator introduces a processing element (PE) fusion mechanism that dynamically fuses adjacent PEs into clusters to support outlier computations, optimizing the mapping of outlier computation tasks, enabling mixed-precision training, and implementing online quantization. Our approach maintains model accuracy while significantly reducing computational complexity and storage resource requirements. Experimental results demonstrate that our design achieves a 2.9 ×speedup in performance and a 2.17 ×reduction in energy consumption compared to state-of-the-art low-precision accelerators.","dblp","Computer Science","0","https://doi.org/10.23919/DATE64628.2025.10992890","10.23919/DATE64628.2025.10992890","2025-03-31","2026-04-08","skip","","11","accelerator, systolic array, quantization, low-precision, mixed-precision, neural","High"
"doi:10.23919/DATE64628.2025.10993010","","0b58ad59c815dfdace0d93b101f5c40bc92278ff","MPTorch-FPGA: A Custom Mixed-Precision Framework for FPGA-Based DNN Training","Sami Ben Ali","2025","DATE","Training Deep Neural Networks (DNNs) is computationally demanding, leading to a growing interest in reduced precision formats to enhance hardware efficiency. Several frame-works explore custom number formats with parameterizable precision through software emulation on CPUs or GPUs. However, they lack comprehensive support for different rounding modes and struggle to accurately evaluate the impact of custom precision for FPGA-based targets. This paper introduces MPTorch-FPGA, an extension of the MPTorch framework for performing custom, multi-precision inference and training computations in CPU, GPU, and FPGA environments in PyTorch. MPTorch-FPGA can generate a model-specific accelerator for DNN training, with customizable sizes and arithmetic implementations, providing bit-level accuracy with respect to emulated low precision DNN training on GPUs or CPUs. An offline matching algorithm selects one of several pre-generated (static) FPGA configurations using a custom performance model to estimate latency. To showcase the versatility of MPTorch-FPGA, we present a series of training benchmarks using diverse DNN models, exploring a range of number format configurations and rounding modes. We report both accuracy and hardware performance metrics, verifying the precision of our performance model by comparing estimated and measured latencies across multiple benchmarks. These results highlight the flexibility and practical value of our framework.","dblp","Computer Science","1","https://doi.org/10.23919/DATE64628.2025.10993010","10.23919/DATE64628.2025.10993010","2025-03-31","2026-04-08","skip","","11","CPU, accelerator, mixed-precision, neural, inference","High"
"doi:10.23919/DATE64628.2025.10993043","","8d11605441fc04195b776db1a22f3617346064b5","SoftEx: A Low Power and Flexible Softmax Accelerator with Fast Approximate Exponentiation","Andrea Belano","2025","DATE","Transformer-based models excel in NLP, vision, and audio processing, but the softmax operator can be a performance bottleneck, especially with optimized matrix-multiplication hard-ware. We introduce SoftEx, a parametric accelerator for BF16 softmax, using approximate exponentiation «0.14% relative error) to boost softmax calculation. Integrated into a 12nm octa-core RISC-V cluster together with a matrix-multiplication systolic array, SoftEx reduces time and energy for attention probability computation by up to 10.8x and 26.8x, boosting MobileBERT throughput by 2.17x to 324 GOPS or 1.30 TOPS/W.","dblp","Computer Science","0","https://doi.org/10.23919/DATE64628.2025.10993043","10.23919/DATE64628.2025.10993043","2025-03-31","2026-04-08","keep","","11","RISC-V, accelerator, systolic array, BF16, transformer, matrix","High"
"doi:10.23919/DATE64628.2025.10993090","","47af784e9b82991e65d320f8fde518a42091a427","RGHT-Q: Reconfigurable GEMM Unit for Heterogeneous-Homogeneous Tensor Quantization","Seungho Lee","2025","DATE","The high computational demands of large language models (LLMs) are limited by the lack of GPU hardware support for heterogeneous quantization, which mixes integers and floating points. To address this limitation, we propose an LLM processing element (PE), RGHT-Q, which features reconfigurable general-matrix multiplication (GEMM) operations for both heterogeneous and homogeneous tensor quantization. The RGHT-Q introduces a novel design that leverages butterfly routing and multi-precision multipliers. As a result, we achieve significant performance improvements, offering 3.14× higher energy efficiency, and 1.56× better area efficiency compared to prior designs.","dblp","Computer Science","0","https://doi.org/10.23919/DATE64628.2025.10993090","10.23919/DATE64628.2025.10993090","2025-03-31","2026-04-08","skip","","11","tensor, GEMM, quantization, matrix","High"
