"paper_id","arxiv_id","s2_paper_id","title","authors","year","venue","abstract","source","categories","citation_count","url","doi","published_date","crawled_date","keep","notes","relevance_score","matched_keywords","relevance"
"doi:10.1145/3489517.3530585","2208.03646","0f1358b84f319947e20304edd42ec6fdd2d5de2c","A length adaptive algorithm-hardware co-design of transformer on FPGA through sparse attention and dynamic pipelining","Hongwu Peng","2022","DAC","Transformers are considered one of the most important deep learning models since 2018, in part because it establishes state-of-the-art (SOTA) records and could potentially replace existing Deep Neural Networks (DNNs). Despite the remarkable triumphs, the prolonged turnaround time of Transformer models is a widely recognized roadblock. The variety of sequence lengths imposes additional computing overhead where inputs need to be zero-padded to the maximum sentence length in the batch to accommodate the parallel computing platforms. This paper targets the field-programmable gate array (FPGA) and proposes a coherent sequence length adaptive algorithm-hardware co-design for Transformer acceleration. Particularly, we develop a hardware-friendly sparse attention operator and a length-aware hardware resource scheduling algorithm. The proposed sparse attention operator brings the complexity of attention-based models down to linear complexity and alleviates the off-chip memory traffic. The proposed length-aware resource hardware scheduling algorithm dynamically allocates the hardware resources to fill up the pipeline slots and eliminates bubbles for NLP tasks. Experiments show that our design has very small accuracy loss and has $80.2 \times$ and $2.6 \times$ speedup compared to CPU and GPU implementation, and $4 \times$ higher energy efficiency than state-of-the-art GPU accelerator optimized via CUBLAS GEMM.ACM Reference Format:Hongwu Peng1+, Shaoyi Huang1+, Shiyang Chen2, Bingbing Li1, Tong Geng3, Ang Li3, Weiwen Jiang4, Wujie Wen5, Jinbo Bi1, Hang Liu2 and Caiwen Ding[1]. 2022. A Length Adaptive Algorithm-Hardware Co-design of Transformer on FPGA Through Sparse Attention and Dynamic Pipelining. In Proceedings of the 59th ACM/IEEE Design Automation Conference (DAC) (DAC ‘22), July 10-14, 2022, San Francisco, CA, USA. ACM, New York, NY, USA, 6 pages. https://doi.org/10.1145/3489517.3530585","dblp","Computer Science","65","https://doi.org/10.1145/3489517.3530585","10.1145/3489517.3530585","2022-06-06","2026-04-08","skip","","15","GEMM, CPU, accelerator, transformer, neural, deep learning","High"
"doi:10.23919/DATE56975.2023.10137099","","da4ce8363314cc959531047292ea2836757c4414","Mobile Accelerator Exploiting Sparsity of Multi-Heads, Lines, and Blocks in Transformers in Computer Vision","Eunji Kwon","2023","DATE","It is difficult to employ transformer models for computer vision in mobile devices due to their memory- and computation-intensive properties. Accordingly, there is ongoing research on various methods for compressing transformer models, such as pruning. However, general computing platforms such as central processing units (CPUs) and graphics processing units (GPUs) are not energy-efficient to accelerate the pruned model due to their structured sparsity. This paper proposes a low-power accelerator for transformers with various sizes of structured sparsity induced by pruning with different granularity. In this study, we can accelerate a transformer that has been pruned in a head-wise, line-wise, or block-wise manner. We developed a head scheduling algorithm to support head-wise skip operations and resolve the processing engine (PE) load imbalance problem caused by different number of operations in one head. Moreover, we implemented a sparse general matrix-to-matrix multiplication (sparse GEMM) module that supports line-wise and block-wise skipping. As a result, when compared with a mobile GPU and mobile CPU respectively, our proposed accelerator achieved $6.1\times$ and $13.6\times$ improvements in energy efficiency for the detection transformer (DETR) model and achieved approximately $2.6\times$ and $7.9\times$ improvements in the energy efficiency on average for the vision transformer (ViT) models.","dblp","Computer Science","10","https://doi.org/10.23919/DATE56975.2023.10137099","10.23919/DATE56975.2023.10137099","2023-04-01","2026-04-08","keep","","15","GEMM, CPU, accelerator, transformer, accelerate, matrix","High"
"doi:10.23919/DATE58400.2024.10546677","","448924d48a8ccce3e8e4f411138edc1d7f6faa71","Sava: A Spatial- and Value-Aware Accelerator for Point Cloud Transformer","Xueyuan Liu","2024","DATE","Point Cloud Transformer is undergoing a rising trend in both industry and academia. It aligns traditional point cloud feature extraction methods with the latest transformer architecture and achieves remarkable performance. However, accelerators for traditional point cloud neural networks (PCNNs) and those solely for transformers fail to capture the characteristics of point cloud transformers, thus exhibiting poor performance. To address this challenge, we propose Sava, a co-designed accelerator that adopts a spatial- and value-aware hybrid pruning strategy for point cloud transformers. In terms of the spatial domain, we observe that points in regions of various densities exhibit different levels of importance. In the value space, a minor input contributes less to features, indicating lower importance. Considering both perspectives, we hybridize the information inherited from the spatial and value spaces to prune less significant values in attention, which converts data to sparse patterns and makes it readily accelerated. Furthermore, we adopt low-bit quantization to boost computations and apply varying quantization precisions across different network layers based on their sensitivity. In support of our algorithm, we propose an architecture that employs a configurable mixed-precision systolic array for various computing loads under diverse precisions. To address the workload imbalance of the unstructured sparse computations, we introduce a data rearrangement mechanism, which improves resource utilization while hiding latency. We evaluate our Sava on four point cloud transformer models and achieve notable accuracy and performance gains. In comparison with CPU, GPUs, and ASICs, our Sava offers 10.3×, 3.6×, 3.3×, 2.6×, 2.2× speedup, along with 20×, 8.8×, 6.9×, 3.2×, 2.4× energy savings on average.","dblp","Computer Science","1","https://doi.org/10.23919/DATE58400.2024.10546677","10.23919/DATE58400.2024.10546677","2024-03-25","2026-04-08","skip","","15","CPU, accelerator, systolic array, quantization, mixed-precision, transformer, neural","High"
"doi:10.1109/LCA.2025.3544989","2502.17658","88d7312a59166be884fe9f941e93c9b789cf2881","Thor: A Non-Speculative Value Dependent Timing Side Channel Attack Exploiting Intel AMX","Farshad Dizani","2025","IEEE-CAL","The rise of on-chip accelerators signifies a major shift in computing, driven by the growing demands of artificial intelligence (AI) and specialized applications. These accelerators have gained popularity due to their ability to substantially boost performance, cut energy usage, lower total cost of ownership (TCO), and promote sustainability. Intel's Advanced Matrix Extensions (AMX) is one such on-chip accelerator, specifically designed for handling tasks involving large matrix multiplications commonly used in machine learning (ML) models, image processing, and other computational-heavy operations. In this paper, we introduce a novel value-dependent timing side-channel vulnerability in Intel AMX. By exploiting this weakness, we demonstrate a software-based, value-dependent timing side-channel attack capable of inferring the sparsity of neural network weights without requiring any knowledge of the confidence score, privileged access or physical proximity. Our attack method can fully recover the sparsity of weights assigned to 64 input elements within 50 minutes, which is 631% faster than the maximum leakage rate achieved in the Hertzbleed attack.","dblp","Computer Science","2","https://doi.org/10.1109/LCA.2025.3544989","10.1109/LCA.2025.3544989","2025-01-01","2026-04-08","skip","","15","AMX, accelerator, AI, matrix, neural","High"
"doi:10.1109/LCA.2025.3555183","","6ab137451d9794d477affcc34f0baf872543fbab","Exploiting Intel AMX Power Gating","Joshua Kalyanapu","2025","IEEE-CAL","We identify a novel vulnerability in Intel AMX’s dynamic power performance scaling, enabling NetLoki, a stealthy and high-performance remote speculative attack that bypasses traditional cache defenses and leaks arbitrary addresses over a realistic network where other attacks fail. NetLoki shows a 34,900% improvement in leakage rate over NetSpectre. We show that NetLoki evades detection by three state-of-the-art microarchitectural attack detectors (EVAX, PerSpectron, RHMD) and requires a 20,000x reduction in the system’s timer resolution (10 us) than the standard 0.5 ns hardware timer to be mitigated via timer coarsening. Finally, we analyze the root cause of the leakage and propose an effective defense. We show that the mitigation increases CPU power consumption by 12.33%.","dblp","Computer Science","1","https://doi.org/10.1109/LCA.2025.3555183","10.1109/LCA.2025.3555183","2025-01-01","2026-04-08","skip","","15","AMX, CPU","High"
"doi:10.1109/LCA.2025.3560786","2504.08398","8546f3ca49ff38398493c2e7464fd2c97d703d37","MixDiT: Accelerating Image Diffusion Transformer Inference With Mixed-Precision MX Quantization","Daeun Kim","2025","IEEE-CAL","Diffusion Transformer (DiT) has driven significant progress in image generation tasks. However, DiT inferencing is notoriously compute-intensive and incurs long latency even on datacenter-scale GPUs, primarily due to its iterative nature and heavy reliance on GEMM operations inherent to its encoder-based structure. To address the challenge, prior work has explored quantization, but achieving low-precision quantization for DiT inferencing with both high accuracy and substantial speedup remains an open problem. To this end, this paper proposes MixDiT, an algorithm-hardware co-designed acceleration solution that exploits mixed Microscaling (MX) formats to quantize DiT activation values. MixDiTquantizes the DiT activation tensors by selectively applying higher precision to magnitude-based outliers, which produce mixed-precision GEMM operations. To achieve tangible speedup from the mixed-precision arithmetic, we design a MixDiTaccelerator that enables precision-flexible multiplications and efficient MX precision conversions. Our experimental results show that MixDiTdelivers a speedup of 2.10–5.32× over RTX 3090, with no loss in FID.","dblp","Computer Science","4","https://doi.org/10.1109/LCA.2025.3560786","10.1109/LCA.2025.3560786","2025-01-01","2026-04-08","skip","","15","GEMM, quantization, low-precision, mixed-precision, MX, transformer, inference","High"
"doi:10.1109/TC.2024.3388896","2311.07493","1e437a3d0a04a92afb00c18a4deddd6a83f12f66","Ara2: Exploring Single- and Multi-Core Vector Processing With an Efficient RVV 1.0 Compliant Open-Source Processor","Matteo Perotti","2024","IEEE-TC","Vector processing is highly effective in boosting processor performance and efficiency for data-parallel workloads. In this paper, we present Ara2, the first fully open-source vector processor to support the RISC-V V 1.0 frozen ISA. We evaluate Ara2's performance on a diverse set of data-parallel kernels for various problem sizes and vector-unit configurations, achieving an average functional-unit utilization of 95% on the most computationally intensive kernels. We pinpoint performance boosters and bottlenecks, including the scalar core, memories, and vector architecture, providing insights into the main vector architecture's performance drivers. Leveraging the openness of the design, we implement Ara2 in a 22nm technology, characterize its PPA metrics on various configurations (2-16 lanes), and analyze its microarchitecture and implementation bottlenecks. Ara2 achieves a state-of-the-art energy efficiency of 37.8 DP-GFLOPS/W (0.8V) and 1.35GHz of clock frequency (critical path: <inline-formula><tex-math notation=""LaTeX"">$\sim$</tex-math><alternatives><mml:math><mml:mo>∼</mml:mo></mml:math><inline-graphic xlink:href=""perotti-ieq1-3388896.gif""/></alternatives></inline-formula>40 FO4 gates). Finally, we explore the performance and energy-efficiency trade-offs of multi-core vector processors: we find that multiple vector cores help overcome the scalar core issue-rate bound that limits short-vector performance. For example, a cluster of eight 2-lane Ara2 (16 FPUs) achieves more than 3x better performance than a 16-lane single-core Ara2 (16 FPUs) when executing a 32x32x32 matrix multiplication, with 1.5x improved energy efficiency.","dblp","Computer Science","24","https://doi.org/10.1109/TC.2024.3388896","10.1109/TC.2024.3388896","2023-11-13","2026-04-08","keep","","15","RISC-V, RVV, matrix, vector","High"
"doi:10.1109/TCAD.2023.3303851","","0f6511c0694e5428b6fd5e6e48adf495511bc84d","DiagNNose: Toward Error Localization in Deep Learning Hardware-Based on VTA-TVM Stack","Shamik Kundu","2024","IEEE-TCAD","Low-level hardware faults manifested in a Deep learning (DL) accelerator usher in graceless degradation of high-level classification accuracy, which can eventuate to catastrophic circumstances. This violates the crucial Functional Safety (FuSa) of the DL accelerator, maintaining which is imperative in high-assurance applications. Conventional techniques for error localization incur high-test efforts, without regards to the unique challenges posed by DL systems. In this direction, we propose DiagNNose, a two-tier machine learning-based error localization framework for on-line fault management in DL accelerators. We develop a novel diagnostic pattern selection algorithm to obtain a minimal subset of functional test patterns, that are executed in the accelerator in mission mode. By extracting and analyzing dataflow-based features from the intermediate computations of the general matrix multiply (GEMM) core, a lightweight multilayer perceptron accomplishes bit-level error localization in 8-bit, 16-bit, and 32-bit datapath units with high fidelity. We have limited ourselves to a single accelerator design, i.e., the versatile tensor accelerator (VTA) architecture to evaluate our proposed DiagNNose framework. On executing state-of-the-art deep neural networks trained on ImageNet; error localization using only 30 diagnostic functional test patterns demonstrate up to 98.4% diagnosability, thereby demonstrating an improvement of 54.63% over a random test pattern set, with as low as 4.95% overhead in the DL accelerator in mission mode.","dblp","Computer Science","4","https://doi.org/10.1109/TCAD.2023.3303851","10.1109/TCAD.2023.3303851","2024-01-01","2026-04-08","skip","","15","tensor, GEMM, accelerator, dataflow, matrix, neural, deep learning","High"
"doi:10.1109/TPDS.2023.3287883","2302.01769","229db0006e6f2ea8f45cf266dbdeeb720d38c2b3","GraphAGILE: An FPGA-Based Overlay Accelerator for Low-Latency GNN Inference","Bingyi Zhang","2023","IEEE-TPDS","This article presents GraphAGILE, a domain-specific FPGA-based overlay accelerator for graph neural network (GNN) inference. GraphAGILE consists of (1) <italic>a novel unified architecture design</italic> with an <italic>instruction set</italic>, and (2) <italic>a compiler</italic> built upon the instruction set that can quickly generate optimized code. Due to the proposed instruction set architecture (ISA) and the compiler, GraphAGILE does not require any FPGA reconfiguration when performing inference on various GNN models and input graphs. For the architecture design, we propose a novel hardware module named Adaptive Computation Kernel (ACK), that can execute various computation kernels of GNNs, including general matrix multiplication (GEMM), sparse-dense matrix multiplication (SpDMM), and sampled dense-dense matrix multiplication (SDDMM). The compiler takes the specifications of a GNN model and the graph meta data (e.g., the number of vertices and edges) as input, and generates a sequence of instructions for inference execution. We develop the following compiler optimizations to reduce inference latency: 1) computation order optimization that automatically reorders the computation graph to reduce the total computation complexity, 2) layer fusion that merges adjacent layers to reduce data communication volume, 3) data partitioning with a partition-centric execution scheme that partitions the input graph to fit the available on-chip memory of FPGA, 4) kernel mapping that automatically selects execution mode for ACK, and performs task scheduling to overlap computation with data communication and achieves dynamic load balance. We implement GraphAGILE on a state-of-the-art FPGA platform, Xilinx Alveo U250. GraphAGILE can execute widely used GNN models, including GCN, GAT, GIN, GraphSAGE, SGC and other GNN models supported by GraphGym. Experimental results show that GraphAGILE achieves up to <inline-formula><tex-math notation=""LaTeX"">$47.1\times$</tex-math><alternatives><mml:math><mml:mrow><mml:mn>47</mml:mn><mml:mo>.</mml:mo><mml:mn>1</mml:mn><mml:mo>×</mml:mo></mml:mrow></mml:math><inline-graphic xlink:href=""zhang-ieq1-3287883.gif""/></alternatives></inline-formula> (<inline-formula><tex-math notation=""LaTeX"">$3.9\times$</tex-math><alternatives><mml:math><mml:mrow><mml:mn>3</mml:mn><mml:mo>.</mml:mo><mml:mn>9</mml:mn><mml:mo>×</mml:mo></mml:mrow></mml:math><inline-graphic xlink:href=""zhang-ieq2-3287883.gif""/></alternatives></inline-formula>) reduction in end-to-end latency, including the latency of compilation and hardware execution, compared with the state-of-the-art implementations on CPU (GPU), and achieves up to <inline-formula><tex-math notation=""LaTeX"">$2.9\times$</tex-math><alternatives><mml:math><mml:mrow><mml:mn>2</mml:mn><mml:mo>.</mml:mo><mml:mn>9</mml:mn><mml:mo>×</mml:mo></mml:mrow></mml:math><inline-graphic xlink:href=""zhang-ieq3-3287883.gif""/></alternatives></inline-formula> reduction in hardware execution latency compared with the state-of-the-art FPGA accelerators.","dblp","Computer Science","33","https://doi.org/10.1109/TPDS.2023.3287883","10.1109/TPDS.2023.3287883","2023-02-02","2026-04-08","skip","","15","GEMM, CPU, accelerator, matrix, neural, inference","High"
"doi:10.1109/TVLSI.2023.3286122","","ecd09ec42beb68994a4ab8273fb0c098c568650f","An Energy-Efficient GeMM-Based Convolution Accelerator With On-the-Fly im2col","Jordi Fornt","2023","IEEE-TVLSI","Systolic array architectures have recently emerged as successful accelerators for deep convolutional neural network (CNN) inference. Such architectures can be used to efficiently execute general matrix–matrix multiplications (GeMMs), but computing convolutions with this primitive involves transforming the 3-D input tensor into an equivalent matrix, which can lead to an inflation of the input data, increasing the OFF-chip memory traffic which is critical for energy efficiency. In this work, we propose a GeMM-based systolic array accelerator that uses a novel data feeder architecture to perform ON-chip, on-the-fly convolution lowering (also known as im2col), supporting arbitrary tensor and kernel sizes as well as strided and dilated (or atrous) convolutions. By using our data feeder, we reduce memory transactions and required bandwidth on state-of-the-art CNNs by a factor of two, while only adding an area and power overhead of 4% and 7%, respectively. Application specific integrated circuit (ASIC) implementation of our accelerator in 22-nm technology fits in less than 1.1 mm 2 and reaches an energy efficiency of 1.10 TFLOP/sW with 16-bit floating-point arithmetic.","dblp","Computer Science","19","https://doi.org/10.1109/TVLSI.2023.3286122","10.1109/TVLSI.2023.3286122","2023-11-01","2026-04-08","skip","","15","tensor, GEMM, accelerator, systolic array, matrix, neural, inference","High"
"doi:10.1109/TVLSI.2024.3414260","","bc5148170deead87bfc4baf265a5f0a5d15d80da","ABS: Accumulation Bit-Width Scaling Method for Designing Low-Precision Tensor Core","Yasong Cao","2024","IEEE-TVLSI","A big gap exists between deep neural network (DNN) applications’ computational demand and the computing power of DNN accelerators. Low-precision floating-point (LP-FP) computation is one of the important means to improve the performance of DNN training and inference. However, the high-precision accumulators are typically applied to summating the dot products during general matrix multiplication (GEMM) in tensor cores (TCs). As the precision of data decreases, the accumulator becomes the main consumer of multiply-accumulate’s (MAC’s) area and power. Reducing the accumulators’ bit-width is of significant importance for improving the area- and energy-efficiency of TCs. There are two main challenges: 1) theoretical support on the floating-point (FP) formats with the lowest bit-width of TC’s accumulators and 2) how to integrate the LP-FP TC in the framework of DNN training and inference to evaluate its benefits. In this article, we propose accumulation bit-width scaling (ABS), a novel ABS method, to guide the design of LP-FP TCs. We 1) implement this method by constructing a novel variance retention ratio (VRR) model to predict the FP format with the minimum bit-width for TC’s accumulator; 2) provide a generator of DNN accelerator based on a systolic-array (SA) TC, supporting many low-precision configurations; and 3) design an LP-FP DNN executing framework that supports software-simulation mode and hardware-accelerator mode to run LP-FP DNN tasks. The experimental results show that the LP-FP TC guided by our ABS method has a maximum reduction of 76.47% and 75.60% in area and power consumption, respectively, compared with the advanced TCs.","dblp","Computer Science","2","https://doi.org/10.1109/TVLSI.2024.3414260","10.1109/TVLSI.2024.3414260","2024-09-01","2026-04-08","skip","","15","tensor, GEMM, accelerator, low-precision, matrix, neural, inference","High"
"doi:10.1109/tvlsi.2025.3591522","","cbf92b6f0728419b2bb5614462acee2f1f28c46a","SGRACE: Scalable Architecture for On-Device Inference and Training of Graph Attention and Convolutional Networks","José L. Núñez-Yáñez","2025","IEEE-TVLSI","In this article, we propose a hardware accelerator for on-device inference and training of deeply quantized graph convolutional networks (GCNs) and graph attention networks (GAT). The architecture unifies in a single dataflow both GAT and GCN support without breaking the matrix global formulation needed for high performance. In addition, it supports adaptive fixed-point precision (from 1- to 8-bit) and provides scalable performance through configurable hardware threads and compute units available in each thread. Each hardware thread employs a hierarchical dataflow combining fine- and coarse-grained components. The fine-grained dataflow streams words with a bit-width that depends on the selected precision. The coarse-grained dataflow connects aggregation and combination stages, incorporating an optional attention mechanism in GAT mode which is bypassed in GCN mode. In training mode, the hardware emulates multiple precisions (i.e., 1-/2-/4-/8-bit) to perform hardware-aware quantized training (HQT) for weights, features, attention coefficients, and the graph connectivity expressed in the normalized adjacency matrix. In inference mode, the architecture is optimized to support a single precision (i.e., 1- and 2-bit). The accelerator is mapped to a Zynq Ultrascale MPSOC and integrated within the Pytorch framework. Performance evaluation on Planetoid and Molecular graph datasets demonstrates over $100\times $ acceleration for GCN and GAT compared to on-device CPU execution. The comparison with other FPGA, mobile GPU, and CPU hardware shows up to $50\times $ better performance per joule. Results confirm HQT as an effective and efficient quantization strategy for graph neural network acceleration.","dblp","Computer Science","1","https://doi.org/10.1109/tvlsi.2025.3591522","10.1109/tvlsi.2025.3591522","2025-11-01","2026-04-08","skip","","15","CPU, accelerator, dataflow, quantization, on-device, matrix, neural, inference","High"
