"paper_id","arxiv_id","s2_paper_id","title","authors","year","venue","abstract","source","categories","citation_count","url","doi","published_date","crawled_date","keep","notes","relevance_score","matched_keywords","relevance"
"doi:10.1109/tpds.2024.3437657","","967a74babc8cbe58d6e08a50087ae6971b19a19d","Which Coupled is Best Coupled? An Exploration of AIMC Tile Interfaces and Load Balancing for CNNs","Joshua Alexander Harrison Klein","2024","IEEE-TPDS","Due to stringent energy and performance constraints, edge AI computing often employs heterogeneous systems that utilize both general-purpose CPUs and accelerators. Analog in-memory computing (AIMC) is a well-known AI inference solution that overcomes computational bottlenecks by performing matrix-vector multiplication operations (MVMs) in constant time. However, the tiles of AIMC-based accelerators are limited by the number of weights they can hold. State-of-the-art research often sizes neural networks to AIMC tiles (or vice-versa), but does not consider cases where AIMC tiles cannot cover the whole network due to lack of tile resources or the network size. In this work, we study the trade-offs of available AIMC tile resources, neural network coverage, AIMC tile proximity to compute resources, and multi-core load balancing techniques. We first perform a study of single-layer performance and energy scalability of AIMC tiles in the two most typical AIMC acceleration targets: dense/fully-connected layers and convolutional layers. This study guides the methodology with which we approach parameter allocation to AIMC tiles in the context of large edge neural networks, both where AIMC tiles are close to the CPU (tightly-coupled) and cannot share resources across the system, and where AIMC tiles are far from the CPU (loosely-coupled) and can employ workload stealing. We explore the performance and energy trends of six modern CNNs using different methods of load balancing for differently-coupled system configurations with variable AIMC tile resources. We show that, by properly distributing workloads, AIMC acceleration can be made highly effective even on under-provisioned systems. As an example, 5.9x speedup and 5.6x energy gains were measured on an 8-core system, for a 41% coverage of neural network parameters.","dblp","Computer Science","0","https://doi.org/10.1109/tpds.2024.3437657","10.1109/tpds.2024.3437657","2024-10-01","2026-04-08","keep","","13","CPU, AI inference, edge AI, AI, matrix, vector, neural, inference","High"
"doi:10.1109/TVLSI.2024.3422684","2405.19915","cc24f933b343b6a9701088cf6ae1dbf3299c0c9e","P2-ViT: Power-of-Two Post-Training Quantization and Acceleration for Fully Quantized Vision Transformer","Huihong Shi","2024","IEEE-TVLSI","Vision transformers (ViTs) have excelled in computer vision (CV) tasks but are memory-consuming and computation-intensive, challenging their deployment on resource-constrained devices. To tackle this limitation, prior works have explored ViT-tailored quantization algorithms but retained floating-point scaling factors, which yield nonnegligible requantization overhead, limiting ViTs’ hardware efficiency and motivating more hardware-friendly solutions. To this end, we propose P2-ViT, the first power-of-two (PoT) posttraining quantization (PTQ) and acceleration framework to accelerate fully quantized ViTs. Specifically, as for quantization, we explore a dedicated quantization scheme to effectively quantize ViTs with PoT scaling factors, thus minimizing the requantization overhead. Furthermore, we propose coarse-to-fine automatic mixed-precision quantization to enable better accuracy-efficiency tradeoffs. In terms of hardware, we develop a dedicated chunk-based accelerator featuring multiple tailored subprocessors to individually handle ViTs’ different types of operations, alleviating reconfigurable overhead. In addition, we design a tailored row-stationary dataflow to seize the pipeline processing opportunity introduced by our PoT scaling factors, thereby enhancing throughput. Extensive experiments consistently validate P2-ViT’s effectiveness. Particularly, we offer comparable or even superior quantization performance with PoT scaling factors when compared with the counterpart with floating-point scaling factors. Besides, we achieve up to <inline-formula> <tex-math notation=""LaTeX"">$10.1\times $ </tex-math></inline-formula> speedup and <inline-formula> <tex-math notation=""LaTeX"">$36.8\times $ </tex-math></inline-formula> energy saving over GPU’s Turing Tensor Cores, and up to <inline-formula> <tex-math notation=""LaTeX"">$1.84\times $ </tex-math></inline-formula> higher computation utilization efficiency against SOTA quantization-based ViT accelerators. Codes are available at <uri>https://github.com/shihuihong214/P2-ViT</uri>.","dblp","Computer Science","16","https://doi.org/10.1109/TVLSI.2024.3422684","10.1109/TVLSI.2024.3422684","2024-05-30","2026-04-08","skip","","13","tensor, accelerator, dataflow, quantization, mixed-precision, transformer, accelerate","High"
"doi:10.1109/IPDPS57955.2024.00090","","a96a04b1035256806785d41528409ad96c7840e8","Optimizing General Matrix Multiplications on Modern Multi-core DSPs","Kainan Yu","2024","IPDPS","General Matrix Multiplication (GEMM) is a key subprogram in high-performance computing (HPC) and deep learning workloads. With the rising significance of power and energy consumption in HPC systems, accelerators based on Digital Signal Processors (DSPs) have been integrated into general-purpose HPC systems. Due to the architecture disparities, the GEMM optimization techniques used on conventional multi-core CPUs and GPGPUs are not always applicable to DSPs. This paper shares our experience in optimizing GEMM on multi-core GPDSPs, using a CPU-DSP processor as a case study. Our approach employs a range of techniques to optimize performance for DSP architectures. These include data partitioning, three-level pipelining, dedicated micro-kernel design, and improved vector reduction. These optimizations maximize the overlap between computation and communication while fully exploiting the capabilities of floating-point arithmetic units to achieve high performance. Our experimental results demonstrate that the performance attained by our optimization is up to 96% of the theoretical peak performance of the hardware.","dblp","Computer Science","5","https://doi.org/10.1109/IPDPS57955.2024.00090","10.1109/IPDPS57955.2024.00090","2024-05-27","2026-04-08","keep","","13","GEMM, CPU, matrix, vector, deep learning","High"
"doi:10.1109/ISCA59077.2024.00069","","9c7643224b26a05584504cff2896ac9286bc3c71","TCP: A Tensor Contraction Processor for AI Workloads Industrial Product","Hanjoon Kim","2024","ISCA","We introduce a novel tensor contraction processor (TCP) architecture that offers a paradigm shift from traditional architectures that rely on fixed-size matrix multiplications. TCP aims at exploiting the rich parallelism and data locality inherent in tensor contractions, thereby enhancing both efficiency and performance of AI workloads.TCP is composed of coarse-grained processing elements (PEs) to simplify software development. In order to efficiently process operations with diverse tensor shapes, the PEs are designed to be flexible enough to be utilized as a large-scale single unit or a set of small independent compute units.We aim at maximizing data reuse on both levels of inter and intra compute units. To do that, we propose a circuit switch-based fetch network to flexibly connect compute units to enable inter-compute unit data reuse. We also exploit input broadcast to multiple contraction engines and input buffer based reuse to further exploit reuse behavior in tensor contraction. Our compiler explores the design space of tensor contractions considering tensor shapes and the order of their associated loop operations as well as the underlying accelerator architecture.A TCP chip was designed and fabricated in 5nm technology as the second-generation product of Furiosa AI, offering 256/512/1024 TOPS (BF16/FP8 or INT8/INT4) with 256 MB SRAM and 1.5 TB/s 48 GB HBM3 under 150 W TDP. Commercialization will start in August 2024.We performed an extensive case study of running the LLaMA-2 7B model and evaluated its performance and power efficiency on various configurations of sequence length and batch size. For this model, TCP is 2.7 × and 4.1 × better than H100 and L40s, respectively, in terms of performance per watt.","dblp","Computer Science","8","https://doi.org/10.1109/ISCA59077.2024.00069","10.1109/ISCA59077.2024.00069","2024-06-29","2026-04-08","keep","","13","tensor, accelerator, FP8, BF16, INT8, AI, matrix","High"
"doi:10.1145/3725843.3756101","","502b5cd996ff7c0825359d63f1f753ded1149186","MHE-TPE: Multi-Operand High-Radix Encoder for Mixed-Precision Fixed-Point Tensor Processing Engines","Qizhe Wu","2025","MICRO","Fixed-point general matrix multiplication (GEMM) is pivotal in AI-accelerated computing for data centers and edge devices in GPU and NPU tensor processing engines (TPEs). This work exposes two critical limitations in typical spatial mixed-precision TPEs: ❶ Redundant partial products (PPs) reduction in PE multipliers across temporal and spatial domains in MAC arrays. ❷ Compute density imbalance: when the operand bit-width is reduced by one-half, the throughput of GEMM only doubles, which is half of the theoretical 4× improvement. To address these challenges. First, we design a multi-operand high-radix encoder based on vector inner products, which reduces PPs for vector reduction by half through decoding. Second, we establish a three-stage computational paradigm for TPE’s microarchitecture, comprising bit-slice encoding, PPs generation, and PPs reduction, which enables bit-width reconfiguration in unified hardware. Our approach decomposes the mixed-precision mapping process in TPEs into two components: temporal mapping of multi-precision multiplicands and spatial mapping of multipliers, achieving balanced computational density. Implementation results based on the UMC 22nm process demonstrate that this architecture outperforms other solutions in critical metrics, including the mixed-precision support range (INT2 ∼ INT32 combinations), area efficiency, and energy efficiency.","dblp","Computer Science","1","https://doi.org/10.1145/3725843.3756101","10.1145/3725843.3756101","2025-10-17","2026-04-08","","","13","tensor, GEMM, mixed-precision, AI, matrix, vector","High"
"doi:10.1007/978-3-032-06751-7_13","","bc1d6a1c6fffbc43a3fee7aae0d0eed6d9d5979b","RISC-V Acceleration for Linear Algebra Problems: Eigen Library Enhancements with RVV Support","Valeria Puzikova","2025","PACT","[abstract unavailable]","dblp","Computer Science","0","https://doi.org/10.1007/978-3-032-06751-7_13","10.1007/978-3-032-06751-7_13","","2026-04-08","skip","","13","RISC-V, RVV","High"
"doi:10.1145/3712285.3759771","","e841ed50f0a3e9344958e221171d81b9d9e88153","HyTiS: Hybrid Tile Scheduling for GPU GEMM with Enhanced Wave Utilization and Cache Locality","Zheng Zhang","2025","SC","General matrix-matrix multiplication (GEMM) is a fundamental operation in both deep learning and scientific computing. To accelerate these workloads, GPUs with a large number of streaming multiprocessors (SMs) are widely used. However, as modern GPUs scale in core count and adopt larger tile sizes, the wave quantization problem induced by partially filled waves results in growing hardware underutilization and substantially degraded performance. Existing solutions to this problem often suffer from low execution efficiency or introduce additional synchronization overhead. To address these challenges, we propose HyTiS, a hybrid tile scheduling framework that combines two-level tile scheduling with adaptive tile layout selection. The first level improves throughput by maximizing utilization in full waves, while the second level reduces latency in partial waves through fine-grained tiling. To minimize tuning overhead, HyTiS performs an offline profiling phase to identify throughput- and latency-optimized micro-kernels, forming an efficient runtime search space across diverse tensor workloads. Additionally, we study the impact of tile layouts on L2 cache behavior and introduce an analytical model to select layouts that minimize data movement from global memory to L2 cache at the wave granularity. Extensive evaluations on NVIDIA H100 and A100 GPUs show that HyTiS achieves significant speedups, up to 1.95 × and 2.08 × over cuBLAS, respectively. Detailed system-level analyses further demonstrate the effectiveness of HyTiS in mitigating wave quantization and improving L2 cache affinity.","dblp","Computer Science","4","https://doi.org/10.1145/3712285.3759771","10.1145/3712285.3759771","2025-11-15","2026-04-08","skip","","13","tensor, GEMM, quantization, accelerate, matrix, deep learning","High"
"doi:10.1145/3582016.3582018","","7e4937ea9b02cce1db69772beb17ccaf8d2c7ed8","Graphene: An IR for Optimized Tensor Computations on GPUs","Bastian Hagedorn","2023","ASPLOS","Modern GPUs accelerate computations and data movements of multi-dimensional tensors in hardware. However, expressing optimized tensor computations in software is extremely challenging even for experts. Languages like CUDA C++ are centered around flat buffers in one-dimensional memory and lack reasonable abstractions for multi-dimensional data and threads. Existing tensor IRs are not expressive enough to represent the complex data-to-thread mappings required by the GPU tensor instructions. In this paper, we introduce Graphene, an intermediate representation (IR) for optimized tensor computations on GPUs. Graphene is a low-level target language for tensor compilers and performance experts while being closer to the domain of tensor computations than languages offering the same level of control such as CUDA C++ and PTX. In Graphene, multi-dimensional data and threads are represented as first-class tensors. Graphene’s tensors are hierarchically decomposable into tiles allowing to represent optimized tensor computations as mappings between data and thread tiles. We evaluate Graphene using some of the most important tensor computations in deep learning today, including GEMM, Multi-Layer Perceptron (MLP), Layernorm, LSTM, and Fused Multi-Head Attention (FMHA). We show that Graphene is capable of expressing all optimizations required to achieve the same practical peak performance as existing library implementations. Fused kernels beyond library routines expressed in Graphene significantly improve the end-to-end inference performance of Transformer networks and match or outperform the performance of cuBLAS(Lt), cuDNN, and custom handwritten kernels.","dblp","Computer Science","41","https://doi.org/10.1145/3582016.3582018","10.1145/3582016.3582018","2023-03-25","2026-04-08","skip","","12","tensor, GEMM, transformer, accelerate, deep learning, inference","High"
"doi:10.1109/CGO68049.2026.11395194","2504.16214","9fe9c846e4885550097118ca77d5a5df2c28e96f","Hexcute: A Compiler Framework for Automating Layout Synthesis in GPU Programs","Xiao Zhang","2026","CGO","Efficient GPU programming is crucial for achieving high performance in deep learning (DL) applications. The performance of GPU programs depends on how data is parallelized across threads and arranged within memory subsystems. The mapping functions describing tensors on GPUs are known as tensor layouts. Low-level programming frameworks, such as CUTLASS and Hidet, provide expressive layout abstractions but often require considerable programming effort to manually specify optimal layouts. High-level GPU programming languages, such as Triton, rely on compiler heuristics to generate dataflow, layouts, and pipelining strategies in GPU programs. However, the heuristics for dataflow and pipelining strategies are not generalizable to complex operators. To balance expressiveness and programmability, we propose Hexcute, a compiler framework that automates layout synthesis while providing explicit control over dataflow and pipelining. Hexcute formalizes layout synthesis as a constraint programming problem and solves it with a type-inference-based algorithm. This approach enables systematic exploration of optimal layouts and instructions.Our evaluation shows that Hexcute matches the performance of libraries like cuBLAS and FlashAttention on GEMM, Attention, and their variants, while reducing the amount of code by 1.27×-7.94× compared to CUTLASS. For mixed-type mixture-of-experts (MoE) operators, Hexcute achieves an average speedup of 6.46× over Triton. In the end-to-end evaluations of vLLM, Hexcute delivers up to 2.60× speedup on DeepSeek-R1-AWQ and 2.04× on a Mamba-based model.","dblp","Computer Science","0","https://doi.org/10.1109/CGO68049.2026.11395194","10.1109/CGO68049.2026.11395194","2025-04-22","2026-04-08","skip","","12","tensor, GEMM, dataflow, deep learning, inference","High"
"doi:10.1109/CGO68049.2026.11395227","","624ba99473c5c40b3ef519be56808a82dc2f1c80","Progressive Low-Precision Approximation of Tensor Operators on GPUs: Enabling Greater Trade-Offs between Performance and Accuracy","Fan Luo","2026","CGO","Recent GPUs integrate specialized hardware for low-precision arithmetic (e.g., FP16, INT8), offering substantial speedups for tensor operations. However, existing methods typically rely on coarse, operator-level trial-and-error tuning, which restricts the performance–accuracy trade-off space and limits achievable gains.We present Platensor, a progressive low-precision approximation framework that expands this trade-off space through ne-grained, tile-level strategies. The key idea is to exploit the tiled computation patterns of GPUs to enable flexible precision control and richer optimization opportunities. Platensor performs a two-phase exploration: a fast rule-based pass that selects promising tile-level configurations, followed by an evolutionary search that refines them. It then automatically generates optimized kernels that combine tiles of different precisions.Experiments on GEMM operators and representative applications—including kNN, LLMs, and HPL-MxP—show that Platensor significantly broadens the attainable performance– accuracy trade-offs and more fully leverages low-precision arithmetic on modern GPUs compared to operator-level tuning.","dblp","Computer Science","0","https://doi.org/10.1109/CGO68049.2026.11395227","10.1109/CGO68049.2026.11395227","2026-01-31","2026-04-08","skip","","12","tensor, GEMM, low-precision, INT8","High"
"doi:10.1109/DAC56929.2023.10247872","","9ed7584b4b4f31318e5b50e2134ad2193d7b5ef6","APPEND: Rethinking ASIP Synthesis in the Era of AI","Cangyuan Li","2023","DAC","Application-specific instruction-set processors (ASIP) has been widely used to speedup specific applications based on general-purpose processor (CPU) ISA-extension and scalar/vector units customization. However, as deep neural processing unit (NPU) becomes a dominant IP in nowadays system-on-chip (SoC) designs, the rich computational and memory resource of the NPUs integrated into advanced CPUs should also be utilized to achieve an even better application performance boost than vector/scalar compute-unit customization only. In this paper, we propose APPEND, a novel framework that tries to enrich the ASIP design methodology by taking the co-designing of both NPU and RISC-V CPU into consideration. To fully utilize and customize the resources of CPU and NPU, APPEND automatically (1) identifies the NPU-compatible kernels from the target application and partition the applications in between the NPU and RISC-V CPU core, (2) based on the application performance specification, applies the necessary hardware parameterization and customization based on the RISC-V CPU and NPU templates, and also (3) generates the extended NPU instructions to accelerate the critical and compatible kernels of the target application.","dblp","Computer Science","5","https://doi.org/10.1109/DAC56929.2023.10247872","10.1109/DAC56929.2023.10247872","2023-07-09","2026-04-08","keep","","12","RISC-V, CPU, AI, accelerate, vector, neural","High"
"doi:10.1109/DAC63849.2025.11133246","","19d60e930dbe9b77562792c58e9d7d6a80c50fad","BLOOM: Bit-Slice Framework for DNN Acceleration with Mixed-Precision","Fangxin Liu","2025","DAC","Deep neural networks (DNNs) have revolutionized numerous AI applications, but their vast model sizes and limited hardware resources present significant deployment challenges. Model quantization offers a promising solution to bridge the gap between DNN size and hardware capacity. While INT8 quantization has been widely used, recent research has pushed for even lower precision, such as INT4. However, the presence of outliers-values with unusually large magnitudes-limits the effectiveness of current quantization techniques. Previous compression-based acceleration methods that incorporate outlieraware encoding introduce complex logic. A critical issue we have identified is that serialization and deserialization dominate the encoding/decoding time in these compression workflows, leading to substantial performance penalties during workflow execution. To address this challenge, we introduce a novel computing approach and a compatible architecture design named “BLOOM”. BLOOM leverages the strengths of the “bit-slicing” method, effectively combining structured mixed-precision and bit-level sparsity with adaptive dataflow techniques. The key insight of BLOOM is that outliers require higher precision, while normal values can be processed at lower precision. By interleaving 4-bit values, we efficiently exploit the inherent sparsity in the highprecision components. As a result, the BLOOM-based accelerator outperforms the existing outlier-aware accelerators by an average $1.2 \sim 4.0 \times$ speedup and $24.6 \% \sim 71.3 \%$ energy reduction, respectively, without model accuracy loss.","dblp","Computer Science","0","https://doi.org/10.1109/DAC63849.2025.11133246","10.1109/DAC63849.2025.11133246","2025-06-22","2026-04-08","skip","","12","accelerator, dataflow, quantization, INT8, mixed-precision, AI, neural","High"
"doi:10.23919/DATE56975.2023.10137076","","8a56bf49179f93feb2889e58358391b946af3168","FPGA Acceleration of GCN in Light of the Symmetry of Graph Adjacency Matrix","Gopikrishnan Raveendran Nair","2023","DATE","Graph Convolutional Neural Networks (GCNs) are widely used to process large-scale graph data. Different from deep neural networks (DNNs), GCNs are sparse, irregular, and unstructured, posing unique challenges to hardware acceleration with regular processing elements (PEs). In particular, the adja-cency matrix of a GCN is extremely sparse, leading to frequent but irregular memory access, low spatial/temporal data locality and poor data reuse. Furthermore, a realistic graph usually consists of unstructured data (e.g., unbalanced distributions), creating significantly different processing times and imbalanced workload for each node in GCN acceleration. To overcome these challenges, we propose an end-to-end hardware-software co-design to accelerate GCNs on resource-constrained FPGAs with the features including: (1) A custom dataflow that leverages symmetry along the diagonal of the adjacency matrix to accelerate feature aggregation for undirected graphs. We utilize either the upper or the lower triangular matrix of the adjacency matrix to perform aggregation in GCN to improve data reuse. (2) Unified compute cores for both aggregation and transform phases, with full support to the symmetry-based dataflow. These cores can be dynamically reconfigured to the systolic mode for transformation or as individual accumulators for aggregation in GCN processing. (3) Preprocessing of the graph in software to rearrange the edges and features to match the custom dataflow. This step improves the regularity in memory access and data reuse in the aggregation phase. Moreover, we quantize the GCN precision from FP32 to INT8 to reduce the memory footprint without losing the inference accuracy. We implement our accelerator design in Intel Stratix10 MX FPGA board with HBM2, and demonstrate $1.3\times-110.5\times$ improvement in end-to-end GCN latency as compared to the state-of the-art FPGA implementations, on the graph datasets of Cora, Pubmed, Citeseer and Reddit.","dblp","Computer Science","11","https://doi.org/10.23919/DATE56975.2023.10137076","10.23919/DATE56975.2023.10137076","2023-04-01","2026-04-08","skip","","12","accelerator, dataflow, INT8, MX, accelerate, matrix, neural, inference","High"
